,URL,Content_title,Contents,sentiment,word_search,word_count
337,https://www.sportsmole.co.uk/football/arsenal/transfer-talk/news/philippe-coutinho-hints-at-permanent-barcelona-exit_481539.html,Philippe Coutinho hints at permanent Barcelona exit,"The 29-year-old joined Aston Villa on loan in January and has been in impressive form for Steven Gerrard's side, scoring four times and registering three assists in 10 appearances. Villa have the option of signing Coutinho on a permanent deal this summer, but the club are yet to make a final decision on the Brazilian. The playmaker has a contract at Camp Nou until next June but has suggested that he has already played his last game for the Catalan giants. ""I have a beautiful story at Liverpool, I was happy there, now I'm starting to write a story at Aston Villa,"" he told Globo Esporte. ""I'm happy that once again I'm able to play well in England, as I've played in Italy, Spain and Germany. ""It's hard to say what didn't work at Barca. I had good times there, but the sequence and the way of acting were factors that could have been different. It was time to move forward, always with great respect and professionalism. ""I am grateful to Barcelona for believing in my work and I am grateful for having defended a club with a lot of history."" Coutinho - also recently linked with a switch to Arsenal - has scored 25 times and registered 14 assists in 106 appearances for Barcelona.  ",positive,liverpool,1
338,https://www.sportsmole.co.uk/football/man-utd/transfer-talk/news/villa-newcastle-considering-move-for-paul-pogba_481519.html,"Aston Villa, Newcastle United 'considering move for Manchester United's Paul Pogba'","With just over three months remaining on his contract, Pogba appears likely to depart Old Trafford on a free transfer at the end of the season. The World Cup winner will not be short of options with Real Madrid, Juventus and Paris Saint-Germain all said to be monitoring the situation. However, according to The Sun, Villa and Newcastle are considering whether to hand the France international an opportunity to remain in the Premier League. As it stands, a switch to either Villa Park or St James' Park appears unlikely, but both clubs could offer the 29-year-old guaranteed first-team football, something which would not be agiven at the other trio of teams. Steven Gerrard has already been able to attract Philippe Coutinho to Villa, and his status may come into the equation if the West Midlands outfit pursue Pogba's signature. Meanwhile, Newcastle are expected to make bids for several high-profile players later in 2022, providing that they are able to avoid relegation to the Championship.  ",positive,liverpool,0
339,https://www.sportsmole.co.uk/football/man-utd/transfer-talk/news/man-united-players-angry-at-paul-pogba-contract-offer_483127.html,Manchester United players 'angry at Paul Pogba contract offer',"The 29-year-old's current deal at Old Trafford is set to expire in June, and he is now free to negotiate pre-contract agreements with foreign clubs. According to the Daily Mirror, United have offered Pogba a new contract with wages worth around £400,000 per week, plus additional bonuses which could take the deal to around £500,000 per week. However, the report adds that this offer has angered a number of players in the United dressing room as they do not believe the Frenchman deserves a pay rise. Five-time Ballon d'Or winner Cristiano Ronaldo is currently the highest earner at United, pocketing around £450,000 per week, while the likes of Bruno Fernandes and captain Harry Maguire are earning significantly less than £300,000 per week. Pogba is understood to have held talks with Paris Saint-Germain chief Leonardo over a potential summer move to the French capital, while Real Madrid and former club Juventus have also been linked with the midfielder.  ",positive,liverpool,0
340,https://www.sportsmole.co.uk/football/arsenal/news/arsenals-bukayo-saka-nominated-for-pl-player-of-the-month_481518.html,Arsenal's Bukayo Saka nominated for Premier League Player of the Month,"The 20-year-old led from the front for the Gunners in March, claiming two goals and an assist from four Premier League matches as Mikel Arteta's side broke into the top four of the table. Saka scored a peach of a left-footed effort against Watford after combining expertly with Martin Odegaard for his side's opener, and he scored the only goal of the game in a 1-0 win over Aston Villa last Saturday. The England international is the sole Arsenal nominee in March's batch, with Tottenham Hotspur duo Harry Kane and Dejan Kulusevski also up for the award. Chelsea also have two nominees in the forms of Trevoh Chalobah and Kai Havertz, while Liverpool's Andy Robertson, Brentford's Ivan Toney and Aston Villa's Matty Cash complete the list. Michail Antonio, Cristiano Ronaldo, Mohamed Salah, Trent Alexander-Arnold, Raheem Sterling, David de Gea and Joel Matip have already received the individual honour this season.  ",positive,liverpool,1
341,https://www.sportsmole.co.uk/football/arsenal/news/patrick-vieira-inducted-into-premier-league-hall-of-fame_481432.html,Patrick Vieira inducted into Premier League Hall of Fame,"The Frenchman captained the Gunners during their 2003-04 Invincibles season - one of three Premier League titles he won in North London - after becoming Arsene Wenger's first signing for the club in 1996. Vieira went on to make 307 appearances for Arsenal - scoring 31 goals and setting up 34 more - and has joined Wayne Rooney as the two first PL Hall of Fame inductees in 2022. ""Being inducted into the Premier League Hall of Fame is a fantastic achievement,"" Vieira told arsenal.com. ""When I received the news, I thought about being a young boy playing in Senegal, or in a suburb of Paris. ""To be there with the best players in the Premier League, the best league in the world, is bigger than what I was ever thinking about. To have my name around those players makes me proud and makes me realise how good I was. ""It's not bad company to join. I was lucky to play at the same time as some of them, of course including Thierry Henry and Dennis Bergkamp. So to share the stage with them makes me realise I had a really good career. ""What really makes me happy and proud is when your name is mentioned by new, up-and-coming holding midfielders as an example of how they would like to play."" Vieira joins former teammates Henry and Bergkamp in the hall of fame, while Alan Shearer, David Beckham, Eric Cantona, Steven Gerrard, Frank Lampard and Roy Keane also make up the list.  ",positive,liverpool,0
342,https://www.sportsmole.co.uk/football/man-utd/transfer-talk/news/arsenal-chelsea-join-race-for-ronald-araujo_481847.html,"Arsenal, Chelsea 'join race for Barcelona's Ronald Araujo'","It was reported earlier this month that Araujo was keen to remain at Camp Nou as he has been one of the standout performers since Xavi's arrival in the dugout and he is on board with the manager's project at the club. However, that has not stopped the speculation and interest in the 23-year-old's availability, with Manchester United and Juventus among the clubs monitoring his situation. The Express now reports that Arsenal and Chelsea are also showing interest in the Uruguayan international, who is yet to agree to new terms with the Spanish giants, with his current contract set to expire in 2023. Barca are believed to not want to miss out on a transfer fee for Araujo if he remains at the club but then fails to sign a new contract, meaning that he could leave for nothing next year, which may force the Catalan club into a sale this summer. Araujo arrived at Barca in 2018 before making his first-team debut in 2019, and has gone on to feature 72 times for the club.  ",negative,liverpool,0
343,https://www.sportsmole.co.uk/football/man-utd/transfer-talk/news/antonio-rudiger-agent-met-with-barcelona-on-wednesday_482066.html,Antonio Rudiger agent 'met with Barcelona on Wednesday',"The Germany international's contract with Chelsea is due to expire at the end of June, and it appears increasingly likely that he will be leaving Stamford Bridge ahead of next season. Manchester United, Juventus, Real Madrid and Paris Saint-Germain continue to be credited with an interest in the centre-back, who has again been a vital player for the Blues this term. However, according to Sky Sports News, Barcelona are now showing an interest, with Rudiger's agent meeting with the Catalan outfit's officials on Wednesday. The report claims that Sahr Senesie, who is also the defender's half-brother, met with Barcelona sporting director Mateu Alemany and deputy Jordi Cruyff. The 29-year-old is currently unable to sign a new deal with Chelsea due to the sanctions placed on owner Roman Abramovich. Rudiger has scored three times and registered four assists in 42 appearances for Thomas Tuchel's side during the 2021-22 campaign.  ",positive,liverpool,0
344,https://www.sportsmole.co.uk/football/man-utd/transfer-talk/news/barcelona-boss-xavi-rejects-chance-to-sign-cristiano-ronaldo_481946.html,Barcelona boss Xavi 'rejects chance to sign Cristiano Ronaldo',"The 37-year-old returned to Old Trafford from Juventus last summer; however, the five-time Ballon d'Or winner has endured a mixed 2021-22 campaign with the Red Devils and will end the season without silverware. With United at risk of failing to qualify for the Champions League, speculation has been rife over Ronaldo's future and according to El Nacional, via the Daily Mirror, the striker has been offered to Barcelona by his agent Jorge Mendes. However, the report adds that Xavi has rejected the chance to sign the Portugal international as he feels that his potential arrival at Camp Nou would be ""the biggest betrayal in history between Barcelona and [Real Madrid]"". Ronaldo spent nine trophy-laden seasons at Real Madrid between 2009 and 2018, scoring 450 goals in just 438 appearances across all competitions, including 18 goals in 30 games against Barcelona. Luis Figo, Ronaldo, Samuel Eto'o and Luis Enrique are among an exclusive group of players to have represented both Clasico sides over the years. Cristiano Ronaldo, who has scored 18 goals in 33 matches for United this season, is under contract at Old Trafford until June 2023.  ",negative,liverpool,0
345,https://www.sportsmole.co.uk/football/barcelona/transfer-talk/news/leeds-relaxed-about-raphinha-future-amid-barcelona-links_481894.html,Leeds United 'relaxed about Raphinha future amid Barcelona links',"The Brazilian international has been a key part of the squad this season, featuring in 27 of their 30 Premier League games and scoring nine times in the process. Such form has led to interest from some of Europe's top teams including Barcelona, who are hoping to sign him during the upcoming summer transfer window. However, The Mirror claims that Leeds are relaxed about Raphinha's situation at the moment given that he still has two years remaining on his contract at Elland Road. The 25-year-old also does not have a release clause in his current deal, and the £33.5m that Barcelona are willing to pay does not come close to the club's valuation of him. The Premier League side have no desire to sell Raphinha for anything short of their target sum and are understood to be in talks with him over an extension to his current deal as they look to ward off interest from elsewhere.  ",positive,liverpool,0
346,https://www.sportsmole.co.uk/football/man-utd/transfer-talk/news/barcelona-agree-five-year-contract-with-raphinha_481806.html,Barcelona 'agree five-year contract with Raphinha',"The 25-year-old's future is currently the subject of much speculation, with a number of clubs believed to be keen to sign him during this summer's transfer window. Manchester City, Manchester United, Liverpool and Bayern Munich are all said to be admirers of the Brazil international, who has scored nine times and registered three assists in 28 appearances for the Whites during the 2021-22 campaign. However, a recent report claimed that Raphinha had instructed his agent to negotiate with only Barcelona. According to Sport, the attacker has already come to an agreement with Xavi's side over personal terms, with the Catalan outfit placing a five-year contract on the table. The report claims that Barcelona are now attempting to come to an agreement with Leeds over a transfer fee, and versatile defender Oscar Mingueza could be involved in the deal. The Whites have already allegedly turned down an offer of €35m (£29.1m) and are in a strong position to negotiate a higher fee, with Raphinha having a contract at Elland Road until June 2024.  ",positive,liverpool,1
347,https://www.sportsmole.co.uk/football/leeds-united/injury-news/news/leeds-provide-injury-and-fitness-updates-for-seven-players_481858.html,Leeds United provide injury and fitness updates for seven players,"The 28-year-old has been plagued with injuries throughout this season and has been reduced to just 10 appearances across all competitions as a result. Bamford, who was withdrawn in the 23rd minute of Leeds' 3-2 win at Wolverhampton Wanderers earlier this month, has now been ruled out for a ""minimum of six weeks"", meaning the striker is unlikely to play any part in the club's final eight fixtures as they fight for Premier League survival. A statement from Leeds' Head of Medicine and Performance, Rob Price, read: ""As all of the stats show, Patrick has put his body on the line for Leeds United for a number of seasons, he has played with a plantar fascia injury for the last 12 months and despite treatment and a prolonged period of rehabilitation, the injury has progressed from a partial tear to a full rupture. ""As all sports medics know, injuries to the plantar fascia are notoriously difficult to manage, but all concerned are confident that he will make a full recovery from this injury in good time. ""Patrick has been incredibly unlucky this year, his game time has been limited by different injuries including an ankle injury sustained at Newcastle and hamstring and quad injuries once back in training and matchday squads. ""What he needs is a period of rest and rehabilitation to allow his body to fully recover."" Leeds have, however, provided positive updates for six other first-team players, including club captain Liam Cooper, Kalvin Phillips (both hamstring) and Diego Llorente (back) who have all taken part in training after recovering from injury and are available for Saturday's home game against Southampton. Goalkeeper Illan Meslier is suffering with severe bruising to his upper thigh and lower torso and has not trained this week; however, Leeds have revealed that he should be fit for this weekend's clash with the Saints. Mateusz Klich suffered a concussion injury in the win at Wolves, but after completing the necessary concussion protocols in training, the midfielder will also be in contention to feature for Jesse Marsch's side on Saturday, as will star attacker Raphinha who has also returned to training after recovering from a bout of COVID-19.  ",positive,liverpool,0
348,https://www.sportsmole.co.uk/football/man-utd/transfer-talk/news/raphinha-to-sign-new-leeds-contract-despite-liverpool-bayern-links_474820.html,"Raphinha to sign new Leeds United contract despite Liverpool, Bayern Munich links?","The 25-year-old has been a standout performer in Marcelo Bielsa's struggling Whites side this season, scoring eight goals in 17 Premier League appearances. Jurgen Klopp's Liverpool and perennial Bundesliga winners Bayern Munich are two clubs who have been strongly linked with Raphinha, while Manchester United, Manchester City and Chelsea have also been credited with an interest. However, The Mirror reports that Leeds are keen to reward the Brazil international with a new and improved contract, with his current deal set to expire in June 2024. The report adds that director of football Victor Orta held two positive meetings with the player's agent, former Chelsea midfielder Deco, before Christmas regarding a contract extension. In addition, Raphinha is settled in West Yorkshire and he is planning to marry his partner in England after the pair announced their engagement on New Year's Eve. Raphinha has scored 14 goals and provided 10 assists in 48 appearances for Leeds across all competitions since joining the club from Rennes in the summer of 2020.  ",positive,liverpool,1
349,https://www.sportsmole.co.uk/football/man-utd/transfer-talk/news/west-ham-interested-in-signing-leeds-winger-raphinha_476598.html,West Ham United 'interested in signing Leeds United winger Raphinha',"The 25-year-old has excelled for the Whites since his arrival from Rennes in October 2020, scoring 14 goals and providing 11 assists from 51 appearances across all competitions. Raphinha and his agent, former Chelsea midfielder Deco, are understood to have held positive talks with Leeds over a new and improved contract, with his current deal set to expire in June 2024. However, Sky Sports News reports that West Ham are closely monitoring Raphinha's situation ahead of a proposed move for the winger. Chelsea, Liverpool, Manchester United and Bayern Munich have all been credited with an interest in the Brazil international earlier in the transfer window. Raphinha has previously indicated that he is happy at Elland Road and believes he can fulfil his career ambitions under Marcelo Bielsa. West Ham boss David Moyes is in the market for attacking reinforcements, with Reims forward Hugo Ekitike and Chelsea's academy graduate Armando Broja – currently on loan with Southampton – two more players believed to be on his radar.  ",positive,liverpool,1
350,https://www.sportsmole.co.uk/football/chelsea/transfer-talk/news/leeds-confident-of-new-club-record-raphinha-deal_477259.html,Leeds United 'confident of new club-record Raphinha contract',"The 25-year-old has been heavily linked with a number of Premier League clubs including Chelsea, Liverpool and West Ham United, with the latter believed to have failed with a club-record offer late in the January window. Leeds have been in talks with Raphinha and his agent, former Chelsea midfielder Deco, for some time over a contract extension, with his current deal at Elland Road set to expire in June 2024. According to Football Insider, the Whites are prepared to make Raphinha the highest-paid player at the club, offering him a significant pay rise as a reward for his stellar performances over the last two seasons. The report adds that Leeds are confident the Brazil international will agree to signing a new deal 'within weeks'. Raphinha has excelled for the Yorkshire outfit since joining from Rennes in October 2020, scoring 14 goals and providing 11 assists in 51 appearances across all competitions.  ",negative,liverpool,1
351,https://www.sportsmole.co.uk/football/barcelona/transfer-talk/news/xavi-we-cannot-spend-crazy-money-this-summer_482955.html,Xavi: 'We cannot spend crazy money this summer',"The Catalan outfit continue to be linked with a big-money move for Borussia Dortmund's Erling Braut Haaland, who will have a £67m release clause in his contract this summer. The cost of the deal could eventually reach £300m, though, including agent fees and wages. Xavi has said that the club are working to boost their squad in the upcoming market, but they cannot afford 'to go crazy', potentially ruling out a move for Haaland. ""The economic situation explains itself, we are not in a place to go 'crazy', we are trying to bolster ourselves for next season, we will try whatever is possible. We have to be careful because it is not an easy situation,"" Xavi told reporters. Barcelona have the option to sign on-loan Wolverhampton Wanderers attacker Adama Traore on a permanent deal this summer, but the Spain international is allegedly losing his battle to secure a long-term return to Camp Nou.  ",neutral,liverpool,0
352,https://www.sportsmole.co.uk/football/man-utd/transfer-talk/news/man-united-preparing-summer-move-for-robert-lewandowski_480338.html,Manchester United 'preparing summer move for Robert Lewandowski',"The 33-year-old has entered the final 18 months of his contract at Allianz Arena, and there has recently been a host of speculation surrounding his future with the Bundesliga champions. Bayern CEO Oliver Kahn said that the club would soon be sitting down for contract talks with the Poland international, but the centre-forward recently said that he was ""open to everything"" regarding his future. A whole host of clubs, including Chelsea, Manchester City, Atletico Madrid, Barcelona and Real Madrid, are said to be keeping a close eye on the situation at Bayern. However, according to Bild, the strongest interest is arriving from Man United, with the Red Devils lining up a summer bid for Lewandowski. The 20-time English champions will lose Edinson Cavani on a free transfer this summer, while Cristiano Ronaldo is said to be determined to leave Old Trafford in the upcoming market. Lewandowski has again been in brilliant form for Bayern during the 2021-22 campaign, scoring 42 times and providing four assists in 35 appearances in all competitions, including 12 goals in eight Champions League outings.  ",positive,liverpool,0
353,https://www.sportsmole.co.uk/football/liverpool/transfer-talk/news/bayern-lead-barcelona-real-madrid-in-gravenberch-race_480258.html,"Bayern Munich lead Barcelona, Real Madrid in Ryan Gravenberch race?","The 19-year-old has been an important player for his Dutch club during the 2021-22 campaign, making 34 appearances in all competitions, contributing one goal and four assists in the process. Gravenberch has entered the final 18 months of his contract in Amsterdam, and there has been a host of speculation surrounding his future in recent months. Barcelona and Real Madrid are both believed to be interested in signing the Netherlands international this summer, while Liverpool and Juventus have also recently been linked with his services. However, according to Italian journalist Fabrizio Romano, Bayern are in a strong position to sign the teenager in the upcoming market. Romano claims that Bayern CEO Oliver Kahn recently met with the midfielder's agent Mino Raiola in Monaco to discuss a summer move, although the Bundesliga champions are not currently prepared to pay his €30m (£25m) price tag. Gravernberch has scored 10 goals and provided 11 assists in 95 appearances for Ajax in all competitions, while he has been capped 10 times by the Netherlands.  ",positive,liverpool,1
354,https://www.sportsmole.co.uk/football/man-utd/transfer-talk/news/man-united-handed-boost-in-race-for-lewandowski_482868.html,Manchester United handed boost in race for Robert Lewandowski?,"The Poland international's contract at Allianz Arena is due to expire in June 2023, and he could seek a move away from the club this summer if he does not sign a new deal in the coming months. Barcelona have been strongly linked with the striker, but according to ESPN, the deal would be difficult for the Catalan outfit due to their ongoing financial problems. The report claims that the form of Pierre-Emerick Aubameyang and return of Ansu Fati from injury also means that Xavi's side are happy with their attacking options at this moment in time. Man United are also said to be weighing up a summer move for Lewandowski, and the Red Devils could now potentially have a free run at signing him. The 33-year-old has again been in excellent form at club level during the 2021-22 campaign, scoring 45 goals and registering four assists in 39 appearances in all competitions. The 20-time English champions are expected to move for a new striker in the upcoming market even if Cristiano Ronaldo stays at the club for another season.  ",negative,liverpool,0
355,https://www.sportsmole.co.uk/football/bayern-munich/transfer-talk/news/bayern-open-contract-talks-with-thomas-muller_482274.html,Bayern Munich 'open contract talks with Thomas Muller',"The Germany international has enjoyed a legendary career at the Allianz Arena, contributing 226 goals from his 618 appearances in all competitions. However, with 15 months remaining on his contract, speculation persists that the 32-year-old may take on a new challenge before the end of his career. According to Bild, club officials have made their opening move to hand Muller fresh terms before the start of the summer transfer window. The report claims that Muller's representatives have held talks with Bayern CEO Oliver Kahn and sporting director Hasan Salihamidzic. Earlier this year, it was claimed that Newcastle United had made contact with Bayern regarding a potential deal for the frontman.  ",positive,liverpool,0
356,https://www.sportsmole.co.uk/football/arsenal/transfer-talk/news/spurs-leading-race-to-sign-djed-spence_479802.html,Tottenham Hotspur 'leading race to sign Djed Spence',"Spence has established himself as one of the best full-backs in the Championship this season, making a total of 26 starts on loan at Nottingham Forest. With less than 18 months remaining on his contract, parent club Boro will cash in on the 21-year-old this summer, a scenario which has led to many clubs monitoring developments regarding his future. Nevertheless, according to Goal, Spurs are still fancied to eventually get a deal for the Englishman over the line with Antonio Conte keen to improve in the wing-back areas. The same outlet has claimed that Bayern Munich have recently joined the race for Spence, although the right-sided player would likely find himself as a backup squad member at the Allianz Arena. Arsenal are among the other Premier League clubs who are said to be admirers.  ",positive,liverpool,0
