,URL,Content_title,Contents,sentiment,word_search,word_count
116,https://www.sportsmole.co.uk/football/chelsea/transfer-talk/news/man-city-ready-to-join-race-for-paulo-dybala_482010.html,Manchester City ready to join race for Juventus forward Paulo Dybala?,"Despite another strong season under Pep Guardiola, City's forward line is expected to be different next season with Julian Alvarez having already been signed from River Plate and speculation continuing regarding a bid for Erling Braut Haaland. Nevertheless, according to Corriere dello Sport, the Premier League leaders are contemplating whether to join the race for Dybala. The Argentina international is expected to depart Turin on a free transfer after Juventus showed a reluctance to meet the attacker's wage demands. Dybala, now 28 years of age, has no shortage of admirers with Chelsea, Atletico Madrid and AC Milan are said to be monitoring the situation. Despite Dybala seemingly being set to leave Juventus, he has still contributed 13 goals from 29 appearances in all competitions this season.  ",positive,liverpool,0
117,https://www.sportsmole.co.uk/football/man-utd/transfer-talk/news/river-plate-chief-denies-edinson-cavani-reports_479966.html,River Plate chief denies Edinson Cavani reports,"The Manchester United attacker is due to become a free agent at the end of the season and is not expected to extend his stay at Old Trafford for another year. A return to South America has understandably been mooted for Cavani, with reports claiming that River Plate had planned to sign the Uruguay international to replace Manchester City-bound Julian Alvarez. However, Francescoli has now poured cold water over such rumours, telling Supermite: ""I never spoke with Cavani. There were no negotiations at all."" Cavani is thought to be holding out for a move to La Liga for the 2022-23 season, with the 35-year-old believing that he still has something to offer at the top level. The former Paris Saint-Germain attacker has 19 goals and seven assists to his name from 54 games for Man United but has only made 15 appearances during an injury-hit 2021-22 campaign.  ",negative,liverpool,0
118,https://www.sportsmole.co.uk/football/man-city/transfer-talk/news/guardiola-congratulates-man-city-for-alvarez-signing_477254.html,Pep Guardiola congratulates Manchester City for Julian Alvarez signing,"The 21-year-old forward moved to the Citizens for a fee worth around £14.2m plus add-ons and he has signed a five-and-a-half-year contract, but the Argentina international will remain on loan with River Plate until July at the earliest. Guardiola has admitted that Alvarez is good enough to join the first team immediately, but he believes that it is best for all parties that the forward remains in his native South America for the rest of the season. Speaking to the press ahead of Saturday's FA Cup fourth-round tie against Fulham, Guardiola said: ""Congratulations for City, they work to be in the present but of course for the future. ""It's a player that could be already with us now but we have enough players, I don't like to have too many players in several positions. The best is stay in River Plate, he's done incredibly well. ""In the next pre-season he'll be with us, after we'll decide what happens, every season the squad moves. I am personally really pleased to have this talented young player for the next years. Alvarez, who is regarded as one of the brightest talents in South America, excelled for River Plate in 2021, scoring 24 goals and registering 15 assists in 46 appearances across all competitions.  ",positive,liverpool,0
119,https://www.sportsmole.co.uk/football/man-city/transfer-talk/news/man-city-optimistic-about-beating-real-to-haaland_482271.html,Manchester City 'optimistic about beating Real Madrid to Erling Braut Haaland',"With the Norway international possessing a release clause in the region of £63m, a number of top European clubs are expected to make formal bids over the coming weeks and months. If reports are to be believed, City and Real Madrid are the two frontrunners for the 21-year-old, who has still managed to score 23 goals during an injury-hit campaign. According to ESPN, the Premier League leaders feel that they will be able to edge out Los Blancos at the negotiating table. As well as City believing that they can put together a strong financial package due to recent player sales, the report suggests that they feel the temptation to work with Pep Guardiola could also sway Haaland. The same outlet states that Real are also prepared to prioritise the addition of Paris Saint-Germain forward Kylian Mbappe, who is currently due to become a free agent.  ",positive,liverpool,0
120,https://www.sportsmole.co.uk/football/man-utd/transfer-talk/news/barcelona-interested-in-edinson-cavani_465597.html,Barcelona interested in Edinson Cavani?,"The 34-year-old extended his Old Trafford stay until the summer of 2022 earlier this year but is not expected to remain in Manchester beyond the end of the current campaign. However, with Cavani enduring a slow start to the new season due to injury and now having to compete with Cristiano Ronaldo for starts up front, there are suggestions that his United career could end before next summer. According to the Daily Star, Barca intend to dip into the centre-forward market in January amid their attacking injury crisis, and Cavani has been identified as an ideal acquisition. The report adds that Cavani would only join the Catalan giants on a short-term loan deal, and the Blaugrana would have to fork out a substantial amount of the striker's wages while he plies his trade in La Liga. Cavani registered 17 goals and six assists from 39 games in all competitions during his debut season with Man United but has only played 47 minutes of Premier League football so far this term.  ",positive,liverpool,0
121,https://www.sportsmole.co.uk/football/spurs/transfer-talk/news/tottenham-lining-up-summer-move-for-de-ketelaere_476120.html,Tottenham Hotspur 'lining up summer move for Charles De Ketelaere',"The 20-year-old has been in impressive form for his Belgian club during the 2021-22 campaign, scoring 13 times and registering eight assists in 31 appearances in all competitions. Manchester City have been linked with the attacker, who has two-and-a-half years left to run on his current deal, while a number of other clubs are also believed to be interested in his services. According to journalist Ekrem Konur, Tottenham are planning to move for De Ketelaere when this summer's transfer window opens for business. The attacker, who is capable of operating in a number of different forward positions, has found the back of the net on one occasion in his four appearances for Belgium. De Ketelaere played twice against Man City in the group stage of this season's Champions League but was on the end of heavy defeats to the Premier League champions on both occasions.  ",negative,liverpool,0
122,https://www.sportsmole.co.uk/football/man-city/transfer-talk/news/erling-braut-haaland-to-decide-future-by-the-end-of-this-month_482378.html,Erling Braut Haaland 'to decide future by the end of this month',"The 21-year-old has been heavily linked with a move to Real Madrid, who will face competition from Manchester City and fierce rivals Barcelona for the youngster's signature. All three clubs are said to have held talks with agent Mino Raiola and Haaland's father, and all of the contract offers clearly state the sporting and economic elements Haaland will benefit from. According to Sport, Haaland wants to leave Dortmund in a respectful manner as he holds a good relationship with the club and the fans, so he will communicate with the German outfit first about his decision. The release clause of £63m in the Norwegian's current contract at Signal Iduna Park has to be activated before 30 April, which is why Haaland will decide between Los Blancos, Barca or Man City by the end of this month. During his two-and-a-half seasons at Dortmund so far, Haaland has netted an impressive 80 goals in 83 appearances for the club, breaking Champions League goalscoring records along the way.  ",positive,liverpool,0
123,https://www.sportsmole.co.uk/football/barcelona/transfer-talk/news/philippe-coutinho-willing-to-take-pay-cut-to-join-aston-villa_481843.html,Philippe Coutinho 'willing to take pay cut to join Aston Villa',"The winger has had a positive impact on Steven Gerrard's side, having netted four goals and provided three assists in 10 Premier League appearances for Villa so far. Coutinho is currently under contract at Camp Nou until 2023, but it is believed that the Spanish giants wish to sell the Brazilian international this summer, for a figure in the region of £40m. According to Mundo Deportivo, the 29-year-old's salary will be a barrier for Villa, but after seemingly regaining his confidence on the pitch, Coutinho will be willing to take a pay cut to permanently be based at Villa Park. Gerrard has made it clear that he wants the club to pursue the option to purchase Coutinho for £40m; although, they may have to fend off competition from fellow Premier League outfit Arsenal. In total, Coutinho has scored 25 goals in 106 appearances for Barca, with his current loan move the second temporary spell he has had away from Catalonia.  ",negative,liverpool,0
124,https://www.sportsmole.co.uk/football/spurs/transfer-talk/news/tottenham-keen-to-sign-matthias-ginter-on-a-free-transfer_483168.html,Tottenham Hotspur 'keen to sign Matthias Ginter on a free transfer',"The 28-year-old has again been an important player for his German club this season, making 29 appearances in all competitions, contributing one goal in the process. Ginter will leave Monchengladbach on a free transfer at the end of June, though, and a number of clubs, including Juventus, West Ham United and Aston Villa, have been linked with his services. However, according to Sky Sports News, there is also serious interest from Tottenham, with the North London club keen to sign him on a free transfer. Barcelona and Real Madrid have also previously been linked with the German, although it seems that both clubs have cooled their interest ahead of the summer. Ginter has made 177 appearances for Monchengladbach since arriving from Borussia Dortmund in July 2017, scoring 11 goals and contributing five assists in the process. The defender is currently free to agree a pre-contract with clubs outside of Germany.  ",positive,liverpool,0
125,https://www.sportsmole.co.uk/football/arsenal/transfer-talk/news/arsenal-make-contact-over-philippe-coutinho-move_481557.html,Arsenal 'make contact over Philippe Coutinho move',"The 29-year-old has reignited his career on loan at Aston Villa, registering four goals and three assists in 10 Premier League matches under the tutelage of ex-Liverpool teammate Steven Gerrard. Villa possess the option to sign Coutinho permanently for a fee of €40m (£33.4m) this summer, and the Brazil international has seemingly confirmed that he will leave Barcelona for good in a few months' time. The Lions may face stiff competition for Coutinho's signature, though, as Mundo Deportivo claims that Arsenal have touched base with the attacker's entourage. The report adds that Coutinho is not prepared to make a decision on his future until the end of the season, but the pull of London and potential Champions League football could aid Arsenal's bid to sign him. Coutinho has registered 25 goals and 14 assists in 106 games for Barcelona, and his deal at Camp Nou is due to expire in the summer of 2023.  ",negative,liverpool,1
126,https://www.sportsmole.co.uk/football/man-utd/transfer-talk/news/man-city-leading-the-race-for-barcelonas-araujo_482068.html,Manchester City 'leading the race for Barcelona's Ronald Araujo',"The Uruguay international's future is currently the subject of much speculation, with his contract at Camp Nou due to expire in June 2023. Barcelona are currently struggling to come to an agreement with the defender over an extension, and a number of Premier League clubs are said to be interested in his services. Manchester United, Chelsea, Arsenal and Liverpool have all been credited with an interest in Araujo ahead of this summer's transfer window. However, according to Super Deporte, Man City are leading the race for the 23-year-old, identifying him as the ideal centre-back partner for Ruben Dias. The report claims that Barcelona are open to selling Araujo this summer if he does not sign a new deal, as the club fear losing him on a free transfer in the summer of 2023. The South American has been a vital player for Xavi's side during the 2021-22 campaign, making 33 appearances in all competitions, scoring four times in the process.  ",positive,liverpool,1
127,https://www.sportsmole.co.uk/football/barcelona/transfer-talk/news/marsch-we-want-raphinha-to-stay-amid-barcelona-links_482082.html,Leeds United boss Jesse Marsch: 'We want Raphinha to stay amid Barcelona links',"The 25-year-old Brazil international has been a standout performer for the Whites this season, scoring nine goals and registering three assists in 27 Premier League games. Raphinha's impressive performance for club and country are believed to have caught the eye of a number of top European clubs, with Barcelona seemingly leading the race for his signature. Speaking to the press ahead of Leeds' top-flight game against Southampton on Saturday, Marsch has revealed that he has not spoken to Raphinha or to the player's agent Deco about a potential switch to Barcelona, and admits that he is not surprised to see the attacker linked with one of Europe's best clubs. ""[Raphinha is] a massive talent and my challenge is, despite all of the talk outside, is to have the relationship where we can focus on his development in helping the team while he is here,"" Marsch told reporters on Thursday. ""I haven't had a word with him about Deco or Barcelona. It should be out there because [he] is fantastic. ""I just want him to become the player I know he can be. Everyone here wants to enjoy the football he can play and of course we want him to stay as long as possible. Fantastic player and very good person."" Leeds are believed to be relaxed over Raphinha's future, though one report claims that the former Rennes attacker has already agreed a five-year deal with the Catalan giants.  ",positive,liverpool,0
128,https://www.sportsmole.co.uk/football/barcelona/transfer-talk/news/lewandowski-tells-bayern-he-has-agreed-barcelona-terms_483060.html,Robert Lewandowski 'tells Bayern Munich he has agreed Barcelona terms',"The legendary frontman has enjoyed one of the best campaigns of his career in 2021-22, scoring 44 goals from 38 appearances in the Bundesliga and Champions League. However, nearing the end of his eighth year at the Allianz Arena, it has been frequently suggested that the Poland international is ready to take on a new challenge. According to TVP Sport, the 33-year-old has informed Bayern CEO Oliver Kahn that he does want to extend his deal past the end of the 2022-23 campaign. Furthermore, Lewandowski is said to have told Kahn that he has already agreed terms over a potential transfer to Barcelona during the summer transfer window. As it stands, it is unclear whether the Catalan giants would be able to meet Bayern's valuation of the player, the other option being to wait 15 months to wrap up the deal.  ",positive,liverpool,0
129,https://www.sportsmole.co.uk/football/spurs/transfer-talk/news/djed-spence-wanted-by-seven-premier-league-clubs_480122.html,Middlesbrough's Djed Spence wanted by seven Premier League clubs?,"The 21-year-old has thrived on loan at Nottingham Forest this season, registering two goals and three assists in 34 matches across all competitions. Spence is due to return to Middlesbrough in the summer and has a contract at the Riverside Stadium until 2024, but his performances have supposedly led to interest from across the continent. According to Sky Deutschland journalist Florian Plettenburg, seven top-flight English clubs are keeping tabs on the defender's future, with Manchester City and Tottenham Hotspur among them. Plettenburg adds that it may take a fee of €15m (£12.5m) to prise Spence away from Middlesbrough, and the player wants a final decision on his future to be made before the end of May. Bayern Munich have also been credited with an interest in Spence, who has two goals to his name from 70 appearances for parent club Middlesbrough.  ",negative,liverpool,0
130,https://www.sportsmole.co.uk/football/man-utd/transfer-talk/news/liverpool-still-monitoring-torino-defender-bremer_482870.html,Liverpool 'still monitoring Torino defender Bremer',"The 25-year-old only signed a new deal with his Italian club in February but continues to be strongly linked with a move away from the Bull in the upcoming market. Manchester United, Arsenal, Juventus and Inter Milan are all believed to be keen on the defender, who has scored three times and registered one assist in 28 Serie A appearances this term. According to Goal, Liverpool also continue to track the progress of the South American, as the Reds weigh up making an offer ahead of the 2022-23 campaign. The report claims that Inter are 'in pole position' at this stage, but Jurgen Klopp's side have made 'informal enquiries' about the defender in recent weeks. Torino are believed to value Bremer in the region of €25m (£21m), which is likely to make him an attractive proposition in an inflated transfer market.  ",positive,liverpool,1
131,https://www.sportsmole.co.uk/football/barcelona/transfer-talk/news/barcelona-want-to-sign-galan-to-compete-with-alba_482553.html,Barcelona 'want to sign Javi Galan to compete with Jordi Alba',"The 27-year-old joined Celta from Huesca last summer and has been in strong form for the Sky Blues during the 2021-22 campaign, contributing three assists in 31 appearances in all competitions. Galan still has more than four years left to run on his contract in Vigo, but according to AS, Barcelona will attempt to sign the Spaniard in the upcoming market. The report claims that the Catalan giants view him as the ideal player to compete with Jordi Alba for the left-back spot at Camp Nou next term. Barcelona are allegedly impressed by Galan's 'speed and power' and will open talks with Celta once the 2021-22 campaign has concluded. Benfica's Alex Grimaldo and Real Betis' Alex Moreno are believed to be alternatives to Galan this summer. Alba remains a key player for Barcelona, making 34 appearances in all competitions this term, contributing two goals and nine assists in the process, but he recently turned 33 and has had injury problems in 2021-22.  ",positive,liverpool,0
132,https://www.sportsmole.co.uk/football/spurs/transfer-talk/news/tottenham-handed-boost-in-borna-sosa-pursuit_480088.html,Tottenham Hotspur handed boost in Borna Sosa pursuit?,"The Lilywhites are said to have identified Sosa as one of their prime targets heading into the summer transfer window, with Antonio Conte's side reportedly monitoring his situation. According to The Mirror, they have been handed a major boost as the Bundesliga outfit are set to allow the Croatian international to leave at the end of the campaign should they suffer a relegation to the second tier. After an important victory over Borussia Monchengladbach at the weekend, Die Roten sit just one point behind the relegation playoff place and three points adrift of automatic safety, although they are now expected to cash in on their left-back regardless at the end of the campaign. The Croatian has made 20 league appearances for Stuttgart so far this term, providing five assists to take his tally to 20 alongside three goals since his arrival in Germany in 2018, and he is now said to favour a switch to the Premier League. Sosa also earned his first caps for the national team last year, starting five matches in their World Cup Qualifying campaign.  ",positive,liverpool,0
133,https://www.sportsmole.co.uk/football/liverpool/transfer-talk/news/liverpool-ready-to-pay-gbp42m-gavi-release-clause_483098.html,Liverpool 'ready to pay £42m Gavi release clause',"The 17-year-old has established himself as an integral part of Xavi's first team, but he is yet to extend his stay at Camp Nou beyond the end of next season. Xavi remains optimistic about the club's chances of tying Gavi down to new terms, but Barcelona could be pressured into a sale should the midfield starlet continue to run down the months on his current deal. Liverpool have been strongly linked with a swoop for Gavi, and El Nacional now reports that the Reds are primed to activate the youngster's £42m release clause to bring him to Anfield. The report adds that Gavi still intends to come to an agreement over a new Barcelona contract, but Liverpool have informed his entourage of their interest should the cash-strapped Catalans fail to offer him a sufficient deal. Gavi has scored two goals and set up six more in 38 senior appearances for Barcelona this season and has already earned six caps for the Spain national team.  ",positive,liverpool,2
134,https://www.sportsmole.co.uk/football/man-utd/transfer-talk/news/ronald-araujo-on-verge-of-new-barcelona-deal_483242.html,Ronald Araujo on verge of new Barcelona deal?,"The 23-year-old has been an important player for the Catalan giants this season, scoring four goals in 36 appearances across all competitions. As the Uruguay international has less than 15 months remaining on his current deal at Camp Nou, the defender's long-term future at the club has come into question. However, journalist Fabrizio Romano has provided a positive update for Barca supporters, stating that the defender could put pen to paper on a new deal in the ""coming days"". Romano adds that Barcelona are now in the process of preparing the necessary paperwork for the Araujo to sign his new deal until June 2026, which will include a €1bn release clause. Furthermore, Barca are also working on the 'final details' to extend the contract of 17-year-old starlet Gavi. Barca head coach Xavi revealed to the press last week that Araujo has decided to commit his future to the club, despite reported interest from the likes of Chelsea, Liverpool, Manchester City and Manchester United.  ",positive,liverpool,1
135,https://www.sportsmole.co.uk/football/barcelona/injury-news/news/xavi-ansu-fati-is-closing-in-on-barcelona-return_483305.html,Xavi: 'Ansu Fati is closing in on Barcelona return',"The 19-year-old has recently been back in training for the Catalan giants after recovering from the hamstring problem that he picked up against Athletic Bilbao towards the start of the year. Fati has not yet been deemed ready to make his return, though, with the Spain international again left out of the squad for Thursday's Europa League quarter-final second leg with Eintracht Frankfurt. Speaking ahead of the clash with the German outfit, Xavi said that the club are refusing to 'put pressure' on the youngster, but he is now on the verge of making his return to the field. ""We will not pressure him to return. Everything depends on his feelings, but it is good to see him train with the team. He is close to returning to full team participation,"" Xavi told reporters. A recent report claimed that the teenager was planning to be involved against Cadiz this weekend, but it remains to be seen whether he is named in the squad for that particular contest. Fati, who missed around nine months with a serious knee injury before returning to action last September, has scored 18 goals and registered six assists in 53 appearances for Barcelona in all competitions.  ",positive,liverpool,0
136,https://www.sportsmole.co.uk/football/leeds-united/transfer-talk/news/west-ham-told-to-pay-gbp66m-to-sign-lucas-ocampos_482900.html,West Ham United 'told to pay £66m to sign Sevilla's Lucas Ocampos',"The 27-year-old has been a key player for Julen Lopetegui's side this season, scoring eight goals and providing four assists in 35 appearances across all competitions. According to Estadio Deportivo, Ocampos in close to extending his contract with Los Rojiblancos by a further year until June 2025, and his release clause is set to be increased from €70m to €80m. The report adds that that Sevilla are confident they can keep hold of the Argentina international this summer, unless they fail to qualify for the Champions League. Wolverhampton Wanderers have also been credited with an interest in signing Ocampos, but neither they or the Hammers are expected to match Sevilla's asking price. West Ham are also understood to have identified the likes of Benfica's Darwin Nunez, Atalanta BC's Duvan Zapata and Leeds United's Raphinha as potential targets this summer.  ",negative,liverpool,0
