,URL,Content_title,Contents,sentiment,word_search,word_count
237,https://www.sportsmole.co.uk/football/man-utd/transfer-talk/news/man-united-want-aurelien-tchouameni-as-pogba-replacement_482469.html,Manchester United 'want Aurelien Tchouameni as Pogba replacement',"Pogba's contract at Man United now has less than three months left to run, and the Frenchman is widely expected to leave on a free transfer amid links with Paris Saint-Germain and Juventus. Ralf Rangnick's side will therefore be on the lookout for replacements ahead of the summer transfer window, but they are seemingly fighting a losing battle to prise Declan Rice away from West Ham United. According to the Daily Mail, Monaco starlet Tchouameni is high on United's radar as a possible successor to Pogba, but the former Bordeaux starlet is attracting glances from all across Europe. Manchester City, Real Madrid and PSG have also been credited with an interest in Tchouameni, who has scored three goals and set up two more in 43 outings for Les Monegasques this term. Tchouameni's contract at the Stade Louis II is due to run until the end of the 2023-24 season.  ",positive,liverpool,0
238,https://www.sportsmole.co.uk/football/man-utd/transfer-talk/news/man-united-linked-nkunku-to-sign-new-leipzig-contract_482880.html,Manchester United-linked Christopher Nkunku to sign new RB Leipzig contract?,"The 24-year-old has been in impressive form for his Bundesliga side during the 2021-22 campaign, scoring 27 goals and registering 17 assists in 41 appearances in all competitions. Manchester United are believed to be keen to sign the France international during this summer's transfer window, while Arsenal and Paris Saint-Germain have also been linked with his services. According to Bild, Leipzig have a strategy to keep hold of the in-demand attacker until the summer of 2023. The report claims that the German club want to sign Nkunku to a new contract which will include a release clause of €60m (£50m) clause for next summer. Leipzig are believed to be desperate to get one more season out of the attacker but accept that he will leave eventually, as a number of major European clubs are interested in his signature. Nkunku's potential new deal would allegedly see him double his wages to €7m (£5.9m) a year.  ",positive,liverpool,0
239,https://www.sportsmole.co.uk/football/man-utd/transfer-talk/news/psg-to-beat-man-united-liverpool-to-nkunku_482587.html,"Paris Saint-Germain to beat Manchester United, Liverpool to Christopher Nkunku?","The 24-year-old is enjoying a prolific 2021-22 campaign in front of goal for the German outfit, scoring 27 goals and registering 17 assists in 40 appearances across all competitions. Man United, Liverpool and Real Madrid are all believed to be interested in signing Nkunku, who could be available for around €75m (£63m). However, Foot Mercato reports that PSG are determined to sign Nkunku this summer and they have opened talks with the France international's representatives over a potential transfer. The report adds that PSG president Nasser Al-Khelaifi has identified the attacker as a priority target, especially if either Kylian Mbappe or Neymar leave the club in the summer. Furthermore, Leipzig are keen to keep hold of Nkunku and they are prepared to offer him a bumper new contract, with his current deal expiring in June 2024. Nkunku, who came through PSG's academy before joining Leipzig in 2019, has also attracted interest from Barcelona, Arsenal, Manchester City and Bayern Munich.  ",positive,liverpool,1
240,https://www.sportsmole.co.uk/football/man-utd/champions-league/news/jurgen-klopp-talks-up-darwin-nunez-amid-transfer-links_483103.html,Jurgen Klopp talks up Darwin Nunez amid transfer links,"The Uruguayan was on target for the Portuguese side in the first leg of their Champions League quarter-final with the Reds last week but could not prevent a 3-1 defeat at the Estadio da Luz. A hat-trick against Belenenses at the weekend took Nunez's tally to 31 goals for the season in all tournaments, and a number of top European sides are expected to battle for his signature in the summer. Liverpool are among the teams to have been linked with a move for Nunez, and Klopp liked what he saw from the 22-year-old in last week's first leg. ""An extremely good-looking boy eh?! He is a really good boy - he played in front of me battling against [Ibrahima] Konate. He was calm for the finish. He is good, really good. If he stays healthy, he has a big career ahead of him,"" Klopp told reporters ahead of the second leg. Arsenal, Manchester United, Chelsea and Paris Saint-Germain are all thought to be in the race for Nunez, but Benfica coach Nelson Verissimo wants the club to try to match the £113m they sold Joao Felix for in 2019 if they are to part ways with the South American in the summer.  ",positive,liverpool,1
241,https://www.sportsmole.co.uk/football/man-utd/news/rb-leipzig-to-hijack-man-united-move-for-ten-hag_482995.html,RB Leipzig to hijack Manchester United move for Erik ten Hag?,"It has been widely reported in recent days that the 52-year-old has beaten off competition from Mauricio Pochettino to become the next permanent boss at Old Trafford, once interim boss Ralf Rangnick's temporary spell comes to an end in the summer. However, according to The Telegraph, Bundesliga side Leipzig are said to have made moves to bring the Dutchman to Germany at the end of the season too. Delays of any confirmation for Ten Hag's move to England are said to have irritated his current employers Ajax, as Leipzig look to potentially capitalise on any collapse in a deal. Although, the report does continue with the suggestion that some sources in Germany suggest that Leipzig's interest in Ten Hag was before they appointed current boss Domenico Tedesco back in December. The former Spartak Moscow manager took over at the Red Bull Arena following the departure of Jesse Marsch, and under Tedesco, Leipzig have since climbed up to fourth in the Bundesliga table after a turnaround in form following a poor start to the campaign.  ",negative,liverpool,0
242,https://www.sportsmole.co.uk/football/man-utd/injury-news/news/man-united-missing-five-players-through-injury-against-norwich_483424.html,Manchester United missing five players through injury against Norwich City,"McTominay, Varane, Cavani and Shaw were all unavailable for selection against Everton last weekend, and interim head coach Ralf Rangnick has confirmed that they remain on the sidelines. Fred, meanwhile, picked up a hip problem in the defeat to Everton, and the Brazil international will also be absent for the 20-time English champions at Old Trafford. Mason Greenwood remains out through a club suspension, so the hosts will be without the services of six first-team players for the visit of Norwich. Cristiano Ronaldo suffered a nasty gash to his shin against Everton last weekend, but the Portugal international has trained this week and is available for selection against Dean Smith's side. Victor Lindelof, Nemanja Matic and Paul Pogba could benefit from the absences to make the starting XI this weekend, while Anthony Elanga and Diogo Dalot are pushing to return to the side. Man United are currently seventh in the Premier League table, six points behind fourth-placed Tottenham Hotspur on the same number of matches (31).  ",negative,liverpool,0
243,https://www.sportsmole.co.uk/football/man-utd/injury-news/news/rangnick-admits-shaws-season-is-likely-to-be-over_483426.html,Ralf Rangnick admits Luke Shaw's season is likely to be over,"The 26-year-old had to be substituted during his team's 1-1 draw with Leicester City earlier this month due to an issue relating to his previously-broken leg, which had allegedly been causing him pain for some time. Shaw suffered a double leg fracture during a Champions League clash with PSV Eindhoven in 2015, and he underwent a minor operation last weekend to remove two metal bolts that were inserted during the surgery. Rangnick initially said that the defender would be back in ""two or three weeks"", but the German has now admitted that the left-back is unlikely to play again until next season. ""As it seems, he will be out for another at least four weeks, if not five weeks, so I think for him it will be difficult to be available for one of the remaining seven games,"" Rangnick told reporters. Shaw has again been a regular for the 20-time English champions during the 2021-22 campaign, featuring on 27 occasions in all competitions, contributing five assists. Man United will take on Norwich City, Liverpool, Arsenal, Brentford, Brighton & Hove Albion, Chelsea and Crystal Palace in their final seven league games of the Premier League season.  ",negative,liverpool,1
244,https://www.sportsmole.co.uk/football/liverpool/fa-cup/news/liverpool-handed-diogo-jota-injury-concern-ahead-of-fa-cup-semi-final_483324.html,Liverpool handed Diogo Jota injury concern ahead of FA Cup semi-final,"The Portugal international featured from the first whistle in the Champions League clash with Benfica on Wednesday night before being withdrawn just shy of the hour mark in an apparent tactical switch. However, Jurgen Klopp revealed at his pre-match press conference that Jota was carrying a slight knock, and the 25-year-old will need to be assessed ahead of the clash with Pep Guardiola's men. ""Diogo has a slight knock, but there is a good chance he will be all right - we need to have a closer look tomorrow. That is it,"" Klopp told reporters. The Reds are otherwise in good shape for a swift reunion with Guardiola's side, who saw Kyle Walker and Kevin De Bruyne both suffer ankle injuries in their European showdown with Atletico Madrid. Jota scored the winner for the Reds in their 1-0 quarter-final victory over Nottingham Forest last month - one of 21 strikes the former Wolverhampton Wanderers man has registered in all tournaments this season.  ",positive,liverpool,0
245,https://www.sportsmole.co.uk/football/liverpool/news/liverpool-make-official-request-to-push-back-newcastle-game_483334.html,Liverpool 'make official request to push back Newcastle United game',"The Reds are still fighting for the quadruple after seeing off Benfica in the quarter-finals of the Champions League in midweek, setting up a semi-final showdown with Unai Emery's Villarreal as a result. Jurgen Klopp's side will welcome the La Liga outfit to Anfield for the first leg of their semi-final on April 27, with the second leg taking place six days later at La Ceramica on May 3. A trip to St James' Park to face Newcastle is sandwiched in between those two ties for Liverpool, who have less than 72 hours recovery time between the first leg and the clash with the Magpies. Klopp once again took aim at the Premier League and BT Sport for giving Liverpool the lunchtime kickoff during Thursday's press conference, and the Anfield Watch now reports that the club have officially requested the Newcastle game to be pushed back. The report adds that Liverpool instead want the game to be played at 7.45pm on the Saturday, but the powers-that-be are 'not optimistic' about the chances of their request being successful. Klopp's side are facing a total of nine matches in April, the next of which sees them renew hostilities with Manchester City in Saturday's FA Cup semi-final at Wembley Stadium. The Reds boss has been working with a fully-fit squad in the past couple of weeks, but Diogo Jota is now an injury concern ahead of the meeting with Pep Guardiola's side.  ",negative,liverpool,3
246,https://www.sportsmole.co.uk/football/man-city/news/guardiola-states-where-he-wants-to-manage-after-man-city_483444.html,Pep Guardiola states where he wants to manage after Manchester City,"The 51-year-old has been with the Citizens since 2016, but he now has less than 15 months remaining on his contract and his long-term future at the Etihad Stadium remains uncertain. Guardiola has been linked with the national teams of both Brazil and Argentina in recent weeks, and although the Spaniard claimed earlier this month that he would be 'willing to stay at Man City forever', he has declared his ambitions to coach on the international stage. ""One day I would like to be the coach of a national team, but I would not like to choose it immediately. I need to rest for a while,"" Guardiola told AS Argentina. A potential move to Argentina could see Guardiola reunite with legendary forward Lionel Messi, who has been praised by his former Barcelona coach. ""Messi means everything in my career. I felt what Phil Jackson could feel with Michael Jordan because I had Leo Messi. I owe Messi everything. Everything, everything everything. He made me more competitive,"" Guardiola added. ""We had an impressive group of players, there were a lot of stars who created a unique chemistry between them. Without him, we too would have won. But how much? Impossible. I owe him a bottle of wine to thank him for all the contracts he made me sign."" Guardiola has won a total 31 trophies as a manager with Barcelona, Bayern Munich and Man City, including 10 with the latter, and there could be more silverware on the way with the Citizens this season.  ",positive,liverpool,0
247,https://www.sportsmole.co.uk/football/liverpool/injury-news/news/jurgen-klopp-confirms-trent-alexander-arnold-injury-blow_465870.html,Jurgen Klopp confirms Trent Alexander-Arnold injury blow,"The England international was nowhere to be seen on Liverpool's teamsheet for Tuesday's Champions League clash with Porto after reports on Monday claimed that he had not travelled with the squad to the Estadio do Dragao. Alexander-Arnold was originally reported to be nursing a minor injury, and Klopp has now confirmed that a muscular issue could put his participation in Sunday's game in doubt. Speaking to BT Sport, Klopp said: ""Unfortunately he is injured. He came in from training and we did further assessment and it looked [more] serious. It's a muscle, it's a bit of tightness. He's out for today and it doesn't look great for the City game either."" James Milner has been given the nod at right-back with Alexander-Arnold out, but Klopp has otherwise named an unchanged side for the battle with Sergio Conceicao's outfit. ",positive,liverpool,1
248,https://www.sportsmole.co.uk/football/liverpool/champions-league/news/jurgen-klopp-hails-top-class-curtis-jones-after-champions-league-rout-of-porto_465903.html,Jurgen Klopp hails 'top-class' Curtis Jones after Champions League rout of Porto,"The 20-year-old was at the heart of all the Reds’ best attacking moves and it was his parried shot which produced the early breakthrough goal from Mohamed Salah.  Jones continued to have a significant influence as Sadio Mane, Salah again and substitute Roberto Firmino all scored and Klopp’s side made it 14 goals in their last three visits to the Estadio do Dragao since 2018.  What was more impressive was he was struggling with illness before kick-off.  “Curtis played a good game. He had some problems a little bit with the stomach before the game,” said Klopp.  “They (medical staff) told me I need to keep an eye on him but I told him after the game ‘Whatever it is, keep it’ because it was really a good game. Big Away Win….🔥 pic.twitter.com/oF54KRIcIN  — Curtis Jones (@curtisjr_10) September 28, 2021 Big Away Win….🔥 pic.twitter.com/oF54KRIcIN  — Curtis Jones (@curtisjr_10) September 28, 2021  “He was everywhere, he was involved in everything. Set up the first goal with a surprising finish, goalie cannot save it.  “In a lot of other situations he was really there – maybe not as spectacular as the offensive stuff, but defensively he played a top-class game.  “A lot of things I liked a lot about his performance tonight. So, let’s keep going, Curtis, it was not bad tonight.”  Klopp made only one change from the 3-3 draw against Brentford and that was enforced after right-back Trent Alexander-Arnold was left at home due to a groin injury.  The England defender will now miss Sunday’s visit of Manchester City.  “So the situation when you play Saturday and Tuesday, the players who start the game – which Trent obviously did – have on Sunday no training, they have recovery,” said Klopp.  “On Monday, the only session we have together, we pretty much walk through the things.  “We have meetings and on the pitch we just show the difference between the opponents, so there was no intensity really in the session. Defender Trent Alexander-Arnold sustained a groin injury after training on Monday (Peter Byrne/PA) “But Trent in the middle of the session felt his adductor and in that area he has now a little injury.  “Obviously when you have something with your muscle, it’s not likely for Sunday – no muscle injury heals that quick.  “After that, it’s internationals. I don’t want to make the decision for him but what I heard, I don’t think it will be possible for him to be with the national team.  “But the other people (England’s medical staff) have to decide that in the end but hopefully after that he will be ready again, but we don’t know exactly.” View this post on Instagram                     A post shared by Liverpool Football Club (@liverpoolfc) A post shared by Liverpool Football Club (@liverpoolfc)  Porto coach Sergio Conceicao, whose only consolation was seeing Mehdi Taremi briefly make it 3-1, admitted his team’s performance was not up to the standard required.  “The five goals we conceded are the kind you concede when you are in a relaxed training session and not when you’re playing in the Champions League,” he said.  “Too many mistakes in danger areas. Everything was bad, but the responsibility is mine.”   ",positive,liverpool,4
249,https://www.sportsmole.co.uk/football/liverpool/champions-league/news/jurgen-klopp-claims-liverpools-defending-is-not-that-much-of-a-concern_465695.html,Jurgen Klopp claims Liverpool's defending is 'not that much of a concern',"The Premier League leaders’ wild 3-3 draw at Premier League newcomers Brentford on Saturday was the first time they had conceded three in a match since the European defeat to Real Madrid in April.  It came as something of a shock after previously letting in just one in five league matches this season.  However, they have already experienced similar against AC Milan a fortnight ago when they let in two goals in three minutes just before the interval, resulting in a more difficult second half than they should have had before closing out a 3-2 victory.  “It’s not that much of a concern because I don’t think you should make these things bigger than they are – but we have to show a reaction, that’s for sure,” said Klopp before the squad flew out to Portugal.  “It’s really tricky to win a football game when you are not defending on your highest level and that’s what we didn’t do.  “The common opinion is it’s only about the last line but we had a problem in general with our defending. That’s why Brentford caused us problems and it wasn’t good.  “We have to improve in that department for sure but now is not the moment to be concerned.  “We spoke about it and we know we cannot do it like that. I think we have sorted it but we have to show it tomorrow.”  There is the potential for more defensive disruption as Klopp is likely to rotate his players with Joe Gomez and Ibrahima Konate in contention to come in at centre-back.  Liverpool’s last two meetings with Porto have seen them score 11 goals and concede just one and after both encounters Klopp’s side progressed to the final, winning one and losing one.  The Reds boss is not one for omens, however, and insists Tuesday’s match is a reset.  “It’s not an advantage at all that we won the last two games there, absolutely not. For them it is another reason to be motivated on the highest level,” he added.  “You only have to put yourself in the position of the opponent and the first thing you would want to do is make sure a similar thing doesn’t happen again.  “That doesn’t make our job easier for sure but it’s not about that. We don’t think about the last two games we played there. We think about this one.  “We didn’t think about the game before when we won 4-1 (last season) because it makes no sense. Is right, Naby lad 😁  Putting in those Porto preparations 👊 #UCL pic.twitter.com/yH6b876jLc  — Liverpool FC (@LFC) September 27, 2021 Is right, Naby lad 😁  Putting in those Porto preparations 👊 #UCL pic.twitter.com/yH6b876jLc  — Liverpool FC (@LFC) September 27, 2021  “They qualify year in, year out for the Champions League and they are always first or second in the Portuguese League. That is a top team and that is what we are preparing for.  “I am still happy we won the games when we were there but we don’t think we have won this game already.”  Fit-again midfielder Naby Keita was included in the squad to face Porto after recovering from the foot injury which forced him to miss the Brentford game.   ",positive,liverpool,3
250,https://www.sportsmole.co.uk/football/liverpool/champions-league/news/liverpool-have-weaknesses-too-sergio-conceicao_465699.html,Liverpool have weaknesses too - Sergio Conceicao,"The last two meetings between the clubs, in 2018 and 2019, have seen the Primeira Liga side concede 11 goals and score just one having lost the home legs 5-0 and 4-1.  Conceicao said while little had altered in Klopp's squad, his own side had undergone significant change.  ""If we look at Liverpool's experience, since 2019 they have lost (Dejan) Lovren and (Georginio) Wijnaldum,"" he said. ""We were left with three: (Jesus Manuel) Corona, Otavio and Bruno Costa.  ""That experience and the fact that they stay together is very important in a competition like this.  ""We can highlight numerous theoretical differences, such as the fact that our budget is 20 or 30 per cent of Liverpool's, but that will not come into play tomorrow.  ""What comes in is the preparation of the game, the strategy we define and the way we are going to be organised.  ""We have to be as competitive as Liverpool, an opponent who, for me, is the best team in the world at some moments in the game – and I'm not exaggerating Liverpool's value.  ""It's up to us to counter that opponent's power and expose some of the opponent's weaknesses, because they also exist.""   ",positive,liverpool,4
251,https://www.sportsmole.co.uk/football/man-utd/transfer-talk/news/aurelien-tchouameni-agent-denies-real-madrid-agreement_481868.html,Aurelien Tchouameni agent denies Real Madrid agreement,"The France international has been in impressive form for Monaco during the 2021-22 campaign, scoring three times and registering two assists in 42 appearances in all competitions. The 22-year-old's future has been the subject of much speculation in recent weeks, with Real Madrid believed to be determined to bring him to the club this summer. There have been claims that Los Blancos have already settled on personal terms with the Frenchman. However, Tchouameni's agent has told Le Parisien that there is no agreement with Carlo Ancelotti's side over a summer switch to the Spanish capital. Italian journalist Fabrizio Romano has claimed that there is interest from Real Madrid, while two Premier League clubs and Paris Saint-Germain are also admirers of the midfielder. Tchouameni, recently linked with a switch to Manchester United, only has two years left to run on his current deal with Monaco.  ",positive,liverpool,0
252,https://www.sportsmole.co.uk/football/man-utd/transfer-talk/news/chelsea-psg-join-man-united-real-madrid-in-tchouameni-race_482514.html,"Chelsea, PSG 'join Manchester United, Real Madrid in Aurelien Tchouameni race'","The 22-year-old was one of the first names on the teamsheet under Niko Kovac and now Philippe Clement, scoring three goals and setting up two more in 43 appearances this term. Tchouameni's form has supposedly led to glances from both Real and Manchester United, who are believed to have identified the France international as an ideal replacement for Paul Pogba. However, AS claims that Chelsea and PSG have now joined the race for Tchouameni's signature, with the Blues hopeful of striking a deal despite the uncertainty surrounding their ownership situation. The report adds that Tchouameni has his heart set on a move to Real Madrid, though, while PSG's priority is still a deal for soon-to-be free agent Pogba. Tchouameni's contract at the Stade Louis II is due to expire at the end of the 2023-24 season, and Real have supposedly identified Chelsea's N'Golo Kante as a possible alternative should they miss out on the former Bordeaux man.  ",positive,liverpool,0
