,URL,Content_title,Contents,Sentiment
37,https://www.footballaddrict.com/2022/04/17/facup/,FACup สิงห์ไม่พลาด มาตามนัด เอาชนะพาเลซ 2-0 รีแมตช์ชิงดำกับหงส์แดง,"FACup เชลซีผ่านเข้าไปถึงรอบชิงชนะเลิศ เอฟเอ คัพ 3 ปีติดต่อกัน โดยจะพบ ลิเวอร์พูล ถือเป็นการล้างตาในเกมชิงชนะเลิศ คาราบาว คัพ เชลซี เพิ่งกรำศึกหนักมาเมื่อกลางสัปดาห์ นัดนี้ยังใช้บริการสามประสานอย่าง ไค ฮาแวร์ตซ์, ติโม แวร์เนอร์ และเมสัน เม้าท์ โดยมี มาเตโอ โควาซิชและจอร์จินโญ่ คุมเกมแดนกลาง แต่ตัวหลักอย่าง เอ็นโกโล่ ก็องเต้ และธิอาโก้ ซิลวา เป็นสำรองไปก่อน ด้านครัสตัล พาเลซ ผลงานเจอกันช่วงหลังไม่ดีเลย แพ้รวด 9 เกม วันนี้ให้ วิลเฟร็ด ซาฮากับ เอเบเรชี่ เอเซ่ คอยป้อนบอลให้ ฌอง-ฟิลิปป์ มาเตต้า สิงห์ไฮโซ มาได้ประตูขึ้นนำจนได้ เป็นจังหวะที่มิตเชลล์ ไปเสียบอออลในแดนตัวเองก่อน ฮาแวร์ตซ์ ได้หลุดเข้าไปในกรอบเขตโทษด้านขวาก่อนเปิดไปติดเกอฮีแล้วบอลดันมาตั้งให้ ลอฟตัส-ชีควางเท้าหวดด้วยขวาเต็มข้อบอลพุ่งตุงตาข่าย 1-0!!! เชลซี มาได้ประตูหนีห่างหลังเดินหน้าบุกขึ้นมาอีกครั้ง แวร์เนอร์ฝากบอลไปให้เม้าท์เกี่ยวเข้าไปในกรอบเขตโทษก่อนแปด้วยขวาหนีมือของบัตแลนด์เข้าประตูไป 2-0!!! หมดเวลาการแข่งขัน เชลซี ไม่พลาดผ่านเข้าไปถึงรอบชิงชนะเลิศ เอฟเอ คัพ สำเร็จ โดยจะพบกับลิเวอร์พูล ในช่วงกลางเดือนหน้า   สนับสนุนโดย@vv123 อ่านต่อได้ที่ข่าวฟุตบอล ",neutral
38,https://www.footballaddrict.com/2022/04/13/%e0%b8%aa%e0%b8%a5%e0%b8%b2%e0%b8%a2%e0%b9%80%e0%b8%9b%e0%b9%87%e0%b8%99%e0%b9%80%e0%b8%aa%e0%b8%b5%e0%b9%88%e0%b8%a2%e0%b8%87%e0%b9%86/,สลายเป็นเสี่ยงๆ ชาก้า’ รับความสัมพันธ์กับ แฟนปืน คงไม่กลับมาเหมือนเดิม,"สลายเป็นเสี่ยงๆ กองกลางชาวสวิตเซอร์แลนด์เคยเป็นประเด็นดังหลังมีปัญหากับแฟนบอลของ อาร์เซน่อล ในเกมเปิดรังเหย้าพบ คริสตัล พาเลซ เมื่อเดือนตุลาคม 2019 จากจังหวะเอามือป้องหูตอนที่โดนโห่ระหว่างเดินออกจากสนาม เขาโดนปลดออกจากตำแหน่งกัปตันทีมและเกือบได้ย้ายออกจากทีม จนกระทั่ง มิเกล อาร์เตต้า ที่เข้ามารับตำแหน่งต่อจาก อูไน เอเมรี่ เกลี้ยกล่อมให้เขาอยู่ต่อ ชาก้า เปิดเผยว่าภาพของแฟนบอลบนอัฒจันทร์ยังติดตาเขาอยู่ทุกครั้งที่เดินเข้าอุโมงค์ และไม่คิดว่าความสัมพันธ์จะกลับมาเป็นเหมือนก่อนหน้า “ตอนผมเดินเข้าใกล้อุโมงค์, ผมมองขึ้นไปที่แฟนบอลด้านบนอัฒจันทร์, และนี่เป็นส่วนที่ผมจะจดจำตลอดไป” ชาก้า กล่าวผ่านThe Players’ Tribune “ตอนนี้เวลาผมหลับตาลง, ผมยังเห็นหน้าของพวกเขาอยู่เลย ผมเห็นถึงความโกรธแค้น ไม่ใช่ว่าพวกเขาไม่ชอบผมนะ ไม่เลย, มันแตกต่างกัน เป็นความเกลียดชัง, เกลียดชังล้วนๆ” “ผมทำผิดไปรึเปล่า? ใช่ แต่ผมจะแสดงออกแตกต่างจากเดิมมั้ยหากเกิดขึ้นอีกครั้งในวันพรุ่งนี้? บอกตามตรงนะผมไม่รู้เลย” “ทุกวันนี้ถ้าเราแพ้, ผมเกลียดการเดินเข้าอุโมงค์ช่วงไม่กี่เมตรสุดท้าย เพราะผมยังจดจำใบหน้าเหล่านั้นได้ คนกลุ่มเดียวกันนั่งอยู่ตรงนั้น” “ตอนนี้ผมเลยก้มหัวเอาไว้ ผมผ่านฝันร้ายมาแล้วรอบนึง ผมไม่อยากให้เป็นแบบนั้นอีก” “วันนี้ผมรู้ว่าผมตัดสินใจได้ถูกต้องแล้ว, ถูกต้องสุดๆ เพราะผมยังอยู่ตรงนี้ แต่ผมก็แกล้งทำเป็นว่าความสัมพันธ์ระหว่างผมกับแฟนบอลจะเป็นเหมือนเดิม เพราะช่วงเวลานั้นจะอยู่ในใจผมตลอดไป” “ก็เหมือนกับแก้วที่แตกไปแล้วนั่นล่ะรู้มั้ย? คุณประกบให้ติดกันอีกครั้งได้แต่รอยร้าวยังคงอยู่ตรงนั้น”   สนับสนุนโดย@vv123 อ่านต่อได้ที่ข่าวฟุตบอล ",neutral
39,https://www.footballaddrict.com/2022/04/11/%e0%b9%80%e0%b8%84%e0%b8%a7%e0%b8%b4%e0%b8%99-%e0%b9%80%e0%b8%94%e0%b8%ad-%e0%b8%9a%e0%b8%a3%e0%b8%ad%e0%b8%a2%e0%b8%99%e0%b9%8c/,เควิน เดอ บรอยน์ เผยเหตุผลที่ดูสนิท เวอร์กิล ฟาน ไดจ์ เพราะลูกเรียนที่เดียวกัน,เควิน เดอ บรอยน์ หลังเกมที่ “เรือใบสีฟ้า” เปิดบ้านเสมอกับ “หงส์แดง” ไปแบบสุดมัน 2-2 เมื่อคืนวันอาทิตย์ที่ผ่านมา หลังเกมก็มีการจับภาพที่โค้ชและนักเตะหลายคนของทั้งสองทีมเดินเข้าไปพูดคุยทักทายกัน เป็นเพราะลูกของพวกเขาเรียนที่เดียวกัน โดยเฉพาะกับทาง เดอ บรอยน์ และ ฟาน ไดจ์ ที่มีหลายคนสงสัยว่าเหตุใดทั้งคู่ถึงดูรู้จักกันเป็นอย่างดี และเมื่อถูกถามถึงเรื่องดังกล่าวมิดฟิลด์ชาวเบลเยี่ยมก็ได้ตอบว่า “ผมรู้จัก เวอร์กิล ผมกับเขาเจอกันบ่อยมาก” เดอ บรอยน์ กล่าว “ลูกของพวกเราเรียนที่เดียวกันและพวกเขาชอบเล่นด้วยกัน มันเลยเป็นการทักทายแบบเป็นกันเอง”   สนับสนุนโดย@vv123 อ่านต่อได้ที่ข่าวฟุตบอล ,positive
40,https://www.footballaddrict.com/2022/04/11/%e0%b9%80%e0%b8%ad%e0%b9%87%e0%b8%99%e0%b8%84%e0%b8%b8%e0%b8%99%e0%b8%84%e0%b8%b9/,เอ็นคุนคู เก่งขนาดนี้ แมนเชสเตอร์ ยูไนเต็ด ไม่ตามสเก๊าท์ สื่อเผย รังนิคงง,เอ็นคุนคู รังนิค เป็นอดีตกุนซืแอร์เบ ไลป์ซิก มีความสัมพันธ์เน้นแฟ้นกับสโมสรในกลุ่มเร้ดบูลล์ ก่อนตัดสินใจเข้ามารับคุมยูไนเต็ด แบบขัดตาทัพเมื่อพฤศจิกายนที่ผ่านมา ทันทีที่เขาเริ่มงาน ESPN รายงานว่า รังนิค ตกใจกับทีมแมวมองของสโมสรที่แจ้งว่าไม่ได้ตามสเก๊าท์ เอ็นคุนคู เพราะไม่ได้อยู่ในลิสต์เป้าหมาย เรื่องราวนี้ถูกเปิดเผยผ่าน Stretford Paddock ทางยูทูบ ที่ให้รายละเอียดว่า ยูไนเต็ดไม่ได้สนใจมิดฟิลด์วัย 24 ปี จึงไม่ได้ตามสเก๊าท์ใดๆนักเตะเลย เอ็นคุนคู ถือเป็นหนึ่งในผู้เล่นที่กำลังถูกจับตามองอย่างมาก หลังทำไปแล้ว 28 ประตูในทุกรายการของซีซั่นนี้ รวมถึง 7 ประตูในยูฟ่า แชมเปี้ยนส์ลีก รอบแบ่งกลุ่ม จากฟอร์มที่ยอดเยี่ยม ทำให้มีข่าวออกมาว่า ทางไลป์ซิก พร้อมรับฟังทุกข้อเสนอที่ราคา 63 ล้านปอนด์ หลังสัญญาของนักเตะกำลังจะหมดลงในซัมเมอร์ปี 2024   สนับสนุนโดย@vv123 อ่านต่อได้ที่ข่าวฟุตบอล ,negative
41,https://www.footballaddrict.com/2022/04/10/%e0%b9%80%e0%b8%ad%e0%b9%87%e0%b8%a1%e0%b8%9a%e0%b8%b1%e0%b8%9b%e0%b9%80%e0%b8%9b%e0%b9%89/,เอ็มบัปเป้ เสียดายสามประสาน ปารีส แซงต์-แชร์กแมง คลิ๊กกันช้าไป,เอ็มบัปเป้ ลีกเอิงเมื่อคือวันเสาร์ที่ผ่านมา “เปแอสเช” บุกไปถล่มเอาชนะแกลร์กมงต์ ฟุต 6-1 โดยที่ เนย์มาร์ และ เอ็มบัปเป้ ช่วยกันแฮตทริค ขณะที่ เมสซี่ โชว์ฟอร์มทำ 3 แอสซิสต์ สองนัดที่ผ่านมาสามประสาน MNM ยิงรวมกันไป 11 ประตู และมี 8 แอสซิสต์ ซึ่งดูเหมือนว่าพวกเขาจะเข้าขากันช้าไป โดยเฉพาะหลังจากที่กระเด็นตกรอบ 16 ทีมยูฟ่า แชมเปี้ยนส์ ลีก อย่างไรก็ตามเปแอสเชนำเป็นจ่าฝูงลีกเอิงทิ้งห่างแรนส์และมาร์กเซย 15 คะแนน เอ็มบัปเป้ ให้สัมภาษณ์หลังเกมว่า “เราแฮปปี้กับฟอร์มตัวเองมากๆ เราเดินหน้าไล่ล่าแชมป์ที่ 10 (ในลีกของเปแอสเช)ต่อไป ผมคิดว่ามันไม่ไกลเกินไป และเราก็พอใจมาก” เกี่ยวกับความเข้าใจในการเล่นของสามประสานในช่วงหลัง “ใช่ๆ มันน่าเสียดายที่มันเกิดขึ้นตอนนี้ นั่นหมายความว่าที่ผ่านมาไม่น้อยเราดีเลย์กัน แต่เรารู้สึกว่าเราเป็นสามผู้เล่นที่มีคุณภาพ และเราพยายามช่วยทีมให้ได้มากที่สุด ซึ่งก็ทำได้ในวันนี้” เมื่อถามว่าเสียใจหรือไม่ที่คลิ๊กกันช้าไป “ชีวิตก็แบบนี้ มีแพ้ มีชนะ คุณต้องมองไปข้างหน้า ที่ผ่านมามันเป็นอดีตไปแล้ว เรามีความเจ็บปวดซึ่งก็ส่งผมมาถึงปัจจุบันแต่คุณต้องมองบวกเข้าไว้” “เราต้องโชว์ให้เห็นว่าเราเป็นสโมสรใหญ่และทีมใหญ่ และเราเล่นเพื่อเป็นแชมป์” เขากล่าว   สนับสนุนโดย@vv123 อ่านต่อได้ที่ข่าวฟุตบอล ,neutral
42,https://www.footballaddrict.com/2022/04/08/aguerooo/,AGUEROOO แมนซิตี้เตรียมเปิดตัวรูปปั้น ‘กุน’ ครบรอบ 10 ปี 93:20,"AGUEROOO อดีตดาวยิงชาวอาร์เจนไตน์เป็นตำนานของ แมนฯ ซิตี้ และสร้างช็อตให้แฟนบอลทั่วโลกได้จดจำจากการยิงประตูชัยตอนทดเจ็บและพาทีมคว้าแชมป์พรีเมียร์ลีก 2011-12 เหนือคู่ปรับร่วมเมืองอย่าง แมนเชสเตอร์ ยูไนเต็ด รูปปั้นของ อเกวโร่ จะถูกตั้งเคียงข้างอดีตเพื่อนร่วมทีมอย่าง แวนซองต์ กอมปานี และ ดาบิด ซิลบา โดยมีการเปิดตัวในวันที่ 13 พฤษภาคมซึ่งเป็นวันครบรอบ 10 ปีเกม แมนฯ ซิตี้ พลิกกลับมาคว้าชัยเหนือ คิวพีอาร์ 3-2 ซิวแชมป์วินาทีสุดท้าย “แมนฯ ซิตี้ ยินดีที่จะประกาศการจัดอีเวนต์และกิจกรรมในแมนเชสเตอร์ เพื่อฉลองครบรอบ 10 ปีของ ’93:20′, เกมนัดประวัติศาสตร์ที่พบกับ คิวพีอาร์ โดยทีมยิงสองประตูช่วงทดเวลาบาดเจ็บและถูกยกย่องให้เป็นหนึ่งในการคัมแบ็คอันยอดเยี่ยมที่สุดของวงการกีฬา, เถลิงบัลลังก์แชมป์เป็นหนแรกในรอบ 44 ปี” แถลงการณ์ระบุ “ตำนานของ เซร์คิโอ อเกวโร่ จะได้รับการเชิดชูผ่านการเปิดตัวรูปั้นที่ดีไซน์และสร้างโดย แอนดี้ สก็อตต์ ช่างปั้นชื่อดัง” อเกวโร่ อำลาจาก แมนฯ ซิตี้ ไปเมื่อซัมเมอร์ที่แล้วหลังฝากผลงานยิง 260 ประตูเป็นสถิติสโมสรและคว้าแชมป์พรีเมียร์ลีก 5 สมัยตลอดช่วงเวลา 10 ปี เขาย้ายไปอยู่กับ บาร์เซโลน่า แต่ต้องโบกมือจากการค้าแข้งไปในเดือนธันวาคมที่ผ่านมาเพราะปัญหาเกี่ยวกับสุขภาพ   สนับสนุนโดย@vv123 อ่านต่อได้ที่ข่าวฟุตบอล ",neutral
43,https://www.footballaddrict.com/2022/04/07/%e0%b8%9f%e0%b8%b2%e0%b8%9a%e0%b8%b4%e0%b9%82%e0%b8%ad-%e0%b8%84%e0%b8%b2%e0%b8%a3%e0%b9%8c%e0%b8%a7%e0%b8%b1%e0%b8%a5%e0%b9%82%e0%b8%8d%e0%b9%88/,ฟาบิโอ คาร์วัลโญ่ ผ่านตรวจร่างกายแล้วปิดดีลซบหงส์แดง รอเปิดตัว,ฟาบิโอ คาร์วัลโญ่ เจ้าหนูวัย 19 ปีเกือบที่จะย้ายมาอยู่กับ ลิเวอร์พูล ตั้งแต่เดือนมกราคมที่ผ่านมาหลังบรรลุข้อตกลงได้ในวันปิดตลาดซื้อขาย อย่างไรก็ตามพวกเขายื่นเอกสารไม่ทันเวลาเดตไลน์ กระนั้น “หงส์แดง” ยังเป็นตัวเต็งที่จะได้ คาร์วัลโญ่ มาร่วมทีมในช่วงซัมเมอร์และมีการพูดคุยกับ ฟูแล่ม ต้นสังกัดของนักเตะตลอดช่วงที่ผ่านมา ล่าสุดรายงานจาก ฟาบริซิโอ โรมาโน่ นักข่าวดังยืนยันแล้วว่าทีมดังแห่งเมอร์ซี่ย์ไซด์เตรียมจะได้นักเตะมาร่วมทีมแบบเป็นทางการ โดยคาดหมายว่าจะมีการประกาศเกิดขึ้นเมื่อซีซั่นนี้สิ้นสุดลงเพื่อเคารพต่อ “เจ้าสัวน้อย” ทั้งสองฝ่ายบรรลุค่าตัวได้ที่ 5 ล้านปอนด์พ่วงด้วยแอดออน 2.7 ล้านปอนด์ มีการตรวจร่างกายเรียบร้อยตามที่ ฟูแล่ม อนุญาตและ เยอร์เก้น คล็อปป์ กุนซือของ ลิเวอร์พูล ก็ได้พูดคุยกับนักเตะแล้วเช่นกัน คาร์วัลโญ่ ได้รับสัญญายาวจนถึงปี 2027 นอกจากนี้ยังมีการใส่เงื่อนไขจ่ายส่วนแบ่งค่าตัวในอนาคตให้กับทาง ฟูแล่ม ที่ประมาณ 20 เปอร์เซนต์ด้วย เวลานี้ ลิเวอร์พูล ไม่มีแผนที่จะปล่อยให้ คาร์วัลโญ่ กลับไปเล่นกับ ฟูแล่ม แบบยืมตัวและมีโอกาสจะให้เขาเป็นส่วนหนึ่งของทีมในฤดูกาลหน้า ซีซั่นนี้ คาร์วัลโญ่ ผ่านการลงสนามให้กับ ฟูแล่ม ไป 31 เกมในฤดูกาลนี้และยิงได้ 8 ประตูกับแอสซิสต์อีก 7 หน ช่วยให้ต้นสังกัดรั้งจ่าฝูงของแชมเปี้ยนชิพเตรียมเลื่อนชั้นกลับสู่พรีเมียร์ลีก   สนับสนุนโดย@vv123 อ่านต่อได้ที่ข่าวฟุตบอล ,neutral
44,https://www.footballaddrict.com/2022/04/06/%e0%b8%98%e0%b8%b4%e0%b9%82%e0%b8%9a%e0%b8%95%e0%b9%8c-%e0%b8%84%e0%b8%b9%e0%b8%a3%e0%b9%8c%e0%b8%81%e0%b8%95%e0%b8%b1%e0%b8%a7%e0%b8%aa%e0%b9%8c/,ธิโบต์ คูร์กตัวส์ เผยสิงห์แกร่งเหมือนเดิม แต่ชุดขาวรู้แล้วปีก่อนพลาดตรงไหน,ธิโบต์ คูร์กตัวส์ นายทวารวัย 29 ปี จะได้โคจรมาพบกับ “สิงห์บลูส์” ทีมเก่าอีกครั้งเป็นปีที่ 2 ติดต่อกันในศึกแชมเปี้ยนส์ลีก รอบ 8 ทีมสุดท้าย หลังจากปีที่แล้วพวกเขาเป็นฝ่ายแพ้และตกรอบรองชนะเลิศ “ส่วนใหญ่ของพวกเขายังเป็นทีมเดิมและนักเตะชุดเดิม แน่นอนว่าด้วยไดนามิกจากปีที่แล้ว พวกเขาทำได้อย่างราบรื่น” คูร์กตัวส์ กล่าว “ผมว่าปีนี้พวกเขาต้องดิ้นรนมากกว่าเดิมนิดหน่อย แต่พวกเขาก็ยังคงเป็นทีมที่ดีและมีนักเตะบิ๊กเนมที่มีความสามารถวิ่งตัดหลังผ่านเข้าไปได้” “เรื่องดีก็คือพวกเรารู้ว่าเราพลาดจุดไหนเมื่อปีก่อน เพราะฉะนั้นเราสามารถทำได้ดีขึ้นในวันพรุ่งนี้และเก็บผลการแข่งขันที่ดีกว่าเดิม”   สนับสนุนโดย@vv123 อ่านต่อได้ที่ข่าวฟุตบอล ,positive
