,URL,Content_title,Contents,Sentiment
117,https://www.footballaddrict.com/2022/03/31/%E0%B8%A3%E0%B8%B8%E0%B8%94-%E0%B8%9F%E0%B8%B2%E0%B8%99-%E0%B8%99%E0%B8%B4%E0%B8%AA%E0%B9%80%E0%B8%95%E0%B8%A5%E0%B8%A3%E0%B8%AD%E0%B8%A2/#respond,รุด ฟาน นิสเตลรอย นั่งกุนซือทีม PSV ชุดใหญ่ในซีซั่นหน้า อย่างเป็นทางการ,รุด ฟาน นิสเตลรอย อดีตแข้งวัย 45 ผันตัวมารับงานเป็นผู้ช่วยโค้ชทีมชาติเนเธอร์แลนด์ ตั้งแต่ปี 2014 ก่อนจะมาเริ่มมารับงานกุนซือให้ทีมชุดสำรองของ พีเอสวี ตั้งแต่ปีที่แล้ว ล่าสุดทางสโมสรก็ได้ยืนยันตั้งแต่ให้ นิสเตลรอย เข้ามารับตำแหน่งกุนซือทีมชุดใหญ่แทนที่ของ โรเจอร์ ชมิดท์ ที่กำลังจะลาออกจากตำแหน่งหลังจบซีซั่นนี้ โดยเจ้าตัวจะได้เริ่มงานในซีซั่น 2022-2023 และจะเป็นการเซ็นสัญญาระยะสั้น 2 ปี ไปจนถึง 2025 และจะเป็นงานแรกในฐานะกุนซือทีมชุดใหญ่เต็มตัวของเขา นิสเตลรอย เคยฝากผลงานแจ้งเกิดกับ พีเอสวี สมัยที่ยังเป็นนักเตะเมื่อช่วงปลายยุค 90 โดยลงสนามให้ทีม 90 นัดทำไป 77 ประตู ก่อนจะย้ายไปอยู่กับ แมนเชสเตอร์ ยูไนเต็ด ในปี 2001   สนับสนุนโดย@vv123 อ่านต่อได้ที่ข่าวฟุตบอล ,negative
118,https://www.footballaddrict.com/2022/03/23/%e0%b8%9c%e0%b8%b5%e0%b9%81%e0%b8%94%e0%b8%87%e0%b8%84%e0%b8%b8%e0%b8%a2%e0%b8%9a%e0%b8%a7%e0%b8%81-tenhag-%e0%b8%ab%e0%b8%a5%e0%b8%b1%e0%b8%87%e0%b8%9e%e0%b8%b9%e0%b8%94%e0%b8%84%e0%b8%b8%e0%b8%a2/,ผีแดงคุยบวก Tenhag หลังพูดคุยกันเรื่องสัญญาการคุมทีม,สนับสนุนโดย@vv123 อ่านต่อได้ที่ข่าวฟุตบอล ,positive
119,https://www.footballaddrict.com/2022/03/23/%e0%b8%81%e0%b8%b2%e0%b9%80%e0%b8%9a%e0%b8%a3%e0%b8%b5%e0%b8%a2%e0%b8%a5-%e0%b8%a1%e0%b8%b2%e0%b8%a3%e0%b9%8c%e0%b8%95%e0%b8%b4%e0%b9%80%e0%b8%99%e0%b8%a5%e0%b8%a5%e0%b8%b5%e0%b9%88/,กาเบรียล มาร์ติเนลลี่ เชื่อ “พี่ต้า” คือยอดโค้ชรอวันไล่กวาดแชมป์,กาเบรียล มาร์ติเนลลี่ กุนซือหนุ่มวัย 39 ปี เข้ามารับงานคุมทีม “ปืนใหญ่” ช่วงปลายปี 2019 และประสบความสำเร็จด้วยการพาทีมคว้าแชมป์เอฟเอคัพ ตั้งแต่ปีแรก โดยในปัจจุบันก็กำลังพาทีมรั้งอันดับ 4 ของตารางคะแนนมีโอกาสกลับไปเล่นแชมเปี้ยนส์ลีก เป็นหนแรกในรอบ 6 ปี “เขาคอยซัพพอร์ตผมมาเสมอในช่วงที่ผมบาดเจ็บ เขาถือว่าเป็นโค้ชชั้นยอดแล้ว เขาทำงานโดยที่คิดว่าฟุตบอลสมัยใหม่เป็นอย่างไร เขาให้คำแนะนำกับพวกเรา” มาร์ติเนลลี่ กล่าว “เขายังเป็นมนุษย์ที่ดีมากคนหนึ่งอีกด้วย เขาปฏิบัติกับผู้อื่นดีเสมอ ผมรู้สึกได้ว่า อาร์เตเต้ จะเป็นหนึ่งในเหล่าโค้ชที่ทำงานยาวนานพร้อมกับแชมป์หลายรายการภายใต้ชื่อของเขาและมีสถานะของเขาในประวัติศาสตร์ฟุตบอล” “อาร์เซน่อล เข้าร่วมการแข่งขันทุกรายการและคิดที่จะคว้าแชมป์เสมอ พวกเราไม่ได้บรรลุเป้าหมายพวกนี้ตลอดหลายซีซั่นนี้ที่ผ่านมา แต่ตอนนี้พวกเราข้ามผ่านมันไปแล้ว” “ตอนนี้เรามีโอกาสที่จะลงแข่งในแชมเปี้ยนส์ลีก ซีซั่นหน้าและเรากำลังสู้เพื่อสิ่งนี้ นี่คือเป้าหมายหลักของสโมสร เราต้องทำให้ได้”   สนับสนุนโดย@vv123 อ่านต่อได้ที่ข่าวฟุตบอล ,neutral
120,https://www.footballaddrict.com/2022/03/22/%e0%b8%a7%e0%b8%a5%e0%b8%b2%e0%b9%82%e0%b8%ae%e0%b8%a7%e0%b8%b4%e0%b8%8a%e0%b9%80%e0%b8%9b%e0%b9%87%e0%b8%99%e0%b9%80%e0%b8%ab%e0%b8%95%e0%b8%b8/,วลาโฮวิชเป็นเหตุ ม้าลายยอมรับ เปาโลดีบาลาดาวยิงตัวเก่งอาจอาจย้ายทีม,วลาโฮวิชเป็นเหตุ เมาริซิโอ อาร์ริวาเบเน ผู้บริหารของทีม ม้าลาย ยูเวนตุส ยอมรับว่า เปาโล ดีบาลา ดาวยิงตัวเก่งอาจตัดสินใจไม่ต่อสัญญาฉบับใหม่กับสโมสร หลังหมดสัญญาซัมเมอร์นี้ เนื่องจากการย้ายมาของ ดูซาน วลาโฮวิช ทำให้เจ้าตัวไม่ได้เป็นศูนย์กลางของทีมอีกต่อไป เป็นการพบปะที่เป็นมิตร ชัดเจน และให้เกียรติกัน เรามีวิธีการที่จริงใจมากๆ การมาของ วลาโฮวิช ทำให้ เปาโล ไม่ได้เป็นศูนย์กลางของแผนการทำทีมอีกต่อไป และเราได้ตัดสินใจเรื่องนี้ การมาถึงของ วลาโฮวิช เปลี่ยนทุกอย่าง ทั้งโครงสร้างทางเทคนิคของทีม และโปรเจคต์ของ ยูเวนตุส ก็มีการเปลี่ยนแปลงบางอย่าง ส่วนหนึ่งของการเปลี่ยนแปลงเหล่านี้เกี่ยวข้องกับการต่อสัญญาของ ดีบาลา ซึ่งยังไม่ได้มีการต่อสัญญา  สนับสนุนโดย@vv123 อ่านต่อได้ที่ข่าวฟุตบอล ,positive
121,https://www.footballaddrict.com/2022/03/22/franck-kessie-%e0%b8%95%e0%b8%ad%e0%b8%9a%e0%b8%95%e0%b8%81%e0%b8%a5%e0%b8%87%e0%b8%a2%e0%b8%b7%e0%b8%99%e0%b8%a2%e0%b8%b1%e0%b8%99%e0%b8%a2%e0%b9%89%e0%b8%b2%e0%b8%a2%e0%b9%84%e0%b8%9b%e0%b8%9a/,Franck Kessie ตอบตกลงยืนยันย้ายไปบาร์เซโลน่าแบบไม่มีค่าตัว,Franck Kessie โดยฟาบริซิโอ โรมาโน่ ราชานักข่าวตลาดซื้อขายนักเตะรายงานว่า ฟรองค์ เคสซี่ มิดฟิลด์ตัวเก่งของ “ปีศาจแดงดำ”เอซี มิลาน ผ่านการตรวจต่างกายกับ บาร์เซโลน่า เรียบร้อยแล้ว คาดว่าจะเซ็นสัญญาอย่างเป็นทางการในอีกไม่กี่สัปดาห์ข้างหน้า ตามรายงานเผยว่า มิดฟิลด์ชาวไอวอรี่ โคสต์วัย 25 ปี บรรลุข้อตกลงส่วนตัวกับ บาร์เซโลน่า แล้ว โดยได้รับค่าเหนื่อยประมาณ 6.5 ล้านยูโรต่อปี ล่าสุดมีข่าวว่า เคสซี่ ได้เดินทางไปเมือง ลูกาโน เพื่อทำการตรวจร่างกายเป็นที่เรียบร้อยแล้ว  สนับสนุนโดย@vv123 อ่านต่อได้ที่ข่าวฟุตบอล ,neutral
122,https://www.footballaddrict.com/2022/03/22/mike-dean-%e0%b8%ad%e0%b8%ad%e0%b8%81%e0%b8%a1%e0%b8%b2%e0%b8%a2%e0%b8%ad%e0%b8%a1%e0%b8%a3%e0%b8%b1%e0%b8%9a%e0%b8%88%e0%b8%b0%e0%b8%95%e0%b8%b1%e0%b8%94%e0%b8%aa%e0%b8%b4%e0%b8%99%e0%b9%81%e0%b8%95/,Mike Dean ออกมายอมรับจะตัดสินแต่ในห้องVAR,Mike Dean ความเคลื่อนไหวของศึกพรีเมียร์ลีก อังกฤษ ล่าสุด! ไมค์ ดีน ผู้ตัดสินชื่อดังชาวอังกฤษ ในวัย 52 ปี ได้ประกาศแขวนนกหวีด เลิกทำหน้าที่เป่านกหวีดในสนาม หลังจากจบฤดูกาลนี้ (2021-22) ปิดฉาก 22 ปี ที่เข้าสู่วงการเชิ้ตดำมาตั้งแต่ในปี 2000 ทำหน้าที่เป็นผู้ตัดสินให้กับวงการฟุตบอลอังกฤษ และตามข่าวระบุว่า! ไมค์ ดีน ที่ได้ฝากผลงานบนลีกสูงสุดของประเทศอังกฤษ  สนับสนุนโดย@vv123 อ่านต่อได้ที่ข่าวฟุตบอล ,neutral
123,https://www.footballaddrict.com/2022/03/22/%e0%b8%a1%e0%b8%b2%e0%b8%a3%e0%b9%8c%e0%b8%95%e0%b8%b4%e0%b8%99-%e0%b8%8b%e0%b8%b2%e0%b8%a1%e0%b8%b9%e0%b9%80%e0%b8%ad%e0%b8%a5/,มาร์ติน ซามูเอล กูรูชื่อดัง จวกเซาท์เกต เรียกนักเตะตามฟอร์ม แต่แม็คไกวร์ติดเฉย,มาร์ติน ซามูเอล แม็คไกวร์ มีฟอร์มการเล่นที่เลวร้ายกับแมนเชสเตอร์ ยูไนเต็ดในฤดูกาลนี้ อย่างไรก็ตาม เขายังคงได้เป็นส่วนหนึ่งในทีมชาติอังกฤษ “แกเร็ธ เซาท์เกต บอกว่ามันเป็นการตัดสินใจอย่างตรงไปตรงมาที่จะดร็อป มาร์คัส แรชฟอร์ด สำหรับเกมอุ่นเครื่องที่กำลังจะมาถึง ซึ่งทุกคนที่ได้เห็นผลงานของเขากับแมนเชสเตอร์ ยูไนเต็ด ก็คงไม่มีข้อโต้แย้งอะไร “เซาท์เกต เรียกนักเตะจากผลงาน พวกเรารู้กันดี แรชฟอร์ด ไม่ใช่คนแรกที่โดนหมางเมิน หลังจากมาตรฐานของเขาตกลงไป และคงไม่ใช่คนสุดท้ายด้วย “แต่เรื่องนี้มันสม่ำเสมอกับตำแหน่งของ แฮร์รี่ แม็คไกวร์ ในทีมได้อย่างไร? เขาดูขาดความมั่นใจ เขาสร้างความผิดพลาด ยูไนเต็ดดูเปราะบางเมื่อมีเขาเป็นหัวใจในเกมรับ แต่ แม็คไกวร์ กลับเป็นตัวเลือกแบบการันตีเฉย “เซาท์เกต อาจจะโต้แย้งว่า แม็คไกวร์ ไม่ได้ทำให้อังกฤษผิดหวัง แต่เขามีข้อโต้แย้งแบบนั้นเกี่ยวกับ จอร์แดน พิคฟอร์ด เหมือนกัน “ทั้ง แม็คไกวร์ และ พิคฟอร์ด ได้สร้างความผิดพลาดในสีเสื้ออังกฤษ ซึ่ง แม็คไกวร์ กับแมนเชสเตอร์ ยูไนเต็ด ในระยะหลังถือว่าชัดเจนมาก ๆ “คือเขาต้องรอให้นักเตะทำผลงานแบบนั้นในเกมทีมชาติ ก่อนจะโดนดร็อปหรือเปล่า? มันดูไม่สมเหตุสมผลอย่างน่าประหลาดใจสำหรับโค้ชที่ใช้ทฤษฎีปฏิบัตินิยม”   สนับสนุนโดย@vv123 อ่านต่อได้ที่ข่าวฟุตบอล ,neutral
124,https://www.footballaddrict.com/2022/03/21/%e0%b8%94%e0%b8%b2%e0%b8%99%e0%b8%b5%e0%b9%88-%e0%b8%ad%e0%b8%b1%e0%b8%a5%e0%b9%80%e0%b8%a7%e0%b8%aa-2/,ดานี่ อัลเวส แฮปปี้เล่นให้ต่างดาวครบ 400 นัด หวังพาต่างดาวเป็นแชมป์,ดานี่ อัลเวส บิ๊กแมตช์ลาลีก้าที่สนามซานติอาโก้ เบร์นาเบว “ต่างดาว” โชว์ฟอร์มโหดบุกไปชนะจ่าฝูงอย่าง “ราชันชุดขาว” 4-0 โดยได้จากการเบิ้ลของ ปิแอร์-เอเมอริค โอบาเมย็อง และอีกคนละตุงจาก โรนัลด์ อเราโฮ่ และ เฟร์ราน ตอร์เรส ตอนนี้บาร์ซ่ารั้งที่ 3 ของตาราง ตามหลังมาดริด 12 คะแนน แต่พวกเขาแข่งน้อยกว่า 1 เกม และเหลือโปรแกรมอีกถึง 10 นัด หลังเกม อัลเวส พูดถึงโอกาสลุ้นแชมป์พวกเขาว่า “มาฝันไปด้วยกันเถอะ ฝันถึงการเป็นแชมป์ลาลีก้าฤดูกาลนี้ เราจะทำทุกอย่างที่เราทำได้” เกมเมื่อ อัลเวส ได้โอกาสลงเล่นเป็นตัวสำรองในช่วงท้าย ทำให้นั่นเป็นการลงสนามรับใช้บาร์ซ่าครบ 400 นัดของเจ้าตัวด้วย แข้งชาวบราซิลกล่าวว่า “ผมภูมิใจที่ได้เป็นผนักเตะบาร์เซโลน่า และหวังว่าแฟนบอลจะแฮปปี้กับผลงานที่เรามอบให้” “การมาชนะที่เบร์นาเบวมันเป็นอะไรที่น่ายินดีเสมอ และการทำแบบนั้นหลังจากผ่านมานานแล้วยิ่งทำให้มันพิเศษยิ่งขึ้นไปอีก” “การได้เล่นครบ 400 นัดให้กับสโมสรที่สวยงามแห่งนี้มันเป็นเกียรติอย่างมาก” เขากล่าว   สนับสนุนโดย@vv123 อ่านต่อได้ที่ข่าวฟุตบอล ,positive
125,https://www.footballaddrict.com/2022/03/20/%e0%b8%9a%e0%b8%b9%e0%b8%84%e0%b8%b2%e0%b9%82%e0%b8%a2%e0%b9%88-%e0%b8%8b%e0%b8%b2%e0%b8%81%e0%b9%89%e0%b8%b2/,บูคาโย่ ซาก้า ให้เครดิตกับกองหลัง+นายด่าน เกมรับปืนดีเยี่ยม พาทีมคว้าชัย,"บูคาโย่ ซาก้า เกมนี้ อาร์เซน่อล มาเหนือกว่าเป็นฝ่ายที่เดินหน้าเข้าบุกในช่วงครึ่งแรก ก่อนได้ประตูออกนำจาก ซาก้า ยิงเข้าไปตั้งแต่นาทีที่ 30 วิลล่า พยายามจะกลับเข้าสู่เกมแต่กว่าจะกดดันได้มากขึ้นก็ล่วงเลยจนถึงช่วงครึ่งชั่วโมงสุดท้าย ทำให้จบลงด้วยชัยชนะอยู่ในมือของ “ปืนใหญ่” ซาก้า ให้เครดิตกับเกมรับของทีมที่เล่นกันยอดเยี่ยมและเชื่อว่าการจบท็อปโฟร์เป็นไปได้ หลังตอนนี้พวกเขารั้งอันดับ 4 และนำทีมที่ตามหลังมาอย่าง แมนเชสเตอร์ ยูไนเต็ด อยู่ 4 คะแนน แถมยังเหลือเกมตกค้างในมืออีกนัด “เป็นเรื่องที่น่าพอใจมากๆ ผมคิดว่าเราสร้างโอกาสได้เยอะนะ เราเริ่มต้นได้ดีมาก การได้ประตูไวช่วยให้เราตั้งเกมได้ แต่เราต้องเริ่มปิดเกมให้ได้เพื่อป้องกันไม่ให้ตื่นกันเกินไป” ซาก้า บอกกับบีบีซี “ข้อเท้าผมเลือดออกเล็กน้อย แต่เกมเหน้าผมก็จะลุยเหมือนเดิม เป็นส่วนหนึ่งในการเล่นของผมล่ะ ผมจะเล่นแบบเดิมในเกมถัดไป” “เราเล่นเกมรับได้ดีมากนะ ต้องให้เครดิตผู้รักษาประตูกับแนวรับที่เล่นกันอย่างเหนียวแน่นอีกแล้ว การเล่นเกมรับและยันจนถึงที่สุดของเรา, เราทำแบบนั้นได้ในบางเกมของฤดูกาลนี้ สร้างความแตกต่างได้จริงๆ” “เราต้องมองแต่ละเกมให้เหมือนกับเป็นนัดชิง ท็อปโฟร์เป็นไปได้แน่นอน” เกมนี้ อาร์เซน่อล ต้องส่ง แบรนด์ เลโน่ ลงมาเฝ้าเสาแทน อารอน แรมสเดล ที่มีอาการบาดเจ็บ ส่วนในตำแหน่งปีกซ้ายก็ต้องเป็น เอมิล สมิธ โรว์ ออกสตาร์ทเพราะ กาเบรียล มาร์ติเนลลี่ ป่วย เมื่อพูดถึงเรื่องคุณภาพของนักเตะในทีม, ซาก้า ตอบว่า “ไม่ใช่เพียงแค่คุณภาพนะ มันเป็นเรื่องของสปิริตและแพสชั่นที่ทุกคนทุ่มเท, ไม่ว่าใครจะลงสนามมาก็ตาม” “นั่นคือสิ่งสำคัญที่สุดและนั่นคือสิ่งที่ช่วยให้เราคว้าชัยชนะเหล่านี้”   สนับสนุนโดย@vv123 อ่านต่อได้ที่ข่าวฟุตบอล ",neutral
126,https://www.footballaddrict.com/2022/03/18/diego-forlan-%e0%b8%95%e0%b8%b3%e0%b8%99%e0%b8%b2%e0%b8%99%e0%b8%99%e0%b8%b1%e0%b8%81%e0%b9%80%e0%b8%95%e0%b8%b0%e0%b9%81%e0%b8%a1%e0%b8%99%e0%b8%a2%e0%b8%b9%e0%b9%84%e0%b8%99%e0%b9%80%e0%b8%95/,Diego Forlan ตำนานนักเตะแมนยูไนเต็ดพูดถึงแมนยูไนเต็ด,Diego Forlanปีศาจแดงไม่ได้แชมป์มาเป็นเวลาห้าปีแล้ว และไม่เคยได้แชมป์พรีเมียร์ลีกหรือแชมเปี้ยนส์ลีกเลยตั้งแต่เซอร์ อเล็กซ์ เฟอร์กูสันเกษียณ ถ้วยสุดท้ายของยูไนเต็ดคือยูโรป้าลีก 2016/2017 ซึ่งเป็นฤดูกาลที่พวกเขาคว้าแชมป์ลีกคัพด้วย ฟอร์ลัน อดีตกองหน้ายูไนเต็ดและแอตเลติโก มาดริด ให้สัมภาษณ์กับเอล ปาอิสว่า “ผมพูดในฐานะคนนอก ผมว่าถ้าหากมีการเปลี่ยนเจ้าของมันจะมีอะไรเปลี่ยนไปแน่นอน” มีการประท้วงนับไม่ถ้วนเกี่ยวกับความเป็นเจ้าของเกลเซอร์ที่ยูไนเต็ด แม้ว่าพวกเขาจะคว้าถ้วยรางวัลมากมายภายใต้การคุมทีมของเซอร์ อเล็กซ์  สนับสนุนโดย@vv123 อ่านต่อได้ที่ข่าวฟุตบอล ,neutral
