,URL,Content_title,Contents,sentiment,word_search,word_count
60,https://www.goal.com/en/news/football-on-tv-in-india-tv-channel-live-stream/5l0mbuqqo1bv1xm1k182d1b0c,"Football on TV this week: Matches to watch & live stream in India today, tomorrow & this weekend","Football never stops - pandemics aside -whether it is the Premier League, Champions Leagueor international games, there is almost always some action to watch on television. Here are all the fixtures that are being shown live in India tonight, tomorrow and this week on television channels such as Star Sports, Viacom 18 or the Sony Pictures Sports networks, as well as online streaming sites/mobile applications - be it Disney+ Hotstar VIP, Voot Select, SonyLIV or JioTV. *All times are IST. TRAU vs Sudeva Delhi in the I-League kicks off Saturday's club action with Manchester United taking Everton in one or Premier League's feature games this weekend other than Chelsea, Arsenal and Tottenham in their respective ties. Bayern welcome Augsburg in Bundesliga, Juventus take on Cagliari in Serie A, Real Madrid face Getafe in La Liga, while PSG are at Clermont Foot in Ligue 1. Time Match TV Channel/stream* 15:00 TRAU vs Sudeva Delhi 1Sports 17:00 Everton vs Man Utd** Star Sports Select 1 SD & HD 17:05 Gokulam Kerala vs Indian Arrows 1Sports 17:30 Cadiz vs Real Betis Voot Select 18:30 Empoli vs Spezia Voot Select 19:00 Bayern vs Augsburg Sony Ten 2 SD & HD 19:00 Furth vs M'gladbach SonyLIV 19:00 Koln vs Mainz SonyLIV 19:00 Wolfsburg vs Arminia SonyLIV 19:30 Watford vs Leeds Utd Disney+ Hotstar VIP 19:30 Southampton vs Chelsea** Star Sports Select 1 SD & HD 19:30 Arsenal vs Brighton Star Sports Select 2 SD & HD 19:45 Mallorca vs Atletico Madrid Voot Select 20:05 NEROCA vs Aizawl 1Sports 20:30 Reims vs Rennes Voot Select 21:30 Inter vs Verona Vh1 22:00 Hertha vs Union Berlin Sony Ten 2 SD & HD 22:00 Villarreal vs Athletic Club MTV 22:00 Aston Villa vs Tottenham Star Sports Select 1 SD & HD (Sunday)   00:15 Cagliari vs Juventus Voot Select 00:30 Real Madrid vs Getafe MTV 00:30 Clermont Foot vs PSG Vh1 *I-League matches may be streamed online on Facebook, Premier League on Disney+ Hotstar VIP/JioTV, La Liga/Serie A/Ligue 1 on Voot Select/JioTV, and Bundesliga on SonyLIV/JioTV. **Also available onStarSports3(geo-tagged for West Bengal and Kerala) andStarSports1 Bangla. Kenkre vs Churchill Brothers in the I-League precedes club action across Europe on Sunday, as Manchester City vs Liverpool may end up as Premier League's title deciding clash. AC Milan take on Torino in Serie A, while Barcelona are up against Levante in La Liga. Time Match TV Channel/stream* 15:00 Kenkre vs Churchill Brothers 1Sports 16:00 Genoa vs Lazio Voot Select 16:30 Bordeaux vs Metz Voot Select 17:05 Rajasthan vs Real Kashmir 1Sports 17:30 Osasuna vs Alaves Voot Select 18:30 Angers vs Lille Voot Select 18:30 Monaco vs Troyes Voot Select 18:30 Brest vs Nantes Voot Select 18:30 Leicester City vs Crystal Palace Disney+ Hotstar VIP 18:30 Norwich City vs Burnley Disney+ Hotstar VIP 18:30 Brentford vs West Ham Star Sports Select 2 SD & HD 18:30 Napoli vs Fiorentina Voot Select 18:30 Sassuolo vs Atalanta Voot Select 18:30 Venezia vs Udinese Voot Select 19:00 Bochum vs Leverkusen Sony Ten 2 SD & HD 19:45 Espanyol vs Celta Vigo Voot Select 20:05 Mohammedan vs RoundGlass Punjab 1Sports 20:35 Lens vs Nice Vh1 21:00 Frankfurt vs Freiburg Sony Ten 2 SD & HD 21:00 Man City vs Liverpool** Star Sports Select 2 SD & HD 21:30 Roma vs Salernitana Voot Select 22:00 Elche vs Real Sociedad MTV 22:30 Strasbourg vs Lyon Voot Select 23:00 RB Leipzig vs. Hoffenheim Sony Ten 2 SD & HD (Monday)   00:15 Torino vs AC Milan Voot Select 00:30 Levante vs Barcelona MTV 00:30 Marseille vs Montpellier Vh1 *I-League matches may be streamed online on Facebook, Serie A/Ligue 1/La Liga on Voot Select/JioTV, Premier League on Disney+ Hotstar VIP/JioTV, and Bundesliga on SonyLIV/JioTV. **Also available onStarSports3(geo-tagged for West Bengal and Kerala) andStarSports1 Bangla. Mumbai City are set to face former AFC Cup champions Air Force Club from Iraq in a group stage tie of the AFC Champions League, while Al-Shabab take on Al-Jazira. There is a match each in Serie A and La Liga on Monday night. Time Match TV Channel/stream* 22:45 Air Force Club vs Mumbai City Star Sports 3 (Tuesday)   00:15 Bologna vs Sampdoria Vh1 00:30 Rayo Vallecano vs Valencia MTV 01:45 Al-Shabab vs Al-Jazira Star Sports 3 *AFC Champions League matches may be streamed online on Disney+ Hotstar VIP/JioTV, and Serie A/La Liga on Voot Select/JioTV. It's Champions League night as Real Madrid host Chelsea while Bayern Munich take on Villarreal in the second leg of the quarter-finals. Time Match TV Channel/stream* (Wednesday)   00:30 Real Madrid vs Chelsea** Sony Ten 2 SD & HD 00:30 Villarreal vs Bayern Sony Ten 1 SD & HD *UEFA Champions League matches may be streamed online on SonyLIV/JioTV. **Also available on Sony Ten 3 SD & HD (Hindi) and Sony Ten 4 SD & HD (Tamil & Telegu). Champions League quarter-finals leg 2 action continues with Atletico Madrid vs Manchester City and Liverpool vs Benfica. Time Match TV Channel/stream* (Thursday)   00:30 Atletico Madrid vs Man City** Sony Ten 2 SD & HD 01:45 Liverpool vs Benfica Sony Ten 1 SD & HD *UEFA Champions League matches may be streamed online on SonyLIV/JioTV. **Also available on Sony Ten 3 SD & HD (Hindi) and Sony Ten 4 SD & HD (Tamil & Telegu). I-League action resumes with Aizawl vs Sreenidi Deccan, NEROCA vs Rajasthan and Real Kashmir vs Mohammedan. Mumbai City face Al-Jazira in Matchday 3 of the AFC Champions League group stage, as Air Force Club and Al-Shabab go head-to-head from the same group. The night is also filled with Europa League action where the likes of West Ham and Barcelona play their games, besides Roma and Leicester City taking part in their Europa Conference League encounters. Time Match TV Channel/stream* 15:00 Aizawl vs Sreenidi Deccan 1Sports 17:05 NEROCA vs Rajasthan 1Sports 20:05 Real Kashmir vs Mohammedan 1Sports 22:15 Atalanta vs RB Leipzig Sony Ten 2 SD & HD 22:15 PSV vs Leicester City Sony Six SD & HD 22:45 Al-Jazira vs Mumbai City Star Sports 3 (Friday)   00:30 Lyon vs West Ham Sony Ten 1 SD & HD 00:30 Barcelona vs Frankfurt Sony Ten 2 SD & HD 00:30 Rangers vs Braga Sony Six SD & HD 00:30 Roma vs Bodø/Glimt Sony Ten 3 SD & HD 01:45 Air Force Club vs Al-Shabab Star Sports 3 *I-League matches may be streamed online on Facebook, UEFA Europa League/UEFA Europa Conference League on SonyLIV/JioTV, and AFC Champions League/Premier League on Disney+ Hotstar VIP/JioTV. The penultimate round of the I-League concludes with Indian Arrows vs Kenkre, Sudeva Delhi vs Gokulam Kerala and RoundGlass Punjab vs TRAU. Time Match TV Channel/stream* 15:00 Indian Arrows vs Kenkre 1Sports 17:05 Sudeva Delhi vs Gokulam Kerala 1Sports 20:05 RoundGlass Punjab vs TRAU 1Sports *I-League matches may be streamed online on Facebook. You can also download theGoal Live Score App, available for both Android and iOS, to get real-time updates of all the matches.  Copyright © 2022 Goal (English) All rights reserved. The information contained in Goal (English) may not be published, broadcast, rewritten, or redistributed without the prior written authority of Goal (English) ",positive,liverpool,4
61,https://www.goal.com/en/news/will-eden-hazard-be-fit-to-play-for-real-madrid-vs-chelsea/1b5e6zl51m7hb1l0wuoowxn65s,Will Eden Hazard be fit to play for Real Madrid vs Chelsea in the Champions League?,"Real Madrid will face Chelsea in the highly anticipated Champions League semi-finals, with Zinedine Zidane and Thomas Tuchel both looking to get a step closer to continental glory. There will also be a potential reunion for Eden Hazard and Chelsea, as he prepares to welcome his former side in the first leg before travelling to Stamford Bridge a week later. Goalhas what you need to know if Hazard has been deemed fit to feature against his old team. The Belgian has been included in the Champions League squad to face Chelsea on Tuesday evening, and has been declared fitby Zidane. Hazard had been sidelined with a hip injury since March 13, but was able to make a 15-minute cameo in the 0-0 draw to Real Betis on Saturday. Whether or not he will actually feature in the game is a different question, based on the injuries and fitness levelshe has struggled with this season. Should Hazard be selected to play in the game, it will be the first time he has come up against his former club since his€100 million (£88m/$112m) move in 2019. Zidane gave Hazard the all-clear to be named in the team, and outlined the forward's importance to the squad. “I don’t see Eden having any doubts. He looked very good on the field the other day,"" Zidane told reporters at a press conference on Monday. “That was the most important, not feeling anything from his old problems. Now he is good, and now to push on. “We are happy to have him with us, he will bring a lot to the team.” Hazard has had plenty of injury woes this season, making just 15 appearances for Los Blancos in all competitions so far. The former Chelsea man had been diagnosed with an injury in the ""right psoas muscle"" after he was taken off against Elche last month, but did not undergo an operation astwo doctors who previously worked on his right ankle strongly advised against doing so. Real Madrid had been hoping for Hazard to return to fitness in time to face Liverpool, and thenGetafe on April 18, but was only given the green light to play against Real Betis on April 24. Toni Kroos is also aiming for a return to the team after being sidelined since the Champions League second leg quarter-final tie against Liverpool. Ferland Mendy, meanwhile, is a doubt due to an ongoingcalf issue. Zidane said: ""Toni will be available, Ferland won't."" Copyright © 2022 Goal (English) All rights reserved. The information contained in Goal (English) may not be published, broadcast, rewritten, or redistributed without the prior written authority of Goal (English) ",positive,liverpool,2
62,https://www.goal.com/en/news/foden-magic-touch-man-city-break-simeone-atletico-wall/blt50ad20b41710491e,Foden finds the magic touch for Man City to break down Simeone's Atletico wall,"Match statistics: Manchester City 1-0 Atletico Madrid According to quantum theory, there is an astronomically small probability that a ball will eventually pass through a brick wall if it is attempted an infinite number of times. And for 70 minutes on Tuesday, Manchester City appeared to be running the experiment live in their Champions League first leg with Atletico Madrid. Diego Simeone brought a new extreme version of 'anti-football' to the Etihad Stadium and for over three-quarters of the match it worked. Enter Phil Foden. Just 79 seconds after stepping off the bench, the England international found the tiniest pocket of space on the edge of the box, turned quickly and then played an instinctive nutmeg pass into Kevin De Bruyne's path to slide the ball past Jan Oblak. All Man City needed was Phil Foden on the pitch 😅80 seconds after coming on he unlocks the Atletico defence to set up Kevin De Bruyne!Big goal in this tie...#UCL pic.twitter.com/rRIXIah2EI Clinical from Kevin De Bruyne on his 50th #UCL appearance. 🎯The ball from Phil Foden, though. 🥶 pic.twitter.com/647s2zqN4U It felt like City had needed absolute precision to find a way through Atletico's packed defence and it was the homegrown star that delivered it. Quite why the 22-year-old had not started was a mystery before the match, and even more so after he caused the Spanish champions more problems in his 20-minute cameo on the pitch than any other City player. It was not quite overthinking from Pep Guardiola to leave Foden out, but it was a decision that potentially made his team's night more difficult. Foden's livewrire movement stretched Atletico's disciplined defence, and he created City's best opportunity from open play of the night when he tricked his way to the touch line and pulled a ball back for De Bruyne, who could not find a way past the four defenders in the six-yard box as he aimed to secure some breathing space ahead of the second leg. A second goal never came, however, and it is difficult to see who the 1-0 scoreline suits better. City have an advantage to take to Madrid and will hope that Atletico will eventually come out to play and leave some room to attack. But Simeone has a platform to approach the game in the same defensive manner for the majority of the second leg and hope to make the most of any opportunities on the counterattack or from set-pieces. The tempo was set in the opening 15 minutes, when City had 92 per cent possession of the ball. And it felt like a good chunk of Atletico's eight per cent was spent waiting for Jan Oblak to take a goal kick. They eventually reached a surprising 29% of possession by full-time, but this was the ultimate show in defensive football. When Antoine Griezmann broke quickly with just one defender alongside him early in the second half, he was still 70 yards from goal with no support, and eventually kicked the ball out for a throw-in when trying to find a team-mate as he ran out of energy. He and fellow forward Joao Felix spent almost as much time defending in their own box as they did in City's half. It produced a heat map that if it were illustrating a person's health would suggest hypothermia from the neck down. It may not have been entertaining, but it was largely effective. City tried to stretch their opponents, but even with Riyad Mahrez and Raheem Sterling staying close to their respective touchlines, their time and space was quickly shut down by the breathless Renan Lodi and Sime Vrsaljko. When they went through the middle, there was simply no room for Bernardo Silva or De Bruyne to create any magic. And when they were eventually forced to throw long balls into the box, Stefan Savic, Felipe and Reinildo headed and volleyed it clear from danger. It took a moment of magic from Foden and De Bruyne's fifth goal in as many games to find a way through. After what was the first of four massive games against Atletico and Liverpool in the space of 12 days, it is advantage City in the Champions League - but only just. Copyright © 2022 Goal (English) All rights reserved. The information contained in Goal (English) may not be published, broadcast, rewritten, or redistributed without the prior written authority of Goal (English) ",positive,liverpool,1
63,https://www.goal.com/en/news/de-bruyne-thiago-alcantara-man-city-liverpool-potential/blta5dbfe3950b4a4bf,De Bruyne vs Thiago Alcantara: Man City and Liverpool's potential title-deciders,"It is not hyperbolic to suggest this might be the biggest match in Premier League history. Rarely do we get genuine to-the-wire title battles, let alone head-to-heads that seem almost certain to decide which team will lift the trophy. The emerging rivalry between Manchester City and Liverpool is certainly the most high-quality English football has ever seen, and the two manager's contrasting styles have given us some of the sport's greatest moments over the last five years. But for all the talk of Liverpool and Manchester City being an evenly-balanced rivalry, Pep Guardiola has increasingly taken control of this fixture. Jurgen Klopp will be acutely aware that his side have won just one of their last eight meetings and that the matches themselves are becoming more one-sided over time. Earlier this season at Anfield, Mohamed Salah's genius dragged Liverpool into the game and earned them a 2-2 draw, but for long periods – particularly in the first half – Man City were dominant. They should have put the game to bed in the opening 30 minutes, picking up from where they left off in the game before, a thumping 4-1 win at the Etihad. It has been a long time since Klopp's furious pressing and cutting attacking transitions caused Guardiola serious problems; a long time since City would concede three or four in short blitzes. It might have slipped under the radar but Guardiola has found a way to tame Liverpool, deploying a cautious back three (Kyle Walker stays deep) to control against the counters as well as provide wide passing options to circumnavigate Liverpool's narrow forwards. But Klopp has an ace up his sleeve, a way to control this fixture a little more. It is no coincidence that Man City's late flurry of goals in their 4-1 win last season came after Thiago Alcantara was substituted. The Spaniard was taken off in the 68th minute with the score at 1-1. Liverpool essentially fell apart without him. Thiago missed the 2-2 draw altogether and, in his absence, Liverpool couldn't evade the City press and build their way up the pitch. Man City penned them in, before targeting right-back James Milner by instructing false nine Jack Grealish to double up on the left with Phil Foden. That should not happen this time, not with Thiago on the pitch for the full 90. His press-resistance in central midfield and unique capacity to break the lines even when surrounded by on-rushing opponents makes him arguably Klopp's most important player. Thiago takes total control of games, ensuring Liverpool retain a territorial advantage and play with verticality and urgency, wriggling clear of the press to set his team-mates away. And the stats would back that up. Liverpool have won all 12 Premier League matches this season in which Thiago has started. He makes 11.12 progressive passes per 90, the most among Premier League midfielders, and 14.5 passes under pressure per 90, second behind Rodri. He is undoubtedly the key to Klopp redressing the balance, preventing Man City from swarming, and giving Liverpool a foothold in the game. And intriguingly, his direct opponent on that left side of central midfield happens to Man City's most important player: Kevin De Bruyne. The Belgian will occupy the same half-space as Thiago, and considering the likelihood that the Liverpool midfielder will help his team weave away from pressure to counter – creating an end-to-end game – their tussle for space will travel the length of the pitch and back again. The sight of De Bruyne steaming into open grass is rare, but not against Liverpool; Guardiola allows his team to play more directly than usual in this fixture. Thiago's capacity to track De Bruyne as he does so will be crucial, although perhaps of more relevance is how the Liverpool midfielder deals with De Bruyne's unusual movement out to the right. Few No.8s in world football play quite so far out to one side. De Bruyne often takes up the position of a traditional right-winger, crossing and assisting from the pocket of space around the corner of the penalty area. This is of particular significance to Liverpool because their narrow 4-3-3 demands a lot of the two central midfielders either side of Fabinho. Thiago's work getting out to meet De Bruyne when he peels wide could prove decisive, especially considering Andrew Robertson will have his hands full with Riyad Mahrez. Thiago versus De Bruyne aside, it is difficult to predict where this game will be won or lost because so much will rest on in-game changes. In a frantic contest, Klopp and Guardiola will react and counter-react to one another, as they always do. It is worth noting that the 4-1 wasn't just about Thiago leaving the pitch. It was also the result of Guardiola switching to a 4-4-2 with two false nines, puzzling the Liverpool players. We should prepare ourselves for more surprises on Sunday. But whatever the outcome, and however the action unfolds at the Etihad, more than likely one of Thiago or De Bruyne will have been the catalyst; the match and title-winner for their side. Copyright © 2022 Goal (English) All rights reserved. The information contained in Goal (English) may not be published, broadcast, rewritten, or redistributed without the prior written authority of Goal (English) ",positive,liverpool,15
64,https://www.goal.com/en/news/man-city-s-guardola-liverpool-do-something-no-other-team/blt349b3c50466756e1,Man City's Guardola: Liverpool do something no other team does,"Man City boss Pep Guardola has claimed that Liverpool do something no other team does ahead of their clash with the Reds at Etihad Stadium on Sunday. City are currently on course to retain the Premier League title as they sit top of the table with 73 points from 30 matches, one more than second-placed Liverpool. Jurgen Klopp's side can leapfrog the champions with a win in Manchester, though, and Guardiola is very much aware of the unique threat they will pose. ""In the beginning of the season and then two or three months ago, I said, 'what date is Liverpool? When do we play against them?',"" The City boss has told Sky Sports. ""Of course everything is different because we know it's seven games left and we are only one point ahead. ""Winning will not be enough, but it will be an important step. And we know… 'wow, this is the game'. You know it, we know it. So I'm not going to deny it's different to any other game. And the preparations are a bit different, you know, especially because they do something that no other team in all around the world do - the movement they have. ""The threats that they have in front - they had an incredible three players (Mohamed Salah, Sadio Mane and Roberto Firmino) and now an incredible five with Luis Diaz and Diogo Jota. Plus Divock Origi who always scores when they need to make decisive goals."" Guardiola went on to insist that whatever the final result may be, he will still head home to put his feet up and catch the last round of The Masters - one of the standout golfing events on the calendar. ""We don't have a proper striker, but it is what it is. We still score a lot of goals in our way, we still concede few, so we're going to continue to do it,"" he added. ""We have to work on what we need to do, to talk about it and prepare for it. But at the end, I still sleep, wake up in the morning, have breakfast, lunch, dinner… ""So I prepare the training session, then I'm going to rest a little and be completely relaxed in front of the TV, watching Tiger Woods and Tommy Fleetwood."" Guardiola has already delivered three Premier League titles among a whole host of other domestic honours at the Etihad Stadium, but hasn't won the Champions League since 2011, when he was still at Barca. The 51-year-old lifted two European Cups and three La Liga crowns during his four year stint in charge at Camp Nou before moving onto Bayern and eventually City, and it has been suggested that he hit his peak as a coach with the Blaugrana. Guardiola has rejected that notion, however, insisting that the experience he has built up over the last eight years has helped him hone his craft. ""When I was in my early years in Barcelona, I was more anxious about everything, more sensitive for everything,"" he said. ""Now I handle situations a little bit more calmer. ""I've learnt a lot at City. I'm a completely different manager and I feel I'm a better manager than when I started out because of the experiences. ""You can't have the same ideas of 12 or 13 years ago, you become lazy, and you are not scared. You don't have the intuition or the desire to think 'oh, maybe we do it like that' even though maybe it will be a mistake. ""Life is about experiences and learning to improve different things."" Copyright © 2022 Goal (English) All rights reserved. The information contained in Goal (English) may not be published, broadcast, rewritten, or redistributed without the prior written authority of Goal (English) ",positive,liverpool,3
