,URL,Content_title,Contents,sentiment,word_search,word_count
41,https://www.goal.com/en/news/mourinho-rants-plastic-pitch-ridiculous-officials-roma-fail-beat-/blt517e7b96b33db96f,Mourinho rants at plastic pitch & ‘ridiculous’ officials after Roma fail to beat Bodo/Glimt for third time this season,"Jose Mourinho was less than impressed with the standard of officiating and a ""plastic pitch"" after seeing his Roma side fail to beat Bodo/Glimt for the third time this season, with a 2-1 defeat in Norway leaving Serie A heavyweights with work to do in a Europa Conference League quarter-final. The Italian outfit did take the lead in a continental clash with plenty riding on it, as Lorenzo Pellegrini fired them in front, but a side that crushed them 6-1 during the group stage hit back to claim a narrow aggregate lead. Roma lost not only the game but also Gianluca Mancini to a knee injury, with Mourinho blaming an artificial surface for that ailment while also hitting out at some “ridiculous” decisions from the match referee and his assistants that contributed to another shock setback being suffered. Mourinho told Sky Sport Italia when launching into a post-game rant: “The two goals were from a set play and a deflection. We score a lot of goals from set plays too, but it’s a good one to score, a bad one to concede. The first goal was ridiculous. “To be honest, the thing that worries me the most is the injury for Mancini. It’s a concern, it’s something caused by playing on a plastic turf.” October: Bodo/Glimt 6-1 RomaNovember: Roma 2-2 Bodo/GlimtApril: Bodo/Glimt 2-1 Roma pic.twitter.com/1UnTD1vcPx The Portuguese added: “We lost 2-1, we have the second leg to play at the Olimpico in front of our fans and I have no problem saying right now that I feel we are the favourites to reach the semi-final. “I have total faith in my players, in the stadium, the support from our people. Obviously, Bodo/Glimt are a difficult team, but I also have faith we will have a good referee and assistant in the second leg. “When we played in Rome against them, there were two very clear penalties for us that the referee did not see, while today there were two moves that were flagged offside and the first half ended with a ridiculous situation as the offside flag was up on a throw-in, which shows you the level.” UEFA is investigating an alleged post-match physical altercation involving a Roma coach. ""AS Roma announces that, on Thursday evening, at the end of the match, the managers of the Club and some members of the technical staff remained inside the Aspmyra Stadion until 00:45, with the sole purpose of providing to UEFA and the local authorities all the details on what happened in the area in front of the changing rooms after the match,"" wrote Roma in an official statement. ""The club has total confidence in the work of UEFA and its bodies to ensure that the responsibilities for the incident are accurately established, which have already been highlighted in great detail to all the representatives of the competent institutions present on site. ""Lastly, AS Roma underlines that it has always practiced conduct that respects the principles of fair play and the values of sport on and off the pitch: the same principles that we hope will prevail in the return match."" Bodo/Glimt, after putting six past Roma on home soil in October 2021, have already taken a positive result away from Stadio Olimpico this season. They played out a 2-2 draw in the Italian capital back in November and a repeat of those heroics would be enough for them to extend a historic run in continental competition through to the semi-final stage. Mourinho, though, will be determined to get his side firing on all cylinders as the former Chelsea, Real Madrid and Manchester United manager seeks to claim a maiden Europa Conference League crown and add to his already distinguished CV. Copyright © 2022 Goal (English) All rights reserved. The information contained in Goal (English) may not be published, broadcast, rewritten, or redistributed without the prior written authority of Goal (English) ",positive,liverpool,0
42,https://www.goal.com/en/news/ronaldo-maguire-davies-mocks-man-utd-skipper/blt604fcd26ec19d18c,'Imagine being Ronaldo and Maguire is your captain' - Bayern star Alphonso Davies mocks Man Utd over skipper choice,"Cristiano Ronaldo should have the armband over Harry Maguire at Manchester United, Alphonso Davies has suggested, with the Canadian having made a joke about the Portuguese having to call the England defender ""captain"". The veteran forward returned to Old Trafford last summer but has struggled to fire them back to their former glories, with the club set for another season without silverware. Much of the blame has been directed towards Red Devils skipper Maguire, who leads the team over Portugal captain Ronaldo, and Bayern Munich and Canada star Davies admits he cannot believe the centre-back is the man who calls the shots. ""Can you guys imagine [that] you're Ronaldo, right?"" Davies asked his followers on his Twitch channel. ""One of the greatest players ever, in the 21st century. ""Harry Maguire is your captain. You refer to him as captain – I don't know what he says to him."" The left-back added: ""I'm not dissing Harry Maguire, but Ronaldo should get the armband, man."" This is not the first time the decision to hand Maguire the captaincy at Old Trafford has made headlines. Indeed, there were reports of a rift in the United camp, with the Daily Mirror having reported that there was a ""power struggle"" taking place. England defender Maguire denied the report on social media back in February, while Ralf Rangnick has continued to support his skipper, despite his below-par performances in the 2021-22 campaign. It seems unlikely that United will now change their captain before the end of the season, although the new manager at Old Trafford, who could well be Erik ten Hag, may have other ideas. Copyright © 2022 Goal (English) All rights reserved. The information contained in Goal (English) may not be published, broadcast, rewritten, or redistributed without the prior written authority of Goal (English) ",positive,liverpool,0
43,https://www.goal.com/en/news/lampard-reaction-richarlison-showboating-everton-1-0-win-man/bltd6d1751e923932a0,'I was ready to tell him off!' - Lampard's reaction to Richarlison's showboating in Everton's 1-0 win over Man Utd,"Everton boss Frank Lampard was able to laugh off Richarlison's showboating during Saturday's victory over Manchester United, but admitted that at the time he was not impressed with the Brazilian's antics. The Toffees picked up three much-needed points with a 1-0 win at Goodison Park, with Anthony Gordon scoring the only goal of the game in the first half with a deflected effort. But Richarlison caught the eye with an elaborate piece of trickery that had his manager's heart in his mouth. ""I was ready to go all old school on him and tell him off!""Frank Lampard saw the funny side of a bit of showboating from Richarlison vs Man Utd 😅 pic.twitter.com/3QRa5zyB6Q Richarlison doing some keep ups with his head during the match. 😂 Everton lead Manchester United 1-0. 📺: @USA_Network #EVEMUN | #MyPLMorning pic.twitter.com/whWLp3jpev ""I was ready to go all old school on him and tell him off for that,"" Lampard laughed after the game to BT Sport. ""I’m not going to, the fans love him because he gives everything, five little keepy-uppy headers, not for me if he gives it away after that but he had a good day."" Lampard also found time to respond to Burnley boss Sean Dyche, who told his players the Toffees did not know how to win games as a motivational gambit during their 3-2 win midweek. ""It's a big deal, we've had clean sheets here. We're not easy to break down here, and there are moments in games where you have to defend and be tight and compact,"" he added during the post-match press conference. ""We knew that'd be how the second half went. It was our third game in a week, we knew the energy levels were going to drop so we had to close the distances. ""And we do know how to win games! Sean didn't mean it in that way - I've spoken to him since. We've won more games than them this year! ""But I understand the sentiment, we've been losing games away from home and he had to motivate his team. I'd say similar things behind the scenes."" Everton remain in 17th place after Saturday's triumph, four points clear of Burnley and the final relegation spot ahead of the Clarets' visit to Norwich City. Copyright © 2022 Goal (English) All rights reserved. The information contained in Goal (English) may not be published, broadcast, rewritten, or redistributed without the prior written authority of Goal (English) ",positive,liverpool,0
44,https://www.goal.com/en/news/salah-there-are-many-things-people-don-t-know-amid-liverpool/bltf739ce657f0beeaa,Salah: There are many things people don't know amid Liverpool contract negotiations,"Mohamed Salah had admitted that he has yet to reach an agreement with Liverpool over a contract extension while claiming that ""there are many things people don't know"" about the situation. Salah has been a talismanic figure for Liverpool throughout his five-year stay at Anfield, scoring 153 goals in 241 games across all competitions. The Egyptian has helped fire the club to Premier League and Champions League glory, but is now approaching the final year of his contract and speculation over his future is building with each passing week. A number of top clubs have been linked with Salah, including Real Madrid and Barcelona, but the 29-year-old did insist that he would happily spend the remainder of his career at Liverpool back in October. It appears that non-footballing issues are holding up a potential renewal for Salah, who has now given an update on the state of negotations with the club. ""What can I say? There are many things that people don't know about it,"" the forward has told Sky Sports. ""I can't be selfish and talk about my situation, we are in the most important moment for the team."" Asked if he is confident that he will be able to sort out a new contract at Anfield, Salah replied: ""I can't say yes and I can't say no. I've said many times before about what I want but again I can't go deep into my contract right now because it's a sensitive situation and the team needs to win."" The Reds talisman also dismissed any suggestion that the saga is distracting him from his duties on the pitch ahead of a top of the table showdown against Manchester City on Sunday. ""Not at all, I know my job very well and I am very professional,"" he said. ""I'm almost the first one here and the last one to leave, I'm just focusing on the team and winning trophies and giving everything I can to the club."" Klopp offered his take on Salah's contract last month, insisting that the ball is in the Egypt international's court with regards to his future. The Liverpool boss indicated that an offer has already been tabled, telling reporters: ""We cannot do much more, that's how it is. But I don't think it's about that. It's Mo's decision pretty much. The club did what the club can do. That's how it is. ""Nothing bad to say about it. It's fine from my point of view. It's exactly like it should be in this moment in time. Everything is set. Nothing happened further, no signing, no rejection or whatever. ""We just have to wait for that. It's completely fine. No rush in that situation."" Copyright © 2022 Goal (English) All rights reserved. The information contained in Goal (English) may not be published, broadcast, rewritten, or redistributed without the prior written authority of Goal (English) ",positive,liverpool,4
45,https://www.goal.com/en/news/liverpool-klopp-salah-contract-we-cant-do-much-more/bltd3ca6d960cdf6f6c,Liverpool boss Klopp on Salah contract: We can't do much more,"Liverpool boss Jurgen Klopp has confirmed that no further progress has been made in talks between the club and Mohamed Salah over a new contract. Salah, 29, sees his current deal expire at the end of next season. The Reds would be loathe to lose one of the world's premier strikers, and one moreover who is in the form of his life right now. ""Mo definitely expects this club to be ambitious,"" Klopp explained to reporters on Friday. ""We were in the last few years and we are. ""We cannot do much more, that's how it is. But I don't think it's about that. It's Mo's decision pretty much. The club did what the club can do. That's how it is. ""Nothing bad to say about it. It's fine from my point of view. ""It's exactly like it should be in this moment in time. Everything is set. Nothing happened further, no signing, no rejection or whatever. ""We just have to wait for that. It's completely fine. No rush in that situation."" Klopp's words appeared to elicit a strong reaction from Salah's agent, Ramy Abbas. Shortly after the manager's conference Abbas took to Twitter and, while he did not offer any words in his message, a torrent of laughing faces certainly encouraged the interpretation that he may not have been impressed with what he heard. 🤣🤣🤣🤣🤣🤣🤣 One factor in Salah and his agent's favour is that given his current form, the Egyptian would have no shortage of suitors waiting to pick him up on a free transfer in 2023. The forward has smashed 27 goals in 34 games this season in all competitions for the Reds, who have already lifted the Carabao Cup and remain competitive in the Premier League, FA Cup and Champions League. Copyright © 2022 Goal (English) All rights reserved. The information contained in Goal (English) may not be published, broadcast, rewritten, or redistributed without the prior written authority of Goal (English) ",positive,liverpool,1
46,https://www.goal.com/en/news/salah-lasers-egypt-penalty-miss-liverpool-misses-world-cup/bltd01bcfefe8c5ecc2,Salah pelted with missiles & targeted by lasers before missing crucial World Cup play-off penalty as Egypt FA files 'racism' complaint,"Mohamed Salah was pelted with missiles as he left the pitch having been targeted by lasers before he missed a crucial penalty in a World Cup play-off against Senegal. That prompted the Egyptian football association to file a ""racism"" complaint against their opponents, with the loss meaning that Salah and his team-mates would miss out on the World Cup in Qatar. In the run-up to his penalty, which Salah skied to eventually see Sadio Mane and Senegal advance, the Liverpool star was seen with several lasers being aimed at his face by spectators at the Stade Leopold Sedar Senghor. After a 1-0 first-leg win, Egypt conceded a goal in the fourth minute with the two sides deadlocked all the way through to a penalty shootout. Throughout the match, the partisan home crowd were seen shining lasers onto the field, with those pointers out in full force for the penalty kicks. Dozens of lasers could be seen on Salah's face before he missed from the spot, with Egypt eventually losing 3-1 in the shoot-out to miss out on the World Cup. As the Liverpool forward left the pitch, he was again being targeted as security had to escort him down the tunnel and attempt to protect him from the missiles that were raining down from the stands. Following the match, Egypt manager Carlos Queiroz stepped down, ending his time in charge of the team after taking the role in September. Mohamed Salah will turn 34 during the 2026 World Cup, his next opportunity to play at the tournament.Will this be the final, defining image of the Liverpool superstar's attempts to truly make his mark on the grandest stage of all?#SENEGY #WCQ2022 #LFC #YNWA pic.twitter.com/rpuQqBEoWr While they didn't address the lasers specifically, the Egypt FA have confirmed that they have filed a complaint based on the atmosphere in Senegal. The complaint, posted on their Instagram page, also claimed that racist banners were held up targeting Salah during the contest, while posting pictures of the damage done to their team bus after an attack from fans prior to the game. “The Egyptian Football Association have lodged a formal complaint against its Senegalese counterpart to the match observer, the security official, CAF, and FIFA, before the start of the match between the two teams,"" the federation said. “The Egyptian team was subjected to racism after the appearance of offensive banners in the stands aimed at the players, specifically Mohamed Salah. “Moreover, the Senegalese fans terrorised the Egyptian players by throwing bottles and stones at them during the warm-up, as well as attacking the Egyptian team bus, which caused glass shattering and some injuries, which was documented with pictures and videos attached to the complaint.” Copyright © 2022 Goal (English) All rights reserved. The information contained in Goal (English) may not be published, broadcast, rewritten, or redistributed without the prior written authority of Goal (English) ",negative,liverpool,3
47,https://www.goal.com/en/news/liverpool-man-city-premier-league-title-race/ry1uxr1ylhp01rn41zgj6jdmm,Liverpool and Manchester City show why Premier League title race will thrill - but defensive depth is worrying for Reds,"At the end, Pep Guardiola, his team and their fans were the ones celebrating. Maybe that, more than anything else, tells the true story of this brilliant, pulsating Premier League clash. “You’ve seen the champions, now f**k off home,” crowed the Manchester City supporters, packed tightly into the old Anfield Road end. In front of them, Guardiola gave a smile and a fist pump. He looked happy, focused, determined, themeshe would continue in his post-match press conference. His side could have, should have won perhaps, but the 2-2 draw they chiselled out here will have felt like a victory, given the setting and given the circumstances. ""I am satisfied,"" confirmed Guardiola. For Liverpool, it was a case of what might have been. They remain unbeaten,above City in the table and below only Chelsea;but as they head into the second international break of the campaign, they know their position should be even stronger than it is. They led twice, overcoming a terrible first half to raise the Anfield rooffirst through Sadio Mane and then, spectacularly, through the genius of Mohamed Salah. With nine minutes to go, the game was theirs, but City are champions for a reason, and when Guardiola’s side needed a response, and a little bit of good fortune, they got it. Kevin De Bruyne’s deflected leveller at the Kop end ensured the spoils were shared. It was fair, to be perfectly honest. City bossed the first half but Liverpool responded strongly after the break. Both sides had openings, both sides had near misses. Even at 2-2, it needed a remarkable goalline block from Rodri to deny Fabinho a winner. At the other end, Andy Robertson stood firm to prevent Gabriel Jesus from pinching it. That’s how fine the margins are between these sides, and how fine they will be in this most mouth-watering of title races. In Liverpool, City and Chelsea, we have three heavyweight contenders, and it would be wise not to discount Cristiano Ronaldo and Manchester United as well, even if their recent form suggests they still sit a rung below the others. Liverpool certainly look like they will be in the mix, although this was their third draw of the campaign, and in all three they had looked well-placed to get the win. Just as at Brentford last time out, they let the game slip in the final 10 minutes. Warning signs, perhaps? We are used to such levels of consistency from this team, that anything less than perfect tends to stand out. Certainly the pre-match concerns surrounding the absence of Trent Alexander-Arnold were realised here. James Milner is as good a professional as there is, and a more than competent right-back when needed, but the veteran was given a torrid time by Phil Foden throughout. Foden scored the first and created the second, by which time Milner had been substituted for his own good, having picked up a first-half yellow card and been fortunate to avoid a second after the break. As Milner guiltily walked away after upending Bernardo Silva, Guardiola raged at fourth official Mike Dean on the sideline. Jurgen Klopp, meanwhile, simply told Joe Gomez to get ready. It was a wise call. ""We planned it anyway,"" he said afterwards. Alexander-Arnold, Liverpool hope, will be back for the trip to Watford on October 16, and the Reds need him. Not necessarily for his defensive quality - Foden would have given any full-back a hard time today - but for that quality and range of passing which is so integral to the way Liverpool play. Without him, the Reds looked stodgy and scrambled for 45 minutes. They started OK, but by half-time they were on the ropes, unable to keep the ball and grateful to Alisson Becker for two fine interventions to prevent Foden - who else? - from opening the scoring. Liverpool managed one shot in the first half and it was blocked before it got to within 15 yards of Ederson’s goal. Jordan Henderson, the captain, misplaced 50 per cent of his passes in midfield. City were sloppy themselves, but dominated. ""We did it exactly how you shouldn't do against City,"" Klopp pointed out. ""We didn't play football."" Whatever hesaid at half time worked, though. Liverpool emerged a different side, hungrier and sharper, with far more threat. Just before the hour mark, Salah slipped two defenders on the right flank and fed Mane, 1-0 to the home side. City still had Foden though, and 10 minutes later he levelled, ghosting in behind Milner to receive Gabriel Jesus’ pass and fire home. Liverpool’s weak spot punished by City’s star man. Then Liverpool’s star man came to the party. Salah received a pass from Curtis Jones on the left corner of the City box, with four defenders for company. He beat them all, his nimble feet taking him into the area. Then he beat Aymeric Laporte to chop the ball onto his right foot. Then he beat Ederson. Anfield exploded. A moment of genius, fit to win any football match. It didn’t. Foden still had a part to play, this time in space behind Gomez and seeing his low cross reach De Bruyne, whose strike went in off Joel Matip. “Justice,” tweeted City’s official account. Rough justice, Liverpool will feel. Matip was, They emerge unscathedthough, and have now faced both of their main rivals and held their own. City, too, will take confidence. They won at Stamford Bridge last week and stood up tall at Anfield this time around. ""The way we lost in Paris showed me we are a good side,"" Guardiola said. ""And so did the way they drew today."" They’ll be up there come May, no doubt.So will Liverpool, though. If this really is to be the tightest title race in years, then this was the ideal game to prove it. More of this, please! Copyright © 2022 Goal (English) All rights reserved. The information contained in Goal (English) may not be published, broadcast, rewritten, or redistributed without the prior written authority of Goal (English) ",positive,liverpool,12
