,URL,Content_title,Contents,sentiment,word_search,word_count
105,https://www.standard.co.uk/sport/football/everton-vs-man-united-live-stream-premier-league-2022-latest-score-result-watch-tv-team-news-today-b993453.html?page=7#post-374520,"Everton 1-0 Manchester United LIVE! Gordon goal - Premier League result, match stream and latest updates today","nthony Gordon boosted Everton’s hopes of Premier League survival as his first-half strike proved the difference in a scrappy affair against Manchester United. Gordon’s deflected effort before the half hour alleviated the pressure on Frank Lampard after a 3-2 midweek defeat at relegation rivals Burnley had left Everton just a solitary point above the drop zone. This was far from a vintage display from either side but a 1-0 win for the Toffees puts daylight between themselves and the bottom three as United’s top-four ambitions suffered another untimely dent. Marcus ashford was thwarted twice early on by Jordan Pickford but Cristiano Ronaldo was largely subdued as United remain cut adrift from the Champions League places after being downed by Gordon’s shot, which thudded into visiting captain Harry Maguire and left goalkeeper David De Gea stranded. Pickford was again called upon in time added on to deny Ronaldo on the half-volley after being teed up by Maguire before the referee’s whistle for full-time was greeted by an eruption of noise. Here is Ronaldo arriving at Goodison Park.. So Cristiano Ronaldo returns to the United team at Goodison Park. Ronaldo is fit again after recovering from the illness which forced him to miss last weekend’s 1-1 draw with Leicester and he comes straight back into the side. United interim boss Ralf Rangnick makes five changes to the side that drew to Leicester. Alex Telles replaces the injured Luke Shaw at left-back, while Aaron Wan-Bissaka is recalled at right-back instead of Diogo Dalot. In midfield, there is no Scott McTominay as Nemanja Matic starts alongside Fred, while Anthony Elanga and Paul Pogba drop to the bench in place of Marcus Rashford and Ronaldo. For Everton, Frank Lampard recalls Allan and Michael Keane from suspension as part of four changes to the Everton side the lost 3-2 at Burnley on Wednesday. Jonjoe Kenny, Abdoulaye Doucoure, Mason Holgate and Jarrad Branthwaite drop to the bench as Fabian Delph starts in midfield and captain Seamus Coleman is back from illness. Everton XI: Pickford, Coleman, Mykolenko, Keane, Godfrey, Allan, Delph, Iwobi, Gordon, Richarlison, Calvert-Lewin. Subs: Begovic, Kenny, Holgate, Gray, Doucoure, Gomes, Branthwaite, Rondon, Alli. Manchester United XI: De Gea, Wan-Bissaka, Telles, Lindelof, Maguire, Matic, Fred, Fernandes, Sancho, Rashford, Ronaldo. Subs: Heaton, Henderson, Jones, Pogba, Mata, Lingard, Dalot, Elanga, Mejbri. Team news from Goodison Park is coming up in 10 minutes... Two sides out of form, it’s likely to be a scrappy affair. It is, however, hard to look past United’s firepower proving too much for Everton’s leaky defence. Manchester United to win 2-0. Everton wins: 70 Draws: 47 Manchester United wins: 90 Harry Kane and Declan Rice are on Manchester United’s wanted list as they close in on the appointment of Erik ten Hag. The Ajax coach is set to beat Mauricio Pochettino in the race for the Old Trafford hot seat, with confirmation potentially coming within days. He has already been assured during initial talks that he will be given backing in the transfer market, with United’s recruitment team already identifying Kane and Rice as dream targets for their incoming manager. There is another England star they would love to lure to Old Trafford, find out who here. Manchester United hope they have finally found their answer to Jurgen Klopp. That is the gamble in appointing Erik ten Hag, a man who comes with so many unknowns, particularly in comparison to Mauricio Pochettino. But that is also the allure. Read why United chose Ten Hag over Pochettino here. A reminder that Manchester United are closing in on the appointment of Erik ten Hag, with the Dutchman now expected to beat Mauricio Pochettino to the job. Sources close to the process insist a deal is still be finalised for the Ajax manager – but it is understood a nagreement is close to being reached. Ten Hag moved ahead of Pochettino after being interviewed by United football director John Murtough and technical director Darren Fletcher during the international break. United have now spoken to everyone under consideration for the job – and want their new man in place to lead their transfer business this summer. Read the latest here. Cristiano Ronaldo is fit to face Everton after recovering from the illness which forced him to miss last weekend’s 1-1 draw with Leicester. Ronaldo has trained all week and will return to the team as United look to boost their chances of finishing fourth. Luke Shaw will be absent as metal bolts are removed from the leg he fractured in 2015. Scott McTominay is out with a foot issue, while Raphael Varane will also be missing and Edinson Cavani remains sidelined. Everton will welcome back Michael Keane and Allan after suspensions. Donny van der Beek is ineligible to face his parent club, while Andros Townsend, Tom Davies and Yerry Mina remain sidelined. ",positive,liverpool,0
106,https://www.standard.co.uk/sport/football/everton-vs-man-united-live-stream-premier-league-2022-latest-score-result-watch-tv-team-news-today-b993453.html?page=7#post-374523,"Everton 1-0 Manchester United LIVE! Gordon goal - Premier League result, match stream and latest updates today","nthony Gordon boosted Everton’s hopes of Premier League survival as his first-half strike proved the difference in a scrappy affair against Manchester United. Gordon’s deflected effort before the half hour alleviated the pressure on Frank Lampard after a 3-2 midweek defeat at relegation rivals Burnley had left Everton just a solitary point above the drop zone. This was far from a vintage display from either side but a 1-0 win for the Toffees puts daylight between themselves and the bottom three as United’s top-four ambitions suffered another untimely dent. Marcus ashford was thwarted twice early on by Jordan Pickford but Cristiano Ronaldo was largely subdued as United remain cut adrift from the Champions League places after being downed by Gordon’s shot, which thudded into visiting captain Harry Maguire and left goalkeeper David De Gea stranded. Pickford was again called upon in time added on to deny Ronaldo on the half-volley after being teed up by Maguire before the referee’s whistle for full-time was greeted by an eruption of noise. Here is Ronaldo arriving at Goodison Park.. So Cristiano Ronaldo returns to the United team at Goodison Park. Ronaldo is fit again after recovering from the illness which forced him to miss last weekend’s 1-1 draw with Leicester and he comes straight back into the side. United interim boss Ralf Rangnick makes five changes to the side that drew to Leicester. Alex Telles replaces the injured Luke Shaw at left-back, while Aaron Wan-Bissaka is recalled at right-back instead of Diogo Dalot. In midfield, there is no Scott McTominay as Nemanja Matic starts alongside Fred, while Anthony Elanga and Paul Pogba drop to the bench in place of Marcus Rashford and Ronaldo. For Everton, Frank Lampard recalls Allan and Michael Keane from suspension as part of four changes to the Everton side the lost 3-2 at Burnley on Wednesday. Jonjoe Kenny, Abdoulaye Doucoure, Mason Holgate and Jarrad Branthwaite drop to the bench as Fabian Delph starts in midfield and captain Seamus Coleman is back from illness. Everton XI: Pickford, Coleman, Mykolenko, Keane, Godfrey, Allan, Delph, Iwobi, Gordon, Richarlison, Calvert-Lewin. Subs: Begovic, Kenny, Holgate, Gray, Doucoure, Gomes, Branthwaite, Rondon, Alli. Manchester United XI: De Gea, Wan-Bissaka, Telles, Lindelof, Maguire, Matic, Fred, Fernandes, Sancho, Rashford, Ronaldo. Subs: Heaton, Henderson, Jones, Pogba, Mata, Lingard, Dalot, Elanga, Mejbri. Team news from Goodison Park is coming up in 10 minutes... Two sides out of form, it’s likely to be a scrappy affair. It is, however, hard to look past United’s firepower proving too much for Everton’s leaky defence. Manchester United to win 2-0. Everton wins: 70 Draws: 47 Manchester United wins: 90 Harry Kane and Declan Rice are on Manchester United’s wanted list as they close in on the appointment of Erik ten Hag. The Ajax coach is set to beat Mauricio Pochettino in the race for the Old Trafford hot seat, with confirmation potentially coming within days. He has already been assured during initial talks that he will be given backing in the transfer market, with United’s recruitment team already identifying Kane and Rice as dream targets for their incoming manager. There is another England star they would love to lure to Old Trafford, find out who here. Manchester United hope they have finally found their answer to Jurgen Klopp. That is the gamble in appointing Erik ten Hag, a man who comes with so many unknowns, particularly in comparison to Mauricio Pochettino. But that is also the allure. Read why United chose Ten Hag over Pochettino here. A reminder that Manchester United are closing in on the appointment of Erik ten Hag, with the Dutchman now expected to beat Mauricio Pochettino to the job. Sources close to the process insist a deal is still be finalised for the Ajax manager – but it is understood a nagreement is close to being reached. Ten Hag moved ahead of Pochettino after being interviewed by United football director John Murtough and technical director Darren Fletcher during the international break. United have now spoken to everyone under consideration for the job – and want their new man in place to lead their transfer business this summer. Read the latest here. Cristiano Ronaldo is fit to face Everton after recovering from the illness which forced him to miss last weekend’s 1-1 draw with Leicester. Ronaldo has trained all week and will return to the team as United look to boost their chances of finishing fourth. Luke Shaw will be absent as metal bolts are removed from the leg he fractured in 2015. Scott McTominay is out with a foot issue, while Raphael Varane will also be missing and Edinson Cavani remains sidelined. Everton will welcome back Michael Keane and Allan after suspensions. Donny van der Beek is ineligible to face his parent club, while Andros Townsend, Tom Davies and Yerry Mina remain sidelined. ",positive,liverpool,0
107,https://www.standard.co.uk/sport/football/liverpool-xi-vs-man-city-starting-lineup-confirmed-team-news-injury-latest-premier-league-2022-today-b993238.html,"Liverpool XI vs Manchester City: Jota starts - Starting lineup, confirmed team news, injury latest for game today","iverpool head into today’s huge clash in good health. Diogo Jota started on the bench in Portugal despite scoring against Watford last weekend, and is paired alongside Mohamed Salah and Sadio Mane. Klopp says Fabinho will be fit despite suffering a cut in a clash of heads with Nicolas Otamendi on Tuesday as Liverpool secured a 3-0 first-leg victory. The Reds head to the Etihad a point behind the defending champions and knowing that victory would send them to the top of the division with just seven matches to play. Trent Alexander-Arnold returned to the starting lineup for the midweek win over Benfica in the Champions League after a hamstring injury and looked in fine form. Ibrahima Konate scored his first Liverpool goal in that game but has been replaced by Joel Matip. Jordan Henderson has also come back into the starting lineup, having been left on the bench in Portugal, with Naby Keita losing his place in midfield. Starting Liverpool XI: Alisson; Alexander-Arnold, Matip, Van Dijk, Robertson; Fabinho, Thiago, Henderson; Salah, Mane, Jota. ",positive,liverpool,3
108,https://www.standard.co.uk/sport/football/man-city-vs-liverpool-prediction-kick-off-time-tv-live-stream-team-news-2022-latest-h2h-results-premier-league-preview-today-b993332.html,"Manchester City vs Liverpool: Prediction, kick off time, TV, live stream, team news, h2h results preview today","he biggest Premier League game of the season takes place today between Manchester City and Liverpool. The points were shared in a thrilling 2-2 draw when the title contenders met at Anfield in October and just a single point separates the sides ahead of this showdown. While Liverpool have fought hard to close the gap on the defending champions, neither side comes into the Etihad Stadium clash on anything but great form. Click here to follow Manchester City vs Liverpool LIVE! City downed Atletico Madrid in midweek to make it four wins in a row and eight without defeat, while Liverpool’s win at Benfica made it five consecutive victories with their last league defeat coming in December. SPONSORED Here is everything you need to know ahead of the game... Manchester City vs Liverpool is scheduled for a 4.30pm BST kick-off today, Sunday, April 10, 2022. The Etihad Stadium in Manchester will host the match. TV channel: The match will be televised on Sky Sports Premier League and Main Event, with coverage beginning at 4pm. Live stream: Sky Sports subscribers will be able to watch the match online via the Sky Go app. Live blog: You can follow all the action via Standard Sport’s live blog. Man City XI: Ederson, Walker, Stones, Laporte, Joao Cancelo, Bernardo Silva, Rodri, De Bruyne, Foden, Gabriel Jesus, Sterling Subs: Ake, Gundogan, Grealish, Zinchenko, Steffen, Fernandinho, Mahrez, McAtee, Lavia Liverpool XI: Alisson, Alexander-Arnold, Matip, van Dijk, Robertson, Henderson, Fabinho, Thiago, Salah, Jota, Mane Subs: Konate, Milner, Keita, Firmino, Gomez, Jones, Tsimikas, Diaz, Kelleher. This one is just so difficult to call. In City’s favour, they have a great record against Liverpool, are at home, and just have that funny knack of pulling through in these games even when not on top form. In Liverpool’s favour, their goalscoring form is tremendous, they too are on a great run, and Jurgen Klopp’s side appear extra motivated to reclaim the title. But - City are the favourites. A 2-1 Man City win. Liverpool have not won a league game at the Etihad since 2015, with one victory in their last eight meetings overall. Man City wins: 58 Draws: 55 Liverpool wins: 105 ",positive,liverpool,10
109,https://www.standard.co.uk/sport/football/cody-gakpo-latest-transfer-news-arsenal-premier-league-2022-b992857.html,Cody Gakpo: PSV forward drops hint as transfer links continue - ‘I like Arsenal a lot’,"ody Gakpo spoke in glowing terms about Arsenal amid rumours linking the PSV Eindhoven forward with a move to the club. One of Europe’s most exciting young forwards, the 22-year-old has scored 18 times in 41 appearances across all competitions this season, alerting the interest of a number of big clubs around Europe. While the forward, who made his Netherlands debut at Euro 2020, does have a contract running until the summer of 2026, PSV are reportedly open to the idea of cashing in on their academy graduate at the end of the season. Arsenal are on the hunt for a new forward following the departure of Pierre-Emerick Aubameyang with manager Mikel Arteta focusing on signing young players to fit alongside the developing team he currently has at his disposal. Liverpool and Bayern Munich are just some of the teams to have been touted as potential landing spots, Gakpo revealed the Premier League was a destination he’d be open to, as well as how he took inspiration from Arsenal legend Thierry Henry. “The Premier League is a big league,” he told The Sun. “Virgil van Dijk plays there with Liverpool so I like to watch them. “We are not the same kind of league but I think we try to look at the Prem and learn about it. Everybody wants to play one time in the Prem. I don’t favour one team but I like Arsenal a lot. “I looked up to Henry when I was younger because he was a tall guy who played on the wing.” ",positive,liverpool,2
110,https://www.standard.co.uk/sport/football/ruben-neves-transfer-wolves-arsenal-man-united-premier-league-2022-b993182.html,Bruno Lage admits Wolves could sell Ruben Neves amid Arsenal interest and Man United links,"runo Lage has admitted Wolverhampton Wanderes could do little to stop Ruben Neves leaving should a club offer £100m to sign him. Arsenal hold a long-term interest in the Portuguese international although whether or not they would go that high in price remains to be seen. The 25-year-old, who has also been linked with Manchester United, has over two years left to run on his Wolves contract, and would command a high price tag in the transfer market. ""I don’t know if it’s United or other teams, what I know is we have a special player here with us. What he’s doing this season is very good,"" Lage told reporters ahead of Friday’s league trip to Newcastle United. ""I think also the way we play, he can show a better Ruben. The way he plays puts our team on a different level. When you have that player, the best thing to do is improve his salary and years of contract. SPONSORED ""But who knows, when you have a top player like him in that specific position, that can defend and attack, is a top professional and a great man, big teams are there with 100 million pounds to buy these kinds of players."" Lage explained how he felt helpless during his time at Benfica when Atletico Madrid bought forward Joao Felix for more than 120 million euros ($131 million) in 2019. ""It depends on the strategy of Wolves also, that’s why it was so hard to find players in the last two transfer windows,"" Lage added. ""We want to find the best players at the right price and the right age to help us, then after two or three years they can give us economical profit. ""It’s not just about Wolves. In these days which club can refuse a proposal of 80, 90 or 100 million pounds? Five or six."" Additional reporting from Reuters ",positive,liverpool,0
111,https://www.standard.co.uk/sport/football/arsenal-man-utd-transfer-targets-braga-b992863.html,Arsenal and Manchester United put on high alert after Braga boss talks up shop window for transfer targets,"raga boss Carlos Carvalhal wants his stars to show off their skills to the Premier League’s big spenders when they face Rangers in the Europa League. The likes of Arsenal, Manchester United and Liverpool have looked at the Portuguese club’s wealth of talent in recent times, including the Gunners’ links to Ricardo Horta and their English counterparts reported interest in David Carmo. Ex-Swansea boss Carvalhal namechecked defender Carmo as one of several players, along with himself, who can demonstrate their skills in this month’s quarter-final tie with Scottish champions Rangers. “We have an opportunity not just to show this to England, but to all the world. So let's see what we can do,” he told reporters on Wednesday. “We've got the youngest team left in the Europa League. We have a lot of boys with very good quality. This question is put to me and I understand, but it also goes for our players. “David Carmo was linked last year with Liverpool. We have a lot of talented players aged 17, 18, 19 who want to play in England. “They now have a good opportunity to show their abilities to the clubs across the world. The clubs will look to the manager but also the players.” ",positive,liverpool,2
112,https://www.standard.co.uk/sport/football/southampton-vs-chelsea-fc-prediction-kick-off-time-tv-live-stream-team-news-2022-latest-h2h-results-premier-league-preview-b993131.html,"Southampton vs Chelsea FC: Prediction, kick off time, team news, TV, live stream and h2h results","helsea travel to Southampton with their season in danger of unravelling after damaging back-to-back defeats against Brentford and Real Madrid. Amid all the uncertainty of the future of the club, Chelsea desperately need a win to steady the ship. A positive result at St Mary’s would boost confidence ahead of a huge week in which Chelsea face the second leg against Real and then their FA Cup semi-final with Crystal Palace. While it would be unlikely to see them drop out of the top four, the manner of their recent losses would suggest there is an awful lot to get right until the European champions can rest easy on that front. Southampton, meanwhile, have not won in five games across all competitions. Click here to follow Southampton vs Chelsea FC LIVE! Here’s all you need to know about the game at St Mary’s... The Premier League game is scheduled for a 3pm BST kick-off time on Saturday April 9, 2022. St Mary’s Stadium in Southampton will host. TV channel: With the game kicking off during the 3pm blackout across English football, it will not be televised. Highlights: Match of the Day, however, will broadcast highlights when it airs on BBC One at 10.30pm BST on Saturday. Live blog: You can keep up to date with all the action via Standard Sport’s live blog. Southampton XI: Forster, Livramento, Bednarek, Salisu, Walker-Peters, Ward-Prowse, Romeu, Stuart Armstrong, Elyounoussi, Adam Armstrong, Adams Subs: Stephens, Redmond, Caballero, Perraud, Smallbone, Tella, Diallo, Walcott, Valery Chelsea XI: Mendy, Christensen, Thiago Silva, Rudiger, Loftus-Cheek, Kante, Kovacic, Alonso, Mount, Havertz, Werner Subs: Arrizabalaga, Jorginho, Pulisic, Chalobah, Saul, Barkley, Ziyech, James, Sarr Up until recently, Southampton have been very strong at home and, when playing against the better teams in the league, are capable of delivering. With Chelsea out of form, a home win could well be on the cards. Southampton to win 1-0. Southampton wins: 31 Draws: 31 Chelsea wins: 48 ",positive,liverpool,0
113,https://www.standard.co.uk/sport/football/chelsea-fc-edouard-mendy-thomas-tuchel-west-ham-b970044.html,Edouard Mendy has ‘lost confidence’ admits Thomas Tuchel as he laments big Chelsea mistakes in West Ham defeat,"homas Tuchel admitted Edouard Mendy is suffering from a lack of confidence after his error in Chelsea’s shock defeat to West Ham. The goalkeeper, who was this week named runner-up to Gianluigi Donnarumma as Europe’s finest No1, was also culpable when conceding a penalty in the 3-2 defeat. Mendy twice had the chance to clear the danger after Jorginho’s under-hit back-pass, but was panicked into bringing down Jarrod Bowen under pressure from the winger. He was then beaten by Arthur Masuaku’s swerving cross late on, which secured the win for the home side. Tuchel said: “Edou is dealing with a rough period. I don’t know why exactly, but he seems to have lost a bit of confidence. Okay, his decision-making was not on the highest level today with the first goal, but we also bring him to a really awkward situation. “He could have saved the situation, but he did not. We are far, far away from blaming anybody, but we need to admit that we do too many crucial mistakes at the moment that cost us a win against Man United and today as well.” Chelsea’s manager was heavily critical of his players after their 2-1 win against Watford in midweek but despite their sloppiness costing them on Saturday, he refused to lay into the team after only their second Premier League defeat of the season. He added: “I didn’t see our performance dip against Man United or today. I think the performance is enough to even win the game, but what we clearly see is we give easy goals away and this is very unusual. “We make big mistakes that lead to big chances that lead to easy goals. We do this now in three matchdays against Man United, Watford and again today. If you do this at this kind of level, you can’t expect to have a result. “The (title) race is not interesting at the moment. What is interesting is always the next 90 minutes and what is interesting is to have the focus right, the attitude right, and to take care about the details. “We are not good enough on the details at the moment. We do too many big mistakes and have to care about the details. “There is no need to ask questions or start doubting about the big picture. This is a game if you play at West Ham about the details. I can only repeat myself: without doing big mistakes, there is a big chance we win this game.” ",positive,liverpool,0
114,https://www.standard.co.uk/sport/football/chelsea-fc-xi-vs-southampton-starting-lineup-confirmed-team-news-injury-latest-premier-league-2022-b993339.html,"Chelsea FC XI vs Southampton: Starting lineup, confirmed team news and injury latest for Premier League","omelu Lukaku and Hakim Ziyech faced late fitness tests ahead of Chelsea’s trip to Southampton. The pair both missed training on Thursday with what Thomas Tuchel described as “little problems”. Ziyech, however, was fit enough to make the bech as Tuchel opted to rotate. Timo Werner lineup alongisde Kai Havertz in attack and Ruben Loftus-Cheek is afforded a rare start at the base of midfield. “Hudson-Odoi is still out, and we are a bit in doubt with Romelu Lukaku and Hakim Ziyech,"" Tuchel said on Friday. “Romelu has Achilles pain, as well, just pain, nothing major. They were not in training yesterday due to little problems. “We hope to have them in training but need a test and confirmation from training.” Ben Chilwell is a long-term absentee. Predicted Chelsea XI: Mendy; Silva, Rudiger, Christensen; Loftus-Cheek, Kovacic, Kante, Alonso; Mount, Werner, Havertz. ",negative,liverpool,0
