,URL,Content_title,Contents,sentiment,word_search,word_count
75,https://www.standard.co.uk/sport/football/brentford-vs-west-ham-live-stream-premier-league-2022-latest-score-result-watch-tv-team-news-b993543.html?page=5#post-375109,"Brentford 2-0 West Ham LIVE! Toney goal - Premier League result, match stream and latest updates today","rentford vs West Ham - LIVE! Brentford continued their resurgent form by beating West Ham United 2-0 at home in on Sunday to rack up a fourth win in five matches and take another step towards guaranteeing their Premier League survival. Fresh from their shock 4-1 win at Champions League holders Chelsea last week, Thomas Frank’s side overwhelmed another side with European ambitions, Bryan Mbeumo opening the scoring in the second half before top scorer Ivan Toney doubled the lead. Brentford struck first after quick-thinking following a throw-in as Toney slipped the ball into the path of French forward Mbeumo, who slotted into the net with a first-time finish in the 48th minute. Mbeumo repaid the favour by crossing for Toney to head home from close range in the 64th and Brentford comfortably saw out the win to climb to 13th in the table on 36 points, 12 clear of the relegation zone. Frank’s side lost seven games out of eight before turning the tide with a 3-1 win at Norwich City in early March. The result was a further blow to West Ham’s hopes of finishing in the top four as they were left sixth on 51 points, six behind fourth-placed Tottenham. Follow all of the action LIVE with Standard Sport’s dedicated match blog. Jack Rosser will be providing expert analysis from the ground! Additional reporting from PA Lyon goalkeeper Anthony Lopes admits there “are regrets” following his side’s draw with West Ham in the first-leg of their Europa League quarter-final on Thursday night. Despite boasting a numerical advantage for the entirety of the second-half following Aaron Cresswell’s controversial red card, Lyon fell a goal behind after some lax defending allowed Jarrod Bowen’s shot to deflect off of Jerome Boateng and over a scrambling Lopes. You can read Lopes’ full comments here. Michail Antonio has never felt better in a West Ham shirt. The forward is playing with a freedom he has rarely enjoyed since arriving in 2015 from Nottingham Forest. Gone is the pressure of a relegation battle but, most importantly, he no longer fears feeling a tweak in his hamstring. Tonight’s historic Europa League quarter-final against Lyon is a huge moment for West Ham, but for their No9 it is also a significant milestone. When the 32-year-old walks out at the London Stadium, it will be his 38th appearance of the season, matching his highest-ever tally in one season for West Ham, with almost two months of the campaign still to run. Hamstring injuries and muscle problems have dogged his time at the club, but now Antonio finally has confidence in his body to compete at the highest level, despite the gruelling schedule brought about by European and international commitments. “It has been amazing,” Antonio tells Standard Sport. “I’ve loved every minute of it. Setbacks are hard to take, especially when you are trying your hardest and feel like you are doing all the right stuff. This season, throwing in even international games, with no real breaks, my body has managed to stay together.” You can read Antonio’s full interview here. Christian Eriksen has boosted Brentford’s hopes of keeping hold of him this summer by revealing he is “very happy” at the club. The midfielder, who suffered a cardiac arrest on the pitch playing for Denmark at Euro 2020 last year, has excelled since joining Brentford on a free transfer in January. Eriksen scored his first goal for the Bees last Saturday in the 4-1 victory at Chelsea and he will be hoping to build on that when they face West Ham on Sunday. The 30-year-old signed only a six-month contract with Brentford, who are desperate to keep him beyond this summer, but he is happy in west London. You can read Christian Eriksen’s comments in full here. David Moyes has warned Moussa Dembele that football has a strange way of coming back to bite you after the Lyon forward’s cheeky wink on Thursday night. Cameras caught Dembele winking towards a team-mate moments after Aaron Cresswell was shown a soft red card for the slightest of arm-pulls on him. West Ham battled to a 1-1 draw with 10 men to leave their Europa League quarter-final finely poised ahead of the return leg in France next week. But Moyes was fuming with German referee Felix Zwayer. And the West Ham manager has warned Dembele that football can come back to bite you. You can read Moyes’ comments by clicking here. ",positive,liverpool,0
76,https://www.standard.co.uk/sport/football/chelsea-fc-real-madrid-result-champions-league-2022-benzema-havertz-b992931.html,Chelsea 1-3 Real Madrid: Karim Benzema masterclass sinks error-strewn European champions,"eal Madrid stole a commanding lead in their Champions League quarter-final tie with Chelsea after Karim Benzema’s hat-trick secured a 3-1 win at Stamford Bridge. The first warning sign for the hosts, watched on Wednesday night by takeover hopeful Todd Boehly, came after ten minutes when Vinicius Junior hit the post to end what was a strong start from Chelsea. Madrid began to find joy attacking into the acres of space being vacated by the Blues, in eerie resemblance to their haphazard display against Brentford on the weekend. Benzema helped Vinicius break free down the left on 21 minutes and the Brazilian’s cross met his strike partner, who elegantly directed a powerful header in at Edouard Mendy’s near-post. Just two minutes later, it was 2-0. Luka Modric clipped in a cross from the right and Benzema again produced a stunning header, directed back across Mendy and into the far-post, for his 36th goal of the campaign. SPONSORED Chelsea gradually got back into the tie and went into the break with a sense of confidence, courtesy of Kai Havertz’s own header past Thibaut Courtois, which was followed by a miss from the simplest of positions from Benzema. Thomas Tuchel enthusiastically threw on Mateo Kovacic and Hakim Ziyech for the start of the second-half and yet, only 46 seconds after the whistle, Mendy underhit a pass some 30 yards out of his goal and Antonio Rudiger was too soft on Benzema as the striker stole in to roll home his hat-trick goal. Courtois denied Cesar Azpilicueta an immediate route back into the tie but the subdued home crowd were waiting for a moment of magic that failed to come quickly - prompting the introduction of Romelu Lukaku from the bench. The Belgian promptly saw two headers, the latter from a particularly good position, skew off-target as Chelsea continued to create chances but lacked conviction. The defending champions have it all to do at the Bernabeu in six days’ time. ",positive,liverpool,0
77,https://www.standard.co.uk/sport/football/leah-williamson-england-north-macedonia-b992992.html,Leah Williamson ruled out of England clash with North Macedonia as Gabby George gets call-up,"ew England Woman captain Leah Williamson is out of Friday’s World Cup qualifier against North Macedonia. Williamson, who was officially made Lionesses captain this week ahead of this summer’s home Euros, is under concussion protocols having missing training earlier this week as a precaution. The Arsenal Women defender has travelled to Macedonia with the squad, but will not be involved as England look to maintain their perfect record in qualifying. England have won all six of their games in Group D and, if they beat North Macedonia and Northern Ireland over the coming week, and Austria fail to take maximum points, Sarina Wiegman’s side will qualify with two games to spare. As well as Williamson, England will need to contend without Alex Greenwood and Lotte Wubben-Moy on Friday. SPONSORED Arsenal defender Wubben-Moy has returned to her club to manage a thigh injury, while Greenwood is out with a knee issue. Everton defender Gabby George has dully been called up by England. ",negative,liverpool,0
78,https://www.standard.co.uk/sport/football/villarreal-vs-bayern-munich-champions-league-result-2022-b992935.html,Villarreal 1-0 Bayern Munich: Arnaut Danjuma’s goal the difference in thrilling Champions League encounter,"rnaut Danjuma scored the all-important only goal as Villarreal edged past Bayern Munich in the first-leg of an enthralling Champions League quarter-final. After making it past the group stage and eliminating Juventus in the round of 16, the modest Spanish club took a big step toward reaching the semifinals by holding on to a slim victory against favorite Bayern at the La Ceramica Stadium. Danjuma’s goal early in the first half was enough for Villarreal, with Bayern unable to get past the solid defense of Unai Emery’s squad and losing only for the second time in 30 Champions League matches. Bayern was unbeaten in its last 22 away games in the Champions League, with 17 wins and five draws in a record run that had started after a loss in 2017 to a Paris Saint-Germain team coached by Emery. The return leg is next week in Munich, where Villarreal will need a draw to get to the semifinals for the first time since its first last-four appearance in the Champions League in 2006. SPONSORED In the other quarterfinal Wednesday, defending champion Chelsea lost 3-1 to Real Madrid in the first leg in London. Villarreal looked in control from the start and Bayern struggled to create significant scoring chances. The hosts threatened the most and had some good chances to add to its lead. Danjuma opened the scoring in the eighth minute by redirecting a close-range shot by Dani Parejo as the Bayern defense was caught off guard. It was Danjuma’s sixth goal in nine Champions League appearances this season, and seventh in 11 career games in the competition. Villarreal thought it had doubled the lead in the 41st but Francis Coquelin’s goal from a tough angle was disallowed for offside. Striker Gerard Moreno twice had opportunities to add to Villarreal’s lead after that. First with a low shot from outside the area that hit the post in the 53rd, and 10 minutes later after intercepting a bad pass by Bayern goalkeeper Manuel Neuer near midfield and missing his long-range shot into the open net. The ball ended up curling too much as Neuer desperately tried to run back into position. Bayern increased the pressure near the end but again it was Villarreal that nearly added to the lead when substitute Alfonso Pedraza missed from close range on a counterattack in the 87th. Villarreal did a good job containing Robert Lewandowski throughout the match and he had few opportunities inside the area. He entered the match as the Champions League’s leading scorer with 12 goals from eight matches and had scored seven goals in his last five games in all competitions. The Poland striker is ranked third on the all-time list of Champions League scorers, behind Cristiano Ronaldo and Lionel Messi. Bayern’s Canadian player Alphonso Davies made his first appearance since Dec. 17 after a long injury layoff because of cardiac issues. Villarreal, based in a city of about 50,000 people, is playing in the quarterfinals for the first time in 13 years. It qualified for the Champions League by winning last season’s Europa League. Bayern was eliminated by PSG at this stage last season. The German club made it to the last eight 10 times in the last 11 seasons. The team is playing in the quarterfinals for a record 20th time. The winner will play either Benfica or Liverpool in the semifinals. Liverpool won the first leg in Lisbon 3-1. Additional reporting from AP ",positive,liverpool,2
79,https://www.standard.co.uk/sport/football/villarreal-vs-bayern-munich-live-stream-champions-league-2022-latest-score-result-watch-tv-team-news-b992899.html,"Villarreal 1-0 Bayern LIVE! Danjuma goal - Champions League result, match stream and latest updates today","illarreal vs Bayern Munich - LIVE! Unai Emery’s reward for overcoming Juventus in the round of 16 is not the one he would have hoped for. Villarreal host Bayern Munich on Wednesday evening as the Champions League hots up. An expert at navigating one-off European ties, Emery faces a daunting task. Indeed, Bayern - despite some defensive concerns - put Red Bull Salzburg to the sword in the round-of-16, smashing their Austrian opposition 7-1 inside the Allianz Arena. Still, their rather listless display in the away leg (a 1-1 draw) could give Villarreal hope. If they can contain the likes of Robert Lewandowski - which is far easier said than done of course - then perhaps the La Liga outfit could well spring another surprise. SPONSORED Alongside Liverpool and Manchester City, Bayern have been touted as favourites to win the competition outright but, though they are the stronger side on paper, know they face a difficult task against a master tactician such as Emery. Follow all of the action LIVE with Standard Sport’s dedicated match blog! Good night and thank you for joining Standard Sport’s LIVE coverage of Villarreal’s shock win over Bayern Munich. Click here to read our full match report. A thrilling game but a very poor evening for Bayern. 93:00 - The German champions look levels off of Real Madrid, Liverpool and Manchester City. 89:00 - Will Villarreal live to regret these misses? Could have been 4-0 up. 86:00 - Pedraza puts yet ANOTHER good chance for Villarreal wide from just outside the box. 84:00 - So much possession now but they look almost bereft of ideas. 79:00 - Musiala tees up Goretzka in the box but he’s swarmed by yellow shirts. ",positive,liverpool,2
80,https://www.standard.co.uk/sport/football/francis-coquelin-arsenal-mesut-ozil-santi-cazorla-unai-emery-2022-b992862.html,Francis Coquelin shares Arsenal insight on Mesut Ozil and Santi Cazorla - ‘I could send them rubbish balls’,"rancis Coquelin has reflected on his time at Arsenal, hailing the likes of Mesut Ozil and Santi Cazorla. Now with Unai Emery at Villarreal, the Frenchman had to bide his time in north London before establishing himself as a regular towards the end of Arsene Wenger’s time in charge. Thrust back into the starting lineup to cover for injuries only a short time after joining Charlton on loan, Coquelin formed an impressive midfield pivot with Cazorla in particular, one that helped Arsenal beat Manchester City away from home in 2015. Largely, traveling to other big six teams had been a miserable experience for the club but Coquelin - at least for a short while - proved an internal solution of sorts and played the entirety of the FA Cup final win over Aston Villa later that year. Ultimately, he would join Valencia in January 2018 after falling out favour, before moving to Villarreal in the summer of 2020. Ahead of their Champions League clash with Bayern Munich on Wednesday, Coquelin spoke in glowing terms about some of his former teammates. “It was amazing!” he told So Foot. “I was playing with Santi Cazorla and Mesut Özil in front of me. I could send them rubbish balls, and they controlled them with ease. “The understanding I had with Cazorla particularly stayed with me. He’s really impressive. I could do what I wanted on the pitch, I knew he would always there as a guarantee.” ",positive,liverpool,0
81,https://www.standard.co.uk/sport/football/gareth-bale-wales-real-madrid-b991402.html,Underappreciated Gareth Bale has earned the right to do what he wants during twilight of a brilliant career,"n August, Gareth Bale gave an interview to the Observer which was almost comical in its non-committal blandness. Even by the standards of professional footballers, Bale managed to give very little away over the course of 16 quick-fire questions. He answered “nothing” to queries about what made him unhappy and what he would change about his past, and revealed he “wouldn’t want anyone else” to play him in a biopic. Asked what he had wanted to be when growing up, Bale, who appeared to be promoting Rowbots gym, said: “I just wanted to fulfil my potential.” There was almost nothing to be gleaned about Bale the man, his motivations or desires, but one answer, perhaps, did contain a degree of poignancy. Asked for his greatest fear, Bale replied: “Not being the best version of myself. In football and in life.” Bale is one of the finest and most successful British players of his generation, maybe of all time, but there is still a case that he has not been the “best version” of himself on the pitch in recent years. He has played just two hours of football for Real Madrid in the past six months and last started more than 15 League games in a season in 2018-19. Whatever the true circumstances of Bale’s Real purgatory, these are clearly not the statistics of a player determined to squeeze every last drop from his talent. Bale almost single-handedly dragging Wales through their World Cup play-off against Austria last week proved he is still one of the sport’s ultimate clutch players and foremost magicians, but it is intriguing to compare him to his former Real team-mate Cristiano Ronaldo. Both are sublimely gifted players, but Ronaldo has maintained an unquenchable thirst for goals, records and the limelight, which is no longer shared by Bale, at least at club level. Instead, the 32-year-old’s focus has been reduced to the singular goal of reaching the World Cup with Wales, to the point where he is considering retirement immediately after the tournament and could hang up his boots in June if they do not qualify. For anyone who has enjoyed Bale’s brilliance over the years, there is a degree of frustration in knowing that he is still good enough to elevate this stodgy Real side to another level, as he has done for his country. He could have been the club’s post-Ronaldo inspiration. This is seemingly part of the reason for the bile spewed at Bale by the Spanish media. He has seen Real for what they really are — questionable employers and a big business — and by refusing to play their game, he has not only humiliated them, he has fundamentally weakened them. And, given Bale’s well-documented treatment in Spain, why shouldn’t he? Bale, do not forget, worked every bit as hard as Ronaldo to reach the top, transforming himself from a skinny left-back, who was nearly released by Southampton and then nearly sold by Tottenham to Birmingham, into one of the world’s most explosive forwards, at one point behind only the Portuguese and Lionel Messi. If his fire no longer burns so brightly, that is understandable and okay. To despise Bale for wanting to enjoy the fruits of his labours or to scold him for not maintaining a laser-focus on self-improvement would be to hold footballers to dramatically different standards to everyone else. For players, football is a job, the game is a professional environment and, for the majority, their clubs are employers rather than passion projects. How many of us would continue to give our all in the twilight of our careers in a profession where we had already reached the top, achieved almost everything possible, if we then found ourselves saddled with an employer who did not really want us and a succession of bosses who sided with our detractors? In an age when we are increasingly told to enjoy ourselves and maintain a proper work-life balance, Bale appears to be doing just that as he winds down his Real contract, all while continuing to reach extraordinary levels for Wales. Having achieved what he has for Real, Bale has earned the right to disengage from the club’s psychodrama: to play golf, to spend time with his family, to prioritise his country, to give bland interviews and to promote rowing machines. This may not be the best version of Bale “in football”, but perhaps it is “in life”, which is ultimately more important. ",positive,liverpool,0
82,https://www.standard.co.uk/sport/football/gareth-bale-wales-real-madrid-press-la-liga-2022-b990579.html,Gareth Bale: Wales star hits back at being called a ‘parasite’ in Spanish press,"areth Bale has hit back at criticism leveled at him by sections of the media in Spain. The 32-year-old scored twice in a sensational win for Wales at the Cardiff City Stadium on Thursday night to overcome Austria in their World Cup play-off semi-final. Marca called the Welsh captain a ""parasite"" and accused him of faking a back injury that kept him out of Real Madrid’s humiliating loss to Barcelona at the weekend, four days before he scored both goals in Wales’s win over Austria in their World Cup playoff game. ""At a time where people are taking their own lives because of the callousness and relentless of the media, I want to know, who is holding these journalists and the news outlets that allow them to write articles like this, accountable?"" Bale asked in a statement on his social media accounts. ""Fortunately I have developed a thick skin but that doesn’t mean articles like these don’t cause damage and upset those at the receiving end of these malicious stories."" The former Tottenham forward has played only a handful of games at Real Madrid this season and Spanish media criticised him for missing their 4-0 home loss in the Clasico on Sunday with an apparent back injury. Marca ran a headline on Friday calling Bale ""The Welsh parasite"" and columnist Manuel Julia criticised his work ethic at Real. ""He settled in Spain, at Real Madrid, where he sucks the blood (and the euros) of his host without giving anything in return. Unlike others of its kind, such as the flea, the louse or the bedbug, the Parasite Bale does not cause itching or diseases, he just laughs with jocular contempt in a humiliating ceremony, which, luckily, has an expiration date, like all misfortunes,"" Julia wrote. Diario AS said the winger had played only four of Real’s 29 league games this season and did not attend the Clasico at the Santiago Bernabeu to support his colleagues. ""Bale. Go. Home. Now. In that order,"" read the headline on a column by AS editor-in-chief Tomas Roncero. ""Last night he rose again, as a kind of Braveheart of the country of the Dragon with a formidable performance. Real Madrid would be proud of him if it weren’t for the fact that four days ago he left the team stranded, alluding to a false back injury, and miserably erased himself from the Clasico against Barca."" Bale, whose season has been repeatedly disrupted by injury, added in his statement: ""I have witnessed the toll the media can take on people’s mental and physical health. ""I hope that by the time our children are of an age where they are able to ingest news, that journalism ethics and standards will have been enforced more stringently."" The playoff semi-final between Scotland and Ukraine has been postponed until June because of Russia’s invasion of Ukraine. Bale joined Real in 2013 and his contract expires in June. Additional reporting from Reuters ",positive,liverpool,0
