,URL,Content_title,Contents,sentiment,word_search,word_count
39,https://www.standard.co.uk/sport/football/beth-mead-england-vs-north-macedonia-result-2022-b993429.html,Beth Mead scores four as England take huge step to World Cup qualification in North Macedonia thrashing,"eth Mead score four times and Ella Toone bagged a hat-trick as England thrased North Macedonia 10-0 at the Tose Proeski Arena on Friday night. England, who had won the reverse fixture 8-0 in September in Sarina Wiegman’s first match in charge, pumped in five goals in the opening half with Mead scoring two and Ellen White nodding in her 50th goal for the national team. Toone and Georgia Stanway also got on the scoresheet and the visitors picked up from where they left off after the restart as Mead completed her third hat-trick of the campaign and added another to her tally to make it 7-0 inside the hour mark. Stanway added England’s eighth after turning her marker in the penalty area and firing a low shot before Toone struck twice in four minutes to complete the rout with 12 minutes left in the one-sided contest in North Macedonia’s capital. The Lionesses top Group D with a perfect record of 21 points from seven matches. They have scored a staggering 63 goals and conceded none ahead of their meeting with Northern Ireland at Belfast next Tuesday. SPONSORED Additional reporting from Reuters ",positive,liverpool,0
40,https://www.standard.co.uk/sport/football/edouard-mendy-karim-benzema-chelsea-fc-premier-league-2022-b993416.html,Thomas Tuchel: Chelsea star Edouard Mendy has never been ‘fully free of mistakes’,"helsea manager Thomas Tuchel says Edouard Mendy has “never been fully free of mistakes” but has backed the goalkeeper to recover from his mistake in the Champions League. Widely regarded as one of the best custodians in world football, Mendy was caught out by Karim Benzema at Stamford Bridge on Wednesday night, with the French striker able to score his hat-trick when pressing the Senegalese international into a mistake. The fact that Benzema managed something similar against Liverpool’s Loris Karius in the 2018 Champions League final speaks to a player capable of creating and pouncing on opportunities but Mendy has not always been entirely commanding of late. Some lax passing almost allowed Ivan Toney to score before Brentford thrashed Chelsea 4-1 at Stamford Bridge only days before the Madrid game, while Tuchel has previously admitted Mendy “lost confidence” after a poor game during a loss at West Ham. Clearly, it would be foolish to write off a player to have won both the Champions League and the Africa Cup of Nations, as well as a number of individual awards, over the past year and Tuchel has offered some perspective. ‘He was never fully free of mistakes, also not last season, but we helped him,’ said Tuchel. ‘It’s bad timing to do a mistake like this in a quarter-final, such a big occasion like this, one of the worst moments. I hope it doesn’t affect his self-confidence too much, because accepting mistakes is also what goalkeeping is about, living with mistakes, and going back and helping your team. Now he can prove he is a true champion.’ ",negative,liverpool,1
41,https://www.standard.co.uk/sport/football/mo-salah-liverpool-contract-latest-update-jurgen-klopp-premier-league-2022-b993414.html,Mohamed Salah offers cryptic update on Liverpool future - ‘There are many things that people don’t know’,"ohamed Salah has offered a cryptic fresh update on his Liverpool future. The Premier League’s top scorer has only 16 months left on his contract and talks look to have hit an impasse in recent months. Jurgen Klopp has repeatedly claimed there was no update on how talks were progressing over a potential extension for the 29-year-old amid reports linking the player with a move away. Equally, there have been suggestions the Egyptian forward is close to extending his stay at Anfield for a number of years but, for as long as nothing is signed, the worry that a player to have propelled Liverpool back to the top of English football could leave will only increase. In 241 games for the club since moving from AS Roma in 2017, Salah has scored 153 goals and remains one of the game’s leading marksmen. But ahead of Sunday’s clash with rivals Manchester City which could go a long way to deciding this season’s champions, Salah sought to play down the potential distraction. Salah told Sky Sports News: ""There are many things that people don’t know about it - I can’t be selfish and talk about my situation (because) we are in the most important situation that is coming for the team. ""I’ve said many times what I want but I can’t really go deep into the contract now because it is a sensitive situation. ""I can’t go in the news and talk about the contract now, I am just focused on the team. That is the most important thing for me, (being) focused to win trophies and I’m just giving everything for the club."" Additional reporting from PA ",positive,liverpool,2
42,https://www.standard.co.uk/sport/football/pep-guardiola-man-city-liverpool-jurgen-klopp-premier-league-2022-b993405.html,Manchester City manager Pep Guardiola will reflect on ‘biggest’ challenge Liverpool even in retirement,"ep Guardiola has vowed that he will reflect on Jurgen Klopp’s Liverpool team as the “biggest rivalry” in his career when the Manchester City manager retires. The two will meet on Sunday in what is surely one of the biggest Premier League games in history. City’s lead has been cut down to just one point and a win for either side would put one hand on the title at this stage of the campaign. Throughout the respective spells of both Guardiola and Klopp in England, their sides have redefined what it takes to win a title. City have broken the 100 point barrier and the 2018-19 season saw Liverpool finish on 97 points, only to end up second. Klopp’s own Premier League victory saw his team amass 99 points and the German is the manager to have beaten Guardiola the most over the course of his career, with 9 wins in 22 matches. The City chief managed Barcelona during a time in which battles with Jose Mourinho’s Real Madrid were legendary, though looks upon this challenge as even greater. Speaking ahead of their game at the Etihad Stadium, Guardiola said: ""I admire what they do, how good they are. I enjoy this challenge. ""When I retire and watch and play golf I will remember the biggest rivalry was Liverpool.” ",positive,liverpool,3
43,https://www.standard.co.uk/sport/football/ralf-rangnick-consultant-erik-ten-hang-manager-news-man-united-premier-league-2022-b993390.html,Ralf Rangnick will talk to Manchester United bosses about consultancy role in the ‘next couple of weeks’,"nterim Manchester United manager Ralf Rangnick has revealed he will hold talks in regards to his consultancy role in the next “couple of weeks”. The German agreed a two-year contract beyond his coaching spell at Old Trafford when replacing Ole Gunnar Solskjaer in November to continue working behind the scenes. Having previously helped Red Bull establish two leading teams on the continent in both Salzburg and Leipzig, Rangnick said he was looking “forward to supporting the club’s longer-term goals on a consultancy basis” when appointed at United. Clearly, his spell in charge has not exactly gone to plan with this expensively-assembled team facing a fight to even qualify for next season’s Champions League. Currently, United sit three points behind Tottenham in fourth and have only won three of their last six games. Still and, even with the seemingly imminent appointment of Ajax boss Erik Ten Hag, Rangnick has hinted he will hold talks with decision-makers at the club in the coming weeks, although his full focus is on finishing the season in charge. ""What I know about all the managers the club has spoken to so far, they are top managers, top coaches, and if this includes Erik ten Hag it is also true of him,” he said. ""That’s all I can say about that at this stage. For me it’s about preparing for tomorrow’s game."" ""As you know I have agreed a contract as an advisor. ""We will speak about that in the next couple of weeks and at the end of the season. Right now my full focus is on tomorrow."" ",positive,liverpool,0
44,https://www.standard.co.uk/sport/football/steven-gerrard-antonio-conte-tottenham-aston-villa-premier-league-2022-b993380.html,Steven Gerrard offers Tottenham reality check ahead of Aston Villa clash,"teven Gerrard has urged his Aston Villa players not to view Tottenham as “unbeatable”. Antonio Conte’s side look to have turned a corner in recent weeks, moving into the top four after a run of five wins in six Premier League games with only title-chasing Liverpool in better form. Prior to that, Conte had struggled to get a consistent tune out of his players and even hinted he may not be the right manager for the job after a disappointing loss away at Burnley in February. Now into the top four, Spurs travel to a Villa side on Saturday who look ready for the season to end. Three defeats in a row has seen Gerrard suggest many in his squad are playing for their futures as the former England captain gears up for his first full season in charge of a Premier League club. Speaking ahead of the game, Gerrard called on his players to draw on some of Spurs’ inconistent displays, believing Conte to have been “extremely frustrated” as a result. “Spurs are in great form and they’ve got a top-class manager,” he said. “You have to remember that over the course of the season, Spurs aren’t unbeatable. “It wasn’t so long ago that the manager was extremely frustrated because they had inconsistencies. Good team, good form, good players but not unbeatable.” ",positive,liverpool,1
45,https://www.standard.co.uk/sport/football/pep-guardiola-jurgen-klopp-man-city-liverpool-premier-league-2022-b993367.html,Pep Guardiola hails ‘exceptional’ Manchester City as ‘the best’ in message to Liverpool boss Jurgen Klopp,"ep Guardiola believes Jurgen Klopp “makes world football a better place to live” but has hailed his “exceptional” squad as “the best.” The Manchester City boss is preparing to welcome title-chasing Liverpool to the Etihad Stadium on Sunday in what has been described in some circles as one of the biggest games in Premier League history. City’s lead has been cut down to only one point and any victor on Sunday would surely be considered as favourites to win the title. While the rivalry arguably lacks some of the needle the battles Manchester United and Arsenal had at the turn of the millennium, the overall quality of both City and Liverpool has rarely been matched by other English sides. Guardiola and Klopp, however, do not appear to have the kind of fiery relationship Sir Alex Ferguson and Arsene Wenger - or Jose Mourinho and Rafa Benitez - were embroiled in with the Liverpool boss hailing his City counterpart as “the best coach in the world.” Speaking at his press conference, Guardiola distanced himself from such comments but moved to praise Klopp in return. “I didn’t become a manager to be the best. I’m not. Thank you so much, but I’m not. I’d like to say I’m the best, but I’m not. “I’d say incredible things about my team. My team are the best. I like to admit my players are exceptional. ""Jurgen makes world football a better place to live. He’s a huge competitor. He’s a good guy and I don’t have any problems with him.” Guardiola did not want to comment on the publication of further accusations about the club’s final affairs this week. He said: ""I cannot control the people from where it comes. It has come from outside and when you understand the important win we had a few days ago, and the games we have ahead of us this week, I don’t spend one second... in fact I am 50 seconds talking about it now, so next question."" Additional reporting from PA ",positive,liverpool,3
46,https://www.standard.co.uk/sport/football/ralf-rangnick-man-utd-everton-premier-league-b993358.html,Ralf Rangnick admits Manchester United must win every game to beat Arsenal and Tottenham to fourth place,"anchester United must put together a flawless finish to their season to beat Arsenal, Tottenham and West Ham to fourth place in the Premier League, Ralf Rangnick has admitted. Ahead of Saturday’s trip to Everton, the Red Devils sit seventh and three points behind Spurs in fourth. Arsenal have a game in hand over their rivals while United hold the worst goal difference of the quartet. “In the first instance, we need to win the next game and then we can speak about the other games,” Rangnick told reporters. “If you look at the current situation in the table, we can't afford to drop points anymore and I think everybody in the team and the squad is aware of that.” Raphael Varane will miss the lunchtime game at Goodison Park along with Luke Shaw, Edinson Cavani and Scott McTominay. Cristiano Ronaldo does return against the struggling Toffees for United, and Rangnick put the onus on his players to improve their attitude after a run of one win in six games. “We're all aware of the importance of the game for both sides,” he added. “For me, game plan and tactics are one thing for tomorrow, but probably the most important thing is mentality and attitude.” ",negative,liverpool,0
47,https://www.standard.co.uk/sport/football/tuchel-chelsea-real-madrid-southampton-b993350.html,Thomas Tuchel reveals crunch talks with Chelsea stars to reverse downward spiral ahead of Southampton trip,"homas Tuchel has given his Chelsea players a dressing down for their performances against Real Madrid and Brentford. The European champions were hammered 4-1 by London rivals Brentford last weekend before Madrid all but ended their hopes of defending their Champions League crown with a 3-1 win at Stamford Bridge on Wednesday. Tuchel has been dumbfounded by the defensive displays which have seen them ship seven goals in two games, with the Blues usually so robust at the back under the German. Ahead of Saturday's visit to Southampton, the former Paris Saint-Germain boss hauled his players in for a meeting at their Cobham training ground on Thursday to vent his frustrations. “It was not a discussion meeting yesterday… It was more [one where] I gave my point of view,” said Tuchel. “This is sometimes necessary. We take the players' view very seriously and often into account but over the last two games we thought it is necessary to give our point of view. “Behind closed doors, in an atmosphere where everybody can take criticism. I feel involved in a development like this. We don’t point fingers and look for people that are guilty. We are in this together. We needed to point out some points in our game where we are unhappy and could have defended better."" Asked about the sudden defensive frailties, Tuchel said: “It is very not like us to defend like this and concede so many goals. “That’s why we didn’t see it coming because it was not the case before national break. These two matches within five days are very untypical and not easy to deal with because it does not fit to a pattern. “We constantly try to figure out how we can improve. We need to stop this kind of direction and development as soon as possible. The best possibility is tomorrow [against Southampton].” ",positive,liverpool,0
48,https://www.standard.co.uk/sport/football/man-city-vs-liverpool-title-decider-preview-b993325.html,Manchester City vs Liverpool: Title-decider that could prove first of epic trilogy,"t is testament to the brilliance of the Premier League’s tearaway two that Sunday’s meeting is being branded, with such justified conviction, a title-decider. There are still eight matches to play in this league season, almost a quarter of the campaign, a period in which some of the most iconic Premier League title races have produced their most dramatic twists and turns. But this feels different, the latest instalment of a rivalry that has raised the bar, between two teams so good they really ought to be peerless. Instead, they have each other. For Liverpool in particular, defeat would surely be terminal, the gap widening to four points and meaning Manchester City would have to slip up twice even if Jurgen Klopp’s side are flawless. City, though, will be equally wary of ceding ground to a team who have been just that since mid-January, winning ten on the bounce in the league. The level of excellence required just to keep pace in this race, let alone win it, has brought back memories of three years ago, when 98 points played 97 and Liverpool closed out the season with nine straight wins but were still pipped by City, who racked up 14. Statistically the highest-quality title race in top-flight history might have lacked some of the slip-ups and swings that have punctuated its greatest, but it was also missing this kind of business end head-to-head, the fixture computer conspiring to throw up their league second meeting as early as the third day of the New Year. Both head to the Etihad in prime form, big guns firing and - with the exception of Ruben Dias’ continued absence - full-strength teams. That this could yet prove the first of a season-defining trilogy is lost on no one either, as talk of trebles and quadruples abounds. The FA Cup semi-final between Manchester United and Arsenal in 1999 is often credited with having indirectly determined the Premier League and European champions as well, but Liverpool and City might yet have one another’s fate in their hands on all fronts, all the way to the line. They meet again at Wembley in the FA Cup next weekend and, after each taking significant strides towards the Champions League semi-finals in midweek, remain on course for a showdown in Paris at the end of it all. But for now, all that matters is Sunday: whichever name is on top of the Premier League table by the end of the weekend will likely be the same one on the Premier League trophy by the end of May. ",positive,liverpool,3
49,https://www.standard.co.uk/sport/football/arsenal-injury-news-thomas-partey-mikel-arteta-b993331.html,Arsenal injury news: No guarantee Thomas Partey will play again this season,"ikel Arteta has given no assurances that Thomas Partey will play for Arsenal again this season, describing his thigh injury as “significant”. Partey injured this thigh during Monday night’s 3-0 defeat to Crystal Palace and was forced to limp off in the second-half. The midfielder has since undergone a scan, which revealed muscle damage, meaning he will definitely miss this weekend’s game with Brighton and next week’s trip to Southampton. Partey is due to see a specialist and Arteta is unsure if the Ghana international will get back on the pitch this season. “It is a little bit ambiguous but he has a significant injury and we’ll have to keep assessing him, but he will be out for some weeks,” said Arteta. SPONSORED “It could be [that he plays again this season] but it could not be the case – because it is an area where he had a previous injury as well and he felt it straight away and he is not fit. “We lost two big players (Kieran Tierney and Partey), really important plays for us in the team for sure. “But we’re not going to have them so we cannot be crying for that because they’re not going to be available for us. “So we have to find other solutions and we have to still be as good and as competitive as he have been.” ",positive,liverpool,0
50,https://www.standard.co.uk/sport/football/arsenal-mikel-arteta-nuno-tavares-b993328.html,Mikel Arteta: I know Crystal Palace hook hurt Nuno Tavares but now he must react,"rsenal boss Mikel Arteta has spoken with Nuno Tavares after hooking him at half-time against Crystal Palace and has urged the full-back to bounce back from his tough run of form. Nuno has started just two games since the turn of the year and on both occasions has not made it past 45 minutes of action. The 22-year-old, however, impressed earlier on in the season and Arteta has encouraged him to learn from this tough spell now. Nuno could get plenty of game time before the campaign ends as fellow left-back Kieran Tierney will be out for the rest of the season after undergoing knee surgery. “Obviously I speak with the players and I spoke with Nuno because I care a lot how they feel and we are here to help them, and make their careers better,” said Arteta. “That was a decision that hurt him, obviously, but he understands that it was for the benefit of the team, that I believe it was for the benefit of the team, and he respects that. “Now he needs to react on that situation, because it is a great opportunity to learn a lot in that period in your career.” Tierney’s surgery on Thursday evening was a success, but he is still not expected to return before the end of the club season. He could, however, be back for Scotland’s World Cup qualifying play-off semi-final against Ukraine in June. “I don’t know yet, he just had a surgery yesterday,” said Arteta. “So it is very early to understand how everything is going to develop, he’s going to be out for the period that we estimate but to know what condition he will be after that period, I think it’s too soon to to be able to say something. “I think the player has to do the maximum that he can to be in the best possible condition as quick as possible. “I’m sure Kieran will do that and once he’s there, let’s see if he’s able to compete and with what kind of risk or not, but I’m sure he will do that. “Our responsibility is to look after them when we have them here. “Once they go to a national team in these cases it is the job and responsibility of Steve Clarke to decide a team that he believes is the best to win games and we have to try to have good communications with national teams, which we have, but these things happen.” ",positive,liverpool,0
51,https://www.standard.co.uk/sport/football/north-macedonia-vs-england-captain-bright-williamson-b993308.html,North Macedonia vs England: Millie Bright to captain World Cup qualifier in Leah Williamson’s absence,"helsea defender Millie Bright is set to captain England against North Macedonia on Friday night in the absence of Leah Williamson. Arsenal centre-back Williamson was named Lionesses captain this week ahead of the summer’s home Euros, but she will be absent tonight due to concussion protocols. Bright, who was made vice-captain this week, is due to lead the team instead and has spoken of her pride about being one of the team’s leaders under manager Sarina Wiegman. “It’s a massive honour. As a player, there’s no higher honour than being able to lead your country out,” said Bright. “I’m extremely proud of Leah, she’s been absolutely amazing. It is fully deserved.” England have won all six of their games in World Cup qualifying so far and could secure qualification over the next week. They sit top of Group D and if they beat North Macedonia and Northern Ireland, and Austria fail to take maximum points, England will qualify with two games to spare. ",positive,liverpool,0
52,https://www.standard.co.uk/sport/football/christian-eriksen-transfer-brentford-b993303.html,‘Very happy’ Christian Eriksen delivers transfer boost to Brentford amid interest in resurgent Dane,"hristian Eriksen has boosted Brentford’s hopes of keeping hold of him this summer by revealing he is “very happy” at the club. The midfielder, who suffered a cardiac arrest on the pitch playing for Denmark at Euro 2020 last year, has excelled since joining Brentford on a free transfer in January. Eriksen scored his first goal for the Bees last Saturday in the 4-1 victory at Chelsea and he will be hoping to build on that when they face West Ham on Sunday. The 30-year-old signed only a six-month contract with Brentford, who are desperate to keep him beyond this summer, but he is happy in west London. “Everything has been pretty positive, only the coronavirus time when I didn’t play that game at Leicester,” said Eriksen. “But after it has been very heart-warming to be here. The welcome from the fans, players and staff, really everyone, has been very happy for me. I am very happy to be here. “To win 4-1 at Stamford Bridge as a team is a massive statement and it will give the whole club a lot of confidence against the top teams. “All the last few weeks and months have been very emotional and very pleasing obviously for me to be back playing and to score my first goal at Stamford Bridge.” ",positive,liverpool,0
