,URL,Content_title,Contents,Sentiment
217,https://www.assist-football.com/2022/04/16/%e0%b8%9e%e0%b8%b5%e0%b9%88%e0%b8%95%e0%b9%89%e0%b8%b2%e0%b9%80%e0%b8%8b%e0%b9%87%e0%b8%87%e0%b8%9b%e0%b8%b2%e0%b8%a3%e0%b9%8c%e0%b9%80%e0%b8%95%e0%b8%a2%e0%b9%8c%e0%b8%9e%e0%b8%b1%e0%b8%81%e0%b8%a2/,น่าเศร้า! “พี่ต้า” เผย “ปาร์เตย์” หายเจ็บไม่ทันก่อนจบซีซั่นแน่,มิเกล อาร์เตต้า กุนซือใหญ่ อาร์เซน่อล เปิดเผยว่า ปาร์เตย์ กองกลางดาวรุ่ง ได้รับบาดเจ็บที่ต้นขา ระหว่างเกมที่พบกับ คริสตัล พาเลช ดาวเตะทีมชาติกาน่าปัญหาอาการบาดเจ็บต้นขาเกมที่พ่ายให้กับคริสตัล พาเลช 0-3 เมื่อต้นเดือนที่ผ่านมา และพลาดช่วยเกมที่พบ ไบรจ์ตัน สัปดาห์ที่แล้ว รายงานก่อนหน้านี้ของสโมสรเปิดเผยว่า ปาร์เตย์ เตรียมตัวพักยาวไปจนจบฤดูกาลและอาร์เตต้า ก็เป็นกังวลไม่น้อยหลังอาการของเขาตอนนี้ไม่สู้ดีนักและไม่มีทีท่าว่าจะคัมแบ็คกลับมาช่วยทีมได้เลย “โอกาสที่เขาจะกลับมาลงสนามในเกมที่เหลือนั้นดูไม่ดีนักในตอนนี้แต่เราก็ต้องดูกันต่อไปตอนนี้เราไม่ได้มองบวกถึงการกลับมาของ ปาร์เตย์ อาร์เตต้า กล่าวก่อนเกมพบ เซาแธมป์ตัน” ตอนนี้ อาร์เซน่อล ขาดนักเตะอยู่หลายคนมากอย่าง คีแรน เทียร์นี่ย์ ที่มีปัญหาบาดเจ็บหัวเท่า และ ทาเคฮิโระ โทมิยาสุ ที่มีการการบาดเจ็บน่องตามรบกวนเป็นพักๆ อเล็กซองด์ ลากาแซตต์ เองก็พลาดการลงสนามซ้อม ด้วยเหตุผลส่วนตัวแต่ อาร์เตต้า เองก็บอกว่ายังลงสนามได้ ปัจจุบัน อาร์เซน่อล รั้งอันดับที่ 5 ของตารางพรีเมียร์ลีก ตามหลังอันดับ 4 อย่าง สเปอร์ อยู่ 3 คะแนนเท่านั้นฏ ,neutral
218,https://www.assist-football.com/2022/04/16/%e0%b8%82%e0%b8%ad%e0%b8%9a%e0%b8%84%e0%b8%b8%e0%b8%93%e0%b8%9a%e0%b8%b4%e0%b9%80%e0%b8%ad%e0%b8%a5%e0%b8%8b%e0%b9%88%e0%b8%b2/,ขอบคุณที่ผ่านมา! แฟนยูงทองลงข้อความถึง ‘บิเอลซ่า’ ผ่านหนังสือพิมพ์,"แฟนบอลลีดส์ ยูไนเต็ด ขอบคุณ มาร์เซโล่ บิเอลซ่า อดีตกุนซือของพวกเขาเต็มหน้าหนังสือพิมพ์ในอาร์เจนติน่า บิเอลซ่า โดนปลดออกจากตำแหน่งในเดือนกุมภาพันธ์และ เจสซี่ มาร์ช เข้ามารับช่วงต่อ หลังผลงานที่ไม่ดีทำให้ ลีดส์ ต้องไปเกี่ยวข้องกับการลุ้นหนีตกชั้น นั่นทำให้ บิเอลซ่า ยุติช่วงเวลา 4 ปีกับ “ยูงทอง” แต่ก็ฝากความทรงจำให้กับแฟนบอลของสโมสรไว้อย่างมากมาย มาร์ช ช่วยให้ผลงานของ ลีดส์ ดีขึ้นในช่วงหลายสัปดาห์หลัง แต่แฟนบอลก็ยังไม่ลืมสิ่งที่ บิเอลซ่า ทำให้กับสโมสรและเลือกจะขอบคุณเขาผ่านการลงข้อความบนหนังสือพิมพ์ La Capital ในโรซาริโอเมืองเกิดของโค้ชชาวอาร์เจนไตน์ พวกเขาขึ้นข้อความตัวโตๆว่า “ขอบคุณมาร์เซโล่” ต่อด้วยข้อความอันซาบซึ้งว่า “ในเดือนสิงหาคม 2018 เรายืนตกตะลึงกลางแดดจ้ากับฟุตบอลที่เราไม่รู้ว่ามันเป็นไปได้ และเรารู้สึกถึงบางสิ่งบางอย่างอีกครั้ง” “คุณย้ำเตือนเราว่าฟุตบอลมีความสวยงามและการเล่นเป็นทีมคือสิ่งที่ดียิ่งกว่า ทีมมาก่อนตัวเอง” “และคุณมอบหลายสิ่งให้เรามากยิ่งกว่าแค่คำว่าฟุตบอล คุณพาเราก้าวผ่านการระบาดของไวรัสและทำให้เราเป็นหนึ่งเดียวในช่วงเวลาที่เราต่างต้องแยกจากกัน คุณแสดงให้เราเห็นว่าความเป็นหนึ่งเดียวกันและความสุภาพเหมาะสมคือสิ่งสำคัญ, ไม่ว่าจะช่วงเวลาที่ดีหรือร้าย” “คุณอ้าแขนรับความหวาดกลัวของเราและเปลี่ยนความสิ้นหวังให้เป็นความหวัง, เปลี่ยนนักเตะของเราให้เป็นฮีโร่ คุณทำให้เราทุกคนดีขึ้น” “คุณทำให้เรากลับมาภาคภูมิใจ, ทำให้เราสนุกและสร้างความทรงจำอันล้ำค่าที่จะคงอยู่ตลอดไป เป็นสิ่งที่สวยงามนะ มาร์เซโล่ และจะเป็นสิ่งที่สวยงามมากตลอดไป ขอบคุณ”  ",neutral
219,https://www.assist-football.com/2022/04/17/%e0%b9%80%e0%b8%81%e0%b8%ad%e0%b8%ae%e0%b8%b5%e0%b9%80%e0%b8%8a%e0%b8%b7%e0%b9%88%e0%b8%ad%e0%b8%97%e0%b8%b3%e0%b8%96%e0%b8%b9%e0%b8%81%e0%b9%81%e0%b8%a5%e0%b9%89%e0%b8%a7/,คิดมาดีแล้ว! “เกอฮี” ยันคิดถูกแล้วที่ลาสิงห์,มาร์ค เกอฮี กองหลังดาวรุ่ง คริสตัน พาเลช ได้อำลาสิงห์บลู เพื่อมาหาประสบการณ์ใหม่และได้แจ้งเกิดที่นี่ เซ็นเตอร์วัย 21 ปี ลงนามในสัญญายาว 5 ปี ย้ายมาเล่นให้ คริสตัน พาเลช เมื่อตอนซัมเมอร์ ด้วยค่าตัว 18 ล้านปอนด์ หลังปักหลักลงเล่นให้ทีมเยาวชนของเชลซีมานาน หลังย้ายมาในถิ่น เซลเฺฮิร์สต์ พาร์ค เกอฮี ได้ลงสนามสร้างผลงานอย่างต่อเนื่องจนถูกเรียกตัวให้ติดทีมชาติชุดใหญ่ของอังกฤษ” เกอฮี เผยว่า ผมคิดถูกแล้วที่ตัดสินใจย้ายออกมาเชลซี แล้วมาเล่นให้พาเลช มันคือการตัดสินใจที่ถูกต้องในแง่ของเวลาในการลงสนามและจะได้เห็นว่าผมทำอะไรได้บ้าง “การมาที่นี่ไม่ได้หมายความว่าผมจะได้ลงสนามผมยังต้องพิสูจน์ตัวเองกับอะไรอีกหลายๆอย่าง ต้องทำงานอย่างหนัก ซ้อมให้หนักขึ้น แต่ชัดเจนว่าสโมสรแห่งนี้จะสร้างให้ผมมีรากฐานที่ดีในวงการลูกหนัง” “ชัดเจนว่าปาทริค ทำให้ผมคิดถึงเกมแตกต่างจากเดิมอย่างสิ้นเชิง ทั้งเรื่องมุมมองแทคติก และความคิดฟุตบบอล โดยเฉพาะอย่างยิ่งในการพัฒนาขึ้นให้เยอะกว่าเดิมในเรื่องของการตัดสินใจ” “การที่จะเล่นในระดับนี้มันยากมากๆ ต้องยกระดับมาจากแชมเปี้ยนส์ชิพ ดังนั้นทุกการตัดสินใจเป็นสิ่งสำคัญมากๆ และนำไปสู่ช่วงเวลาสำคัญภายในเกมนั้นๆได้เลย เขาช่วยให้ผมคิดเยอะขึ้น” ,neutral
220,https://www.assist-football.com/2022/04/12/%e0%b8%a5%e0%b8%b7%e0%b8%ad%e0%b9%80%e0%b8%a5%e0%b8%a7%e0%b8%b2%e0%b8%99%e0%b8%a2%e0%b9%89%e0%b8%b2%e0%b8%a2%e0%b9%84%e0%b8%9b%e0%b8%9a%e0%b8%b2%e0%b8%a3%e0%b9%8c%e0%b8%8b%e0%b9%88%e0%b8%b2/,กระฉ่อน! “เลวานฯ” ขึ้นยานแม่แน่นอนเซ็น 3 ปี,โรเบิร์ต เลวานดอฟสกี้ กองหน้าตัวยิง เสือใต้ ต้องการที่จะหาประสบกาณ์ใหม่และเขาต้องการที่จะย้ายถิ่นไปค้าแข้งที่ คัมป์ นู หัวหอกวัย 33 ปี ย้ายมาค้าแข้งให้ บาเยิร์น มิวนิค ตั้งแต่ปี 2014 และได้ประสบความสำเร็จไม่น้อย แต่สัญญาที่เหลือกับต้นสังกัดอีกเพียงแค่ปีเดียวเท่านั้น ทำให้เขาตกเป็นเป้าหมายสำคัญกับหลายสโมสรยักษ์ใหญ่ที่ต้องการดึงตัวไปร่วมทัพด้วย เชื่อกันว่า โรเบิร์ต เลวานดอฟสกี้ ต้องการย้ายออกไปหาความท้าทายอะไรใหม่ๆให้กับตัวเอง และ ซาฮาวี่ เอเยนต์ส่วนตัวของเขาก็ได้เขาพบปะพูดคุยกับทางสโมสร บาร์เซโลน่ามาหลายเดือนแล้ว ล่าสุดสำนักข่าวจากบ้านเกิดโปแลนด์ได้ออกมาเปิดเผยว่า นักเตะเเละบาร์เซโลน่าได้บรรลุข้อตกลงกันแล้วและเซ็นสัญญาล่วงหน้าไปถึง 3 ปี นอกจากนี้ สื่อยังอ้างต่อว่า ได้มีสโฒสร ลิเวอร์พูล ปารีส แซงต์ แชร์กแมง และ แมนเชสเตอร์ ซิตี้ ได้ร่วมวงชิงด้วยแต่นักเตะเองเลือกที่จะไปค้าแข้งที่ บาร์เซโลน่า  ,negative
221,https://www.assist-football.com/2022/04/11/%e0%b9%80%e0%b8%9b%e0%b9%8a%e0%b8%9a%e0%b9%80%e0%b8%84%e0%b8%b2%e0%b8%a3%e0%b8%9e%e0%b8%84%e0%b8%a5%e0%b9%87%e0%b8%ad%e0%b8%9b%e0%b8%9b%e0%b9%8c/,รักจริง! “เป๊บ” หวังได้ดินเนอร์กับ ‘คล็อปป์’,เป๊บ กวาร์ดิโอล่า กุนซือเรือใบสีฟ้า แมนเชสเตอร์ ซิตี้ ออกมาให้ความเคารพ เยอร์เก้น คล็อปป์ กุนซือหงส์แดง ลิเวอร์พูล ช่วยให้เขาพัฒนาฝีมือในการคุมทีมเข้าไปอีกหลังได้เจอกันหลายปีที่ผ่านมา กวาร์ดิโอล่า พาแมนเชสเตอร์ ซิตี้ เปิดบ้านเสมอกับลิเวอร์พูล 2-2 ซึ่ง “เรือใบสีฟ้า” ยิงนำ 2 รอบจาก เควิน เดอ บรอยน์ และ กาเบรียล เชซุส แต่ทางทีมเยือน ก็ทวงคืนได้ทั้ง 2 ครั้งจาก ดิโอโก้ โชต้า และ ซาดิโอ มาเน่ ในการให้สัมภาษณ์หลังเกม กวาร์ดิโอล่า กล่าวว่า: “ผมไม่รู้ว่า เยอร์เก้น เคารพผมหรือเปล่านะ แต่ว่าผมเคารพเขามากเลย “เขาทำให้ผมเป็นผู้จัดการทีมที่ดีขึ้น… ทีมของเขามีพลังงานเชิงบวก เล่นกันอย่างดุดัน และต้องการเล่นเกมรุก ผมพยายามเลียนแบบเขา “เราไม่ได้เป็นเพื่อนกัน เราไม่ได้ทานมื้อเย็นร่วมกัน สักวันหนึ่งเราจะดินเนอร์ด้วยกันในหอเกียรติยศ “ผมมีเบอร์โทรศัพท์ของเขาแต่ผมไม่เคยโทรหาเขา ผมเคารพเขามาก ๆ และเขาก็รู้ว่าในวันเสาร์หน้า เราจะพยายามเอาชนะพวกเขา” ,positive
222,https://www.assist-football.com/2022/04/12/%e0%b8%a5%e0%b8%b9%e0%b8%81%e0%b9%80%e0%b8%9b%e0%b9%87%e0%b8%99%e0%b9%80%e0%b8%9e%e0%b8%b7%e0%b9%88%e0%b8%ad%e0%b8%99%e0%b8%81%e0%b8%b1%e0%b8%99/,ลูกเป็นเพื่อนกัน! KDB เผยรู้จัก VvD มานานแล้ว,เควิน เดอ บรอยน์ ได้ออกมาเผยหลังเกมบอลหยุดโลกนัดที่ เรือใบสีฟ้า แมนเชสเตอร์ ซิตี้ เปิดบ้านเสมอทีมหงส์แดง ลิเวอร์พูล อย่างสุดมันและการพูดคุยแบบสนิทสนมกับ เวอร์กิล ฟาน ไดจ์ หลังเกมก็มีการจับภาพที่โค้ชและนักเตะหลายคนของทั้งสองทีมเดินเข้าไปพูดคุยทักทายกัน โดยเฉพาะกับทาง เดอ บรอยน์ และ ฟาน ไดจ์ ที่มีหลายคนสงสัยว่าเหตุใดทั้งคู่ถึงดูรู้จักกันเป็นอย่างดี และเมื่อถูกถามถึงเรื่องดังกล่าวมิดฟิลด์ชาวเบลเยี่ยมก็ได้ตอบว่า เดอ บรอยน์ กล่าว “ผมรู้จัก เวอร์กิล ผมกับเขาเจอกันบ่อยมาก” “ลูกของพวกเราเรียนที่เดียวกันและพวกเขาชอบเล่นด้วยกัน มันเลยเป็นการทักทายแบบเป็นกันเอง” ,positive
223,https://www.assist-football.com/2022/04/12/%e0%b9%80%e0%b8%9a%e0%b8%99%e0%b8%97%e0%b9%8c%e0%b8%8a%e0%b8%a1%e0%b8%95%e0%b8%b5%e0%b9%8b%e0%b8%8b%e0%b8%99%e0%b9%80%e0%b8%81%e0%b9%88%e0%b8%87%e0%b8%a1%e0%b8%b2%e0%b8%81/,ของจริงจัด! เบนท์ชม “ตี๋ซน” เล่นได้เข้าได้กับทุกทีม,ดาร์เรน เบนท์ อดีตกองหน้าทีมชาติอังกฤษ ยกย่อง ซน ฮึง-มิน กองหน้า ท็อตแน่ม ฮ็อตสเปอร์ สามารถเล่นได้กับทุกทีมจริงๆ หัวหอกทีมชาติเกาหลีใต้ เพิ่งซัดแฮตทริกไปในเกมที่พบ แอสตัน วิลล่า 4-0 เมื่อสุดสัปดาห์ที่ผ่านมา ทำให้ตอนนี้ยิงไปแล้ว 17 ประตูในพรีเมียร์ลีก เป็นรองดาวซัลโว ตามหลัง ซาร่า เพียง 3 ลูกเท่านั้น เบนท์ เผยใช่ตอนนี้ เขาสามารถทำได้สบายๆ ไปอยู่กับทุกทีมได้ในพรีเมียร์ลีกอังกฤษ “ข้อยกเว้นเพียงหนึ่งเดียวตอนนี้คือ เขาสามารถแซงหน้า ซาดิโอ มาเน่ ได้หรือป่าวในตอนนี้” “เมื่อไม่กี่ฤดูกาลก่อนหน้านี้ ไม่ใช่ฤดูกาลล่าสุด มาเน่ ก็มีปีที่ดร็อปลงมาบ้าง แต่กับ ซน ฮึง-มิน กลับยกระดับขึ้นเรื่อยๆเก่งขึ้นตลอดเวลา” “เขายิงประตูได้ ทำประตูได้ สร้างประตูได้ แล้วเขาก็จบสกอร์ได้ทั้งสองเท้า” “ซน ฮึง-มิน มีความอันตรายมากๆและอย่างต่อเนื่องในการทำประตูด้วย เขาเล่นอย่างฉลาดเคลื่อนที่อย่างว่องไว และทำประตูได้อย่างต่อเนื่องทุกนัดตลอดทั้งฤดูกาล “ ,positive
224,https://www.assist-football.com/2022/04/06/%e0%b8%81%e0%b8%a5%e0%b8%b1%e0%b8%9a%e0%b8%95%e0%b8%b1%e0%b8%a7%e0%b8%81%e0%b8%a5%e0%b8%b1%e0%b8%9a%e0%b9%83%e0%b8%88/,กลับตัวกลับใจ! สื่อเผย ‘เด็มเบเล่’ วันหยุดยังมาซ้อม,"อุสมาน เด็มเบเล่ ปีกตัวจี๊ดของ เจ้าบุญทุ่ม บาเซโลน่า มีข่าวมาจากสื่อกระทิงว่า ถึงจะเป็นหยุดแต่เจ้าตัวก็ยังมาซ้อม ดาวเตะเลือดน้ำหอมลงเล่นไป 90 นาทีในเกมพบกับ เซบีญ่า เมื่อสุดสัปดาห์ ก่อนจะโดนเปลี่ยนตัวออกตอนทดเจ็บพร้อมรับเสียงปรบมือจากแฟนบอลมากมาย ความฟิตของเขาอยู่ในระดับสูงสุดและ เด็มเบเล่ ผ่านการลงสนามมา 2 เดือนติดแล้วโดยที่ไม่มีปัญหาอาการบาดเจ็บเกิดขึ้น ดูเหมือนว่าเจ้าตัวจะหันมาดูแลร่างกายของตัวเองมากขึ้นและมุนโด้ เดปอร์ติโบรายงานว่าเขาเดินทางไปปรากฏตัวที่สนามซ้อมในวันนี้ (อังคาร) เพื่อฟื้นฟูและออกกำลังรักษาสภาพร่างกายของเขา ถึงแม้จะเป็นวันที่ทีมหยุดก็ตาม ทั้งนี้แข้งวัย 24 ปีไม่ใช่นักเตะเพียงแค่คนเดียวที่เดินทางมาสนามซ้อมในวันหยุด ยังมี เซร์คิโอ บุสเกตส์, โรนัลด์ อเราโฮ และ เคลมองต์ ล็องเกลต์ มาปรากฏตัวด้วย จนถึงตอนนี้อนาคตของ เด็มเบเล่ ยังไม่มีข้อสรุปหลังสัญญาของเขาจะหมดลงในช่วงซัมเมอร์ และการต่อสัญญากับทีมเคยล้มเหลวมารอบนึง ถึงอย่างนั้นมีข่าวว่า มาเตว อเลมานี่ ผู้อำนวยการกีฬาของ “ต่างดาว” เดินทางไปโมร็อกโกเพื่อพูดคุยกับเอเยนต์ของ เด็มเบเล่ ",neutral
