,URL,Content_title,Contents,Sentiment
75,https://www.assist-football.com/2022/05/01/%e0%b8%ad%e0%b8%b1%e0%b8%99%e0%b9%80%e0%b8%8a%e0%b9%88%e0%b8%84%e0%b8%a7%e0%b9%89%e0%b8%b25%e0%b9%81%e0%b8%8a%e0%b8%a1%e0%b8%9b%e0%b9%8c/,‘อันเช่’ กุนซือประวัติศาสตร์ซิวแชมป์ลีก 5 ลีกท็อป,คาร์โล อันเชลอตติ กุนซือ ราชันชุดขาว เรอัล มาดริด ได้สร้างตำนานและเป็นผู้จัดการทีมประวัติศาสตร์คนแรกที่ได้แชมป์ลีก 5 ลีกใหญ่ กุนซือชาวอิตาเลี่ยนวัย 62 ปี หวนกลับมาทำทีมเรอัล มาดริด อีกครั้ง แทนที่ซีเนอดีน ซีดาน ในฤดูกาลนี้ และ ประกาศศักดาพาทีมราชันชุดขาวคว้าแชมป์ ลา ลีกา ได้สำเร็จหลังถล่มเอสปันญอล 4-0 ในวันเสาร์ ความสำเร็จดังกล่าว ได้จารึกชื่อของ อันเชลอตติ ว่าเป็นผู้จัดการทีมคนแรกในประวัติศาสตร์ที่คุมทีมคว้าแชมป์ลีก จาก 5 ลีกใหญ่ยุโรปได้สำเร็จ เส้นทางคุมทีมอันยิ่งใหญ่ของเขาเริ่มต้นด้วยการนำเอซี มิลาน คว้าแชมป์เซเรีย อา ในปี 2004 ก่อนจะไปได้แชมป์พรีเมียร์ลีกกับเชลซี ในปี 2010 ตามด้วย ลีกเอิง กับปารีส แซงต์ แชร์กแมง ในปี 2013 และบุนเดสลีกา กับบาเยิร์น มิวนิค ในปี 2017 นอกจากนี้ อันเชลอตติ ยังทำสถิติคว้าแชมป์ยุโรปได้ 3 สมัย เท่ากับ บ็อบ เพสลี่ย์ ตำนานลิเวอร์พูล และซีเนอดีน ซีดาน ตอนที่คุมเรอัล มาดริด โดยอันเชลอตติ คว้าแชมป์ยุโรปกับ เรอัล มาดริด ปี 2014 และเอซี มิลาน ปี 2003 และ 2007 และในฤดูกาลนี้ อันเชลอตติ มีโอกาสเพิ่มสถิติเป็นแชมป์ยุโรปสมัยที่ 4 ถ้าหากเขาสามารถพาทีมผ่านแมนเชสเตอร์ ซิตี้ ในรอบรองชนะเลิศ (นัดแรกทีมเรือใบชนะ 4-3) และเข้าไปลุ้นต่อในนัดชิงฯได้สำเร็จ ,neutral
76,https://www.assist-football.com/2022/05/01/%e0%b8%a5%e0%b8%b5%e0%b8%94%e0%b8%aa%e0%b9%8c-%e0%b9%81%e0%b8%a1%e0%b8%99%e0%b8%8b%e0%b8%b4/,ไฮไลท์ ลีดส์ ยูไนเต็ด VS แมนเชสเตอร์ ซิตี้,ไฮไลท์ฟุตบอล ลีดส์ ยูไนเต็ด VS แมนเชสเตอร์ ซิตี้ ฟุตบอลพรีเมียร์ลีก อังกฤษ ประจำคืนวันที่ 30 เมษยน 2565 ,
77,https://www.assist-football.com/2022/05/01/%e0%b9%80%e0%b8%9b%e0%b9%8a%e0%b8%9b%e0%b8%8a%e0%b8%a1%e0%b8%a5%e0%b8%b9%e0%b8%81%e0%b8%97%e0%b8%b5%e0%b8%a1/,“เป๊ป” ชมลูกทีมผ่านความกดดดันได้ดี,เป๊บ กวาร์ดิโอล่า กุนซือจอมแทคติคของ เรือใบสีฟ้า แมนเชสเตอร์ ซิตี้ พาลูกทีมบุกโชว์ฟอร์มเก่งด้วยการอัด ลีดส์ ยูไนเต็ด ถึงถิ่น 4-0 ทำให้พวกเขากลับไปนำเป็นจ่าฝูงห่าง ลิเวอร์พูล ที่แต้มเดียวเหมือนเดิม ในขณะที่เหลือเกมให้เล่นอีก 4 นัด เป๊ป กล่าวกับSky Sports หลังตบเกม : “เรารู้ดีว่าการมาเยือนที่นี่จะเจอแนวทางการเล่นของพวกเขาแบบนี้ พวกเรามีปัญหามากในช่วงครึ่งแรก แต่ท้ายที่สุดเราก็คอนโทรลและยิงประตูเพิ่มได้” “ถือเป็นผลการแข่งขันที่ยอดเยี่ยมมาก วันนี้มันสำคัญมากในการสร้างโอกาสเพื่อให้เราได้เป็นแชมป์อีกครั้ง” “พวกเราเล่นเกมรับได้ดีและบางครั้งในเกมแบบนี้ลูกเซ็ตพีชมันก็กลายเป็นจุดสำคัญ การมี นาธาน อาเก้ ในสนามช่วยให้พวกเราแข็งแกร่งมาก” “ลาปอร์ต ก็มีเกมที่น่าทึ่ง เขามีซีซั่นที่ยอดเยี่ยม เรายังเหลือเกมให้เล่นอีก 5 นัด และอาจจะเป็น 6 จนจบซีซั่นนี้” “ผมก็อยากจะรู้สึกกดดันให้น้อยกว่าที่รู้สึกตอนนี้ ถือเป็นซีซั่นที่ยาวนานและนี่คือการพยายามช่วงสุดท้ายแล้ว” ,positive
78,https://www.assist-football.com/2022/04/27/%e0%b9%80%e0%b8%88%e0%b8%b2-%e0%b9%80%e0%b8%9f%e0%b8%a5%e0%b8%b4%e0%b8%81%e0%b8%8b%e0%b9%8c-%e0%b9%80%e0%b8%9f%e0%b8%b4%e0%b8%a3%e0%b9%8c%e0%b8%a1%e0%b9%80%e0%b8%ad%e0%b8%87%e0%b9%80%e0%b8%88%e0%b9%87/,ปิดเทอมอีกราย! “เฟลิกซ์” ยันเองเจ็บแฮมสตริงพักยาว,เจา เฟลิกซ์ ยืนยันว่าตนเองได้รับบาดเจ็บที่แฮมสริง ไม่สามารถลงสนามช่วยทีมได้แล้วในฤดูกาลนี้ เจา เฟลิกซ์ ดาวรุ่งพุ่งแรงของ แอตเลติโก้ มาดริด ออกมาเปิดเผยว่าเขาไม่สามารถลงสนามช่วยต้นสังกัดได้แล้วในฤดูกาลนี้ หลังได้รับบาดเจ็บที่บริเวณแฮมสตริง ดาวเตะวัย 22 ปี ได้รับบาดเจ็บจากเกมนัดล่าสุดที่เปิดบ้านเอาชนะ เอสปันญอล 2-1 เมื่อสัปดาห์ที่ผ่านมา และโดนเปลี่ยนตัวออกตั้งแต่ในช่วงพักครึ่ง โดยเจ้าตัวได้ออกมายืนยันเองว่าไม่สามารถลงสนามช่วยทีมได้แล้วในฤดูกาลนี้ “มันน่าผิดหวังมากๆ มันเป็นข่าวที่ผมมาอยากให้เกิดขึ้น ผมเศร้าอย่างมากที่ผมจะไม่สามารถลงสนามช่วยทีมได้อีกแล้วในฤดูกาลนี้” “ตอนนี้ผมทำได้เพียงแค่ซัพพอร์ต แอต.มาดริด จากข้างนอก และจะทำงานอย่างหนักเพื่อจะกลับมาให้แข็งแกร่งกว่าเดิม” เฟลิกซ์ กล่าว อย่างไรก็ดี นอกจาก เฟลิกซ์ แล้วจากรายงานของสื่อท้องถิ่นยังเผยอีกว่า ตราหมี ยังต้องเสีย โตมาส์ เลอมาร์ ที่ได้รับบาดเจ็บที่แฮมสตริงในเกมเดียวกันและพักยาวตลอดทั้งฤดูกาลเช่นกัน ,negative
79,https://www.assist-football.com/2022/04/27/%e0%b9%81%e0%b8%a1%e0%b8%99%e0%b8%8b%e0%b8%b4-%e0%b8%a1%e0%b8%b2%e0%b8%94%e0%b8%a3%e0%b8%b4%e0%b8%94/,ไฮไลท์ แมนเชสเตอร์ ซิตี้ VS เรอัล มาดริด,ไฮไลท์ฟุตบอล แมนเชสเตอร์ ซิตี้ VS เรอัล มาดริด ฟุตบอลยูฟ่า แชมป์เปี้ยนส์ลีก ประจำคืนวันที่ 26 เมษายน 2565 ,
80,https://www.assist-football.com/2022/04/28/%e0%b8%9b%e0%b8%b7%e0%b8%99%e0%b8%95%e0%b8%b1%e0%b8%94%e0%b8%aa%e0%b8%b4%e0%b8%99%e0%b9%80%e0%b8%9b%e0%b9%80%e0%b8%9b%e0%b9%89/,‘ปืน’ เตรียมตัดสินอนาคต ‘เปเป้’ ซัมเมอร์,อาร์เซน่อล เตรียมตัดสินใจอนาคตของ นิโคลัส เปเป้ ปีกค่าตัวสถิติสโมสร หลังช่วงหลังฟอร์มตกไม่ได้เป็นตัวจริงยาวนาน ดาวเตะทีมชาติไอวอรี่ โคสต์สร้างผลงานตามความคาดหวังไม่ได้นับตั้งแต่ย้ายจาก ลีลล์ มาอยู่ในถิ่นลอนดอนเหนือด้วยค่าตัว 72 ล้านปอนด์เมื่อปี 2019 ฤดกาลนี้ เปเป้ ได้รับโอกาสลงสนามไม่เยอะและไม่ได้ออกสตาร์ทในพรีเมียร์ลีกมาตั้งแต่เดือนตุลาคม เขาเหลือสัญญาอยู่อีก 2 ปีเมื่อถึงช่วงซัมเมอร์และ อาร์เซน่อล จะทำการพูดคุยอนาคตกับเขา ส่วนสำคัญในแผนการเสริมทัพของ “ปืนใหญ่” สำหรับตลาดซื้อขายรอบถัดไปคือการเสริมแดนหน้าและพวกเขาหวังจะเซ็นหัวหอกใหม่ 2 ราย หนึ่งในนั้นน่าจะยืนริมเส้นได้ด้วยซึ่งจะส่งผลกระทบต่อโอกาสลงสนามของ เปเป้ เปเป้ เคยให้สัมภาษณ์ไว้ในเดือนมีนาคมว่า “ก็น่าหงุดหงิดนะที่ไม่ได้ลงสนาม ไม่มีนักเตะคนไหนสนุกกับการไม่ได้ลงสนามหรอกแต่ผมต้องเคารพการตัดสินใจของโค้ช” “เป็นเรื่องยากสำหรับโค้ชที่จะทำการปรับเปลี่ยนเมื่อทีมยังเดินหน้ากวาดชัยชนะ มิเกล อธิบายเรื่องนั้นไว้และผมรู้ว่าผมต้องทุ่มเทอย่างหนักในตอนซ้อมเพื่อที่จะได้โอกาสลงสนามมากกว่านี้ โค้ชทราบว่าผมคิดยังไงและผมทุ่มเทมากขนาดไหน” ตอนนี้ เปเป้ โฟกัสไปกับเกมโค้งสุดท้ายของฤดูกาลและหวังว่าจะมีบทบาทพา อาร์เซน่อล คว้าตั๋วไปเล่นแชมเปี้ยนส์ลีกได้สำเร็จ อาร์เซน่อล กำลังรั้งอันดับ 4 ของตารางพรีเมียร์ลีกและมีแต้มเหนือ ท็อตแน่ม ฮ็อตสเปอร์ อยู่ 2 คะแนน ซึ่งทั้งสองทีมจะทำศึกนอร์ธ ลอนดอน ดาร์บี้กันในเดือนหน้าด้วย การได้ตั๋วไปเล่นแชมเปี้ยนส์ลีกจะทำให้งบเสริมทัพของพวกเขาเพิ่มขึ้น แต่ อาร์เซน่อล ยังต้องตัดสินใจอนาคตของนักเตะหลายๆคนไม่ใช่เพียงแค่ เปเป้ โดยแข้งอย่างเช่น ปาโบล มารี เองก็อยากอยู่กับ อูดิเนเซ่ ต่อหลังถูกปล่อยยืมตัว ,neutral
81,https://www.assist-football.com/2022/04/26/%e0%b8%ad%e0%b9%80%e0%b8%a3%e0%b8%b2%e0%b9%82%e0%b8%ae%e0%b8%95%e0%b9%88%e0%b8%ad%e0%b8%aa%e0%b8%b1%e0%b8%8d%e0%b8%8d%e0%b8%b2%e0%b9%83%e0%b8%ab%e0%b8%a1%e0%b9%88/,อยู่ต่อ! ต่างดาวประกาศ ‘อเราโฮ’ ต่อสัญญายาวถึง 2026,"Cheers#MadeInLaMasia pic.twitter.com/2Druyu6txm — FC Barcelona (@FCBarcelona) April 26, 2022 บาร์เซโลน่า ประกาศว่า โรนัลด์ อเราโฮ กองหลังของทีมได้ต่อสัญญาอยู่ยาวไปจนถึงปี 2026 เป็นที่เรียบร้อย ทั้งสองฝ่ายทำการพูดคุยเรื่องต่อสัญญามาเป็นเวลาหลายเดือนแล้ว แต่ก็ได้มีการคอนเฟิร์มอย่างเป็นทางการสักทีโดยงานจรดปากกาเซ็นสัญญากันนั้นจะเกิดขึ้นในวันศุกร์ เซ็นเตอร์แบ็ควัย 23 ปีจะได้รับสัญญาใหม่ยาวไปจนถึงปี 2026 มาพร้อมกับค่าฉีกสัญญาเพื่อกันท่าสโมสรอื่นที่ 1 พันล้านยูโร นั่นทำให้เขากลายเป็นนักเตะอีกรายที่ตามรอย อันซู ฟาติ กับ เปดรี ในการฝากอนาคตไว้กับสโมสร โดยที่ กาบี้ มิดฟิลด์ดาวรุ่งถูกคาดหมายว่าจะต่อสัญญาตามไปในเร็วๆนี้ อเราโฮ กลายมาเป็นคนสำคัญในแผงหลังของ “ต่างดาว” ฤดูกาลนี้หลังผ่านการลงสนามไป 26 เกมในลาลีก้า รวมถึงแสดงความสารพัดประโยชน์ให้เห็นด้วยการขยับไปยืนในตำแหน่งฟูลแบ็ค อเราโฮ ย้ายจาก บอสตัน ริเวอร์ สโมสรในอุรุกวัยมาอยู่กับ บาร์ซ่า เมื่อปี 2018 ด้วยค่าตัว 1.7 ล้านยูโรบวกแอดออน ก่อนจะผ่านการลงสนามกับทีมชุดบีไป 42 เกมในลีกตลอดสองฤดูกาล เขาได้รับโอกาสให้ประเดิมสนามกับทีมชุดใหญ่ในปี 2019 ก่อนจะเลื่อนขั้นสู่ชุดใหญ่เต็มตัวในฤดูกาล 2020-21 และตอนนี้ก็ผ่านการลงเล่นไป 56 เกมลีก, ยิงได้ 6 ประตู เขายังผ่านการประเดิมสนามให้ทีมชาติอุรุกวัยชุดใหญ่ในปี 2020 และตอนนี้ก็ลงสนามไปแล้ว 9 เกมด้วยกัน ",neutral
82,https://www.assist-football.com/2022/04/26/%e0%b9%80%e0%b8%97%e0%b8%99%e0%b8%ae%e0%b8%b2%e0%b8%81%e0%b8%82%e0%b8%ad%e0%b8%88%e0%b8%b1%e0%b8%94%e0%b9%80%e0%b8%9e%e0%b8%b4%e0%b9%88%e0%b8%a1%e0%b9%81%e0%b8%84%e0%b9%883%e0%b8%84%e0%b8%99%e0%b8%9e/,“เทนฮาก” เผย จัดเพิ่มแค่ 3 ก็พอไม่ต้องถึง 10 หรอก,"แมนเชสเตอร์ ยูไนเต็ด เปิดเผยถึงการพัฒนาของทีมว่าจะมีงบให้ เทนฮาก เซ็นสัญญานักเตะใหม่ได้แค่ 3 คนเท่านั้น ไม่บ้าจี้ตาม รังนิค ต้องหาถึง 10 คน รายงานข่าวจาก ESPN ระบุว่า ผู้บริหารของยูไนเต็ด จะมีงบประมาณให้ เอริค เทน ฮาก ได้จับจ่ายใช้สอยอยู่ที่ประมาณ 100-150 ล้านปอนด์ในช่วงซัมเมอร์นี้ โดยเน้นย้ำให้กุนซือชาวดัตช์ให้ลำดับความสำคัญไปที่การพัฒนาทีมมากกว่ายกเครื่องใหม่ทั้งหมด ดังนั้นคาดเป้าหมายไว้ว่า เทน ฮาก น่าจะเป็น ดาร์วิน นูเญซ, เยอร์เรี่ยน ทิมเบอร์ และ เปา ตอร์เรส ขณะอยู่ในกลุ่มที่มีสิทธ์ถูกปล่อยตัวมี เอริค ไบญี่, ฟิล โจนส์, อองโตนี่ อเล็ก เตลเลส, และ อารอน วาน-บิสซาก้า ESPN ระบุต่อด้วยว่า ผู้บริหารสโมสรไม่บ้าจี้ทำตามคำแนะนำของ รังนิคอย่างแน่นอน ที่รู้สึกว่าทีมจำเป็นจะต้องเพิ่มนักเตะใหม่ถึง 10 คน หลังเกมที่น่าอับอายพ่ายให้กับ ลิเวอร์พูล ถึง 4-0 ทั้งนี้ปัญหาที่ เทน ฮาก ต้องเจอและรับมือให้ได้ในซัมเมอร์นี้ก็คือ สตาร์หลายคนสำกลังจะหมดสัญญาและเตรียมที่จะย้ายออกจากทีม ไม่ว่าจะเป็น ปอล ป็อกบา, เจสซี่ ลินการ์ด, ฆวน มาต้า, เอดินสัน คาวานี่, และ นมานย่า มาิช ",positive
83,https://www.assist-football.com/2022/04/27/%e0%b9%81%e0%b8%ad%e0%b8%99%e0%b8%9f%e0%b8%b4%e0%b8%a5%e0%b8%94%e0%b9%8c%e0%b9%80%e0%b8%a5%e0%b9%87%e0%b8%81%e0%b9%80%e0%b8%81%e0%b8%b4%e0%b8%99%e0%b9%84%e0%b8%9b/,ใหญ่ไม่พอ! ‘แอนฟิลด์’ เล็กไปอดจัดยูโร 2028,สนามแอนฟิลด์ สนามเหย้าของของทีมหงส์แดง ลิเวอร์พูล มีข่าวมาจาก เดอะ ซัน สื่อจอมแฉ ว่า ความยาวของสนามไม่ตรงตามกำหนดของยูฟ่าจึงทำให้ไม่ได้เป็นสนามแข่งยูโร 2028 5 ชาติบนเกาะอังกฤษ น่าจะได้รับการยืนยันจากยูฟ่า ให้เป็นเจ้าภาพมหกรรมชิงแชมป์ลูกหนังยุโรป โดยคาดว่าจะมีสนามเป็นสังเวียนแข้ง 16 แห่ง โดยจะอยู่ในอังกฤษ 10 สนาม อย่างไรก็ดี รายงานอ้างว่า สนามเหย้าของลิเวอร์พูล ซึ่งประสบความสำเร็จมากสุดอันดับ 2 ของอังกฤษนั้น จะไม่อยู่ในบัญชีสนามที่ใช้ในการแข่งขัน ตามกฏของยูฟ่าแล้ว สนามที่ใช้จัดการแข่งขันทัวร์นาเมนต์นี้ต้องมีความยาว 105 เมตร และกว้าง 68 เมตร เป็นอย่างน้อย แต่ระยะความยาวระหว่าง แอนฟิลด์ โร้ด กับ ค็อป เอนด์ นั้น มีระยะเพียง 101 เมตร และไม่สามารถขยายให้ยาวกว่านี้ได้แล้ว ด้วยสาเหตุดังกล่าวทำให้ “หงส์แดง” ได้รับแจ้งจากสมาคมฟุตบอลอังกฤษแล้วว่า สนามของพวกเขาจะไม่ได้รับการพิจารณา นั่นทำให้ตอนนี้ เมืองลิเวอร์พูล ต้องไปฝากความหวังกับสนามแห่งใหม่ของเอฟเวอร์ตันที่ ท่าเรือแบรนมลี่ย์ มัวร์ ว่าจะเสร็จตามกำหนดในปี 2024 หรือไม่ ,negative
