,URL,Content_title,Contents,Sentiment
146,https://www.assist-football.com/2022/03/29/%e0%b8%99%e0%b8%b2%e0%b8%9a%e0%b8%b2%e0%b8%aa%e0%b8%a3%e0%b8%b1%e0%b8%9a%e0%b8%9c%e0%b8%b9%e0%b9%89%e0%b8%a5%e0%b8%b5%e0%b9%89%e0%b8%a0%e0%b8%b1%e0%b8%a2%e0%b8%81%e0%b8%a7%e0%b9%88%e0%b8%b230%e0%b8%84/,เอาไปสองนิ้วโป้ง! “นาบาส” รับผู้อพยพยูเครนกว่า 30 คน,เคย์เลอร์ นาบาส นายทวารมือกาว เปแอชช รับผู้ลี้ภัยจากสงครามยูเครนให้เข้าพักอาศัยที่บ้านตัวเอง ชาวยูเครนหลายล้านคนต้องอพยพลี้ภัยออกนอกประเทศหลังรัสเซีย ประกาศสงครามและเปิดปฏิบัติการทางการทหารเข้าไปโจมตีบุกบ้านเกิดของพวกเรา สำนักข่าวแดนสเปน SPORT เปิดเผยว่า นายด่านวัย 35 ปีของ เปแอชเช ได้ปรับแต่งบ้านเพื่อรับผู้ลี้ภัยจากยูเครนให้เข้าพักบ้านตนกว่า 30 รายคน อันเดรีย ซาลาส ภรรยาของ นาบาส ได้โพสต์ข้อความผ่านโซเชียลหลายภาษาว่า เราต้องการช่วยเหลือแม่และเด็กๆที่อพยพมาจากยูเครน ที่สามารถเดินทางมาได้มีเพียงแค่เสื้อผ้าที่สวมไส่มาเท่านั้นและไม่มีที่ไหนไปให้มาพักที่บ้านของเรา สำหรับผู้ลี้ภัยที่อยู่ภายใต้การดูแลของ นาบาส จะรับผ่านสมาคม คริสเตียน อีแวนเกลิสต์ ซึ่งมีสำนักงานใหญ่ที่ บาร์เซโลน่า คอยช่วยเหลือและจัดการทั้งหมด ทั้งนี้ ตอนนี้ เปแอชเช ไม่สามารถระบุได้เลยว่า นาบาส ประตูมือกาวของเขา รับผู้ลี้ภัย มากี่คนแล้ว เพราะตัวนักเองก็ไม่อยากเปิดเผยความมีน้ำใจของเรามากสักเท่าไหร่ ,positive
147,https://www.assist-football.com/2022/03/28/%e0%b9%80%e0%b8%97%e0%b8%99%e0%b8%ae%e0%b8%b2%e0%b8%81%e0%b8%a2%e0%b8%b1%e0%b8%87%e0%b9%80%e0%b8%95%e0%b9%87%e0%b8%87%e0%b8%ab%e0%b8%99%e0%b8%b6%e0%b9%88%e0%b8%87/,ซักทีเถอะ! สื่อเผย “เทน ฮาก” ยังเต็งหนึ่ง,"เอริค เทน ฮาก แคนดิเดตผู้จัดการทีมคนใหม่ของปีศาสแดง แมนเชสเตอร์ ยูไนเต็ด ยังคงเป็นตัวเลือกอันดับ 1 สัำหรับตำแหน่งกุนซือ ปีศาจแดง กำลังมองหาผู้จัดการทีมคนใหม่ที่จะเข้ามาคุมทัพแทน ราล์ฟ รังนิค ที่จะลาตำแหน่งหลังจบซีซั่นนี้ เทน ฮาก เพิ่งเข้าสัมภาษณ์งานกับ ยูไนเต็ด เมื่อสัปดาห์ที่ผ่านมา และเชื่อกันว่าเขาทำให้ทีมดังจากแดนผู้ดีประทับใจได้อย่างมากจากการพูดคุยกันครั้งนั้น ทว่า ยูไนเต็ด ยังไม่ได้ยื่นสัญญาให้กุนซือวัย 52 อย่างเป็นทางการ ขณะที่ผู้จัดการรายอื่นๆอย่าง เมาริซิโอ ปอเช็ตติโน่, ฆูเลน โลเปเตกี และ หลุยส์ เอ็นริเก้ ก็ยังคงถูกเชื่อมโยงกับตำแหน่งนายใหญ่ของถิ่น โอลด์ แทรฟฟอร์ด อย่างต่อเนื่อง ล่าสุดมีรายงานว่า เทน ฮาก ยังคงเป็นเป้าหมายหลักของ ยูไนเต็ด โดยบอร์ดบริหารสโมสรต้องการผู้จัดการที่จะเข้ามาเปลี่ยนแปลงสไตล์การเล่นของทีม และผลงานของกุนซือชาวดัตช์กับ อาแย็กซ์ อัมสเตอร์ดัม ก็ทำให้เขาขึ้นไปอยู่อันดับ 1 ในลิสต์ อย่างไรก็ดี รายงานระบุว่า ยูไนเต็ด ต้องการเจรจากับกุนซือรายอื่นๆดูก่อน แล้วค่อยตัดสินใจขั้นสุดท้ายว่าจะดึงใครมาคุมทัพในฤดูกาลหน้า เทน ฮาก พา อาแย็กซ์ คว้าแชมป์ลีก 2 สมัยและเคเอ็นวีบีคัพอีก 2 สมัย นับตั้งแต่เข้ามาคุมทัพเมื่อปี 2017 ขณะที่ปัจจุบันเขาพาทีมครองตำแหน่งจ่าฝูงเอเรดีวีซี่ โดยนำอันดับ 2 อยู่ 2 แต้ม ",neutral
148,https://www.assist-football.com/2022/03/29/%e0%b9%81%e0%b8%9a%e0%b8%a3%e0%b9%8c%e0%b8%99%e0%b8%b2%e0%b8%a3%e0%b9%8c%e0%b9%80%e0%b8%95%e0%b8%a3%e0%b8%b5%e0%b8%a2%e0%b8%a1%e0%b8%a2%e0%b9%89%e0%b8%b2%e0%b8%a2%e0%b8%9f%e0%b8%a3%e0%b8%b5/,รายที่2! ม้าลาย ตัดสินใจไม่ต่อสัญญา “แบร์นาร์”,ยูเวนตุส สโมสรยักษ์ใหญ่ตูริน ประกาศว่าจะไม่ต่อสัญญา แบร์นาร์เคสคี่ กองหน้าม้าลาย เตรียมย้ายฟรีพร้อม ดีบาล่า หลังจบฤดูกาลนี้ แข้งวัย 28 ปี ย้ายมาจาก ฟิออเรนติน่า ด้วยค่าตัวมูลค่า 40 ล้านยูโร ตั้งแต่ปี 2017 จนกลายเป็นนักเตะกำลังสำคัญให้กับสโมสรต้นสังกัด ม้าลาย ยูเวนตุส แต่ในขณะนี้ เขากำลังจะหมดสัญญาสโมสรแล้วและดูทีท่าว่าจะไม่มีการต่อสัญญาเกิดขึ้น ล่าสุดตามรายงานเปิดเผยว่า ม้าลาย ได้ตัดสินใจแล้วว่าจะไม่มีการต่อสัญญากับนักเตะถึงแม้ว่าจะมีการเจรจาก่อนแล้วก็ตาม โดยทางสโมสรไม่ได้มีนัดหมายเรียกเข้ามาคุยเรื่องการเจรจาต่อสัญญาอีกครั้ง แบร์นาร์ จะกาลยเป็นนักเตะรายที่ 2 ที่เตรียมจะย้ายออกจากถิ่น ตูริน แบบฟรีเอเยนต์ โดยก่อนหน้านี้ ก็มี เปาโล ดีบาล่า ที่พึ่งมีการยืนยันแล้วว่าไม่มีการต่อสัญญาเช่นเดียวกัน  ,positive
149,https://www.assist-football.com/2022/03/15/%e0%b9%80%e0%b8%9b%e0%b9%89%e0%b8%a2%e0%b8%b1%e0%b8%87%e0%b9%84%e0%b8%a1%e0%b9%88%e0%b8%94%e0%b9%88%e0%b8%a7%e0%b8%99%e0%b8%95%e0%b8%b1%e0%b8%94%e0%b8%aa%e0%b8%b4%e0%b8%99%e0%b9%83%e0%b8%88/,ช้าก่อน! “น้องเป้” ยังไม่รีบด่วนตัดสินใจย้ายซบราชัน,คิลิยัน เอ็มบัปเป้ กองหน้าหัวหอก เปแอสเช ยังคงไม่ด่วนตัดสินใจย้ายซบ ราชัน หลัง เปแอสเช พึ่งถูกเขี่ยตกรอบ 16 ทีมในศึกแชมเปี้ยนส์ลีก ดาวยิงเลือดน้ำหอมยังคงเหลือสัญญากับสโมสร ปารีส แซงต์-แชร์กแม็ง ไม่ถึง 6 เดือนเท่านั้น โดยมีข่าวลือหนาหูว่าเจ้าตัวอยากย้ายร่วมทีมกับ ราชันชุดขาว มากขึ้นเรื่อยๆ และมีโอกาสสูงที่มันจะเป็นไปได้ ช่วงสุดสัปดาห์ ที่ผ่านมา PSG พึ่งจะถูก เรอัลมาดริดเขี่ยตกรอบ เเชมเปี้ยนส์ลีกไป ทำให้การเซ็นสัญญาของ เอ็มบัปเป้ เป็นไปได้ยากขึ้น อย่างไรก็ดีสำนักข่าวอย่าง Le10sport ระบุว่า เอ็มบัปเป้ ยังต้องการเวลาเพื่อพิจารณาสัญญาเพิ่มเพื่อคิดในถี่ถ้วนในการตัดสินใจอนาคตของตัวเองในครั้งนี้ให้ดีเสียก่อน เอ็มบัปเป้ ยังคงเจรจากับต้นสังกัด เปเเอสเช อยู่เพื่อหวังให้ เป้ อยู่ช่วยทีมต่อในระยะยาว และไม่ต้องการที่จะเสียนักเตะรายนี้ออกไปจากทีมแบบไร้ค่าตัวในช่วงซัมเมอร์นี้ หัวหอกวัย 23 ยังคงทำผลงานได้ยอดเยี่ยมในซีซั่นนี้ ซัดไปแล้ว 26 ประตู กับอีก 17 แอสซิสต์ จากการลงเล่น 36 นัดทุกรายการ ,negative
150,https://www.assist-football.com/2022/03/15/%e0%b8%9e%e0%b8%b5%e0%b9%88%e0%b8%95%e0%b9%89%e0%b8%b2%e0%b9%80%e0%b8%ad%e0%b9%88%e0%b8%a2%e0%b8%8a%e0%b8%a1%e0%b8%9b%e0%b8%b2%e0%b8%a3%e0%b9%8c%e0%b9%80%e0%b8%95%e0%b8%a2%e0%b9%8c/,เอาเรื่อง! พี่ต้าเอ่ยชม “ปาร์เตย์”เล่นได้ยอดเยี่ยม,มิเกล อาร์เตต้า กุนซือใหญ่ อาร์เซน่อล กล่าวชมมิดฟิลด์คนสำคัญ ปาร์เตย์ ว่ายกระดับผลงานได้อย่างยอดเยี่ยม มาไกลมากนับตั้งแต่เซ็นสัญญาญา 2020 สตาร์ทีมชาติกาน่า โชว์ผลงานยอดเยี่ยมซัดประตูเอาชนะ เลสเตอร์ ซิตี้ได้ 2-0 เมื่อคืนวันอาทิตย์ที่ผ่านมาโดดเด่นจนคนพูดถึงเป็นจำนวนมาก ดาวเตะวัย 28 ปี ย้ายจาก แอต มาดริดมาร่วมทัพ อาร์เซน่อล ตั้งแต่ปี 2020 โชว์ผลงานได้ดีวันดีคืนจริงๆ นับตั้งแต่ย้ายเข้ามาร่วมทีมที่ เอมิเรตส์ สเตเดี้ยม “เขาเกือบทำประตูได้หลายต่อหลายครั้ง และเขาเองที่มีส่วนร่วมในประตูทั้งสอง ที่เอาชนะเลสเอตร์ ซิตี้ได้ อาร์เตต้า กล่าว” “คุณเองก็เห็นแล้วว่าเขาได้รับเลือกในการเป็นผู้เล่นยอดเยี่ยมในเดือนที่แล้วมานี่เอง เขามาไกลมากจิงๆ ฟอร์มคงเส้นคงว่า เขารู้ว่าต้องทำอะไรและเล่นยังไงให้มันดีขึ้น” “ผมมองว่าการที่ทำงานร่วมกันและทำความเข้าใจกับเพื่อนๆร่วมทีมอื่นๆกำลังดีขึ้นเรื่อยๆ และตอนนี้มันคือเรื่องของความสม่ำเสมอที่เขามีต่อทีมและผลงานของเขา” ,positive
151,https://www.assist-football.com/2022/04/30/%e0%b9%82%e0%b8%84%e0%b9%89%e0%b8%8a%e0%b9%80%e0%b8%97%e0%b8%81%e0%b8%b8%e0%b8%a1%e0%b8%b1%e0%b9%88%e0%b8%99%e0%b9%83%e0%b8%88%e0%b9%80%e0%b8%82%e0%b9%89%e0%b8%b2%e0%b8%a3%e0%b8%ad%e0%b8%9a/,เต็มที่! “โค้ชเทกุ” ประกาศพา บีจี เก็บชัยเหนือ ชุนนัม,มาโกโตะ เทกุระโมริ เฮดโค้ชทัพ บีจี ปทุม ยูไนเต็ด มีความมั่นใจเต็มที่หวังพา บีจี เข้ารอบเอเอฟซี แชมเปี้ยนส์ลีก 2022 เมื่อวันที่ 29 เมษายน 2565 ที่ห้องแถลงข่าวภายในสนามปทุมธานี สเตเดี้ยม ได้มีการแถลงข่าวก่อนการแข่งขันเอเอฟซี แชมเปี้ยนส์ลีก 2022 กลุ่ม จี นัดที่ 6 ระหว่าง บีจี ปทุม ยูไนเต็ด พบ ชุนนัม ดรากอนส์ โดย “เดอะ แรบบิท” มี มาโกโตะ เทกุระโมริ หัวหน้าผู้ฝึกสอน พร้อมด้วย ฉัตรมงคล ทองคีรี ผู้เล่นของทีมเข้าร่วมในการแถลงข่าว ขณะที่ทาง ชุนนัม มี จอน คยอง จุน หัวหน้าผู้ฝึกสอนพร้อมด้วย ปาร์ค อิน ฮยอก ผู้เล่นของทีมเข้าร่วมในการแถลงข่าว โค้ชเทกุ กล่าวถึงเกมที่จะพบกับ ชุนนัม ดรากอนส์ ว่า “เกมในวันพรุ่งนี้จะเป็นเกมสุดท้ายในรอบแบ่งกลุ่ม แน่นอนว่าเราต้องการที่จะกำหนดชะตาตัวเองในการเข้ารอบ เราต้องชนะเพื่อจบอันดับหนึ่งของกลุ่มให้ได้ ก่อนเกมเราได้วิเคราะห์และคำนวณสถานการณ์ของแต่ละกลุ่มแล้ว แต่ยังคาดการณ์อะไรไม่ได้ เพราะยังต้องตัดคะแนนทีมอันดับสุดท้ายของแต่ละกลุ่ม ดังนั้นเราต้องชนะเพื่อจบอันดับหนึ่งของกลุ่ม เกมที่แล้วเรามีโอกาสที่จะชนะได้แต่สุดท้ายเราไม่เฉียบคมพอ ซึ่งเกมนี้ผมหวังว่าเราจะแก้ไขตรงจุดนี้ให้ดีกว่าเดิม” “แม้ว่าการเจอกันนัดแรกกับ ชุนนัมฯ เราจะชนะพวกเขามาได้ แต่เกมนี้มันน่าจะยากกว่าเดิม เพราะพวกเขาเองก็ยังมีลุ้นเข้ารอบ และเมื่อดูจากฟอร์มการเล่นของเขาที่ผ่านมาก็ถือว่าดีขึ้นกว่าเดิม ดังนั้นเราเองก็จะประมาทไม่ได้ ซึ่งเราเองก็ทำการบ้านมาเป็นอย่างดีสำหรับเกมนี้ และผมเชื่อมั่นว่าเราจะมีผลการแข่งขันที่ดีในวันพรุ่งนี้” ด้าน ฉัตรมงคล ทองคีรี กล่าวถึงเกมนี้ว่า “ตอนนี้ผู้เล่นทุกคนมีความพร้อมมากสำหรับเกมนี้ เราศึกษาคู่แข่งมาเป็นอย่างดี ปีที่แล้วเรามีประสบการณ์ในการเจอทีมจากเกาหลีใต้ทั้งในรอบแบ่งกลุ่มและรอบ 16 ทีม แน่นอนว่าเราพัฒนาจากปีที่แล้วและได้ศึกษาการเล่นของทีมจากเกาหลีใต้มาพอสมควร แต่เกมในวันพรุ่งนี้คงไม่ใช่งานง่ายเหมือนนัดแรกที่เราเจอกัน เพราะมันเป็นเกมสุดท้ายและเขาเองก็ยังมีโอกาสในการเข้ารอบดังนั้นเขาน่าจะสู้เต็มที่แน่นอน แต่เราเองก็ศึกษาเขามาเป็นอย่างดี และพร้อมสำหรับเกมในวันพรุ่งนี้ครับ” “ผมรู้สึกภูมิใจที่ได้เป็นตัวแทนสโมสรจากประเทศไทยลงเล่นในรายการนี้ และสามารถทำผลงานได้ดี พวกเรามุ่งมั่นและพยายามอย่างเต็มที่ในการแข่งขันครั้งนี้ ซึ่งผลลัพธ์ที่ผ่านมาเป็นเรื่องที่น่าภูมิใจมาก ส่วนตัวผมเองก็ดีใจที่ได้มีส่วนร่วมในรายการนี้ และหวังว่าจะพัฒนาฟอร์มการเล่นของตัวเองจากเกมระดับเอเชีย” ด้าน จอน คยอง จุน เฮดโค้ชชุนนัม ดรากอนส์ กล่าวถึงเกมที่จะพบกับ บีจี ปทุมฯ ว่า “แม้ว่าที่ผ่านมาผลการแข่งขันจะไม่เป็นไปตามที่เราคาดไว้ แต่ฟุตบอลก็มีแพ้มีชนะมีเสมอเป็นเรื่องธรรมดาของฟุตบอล และแม้ว่าเราจะแพ้ บีจี ปทุมฯ มาในเกมที่แล้ว แต่สิ่งที่เราต้องทำตอนนี้คือทำให้ดีที่สุดสำหรับเรา จริงอยู่ที่เรายังมีโอกาสในการเข้ารอบหากชนะได้ในวันพรุ่งนี้ แต่นั่นไม่ใช่สิ่งที่เราโฟกัสสำหรับเกมนี้ เราหวังว่าจะทำผลงานออกมาให้ดีที่สุดและไม่อยากคำนึงถึงโอกาสในการเข้ารอบ เพราะมันอาจจะกดดันเราได้ซึ่งผมหวังว่าเราจะมีผลงานที่ดีในวันพรุ่งนี้” สำหรับโปรแกรมการแข่งขันเอเอฟซี แชมเปี้ยนส์ลีก 2022 กลุ่ม จี นัดที่ 6 จะลงสนามในวันเสาร์ที่ 30 เมษายน 2565 คู่แรก บีจี ปทุม ยูไนเต็ด (ไทย) พบ ชุนนัม ดรากอนส์ (เกาหลีใต้) เวลา 18.00 น. คู่ที่ 2 ยูไนเต็ด ซิตี้ (ฟิลิปปินส์) พบ เมลเบิร์น ซิตี้ (ออสเตรเลีย) เวลา 21.00 น. โดยทั้งสองคู่แข่งขันที่สนามปทุมธานี สเตเดี้ยม ถ่ายทอดสดผ่านทาง ELEVEN SPORTS สำหรับ บีจี ปทุม ยูไนเต็ด ปัจจุบันรั้งอันดับ 1 กลุ่ม จี มี 11 คะแนน ด้วยผลงานชนะ 3 เสมอ 2 จากการลงสนาม 5 นัด โดยหากเกมนี้ทัพ “เดอะ แรบบิท” สามารถเอาชนะหรืออย่างน้อยเสมอกับ ชุนนัม ดรากอนส์ ได้ก็จะการันตีการเป็นอันดับหนึ่งของกลุ่มพร้อมผ่านเข้าสู่รอบต่อไปทันที ,neutral
