,URL,Content_title,Contents,Sentiment
8,https://www.sportbible.com/football/manchester-city-star-riyad-mahrez-makes-twitter-plea-to-elon-musk-20220502,Manchester City Star Riyad Mahrez Makes Twitter Plea To Elon Musk,"Manchester City winger Riyad Mahrez has called on Elon Musk to restore his blue tick on Twitter after it mysteriously disappeared. Mahrez, 31, boasts more than three million followers on Twitter but has lost his blue tick, which informs users if the owner of an account has been properly verified. Following the news of Musk's expected takeover of Twitter, Mahrez has appealed to the billionaire to restore the feature on his account. Loadingâ¦ ""Bro @elonmusk give me my blue tick back,"" tweeted Mahrez, followed by three crying-laughing emojis. Fans of rival clubs have used Mahrez's request to mock Manchester City. ""Same blue ticks as UCLs,"" wrote one user. Another added: ""Just imagine he says he won't give you back till you fill your stadium."" Bro @elonmusk give me my blue tick back ððð Musk, the world's richest person with an estimated net worth of $273.6bn (Â£218.8bn), made his shock takeover bid earlier this month. Twitter's board has agreed to his $44bn (Â£34.5bn) takeover offer, with shareholders now set to vote on the proposed deal. Musk has vowed to unlock the ""tremendous potential"" of the company if his takeover is approved. ""Free speech is the bedrock of a functioning democracy, and Twitter is the digital town square where matters vital to the future of humanity are debated,"" Musk said in a statement announcing the deal. Or what?ð­ are you gonna do step overs on himð­ð­ Just imagine he says he won't give you back till you fill your stadium ðð Who first went to confirm if itâs the original Mahrez? He doesnât give blue ticks to finished players. ""I also want to make Twitter better than ever by enhancing the product with new features, making the algorithms open source to increase trust, defeating the spam bots, and authenticating all humans,"" he added. ""Twitter has tremendous potential - I look forward to working with the company and the community of users to unlock it."" It remains to be seen whether Musk's expected takeover will result in Mahrez getting his blue tick back. ",positive
9,https://www.sportbible.com/football/uefa-announce-further-sanctions-against-russia-20220502,"Russian Clubs Banned From Competing In Europe Next Season, Russia Prevented From Bidding For Euro 2028","Russia has been banned from bidding to host Euro 2028 as part of a fresh round of sanctions taken by UEFA in relation to the country's suspension from European football. UEFA suspended Russia's national teams and club sides from competing in its competitions earlier this season following the invasion of Ukraine. European football's governing body has now confirmed that the measures have been extended to next season. Russian clubs will be banned from competing in the men's and women's Champions League, Europa League and UEFA Conference League in the 2022-23 campaign. The country's national sides also remain suspended, with Portugal set to replace Russia in the women's Euros in England this summer. The women's team will no longer compete in European qualification for the 2023 World Cup, while the men's team - who were kicked out of the European play-offs for the 2022 World Cup in Qatar - will also be prevented from competing in next season's Nations League. Russia has also been banned from bidding to host the men's European championship in 2028 and 2032. The UEFA Executive Committee has today declared the bid submitted by the Football Union of Russia to host UEFA EURO 2028 or UEFA EURO 2032 as ineligible.This is one of several decisions relating to the on-going suspension of Russian teams and clubs from UEFA competitions. Russia had previously declared an interest in rivalling the UK and Ireland for the right to host Euro 2028, with Turkey also signalling an interest in hosting the tournament. Russia had also expressed an interest in hosting Euro 2032, as have Turkey and Italy. ""The UEFA Executive Committee has today declared the bid submitted by the Football Union of Russia to host UEFA EURO 2028 or UEFA EURO 2032 as ineligible,"" read a statement released by UEFA on Twitter. ""This is one of several decisions relating to the on-going suspension of Russian teams and clubs from UEFA competitions."" The decision to ban Russian clubs from European competition next season is set to benefit Scottish football, with the winner of the Scottish Premiership now set to automatically qualify for the group stage of the Champions League. Celtic are currently top of the table and will be crowned champions if they claim four points from their final three league games. Earlier this season, Russia lost the right to host the Champions League final. The Gazprom Arena in St Petersburg was due to host the event on May 28 before it was moved to the Stade de France in Paris following the invasion of Ukraine. Loadingâ¦ ",positive
10,https://www.sportbible.com/football/of-everton-burnley-and-leeds-leeds-are-the-more-deserving-to-stay-up-20220502,"'Of Everton, Burnley And Leeds United, Leeds Are The More DESERVING To Stay Up'","Leeds United have been called the 'more deserving' team to stay in the Premier League ahead of relegation rivals Everton and Burnley. Loadingâ¦ The race to escape the drop took another twist on Sunday afternoon with Everton's 1-0 victory over Chelsea. Frank Lampard's side are still in the bottom three, but now one point behind Burnley and Leeds with a game in hand. Norwich City are already down and Watford's chances of survival are nigh on impossible, meaning it'll be one of Everton, Leeds or Burnley to join them in the Championship. TalkSPORT trio Simon Jordan, Jim White and Danny Murphy all want Leeds to stay up over the other two. âªï¸ ð¦ð¶ðºð¼ð»: âI donât want Leeds [to go down] . Theyâre a huge club that I admire.âð ðð®ð»ð»ð: âI donât want it to be Leeds.âð ð¦ð¶ðºð¼ð»: âOf the three, Leeds are the more deserving to stay up.âSimon Jordan and Danny Murphy admit they want #LUFC to stay in the PL. pic.twitter.com/mMrLYuk0ij Jordan said: ""I genuinely don't know [who else goes down]. I would've said Burnley were dead and dusted. I do think at this moment in time, as much as it pains me, the bottle is spinning to Leeds."" White agreed which saw Jordan state: ""For me again, I don't want it to be Leeds because Leeds are a huge club that I admire. If you're looking at these teams saying 'who do you want to stay up?', I know who I want to stay up. Who would you want to stay up out of these three?"" Murphy and White both eventually agreed they'd rather see Leeds stay up and Burnley go down, with Murphy adding why. The former Premier League midfielder explained: ""My memories of playing in big stadiums with great supporters, Leeds games were much bigger for me than Burnley."" Jordan then followed up with: ""I think Leeds are probably, with the way they've come into the Premier League and with the injuries they've had this season, I think they are the more deserving of those three to stay up."" Leeds sacked Marcelo Bielsa in February and hired Jesse Marsch, who did manage to go five games unbeaten. A draw to Crystal Palace on Monday and 4-0 hammering at the hands of Manchester City has seen them dragged back into it, with Burnley now the form team of the trio. The Clarets parted company with long-time boss Sean Dyche last month and placed caretaker Mike Jackson in charge. Since then they've taken ten points from 12 games and scored six goals. Everton, meanwhile, are one of six Premier League teams to never go down and will be hoping to stay up after a disastrous campaign. Who do you think will be relegated from the Premier League? Let us know in the comments. ",negative
11,https://www.sportbible.com/football/jesse-lingard-wanted-by-two-major-european-clubs-20220502,TWO Major European Clubs 'Leading The Chase' To Sign Jesse Lingard On A Free Transfer,"âJesse Lingard is wanted by TWO major European clubs ahead of his summer exit from Manchester United. Lingard is out of contract at the end of the season and will say his goodbyes to the Old Trafford faithful tonight against Brentford. He's played a bit-part rolethis campaign, making just 22 appearances in all competitions following a blistering loanspell at West Ham United last season. âHe's expected to call time on his Man United career this summer, bringing an end to his 20-year association with the club. As for his next team, Italian giants AC Milan and Juventus are 'leading the chase' to land Lingard on a free transfer. That's according toESPNwho claim both Serie A outfits have registered their interest in signing the England midfielder ahead of the 2022/23 term. However, they face competition from clubs in the Premier League, with Newcastle United thought to be keen on snapping up the 29-year-old. If Lingard decides to leave England for Italy, then he'll join the likes ofFikayo Tomoriâand Tammy Abraham who both left Chelsea forMilan and AS Roma respectively. Lingard is eyeing a move away from Man United in a bid to secure regular first team football. He also harbours ambitions of playing for Englandahead of the World Cup in Qatar. Lingard graduated from Man United's famed youth academy and made his competitive debut for the club in 2014. âHe's since compiled over 200 appearances, scoring 35 goals. During his time at Man United, he's won the FA Cup, EFL Cup and Europa League. ",
12,https://www.sportbible.com/football/luton-fans-mock-disgraced-conservative-mp-neil-parish-over-porn-20220502,'We Can See You Watching Porn!': Luton Fans Mock Disgraced Conservative MP Neil Parish Outside Westminster,"Luton Town fans have mocked disgraced Conservative MP Neil Parish after he admitted to watching porn twice while in Parliament. Loadingâ¦ Last week, two female colleagues claimed they had seen Parish watching porn on his phone while sitting near them in Parliament. The 65-year-old, who has represented the constituency of Tiverton and Honiton in Devon since 2010, claimed that the first incident was accidental after he had visited a tractor website. But he admitted that the second incident, which occurred in the House of Commons, was deliberate. ""The situation was that funnily enough, it was tractors I was looking at,"" Parish told the BBC. ""I did get into another website that had a very similar name and I watched it for a bit, which I shouldn't have done. ""But my crime - biggest crime - is that on another occasion I went in a second time."" Parish was suspended by the Conservative party on Friday and has now announced his intention to resign from his role as an MP, triggering an upcoming by-election in his constituency. On Monday, a group of Luton Town supporters mocked Parish while travelling to their final away game of the Championship season against Fulham. The group hired a boat to travel down the Thames to Craven Cottage and when it passed the Houses of Parliament, the fans struck up the chant: ""We can see you watching porn!"" While Fulham have already secured promotion, Luton could yet join them in the Premier League next season. The Hatters are fifth in the table ahead of their trip to Craven Cottage and can secure their place in the play-offs with two points from their final two games against Fulham and Reading. Luton are currently level on points with sixth-place Sheffield United, who have played a game more â with Middlesbrough two points further back in seventh. ",negative
13,https://www.sportbible.com/football/roma-boss-jose-mourinho-accused-of-being-obsessed-by-rivals-lazio-20220502,Roma Boss Jose Mourinho Accused Of Being 'Obsessed' By Rivals Lazio In Remarkable Club Statement,"Roma head coach Jose Mourinho has been accused of being ""obsessive"" and showing a ""lack of respect"" in remarkable club statement released by Lazio. Speaking after Sunday's goalless draw with Bologna which ended Roma's hopes of qualifying for the Champions League, Mourinho expressed his frustrations and referenced Lazio's dramatic 4-3 win over Spezia on Saturday, in which Francesco Acerbi's winning goal may have been scored from an offside position. ""Another thing that never changes is that 22 years ago, you could win a match with a goal that is offside and you can still do it today,"" said Mourinho. Loadingâ¦ ""Yesterday, a team won a match with a goal that was offside."" Lazio have now released a strongly-worded statement on their website in response to Mourinho's comments â hitting back at the Portuguese manager without directly naming him. ""The fact that in 2022, an opposing coach repeatedly mentions other clubs and presumed referee errors and that, at the same time, journalists of proven football faith get worked up about the same matter, forgetting about their professional role and impartiality, proves two things,"" read the statement. ""That Lazio is obsessively in their thoughts, more than other ambitious targets and that, as it usually happens, they look at someone else's home to divert attention from failings or incredible incidents, in their favour, that occurred under everyone's noses. ""Despite the necessity to evolve the image of Italian football, some protagonists are stuck to accusing VAR and referees and too many times, lack of respect towards officials and lack of journalistic objectivity aren't enough considered ""Lazio can't accept criticism and institutions and believe that values are proven on the pitch, not on TV. Lazio will never be the excuse for somebody else or a scapegoat and will take action in the appropriate forums. ð Nota della SocietÃâ¡ï¸ https://t.co/3TH1TxxQlV pic.twitter.com/HjNUq8h0Ph ""The club continue to avoid comments on decisions taken on the pitch, even when incidents against us occur. ""That's the case of Sandro Tonali's foul on Francesco Acerbi in Lazio vs Milan or Roger Ibanez's elbow on Sergej Milinkovic-Savic in the return leg derby, just to name two. ""Decisive episodes which we didn't comment on, out of respect for referees and VAR, respect that others don't have."" Lazio and Roma are now level on 59 points in the Serie A table, with three games remaining in the season. Lazio are currently fifth, ahead of Roma on goal difference, with Fiorentina three points behind the two Rome clubs. Loadingâ¦ ",positive
14,https://www.sportbible.com/football/insane-manuel-neuer-compilation-proves-hes-already-a-football-icon-20220502,'The Art Of Goalkeeping' - Insane Manuel Neuer Compilation Proves He's Already A Football Icon,"An incredible Manuel Neuer compilation titled 'The Art Of Goalkeeping' has gone viral and it puts his legendary career into perspective. Loadingâ¦ The Bayern Munich captain helped his side wrap up their tenth consecutive Bundesliga title last month to take his personal trophy haul to a remarkable 27. Neuer helped redefine what it means to be a goalkeeper in the 2010s, regularly showing his complete lack of respect for the sacred goal-line. At any opportunity, the Germany international would be out and about in the Bayern defence for a touch of the ball. His distribution was unmatched for years and he's still got a wicked kick and throw. Manuel Neuer - The art of Goalkeeping pic.twitter.com/XzCcBJVjCf The 36-year-old has a nerve like no other and is partial to a Cruyff turn in his own area at least once per half... That might be slightly overboard. We'll settle at once per game. What good is a goalkeeper who can't save shots though? Between the sticks Neuer is an absolute phenomenon too. Over the years he's gone one on one with Robert Lewandowski, Lionel Messi and Pierre-Emerick Aubameyang and others only to come out on top. He also saved a Cristiano Ronaldo penalty in a Champions League semi-final shootout back in 2012. Not many can say they've denied Mr. Champions League in his competition. Fans have had their say and they think Neuer deserves to go down as perhaps the greatest goalkeeper in football history. One commented: ""I needed this today, what a comp sir. The greatest."" Another said: ""Easily the best goalkeeper I've ever seen. Complete package."" A third put: ""Best player after Messi and Ronaldo this generation. I donât wanna hear Neymar, Luis Suarez, Sergio Ramos. You simply cannot be the GOAT keeper and be below them."" While someone tweeted: ""The blueprint for modern goalkeepers. Far ahead of his time."" All in all Neuer has won ten Bundesligas, five DFB-Pokals, six DFL-Supercups, two Champions Leagues, two Super Cups and two Club World Cups in addition to the 2014 World Cup. Get all that? He very nearly ended up playing a game in midfield for Bayern as well. Pep Guardiolagenuinely considered the idea during his time as manager according to former CEO Karl-Heinz Rummenigge. ""Manuel invented the art of being a footballer as a goalkeeper and revolutionised this position,"" Rummenigge told51, the club's official magazine. ""I still remember how Pep Guardiola, after winning a championship, seriously came up with the idea of ââputting him in midfield for a game."" There's no denying Neuer is closer to the end of his career than the beginning. Ederson and Alisson Becker have taken up the mantle as the next generation's go-to 'sweeper keeper'. It's always worth remembering there was one before, who paved the way. And he's got a lot left in the tank. ",positive
15,https://www.sportbible.com/football/punter-wins-a-whopping-157866-from-60p-sixteenteam-accumulator-20220502,"Punter Wins A Whopping Â£157,866 From 60p SIXTEEN-TEAM Accumulator After 92nd Minute Winner","âOne lucky punter won a whopping Â£157,866 after placing a 60p bet on a SIXTEEN-team accumulator.â The bettor correctly predicted the outcome of every Premier League and Championship fixture on Saturday, resulting in a huge pay-out. From the 16 matches, there was just ONE draw with Cardiff and Birmingham City sharing the points in Wales - which the gambler predicted. The bet remarkably came in after Wilfried Zaha scored a last-gasp winner for Crystal Palace against Southampton. The punter justneeded Manchester City to win at Elland Road in the late kick-off to cash in and Pep Guardiola's team didn't disappoint as they ran out 4-0 winners. The gambler also had Liverpool, Aston Villa, Burnley and Brighton to thank after they all won their respective Premier League matches. The customer's bet also included Championshipvictories forPreston, Bournemouth, Derby, Bristol City, Huddersfield, Middlesbrough, Cardiff, Millwall, Nottingham Forest and West Brom. Betting slip: Liverpool to beat Newcastle - 2/5 Aston Villa to beat Norwich - 4/11 Crystal Palace to beat Southampton - 2/1 Burnley to beat Watford - 17/10 Brighton to beat Wolves - 9/5 Manchester City to beat Leeds - 2/7 Preston to beat Barnsley - 6/5 Bournemouth to beat Blackburn - 7/5 Derby to beat Blackpool - 16/5 Bristol City to beat Hull - 6/5 Huddersfield to beat Coventry - 2/1 Middlesbrough to beat Stoke - 4/5 Cardiff vs. Birmingham to finish a draw - 9/4 Millwall to beat Peterborough - 1/2 Nottingham Forest to beat Swansea - 8/15 West Brom to beat Reading - 7/5 âTotal stake:â60p âODDS:â263,109/1 âTotal returns:âÂ£157,865.59ââ Ladbrokes PR manager Alex Apati said of the 16-team accumulator viaThe Sun: ""Our punter has played an absolute blinder here, correctly predicting the outcome of all 16 games in the top two tiers of English football on Saturday. ""What makes the acca even more impressive is that there was just one draw across all sixteen games, and our customer managed to pick it out; truly remarkable stuff and we're delighted for them."" ",
16,https://www.sportbible.com/football/peter-crouch-cant-choose-between-phil-foden-and-mohamed-salah-20220502,"""I Can't Yet Choose Between Phil Foden And Mohamed Salah For Player Of The Year""","Peter Crouch can't choose between Manchester City youngster Phil Foden or Liverpool superstar Mohamed Salah for Player of the Year. Loadingâ¦ The duo have played key roles for their sides this campaign and they're currently locked in an intense Premier League title race, as well as through to the Champions League semi-finals. Foden rotates with a number of elite forwards in the City frontline and has eight league goals, while Salah is Liverpool's talisman and currently leads the Golden Boot race with 22 goals in the league. Crouch thinks Foden should win the award over Salah and teammate Kevin De Bruyne if City end the season as Premier League and Champions League winners. He wrote in his Daily Mail column: ""This year, if Manchester City win the Premier League and Champions League, you would have to pick Phil Foden or Kevin De Bruyne. Iâd potentially go for Foden because he has consistently been a shining light for them. ""There are plenty of others you could choose and the same goes for Liverpool. ""The performances of Virgil van Dijk have been an absolute joke. Sadio Mane as well, coming back from winning the Africa Cup of Nations with Senegal and picking up where he left off. He has to be in the conversation. ""I do seem to be skirting around the fact that Mo Salah â already crowned FWA Footballer of the Year â has the most goals and assists this season. ""Clearly he has to be in there, given how electric he has been throughout the campaign, even allowing for him going off the boil slightly in recent weeks."" Salah's goal tally has decreased in 2022 but he's still one of Jurgen Klopp's most consistent performers. The Reds still have a historic quadruple in their sights and Crouch concluded if City and Liverpool share the spoils, it has to be Salah. He continued: ""Those five names are my list and it has to be one of them. If the two clubs trade trophies, Salah pips the others in my view for his sheer weight of goal contributions."" Liverpool ran out 1-0 winners over Newcastle United on Saturday afternoon to temporarily go top of the league. Pep Guardiola's men responded by thrashing Leeds United 4-0 later in the day to return to the summit. Both teams have four games left and know any slip-up will be costly. They'll resume their league campaigns next weekend, with the second leg of their respective Champions League semi-finals coming up. City are set for a blockbuster encounter at the Santiago Bernabeu on Tuesday after beating Real Madrid 4-3, while Liverpool take a 2-0 lead to Villarreal on Wednesday. ",positive
17,https://www.sportbible.com/football/robin-van-persie-once-got-a-three-game-ban-for-celebrating-a-goal-20220502,Robin Van Persie Once Got A Three Game Ban For Celebrating A Goal,"Robin van Persie was once banned for three games during his time at Fenerbahce, after tormenting former Arsenal teammate Oguzhan Ozyakup. Loadingâ¦ Goal celebrations aren't always as happy as they could be, which Richarlison could potentially find out in the wake of throwing a flare back towards the crowd. In 2017, Van Persie was involved in a very angry goal celebration, after scoring in an Istanbul derby during a very heated Turkish Cup game. The Dutchman and Ozyakup had been mates when the pair were at Arsenal at the same time, though the Turkish international only ever played twice for the Gunners. However when the pair met in Turkey things went downhill quickly, with them exchanging words during the game after Ozyakup's teammate Dusko Tosic was sent off for pushing Van Persie. DÃ¼nkÃ¼ Ã§ocuk gelmiÅ idolÃ¼m dediÄi adama dikleniyor ! Robin Van Persie AdamÄ±n aklÄ±nÄ± alÄ±r akÄ±llÄ± ol @Ozyakup #fenerinmaÃ§Ä±var pic.twitter.com/LfIm4iE7rM In the second half, the former Manchester United striker would score what would turn out to be the winner and, taking some notes from former Gunners' teammate Emmanuel Adebayor, the goalscorer did a knee slide right in front of his opponent. Robin van Persie made something similar move in @Fenerbahce - @Besiktas derby against Oguzhan Ozyakup who was playing for Arsenalâs young team when RVP was also playwr of @Arsenal ð Dutch players are interesting ð pic.twitter.com/RXj6CVjRzM ROBIN THE KING VAN PERSIE pic.twitter.com/8sVJ6i6uXr The celebration landed Van Persie a three game ban, although he wasn't reprimanded or shown a red card by the referee at the time of the match. Whilst it got him three days off, it also temporarily ended the striker's friendship with Ozyakup, with the midfielder admitting he'd lost respect for his former teammate. ""I was very good friends with a certain player on the field. That changed today,"" he said after the game. âSometimes you see the real face of a footballer on the field.â Whilst the Besiktas man admitted later in that year that they still weren't talking, adding, ""I do not think I was in the wrong, if anything I was wrong to show Robin as much respect as I did,"" thing eventually got better. The two men eventually reunited in 2020 after Van Persie had moved back to Feyenoord, his first club, Ozyakup joined the team on loan, whilst his former teammate, turned enemy, was on the coaching staff. ",negative
