,URL,Content_title,Contents,Sentiment
18,https://www.sportbible.com/football/six-years-ago-today-jamie-vardy-hosted-leicesters-title-winning-party-20220502,Six Years Ago Today Jamie Vardy Hosted The Ultimate Title Winning Party,"On this day in 2016, Leicester City players gathered at Jamie Vardy's house to see if they would complete an incredible Premier League title race. Loadingâ¦ Six years ago, Leicester were on the verge of the most incredible league winning campaign in the history of the Premier League's history. Having narrowly avoided relegation the previous season, the club had appointed Claudio Ranieri in the summer and the team went on an incredible run to make the impossible suddenly seem possible. On May 2nd title chasers Tottenham Hotspur, themselves trying to win a first league title since 1961, travelled to champions Chelsea in a must win game. The Blues were having a dreadful season but knew that stopping London rivals Spurs picking up all three points would result in Leicester being crowned champions. Whilst things were about to heat up in London, the Foxes' players gathered at Vardy's house to watch the game, as life imitated art, with the fan's ""Jamie Vardy's having a party"" chant came to life. The game at Stamford Bridge would become to be known as the 'Battle of the Bridge,' but it started in relatively basic circumstances for that campaign. Harry Kane scored his 25th goal of the league season, and when Son Heung-min doubled the lead before half time it looked like the champagne would have to be put on ice, as Spurs eyed their first win away to the Blues since 1990. A challenge by Danny Rose on Willian sparked angry scenes, with Mauricio Pochettino entering the pitch to split the two men, before Moussa Dembele gouged Diego Costa's eyes in the melee. Spurs were lucky Rose wasn't sent off for the challenge but then at half time momentum shifted as Eden Hazard was brought on as a substitute. Chelsea got on top with the introduction of the Belgian, despite his poor season to that date, but it was Gary Cahill who scored their first goal. Hazard grabbed the equaliser with seven minutes to go and things got uglier with challenges flying in from the visitors, inspired by the Chelsea players who had said they wanted to get one over their rivals and help Leicester, in the build up to the match. When the full time whistle blew it ended Spurs' slim hopes of winning the league and sparked incredible scenes at Vardy's house party. This will never ever grow old ð¬#OnThisDay in 2016, the Foxes squad assembled.You know what happened next... ð¦ ð ð pic.twitter.com/KNv1V1hkvK Ranieri's side then faced Everton five days later at the King Power Stadium, where the fans were able to join their heroes in celebrating the title. Before kick off the players and the manager were serenaded by Andrea Bocelli singing Nessun Dorma, before they went on to beat the Toffees 3-1. Andrea #Bocelli serenading Claudio #Ranieri & #Leicester City is the most powerful thing you'll see all year. pic.twitter.com/Xv0fFl6yAW They finished off the season with a 1-1 draw against Chelsea to finish on 81 points and ended up winning the title by 10 points, showing the gap between them and the rest. It wasn't Spurs who they beat however, with Pochettino's side losing 5-1 to relegated Newcastle United on the final day and slipping behind Arsenal into third. Though it was the Battle of the Bridge that ended up giving Leicester their incredible title, that night it was all about the scenes at the Vardy residence. Easily the greatest party in Premier League history, fitting for arguably the greatest title win in the era! ",positive
19,https://www.sportbible.com/football/fourfourtwo-predicted-what-david-beckham-would-look-like-by-2020-20220502,"In 1998, FourFourTwo Predicted What David Beckham Would Look Like By 2020","David Beckham is a bit of a catch, isn't he? Loadingâ¦ The former Manchester United and Real Madrid midfielder was voted 'The Sexiest Man Alive' by People Magazine in 2015 because, well, just look at the bloke. For decades, Beckham has successfully won the hearts of a global audience, not only for his talent on the football pitch, but for his good-natured, humble attitude off it. I mean, this was his response to being named 'The Sexiest Man Alive' by People Magazine in 2015. ""I never feel that I'm an attractive, sexy person. ""I mean I like to wear nice clothes and nice suits and look and feel good, but I don't ever think of myself that way."" But Becks' striking good looks, and his teeth for that matter, were supposed to deteriorate over time, according to an incredible snippet from a 1998 edition of FourFourTwo magazine. While at a Car Boot sale, Twitter userIan Walkerstumbled across some old mags. And as he was browsing through, a certain page predicting what David would look like in 2020 pique his interest. Going through some old â¦@FourFourTwoâ© mags from 1998 at the #carboot. This is how they imagined David Beckham would look in 2020 pic.twitter.com/uvOZYHTRa6 How Four Four Two magazine predicted David Beckham would look in 2020 compared to how he looks today. Must be a slippery slope from here. pic.twitter.com/d7Xn2LDaOS Now a couple of years on from the mess that 2020 ended up being, it's fair to say the above prediction was not correct by any stretch of the imagination. The former England captain now owns MLS franchise Inter Miami and remains involved in football. Last week, he sent praise to Southampton midfielder James Ward-Prowse who moved closer to his Premier League free-kick record. Beckham, a man of many styles over the years, still looks suave as ever at the ripe old age of 47 and we don't see that changing anytime soon. ",positive
20,https://www.sportbible.com/football/declan-rice-lost-it-with-eddie-nketiah-in-west-ham-12-arsenal-20220502,Declan Rice Completely Lost It With Eddie Nketiah And It's A Side Of Him You Never See,"Declan Rice lost it while squaring up to Eddie Nketiah during West Ham United's 2-1 defeat to Arsenal and had to be held back by Ryan Fredericks. Loadingâ¦ The Gunners went back into fourth on Sunday evening thanks to goals from Rob Holding and Gabriel. West Ham were hoping for a positive result so they'd have momentum heading into Thursday's Europa League semi-final second leg clash with Eintracht Frankfurt, with the score currently 2-1 to the Bundesliga side. It didn't happen however and late on, the usually calm and composed Rice got in Nketiah's face. Rice saying who tf are you to a guy heâs known since he was 9ð¤£ pic.twitter.com/49qDkWOKwl Nketiah had just been booked for a minor scuffle with Aaron Cresswell and after that died down, Rice decided to get in the face of his fellow Chelsea academy alumni. Fredericks came over to calm the 23-year-old down but he wouldn't let it go and continued to hassle Nketiah before Martin Odegaard intervened. Fans reacted to the incident and they aren't entirely sure what went on. One commented: ""It's very rare Dec loses his s**t like this but you can see why he did today."" Another said: ""Tbh I like his frustration. Would kill for Rice in our midfield."" A third put: ""Proud of Nketiah stood up hands down to show no intention of fighting."" While someone tweeted: ""Iâm not quite sure why Rice wasnât given a yellow for this!?!"" Arsenal took the lead through Holding, who was a late addition to the team after Ben White's withdrawal through injury. Jarrod Bowen equalised for David Moyes' side just before halftime with his 10th goal of the season. Shortly after the break, Gabriel joined centre back partner Holding on the scoresheet with a header of his own. Mikel Arteta's side held on and leapfrogged Tottenham Hotspur in the table with four games remaining. The Spaniard was delighted with his side's 'ugly' performance and thinks it'll help them qualify for next season's Champions League. ""Itâs a massive win, under very difficult circumstances because we put ourselves in real problems, especially with our decision making and in ball possessions, and the spaces we were attacking, and the timing of it and the efficiency of it,"" Arteta explained post-match. ""But the team showed huge character, not to give up, to continue trying to do the right things. ""The way they fought, the way they understood how they have to manage the game in certain moments, with the way we defended, because we didnât concede anything, it was phenomenal. ""In England you say 'win ugly', I think from my point of view today we won ugly, and Iâm extremely happy to see a team that has this capacity to find a way to win and show the character that they showed today."" ",positive
21,https://www.sportbible.com/football/manchester-united-players-to-do-lap-of-honour-despite-planned-walkout-20220502,Manchester United Players To Do Lap Of Honour Despite Planned Walkout Protest,"Manchester United players are set to give a 'lap of honour' around Old Trafford after the Brentford match, but some fans won't still be in the ground to see it, as they protest the Glazers' ownership. Loadingâ¦ A miserable season at Old Trafford will come to end on Monday night, as United play their final home game, ahead of two away fixtures. Fans have only seen their team win nine times in the league in Manchester so far this season, which is actually an improvement on their away form, and the end of the campaign probably can't come soon enough. When the final whistle is blown following the game against Thomas Frank's team the players are set to take a lap of honour, or give a lap of appreciation to the fans, depending on how it's spun. A group of fans will miss the gesture however, as there is a planned walkout 17 minutes from the end of the match, to protest the 17 years the club has been under American ownership from the Glazer family. In recent games the 17 minutes of not being in their seats has come before kick off but the Brentford match protests are planned for the final part of the game. Whilst the club are aware that the players might not get the best reception during their lap, there are several players playing in front of the home fans for the last time. Jesse Lingard and Juan Mata's contracts are both expiring, so could play their last minutes at Old Trafford, whilst Paul Pogba and Edinson Cavani are in the same situation but injured. Nemanja Matic has also revealed that he wants to leave in the summer, and others are expected to depart with the arrival of Erik ten Hag likely to lead to a clearout. Some players may get a warm reception but Pogba, whose future isn't sorted yet, was recently booed when coming off in the game against Norwich City. Monday's game comes a year after the club's fans had their most 'successful' protest against the owners, as they managed to get a game with Liverpool postponed. Thousands gathered outside of Old Trafford, whilst games were still being played behind closed doors due to Covid, and hundreds even got onto the pitch. There were also protests outside of the hotels the two sets of players were gathered at, stopping the clubs getting to the match, and it was played at a later date. The time Premier League winners need to win their remaining three games, with matches against Brighton and Crystal Palace to follow, just to level their worst points tally since the inception of the league in 1992. ",negative
22,https://www.sportbible.com/football/vieira-backs-zaha-to-join-him-in-the-premier-leagues-hall-of-fame-20220502,Patrick Vieira Makes Case For Wilfried Zaha To Join Him In The Premier League's Hall Of Fame,"âPatrick Vieira has backed Wilfried Zaha to someday join him in the Premier League's Hall of Fame, comparing the Crystal Palace star toMatt Le Tissier. Vieiraargued Zaha should one day be inducted in the Hall of Fame following his services for Palace. The 29-year-old scored a last-minute winner against Southampton last weekend and his manager heaped huge praise on the star winger. âThe Arsenal legend, who himself was inducted into the Premier League Hall of Fame in March, compared Zaha's brilliance for Palace to Le Tissier's legendary spell at Southampton. He reckons his body of work throughout his career at Palace shouldn't go unnoticed. Vieiraâexplained: ""Wilfried is a little bit likeMatt Le TissierI would say. When you play at Palace, at Southampton, you may not get the credit that you deserve if you're not playing in one of the top four, top five teams. ""Hopefully they will get to the HallofFame because what they did for Crystal Palace and [Southampton] you canât take that away."" The Palace boss added: ""Wilfried since he has been in this football club has been an important player, has got a special talent, delivering every year that's why I think it's important for people to recognize his talent. ""It's a different way of looking at quality, talented players.Wilfried Zaha and Matt Le Tissier, they deserve a lot of credit for what they achieved for their respective football clubs.""â Zaha has spent the majority of his career atSelhurst Park. He's been an ever-present since returning to the club in 2014 following his failed transfer at Manchester United. The Ivory Coast international has weighed in with goals and assists, and is one of their most important players. Does he deserve a spot in the Premier League's Hall of Fame in the future? Let us know what you think. ",
23,https://www.sportbible.com/football/everton-match-winner-richarlison-to-face-fa-investigation-20220502,Everton Match Winner Richarlison To Face FA Investigation,"Everton match winner Richarlison is set to be the subject of an FA investigation, following his match winning goal against Chelsea on Sunday. Loadingâ¦ The Toffees were in desperate need of all three points at Goodison Park, as Frank Lampard welcomed his former team amidst a tough relegation battle. Burnley's back-to-back wins had left Everton five points from safety and looking like a first relegation since 1951, and with games running out it was becoming a major worry. Richarlison put his side 1-0 up just a minute after the second half begun, pouncing on Cesar Azpilicueta's mistake and slotting past Edouard Mendy, to rapturous scenes from the home supporters. Flares were thrown onto the pitch by the fans, with the forward picking one up and lobbing it back towards the stands, with the FA opening an investigation. DEADLOCK BROKEN! ð¥Richarlison picks the pocket of Azpilicueta on the edge of his own area and cooly slots the ball past Mendy! ð pic.twitter.com/P0VEFoeDi4 At the time fans on social media felt the 24-year-old could have been sent off but Everton claimed the player was looking to get rid of the flare but away from the fans. ""We will look into the matter,"" the club said. ""As far we we are concerned, Richarlison was attempting to throw it out of the ground."" The club and the FA will both investigate the issue, with the FA having previously written to Liverpool's Harvey Elliott earlier this season when he handled a flare. That came in the Carabao Cup final win on penalties, also against Chelsea, with the 19-year-old picking up the flare before putting it back down again. In 2009 Didier Drogba was cautioned by the police after throwing a coin back into the crowd, after a Burnley fan had thrown it in his direction whilst he was celebrating a goal against the Clarets. As well as Richarlison's goal, Lampard and Everton were grateful for Jordan Pickford's brilliant performance in goal, somehow saving from Azpilicueta's shot, after the initial chance had left the goalkeeper on the other side of the goal. The Merseyside team are now just two points below both Leeds and Burnley, with the former dropping below the Clarets after recent results. They have a game in hand and next travel to Leicester City and then Watford, although they have not won an away game in the league since August. ",positive
24,https://www.sportbible.com/football/arsenal-fans-loved-elneny-bossing-rice-while-observing-ramadan-20220502,Arsenal Fans Loved Mohamed Elneny Bossing Declan Rice In Midfield While Observing Ramadan,"âArsenal fans lovedMohamed Elnenyâ dominating Declan Rice in midfield while fasting in their big win over West Ham United on Sunday.â Elnenyhas starred in his side's crucialwins over Chelsea, Manchester United and West Ham in recent weeks. He's spent most of the season on the bench, but has been drafted in by Mikel Arteta - with the player delivering stellar performances in the engine room of the pitch. His remarkable form is even more impressive when you consider he's observing Ramadan. Double celebration tonight: a massive win and a happy Eid ð¤© pic.twitter.com/2eycFxYg17 The Egyptianisfasting during daylight hours, butstill producing the goods in the middle of the park. And his latest heroic showinggarnered huge praise from Arsenal fans, who loved his dominance in his duels with Rice. Elneny breaking fast to feast on Rice for 90 mins gotta respect it ð­ð­ Thought Mohammed Elneny was fastingGuy was eating Rice in the Midfield ð­ð­ Mo Elneny bossing Ngolo KantÃ©, Bruno Fernandes & Declan Rice all in the space of eleven days. Absolutely unreal. Mohammed Elneny of Arsenal is better than Declan Rice and thereâs nothing you could do about it. I need someone to tell me what makes Declan Rice a better player than Elneny. They said Elneny was fasting yesterday & he still ate Rice. Wow ðð Speaking about Ramadan last month,Elnenyâsaid: ""The club gives me the freedom.The mentality must be strong to deal with fasting. I eat a lot at breakfast to get energy.""â The 29-year-old is out of contract at Arsenal this summer, though his recent showings could earn him a new contract and prolong his stay at the Emirates.â The Gunners, meanwhile, currently occupy fourth spot, two points ahead of cross-town rivals Tottenham who also won on Sunday. Mikel Arteta's team have four league games left of the season including a massive showdown against Spurs. ",
25,https://www.sportbible.com/football/christian-pulisics-dad-deletes-tweet-about-sad-chelsea-situation-20220502,Christian Pulisic's Dad Deletes Tweet About 'Sad' Chelsea Situation And Potential Transfer Away,"Christian Pulisic's dad quickly deleted a tweet about his son's treatment at Chelsea following their shock 1-0 loss to Everton. Loadingâ¦ The USA international has found it hard to nail down a starting spot under Thomas Tuchel this season, with 17 of his 33 appearances coming from the bench. Pulisic's last full 90 minutes came against Burnley back in March and he managed to score as well as grab an assist in that 4-0 thrashing. He also scored a last-gasp winner against West Ham United last month. Chelsea have a wealth of attacking talent, but Mark Pulisic decided to voice his frustration on social media after seeing Christian come off the bench once again at Goodison Park. In a now deleted post he vented: ""The sad thing is he loves this club, teammates, and London.â¦ puts his heart and soul into being a pro. Onwards and upwards my boyâ¦ big 6 months ahead.."" The 23-year-old joined Chelsea in 2019 and had the big task of filling Eden Hazard's boots, who moved on to Real Madrid. His arrival coincided with the club's season-long transfer ban and expectations were big. Since then, Pulisic has gone on to make 111 appearances in all competitions and featured in last season's Champions League final victory against Manchester City. He'll be at the World Cup in Qatar with the USA, which is what Mark could be referring to in his tweet rather than a transfer. Pulisic isn't the only attacker to fall down the pecking order. Hakim Ziyech and summer signing Romelu Lukaku regularly join Pulisic on the Blues bench with Timo Werner, Kai Havertz and Mason Mount the preferred front three right now. It was a fiery affair against the Toffees as Frank Lampard's side took a massive step towards Premier League safety. Richarlison dispossessed Cesar Azpilicueta just after the break and slotted past Edouard Mendy for the only goal of the game. Jordan Pickford made a number of vital saves in the Everton net to preserve their lead. Everton are still 18th in the table, but have closed the gap on Burnley and Leeds United to just two points while having a game in hand. Burnley snatched victory from Watford on Saturday while Leeds were pummelled 4-0 by Manchester City later in the day. Meanwhile, Chelsea have comfortably been third for some time but are yet to mathematically qualify for the Champions League. ",negative
26,https://www.sportbible.com/football/stunning-scenes-in-turkey-as-trabzonspor-fans-celebrate-league-title-20220501,Trabzonspor Fans Celebrate First League Title In 38 Years With Stunning 'Rave' In The City,"There were jubilant scenes in the city of Trabzon on Saturday after Trabzonspor were crowned champions of Turkey for the first time in 38 years. Loadingâ¦ Trabzonspor clinched the Turkish Super Lig title with a 2-2 draw against Antalyaspor. It is only the seventh time the club has been crowned champions of Turkey and their first league title since the 1983-84 season. Tens of thousands of the club's supporters took to the streets of the city, which is situated in the northeast of Turkey on the Black Sea coast, to celebrate the victory. ð BitiÅ dÃ¼dÃ¼ÄÃ¼yle beraber yaÅanan coÅku! Trabzonspor'da taraftarlar ve futbolcular ÅampiyonluÄu kutluyor! #SporTotoSÃ¼perLig pic.twitter.com/812VDdNh2X ð BitiÅ dÃ¼dÃ¼ÄÃ¼yle birlikte, Åenol GÃ¼neÅ Spor Kompleksi dÄ±ÅÄ±nda havai fiÅeklerle kutlama! #SporTotoSÃ¼perLig pic.twitter.com/lZKghlIAG8 Stunning footage from the celebrations shows thousands of fans waving the light on their phones in unison while music plays. A number of fans can be seen sitting on top of streetlights to gain a better vantage point of the celebrations, which look more like a rave than a victory party. There were fireworks and a mass pitch invasion at the end of Saturday's match, after Trabzonspor were confirmed as champions. Former Napoli midfielder Marek Hamsik, who now plays for the Turkish club, was swamped by supporters at the full-time whistle. ð´ðµ Millet BahÃ§esi'nde Trabzonsporlu taraftarlarÄ±n Åampiyonluk sevinci! #SporTotoSÃ¼perLig pic.twitter.com/WHRv2VijKQ ð¥³ Marek Hamsik ve Trabzonsporlu taraftarlar kol kola! #SporTotoSÃ¼perLig pic.twitter.com/mqxomiBek2 Speaking after the match, the Slovakia international said: ""This is my first championship in my football career. ""I never expected to have it here, but we did. ""Giving this happiness to masses of people is such a great feeling."" Trabzonspor captain Ugurcan Cakir added: ""As a child of this city, we are so happy."" ",positive
