,URL,Content_title,Contents,sentiment,word_search,word_count
0,https://www.siamsport.co.th/football/fa-cup/view/279615,"โปรแกรมถ่ายทอดสดวันนี้! Siamsportยิงสดเจลีก ,AIS Play จัดให้ดูบอลไทยทุกคู่ , เชลซี พบ พาเลซ ตัดเอฟเอคัพ ,  PPTV ยิงสดนิวคาสเซิ่ล พบ เลสเตอร์","โปรแกรมเจ ลีก ญี่ปุ่น 12:00 น. กัมบะ โอซาก้า พบ โชนัน เบลล์มาเร่  13:00 น. คาชิม่า แอนท์เลอร์ส พบ นาโกย่า แกรมปัส  YouTube Siamsport  13:00 น. ซางัน โทสุ พบ ชิมิสึ เอส-พัลส์  14:00 น. จูบิโล่ อิวาตะ พบ ซานเฟรซเช่ ฮิโรชิม่า  15:00 น. อวิสปา ฟูกูโอกะ พบ เซเรโซ่ โอซาก้า  17:00 น. คาชิว่า เรย์โซล พบ เกียวโต ซังงะ  YouTube Siamsport โปรแกรมไทยลีก 18:00 น. ทรู แบงค็อก ยูไนเต็ด พบ ขอนแก่น ยูไนเต็ด  GMM25, AIS Play  18:00 น. พีที ประจวบ เอฟซี พบ หนองบัว พิชญ เอฟซี  ททบ.5 HD1, AIS Play โปรแกรมไทยลีก 2 18:00 น. อุดรธานี เอฟซี พบ ลำพูน วอริเออร์  T Sports 7, AIS Play  18:00 น. ลำปาง เอฟซี พบ แพร่ ยูไนเต็ด  AIS Play  19:00 น. เกษตรศาสตร์ พบ สุโขทัย เอฟซี  AIS Play  19:00 น. ระยอง เอฟซี พบ คัสตอม ลาดกระบัง ยูไนเต็ด  AIS Play โปรแกรมเอฟเอ คัพ อังกฤษ รอบรองชนะเลิศ 22:30 น. เชลซี พบ คริสตัล พาเลซ  beIN Sports3 โปรแกรมพรีเมียร์ลีก อังกฤษ 20:15 น. เวสต์แฮม พบ เบิร์นลี่ย์  TPF HD 1 (600)  20:15 น. นิวคาสเซิ่ล พบ เลสเตอร์ ซิตี้  PPTV HD, TPF HD 1 (600) โปรแกรมลาลีกา สเปน 19:00 น. กรานาด้า พบ เลบันเต้  beIN Sports1  21:15 น. แอต.มาดริด พบ เอสปันญ่อล  beIN Sports1  23:30 น. แอธ.บิลเบา พบ เซลต้า บีโก้  beIN Sports1  02:00 น. เซบีย่า พบ เรอัล มาดริด  beIN Sports1 โปรแกรมลีก เอิง ฝรั่งเศส 18:00 น. นีซ พบ ลอริยองต์  beIN Sports3  20:00 น. ทรัวส์ พบ สตราส์บูร์ก  beIN Sports3  22:05 น. โอลิมปิก ลียง พบ บอร์กโดซ์  TPF HD 5 (605)  01:45 น. ปารีส แซงต์-แชร์กแมง พบ มาร์กเซย  beIN Sports3 โปรแกรมบุนเดสลีกา เยอรมัน 22:30 น. อูนิโอน เบอร์ลิน พบ แฟร้งค์เฟิร์ต  PPTV HD ดูสดฟุตบอลไทยบน AIS PLAY คลิ๊ก  https://www.siamsport.co.th/thaileague/live    เช็กโปรแกรมพร้อมช่องถ่ายทอดสดทั้งหมด คลิ๊ก  https://www.siamsport.co.th/fixtures เช็กผลบอล ผลบอลล่าสุด ผลบอลสด คลิ๊ก  https://livescore.siamsport.co.th ",neutral,liverpool,0
1,https://www.siamsport.co.th/football/premierleague/view/279612,ทูเคิ่ลกระตุ้นลูกากูควรดูแวร์เนอร์เป็นแบบอย่าง,"ก่อนเกมรอบตัดเชือก เอฟเอ คัพ ที่ เชลซี จะทำศึกลอนดอน ดาร์บี้ เจอกับ คริสตัล พาเลซ คืนวันอาทิตย์นี้ โธมัส ทูเคิ่ล นายใหญ่แห่งถิ่น สแตมฟอร์ด บริดจ์ กระตุ้นให้ โรเมลู ลูกากู นำ ติโม แวร์เนอร์ เป็นแบบอย่างในการพัฒนาตัวเอง ดาวยิงทีมชาติเบลเยี่ยม ไม่ได้ถูกเลือกเป็นช้อยส์แรกในทีม ""สิงห์บลูส์"" ถึงแม้เจ้าตัวจะถูกซื้อจาก อินเตอร์ มิลาน ด้วยค่าตัวมหาศาล แต่กลับไม่สามารถทำผลงานที่ดีได้ จนถูกตัดชื่อออกจากทีม รวมถึงมักจะมีประเด็นให้สัมภาษณ์โจมตีระบบการเล่นของ ทูเคิ่ล อย่างไรก็ดี ลูกากู ไม่ใช่แค่กองหน้าคนเดียวของ เชลซี ที่เจอปัญหาปืนฝืด ในรายของ ติโม แวร์เนอร์ ก็ประสบเจอเรื่องนี้มาตลอดนับตั้งแต่ย้ายมาจาก แอร์เบ ไลป์ซิก ถึงกระนั้น แนวรุกทีมชาติเยอรมนี ก็อดทนรอโอกาส และก้มหน้าก้มตาทำงานหนักเพื่อที่จะได้ลงสนาม ""สิ่งที่ ติโม ทำ คือสิ่งที่ ลูกากู จำเป็นต้องทำให้ได้"" ทูเคิ่ล กล่าว ""การรอ, อดทน, ทำงานหนัก และทีมต้องมาก่อน เขาต้องพร้อมที่จะช่วยทีม เพราะการเป็นกองหน้า คุณสามารถช่วยทีมได้ภายในเวลาไม่กี่วินาที"" ""ตอนนี้ แวร์เนอร์ ทำให้เรื่องการตัดชื่อเขาออกกลายเป็นเรื่องยาก ผมประทับใจ เขาเล่นได้ดีมาก ๆ ใน 2 เกมหลังสุด มันเป็น 2 เกมที่เขาเล่นได้ดีกว่าเกมอื่น ๆ และเขาแสดงให้เห็นว่าเขาสามารถทำอะไรได้บ้าง ทุก ๆ ทราบดีว่าผู้จัดการทีมเป็นคนส่งรายชื่อ และแน่นอนว่าเราก็ทำแบบนั้น"" ""แต่สุดท้ายแล้ว มันก็ขึ้นอยู่กับผู้เล่นด้วยว่าจะทำยังไงเพื่อไม่ให้คุณตัดชื่อพวกเขาออก พวกเขาทำแบบนั้นทั้งตอนซ้อมและตอนแข่ง แน่นอนว่าในเกมการแข่งขันมันคือโอกาสสำหรับทุกคน"" [ ไม่อนุญาตให้คัดลอกรูปภาพหรือนำไปเผยแพร่รูปภาพต่อไม่ว่าวิธีใดๆ ถ้าฝ่าฝืนมีความผิดตามกฎหมายที่ระบุไว้สูงสุด ] ",neutral,liverpool,0
2,https://www.siamsport.co.th/football/premierleague/view/279610,ปฏิกิริยาป็อกบาหลังถูกแฟนแมนยูรุมโห่ (มีคลิป),"แมนเชสเตอร์ ยูไนเต็ด เปิด โอลด์ แทร็ฟฟอร์ด เฉือนเอาชนะ นอริช ทีมบ๊วยของตาราง 3-2 โดยได้ คริสเตียโน่ โรนัลโด้ เหมาแฮตทริก และทำให้ความหวังที่จะคว้าตั๋วไป แชมเปี้ยนส์ ลีก ซีซั่นหน้าเปิดกว้างอีกครั้งหลังทั้ง ท็อตแน่ม ฮ็อตสเปอร์ และ อาร์เซน่อล ต่างปราชัยในวันเดียวกัน ถึงแม้ชัยชนะจะตกเป็นของทีมเจ้าถิ่น แต่แฟนบอล ""เร้ด อาร์มี่"" ต่างพุ่งเป้ารุ่มโห่ใส่ ปอล ป็อกบา พร้อมถ้อยคำหยาบคายตอนที่แข้งทีมชาติฝรั่งเศส ถูกเปลี่ยนตัวออกจากสนามหลีกทางให้ มาร์คัส แรชฟอร์ด ลงเล่นแทนตอนที่สกอร์เสมอกัน 2-2 ในช่วงครึ่งหลัง โดยหลังจบเกมระหว่างที่บรรดานักเตะ ""ปีศาจแดง"" เดินเข้าอุโมงค์โรงละครแห่งความฝัน ป็อกบา ได้ออกท่าทางเอามือขึ้นมาป้องที่หูเหมือนแสดงความหมายให้กองเชียร์โห่ใส่เขาหนักมากกว่านี้ ซึ่งหลังจาก ป็อกบา ทำนั้น บรรดาสาวก ""เร้ด เดวิลส์"" ก็ส่งเสียงโห่ใส่กันเต็มที่ Pogba walking off the pitch! pic.twitter.com/BXu51MuGjo ต่อเรื่องดังกล่าง ราล์ฟ รังนิก กุนซือขัดตาทัพ แมนยู พูดถึงเหตุการณ์นี้ พร้อมยืนยันว่า ป็อกบา ไม่สมควรถูกกระทำแบบเจาะจงเช่นนี้ ""แฟน ๆ น่าทึ่งมาก และผมก็เข้าใจดีเลยว่าพวกเขารู้สึกผิดหวัง เสียใจ แต่ผมไม่คิดว่ามันจะสมเหตุสมผลที่จะไปพุ่งเป้าที่รายบุคคล หรือผู้เล่นคนใดคนหนึ่ง"" ""มันเป็นความรับผิดชอบร่วมกัน ดังนั้นผมจึงมักจะปกป้องผู้เล่นของผม ถึงแม้ผมไม่เห็นว่าเขา (ป็อกบา) ทำอะไรตอนจบเกม แต่มีคนบอกผมมา"" ""มันเป็นปฏิกิริยาของเขาต่อเสียงตะโกนระหว่างเกม อย่างที่ผมพูดไป ผมเข้าใจแฟนๆ ดี แต่ผมคิดว่ามันไม่เหมาะสมที่จะทำแบบนี้กับผู้เล่นคนเดียว"" ""ระหว่างเกมผมคิดว่า ปอล ทำได้ดีในเรื่องการครองบอล แม้ว่าจะไม่ใช่ตำแแหน่งที่ดีที่สุดสำหรับเขา แต่เราไม่มีทั้ง เฟร็ด และ สกอตตี้ (แม็คโทมิเนย์) ดังนั้นผมจึงตัดสินแบบนี้"" [ ไม่อนุญาตให้คัดลอกรูปภาพหรือนำไปเผยแพร่รูปภาพต่อไม่ว่าวิธีใดๆ ถ้าฝ่าฝืนมีความผิดตามกฎหมายที่ระบุไว้สูงสุด ] ",neutral,liverpool,0
3,https://www.siamsport.co.th/football/premierleague/view/279606,นี่เพื่อนเอง!แม็กไกวร์เสียหลักจระเข้ฟาดหางใส่ป็อกบาจนแทบน็อค(มีคลิป),"ปอล ป็อกบา แสดงออกด้วยความไม่พอใจสุด ๆ หลังโดนฟาดด้วยขาหลังเข้าที่ขมับอย่างจังในจังหวะพยายามเข้าทำประตูใส่ นอริช จนทำให้มีเลือดออกๆๆ ""ปีศาจแดง"" แมนฯ ยูไนเต็ด เป็นฝ่ายเอาชนะ นอริช 3-2 แต่มีช่วงเวลาหนึ่งพวกเขาอยู่ในสถานการณ์กดดดัน เมื่อถูกทีมเยือนไล่ตามตีเสมอ 2-2 ทั้งที่เป็นฝ่ายออกนำไปก่อน 2-0 และอารมณ์ตึงเครียดมีมากขึ้นไปอีกในช่วงที่สกอร์เสมอกัน เมื่อ ป็อกบา หัวร้อนสุดขีดเมื่อถูกเพื่อนร่วมทีมเตะฟาดเข้าที่ศีรษะ จังหวะดังกล่าวเกิดขึ้นเมื่อ อเล็กซ์ เตลลิส เปิดบอลมาที่หน้าประตู ซึ่ง คริสเตียโน่ โรนัลโด้ ได้เทคตัวขึ้นโขกบอล แต่ทาง ทิม ครูล นายด่าน “นกขมิ้นเหลืองอ่อน” สามารถป้องกันไว้ได้ อย่างไรก็ดี หลังจากช็อตที่ โรนัลโด้ ขึ้นโขกนั้น แฮร์รี่ แม็กไกวร์ ที่ยืนอยู่ด้านหลังแข้งโปรตุกีส พยามที่จะเข้าหาบอลด้วยการโหม่งเช่นกัน ทว่าจังหวะเสียหลักขาด้านหลังของกัปตัน ""ปีศาจแดง"" ไปฟาดเข้าที่บริเวณใบหน้าของ ป็อกบา เข้าเต็ม ๆ จนถึงขั้นมีเลือดออก Look at Harry Maguire The way Pogba got angry What a legend!!! pic.twitter.com/Ob7LNpdN1p หลังจากนั้น ป็อกบา ก็แสดงความเจ็บปวดและหัวร้อนจน โรนัลโด้ ต้องเข้ามาปลอบประโลม ก่อนที่ทีมแพทย์ของ แมนยู จะเข้ามาปฐมพยาบาลเพื่อประเมินอาการ ซึ่งแข้งเฟร้นช์แมน ได้ออกอาการโมโหสุดขีด และยืนเขม็งด้วยอาการเซ็ง [ ไม่อนุญาตให้คัดลอกรูปภาพหรือนำไปเผยแพร่รูปภาพต่อไม่ว่าวิธีใดๆ ถ้าฝ่าฝืนมีความผิดตามกฎหมายที่ระบุไว้สูงสุด ] ",neutral,liverpool,0
