,URL,Content_title,Contents,Sentiment
12,https://talksport.com/football/1099374/cristiano-ronaldo-stats-man-utd-goals-transfer-news-roy-keane/,Roy Keane tips Cristiano Ronaldo to stay at Manchester United this summer and striker appeared to tell fans he was not finished yet in goal celebration,"Roy Keane has tipped Cristiano Ronaldo to stay at Manchester United this summer and the forward appeared to suggest he was going nowhere on Monday night. The 37-year-old signed a two-year deal on his return to Old Trafford last summer, however, the club’s disappointing Premier League season has led to speculation he could bring his stay to an end early. The Portuguese was recently linked with a move back to Real Madrid, who he played for between 2009 and 2018. Meanwhile, the imminent arrival of Erik ten Hag as manager has led to questions over whether there would be any room in his team for Ronaldo. But club legend Keane is in no doubt that Ronaldo will be part of things next season. Asked if Man United’s clash against Brentford – their final home match of the season – could be Ronaldo’s Red Devils swansong, Keane said: “I wouldn’t have thought so. “I know there’s speculation but I can’t imagine Ronaldo not being at Man United next year unless something drastic changes in the summer. “If you look at the goals he’s got, he’s a threat and any manager would want to work with him. Simple as that.”  Although it’s been a campaign to forget for the 13-time Premier League winners, Ronaldo can hold his head high. So far he has 24 goals to his name, 18 of them in the league. His latest came in their 3-0 win against the Bees as he slotted home a penalty in the second half. And during that celebration he appeared to hint he was staying on beyond the summer by pointing to himself and then Old Trafford as he took in the crowd’s cheers. A post shared by Sky Sports (@skysports) Sky Bet: Bet £10 on Football, Get £30 in Free Bets* – CLAIM HERE NEW CUSTOMERS ONLY. FIRST SINGLE & E/W BET ONLY. ODDS OF 1/1 OR GREATER. 3 x £10 BET TOKENS. FREE BET STAKES NOT INCLUDED IN RETURNS. FREE BETS ONLY REDEEMABLE ON FOOTBALL. FREE BETS ARE NON-WITHDRAWABLE. NO FREE BET EXPIRY. ELIGIBILITY RESTRICTIONS AND FURTHER T&CS APPLY. 18+. BEGAMBLEAWARE.ORG ",positive
13,https://talksport.com/football/1099873/manchester-united-v-brentford-live-stream-commentary-score-kick-off-time-team-news-rangnick-ronaldo-premier-league/,"Manchester United v Brentford LIVE reaction: Red Devils sign off at Old Trafford this season with fine win as Fernandes, Ronaldo and Varane score","Manchester United enjoyed a comfortable 3-0 win over Brentford in their final home match of a miserable season as Old Trafford bid farewell to Ralf Rangnick and some players. Bruno Fernandes fired in an early opener before a narrow offside decision denied Cristiano Ronaldo before half-time. But the veteran did get on the scoresheet soon after, converting from the spot after a foolish foul by Rico Henry. Raphael Varane hooked home a deflected third before fans gave standing ovations to departing players Nemanja Matic and Juan Mata. FOLLOW OUR LIVE BLOG FOR REGULAR UPDATES BELOW… ",positive
14,https://talksport.com/football/1099983/cristiano-ronaldo-bruno-fernandes-varane-brentford/,"Cristiano Ronaldo scores penalty, while Bruno Fernandes and Raphael Varane end droughts as Red Devils get back to winning ways with triumph over Brentford","Manchester United got back to winning ways as they beat Brentford 3-0 in their final game at Old Trafford this season. The Red Devils secured three points in the league for the first time since their win over bottom side Norwich thanks to goals from Bruno Fernandes, Cristiano Ronaldo and Raphael Varane. United opened the scoring just nine minutes into the clash as an unmarked Fernandes volleyed home Anthony Elanga’s cut-back. The strike was Fernandes’ first goal in his last 11 outings. Shortly after the Portugal international’s goal, the Bees had two attempts at equalising – Christian Eriksen and Ivan Toney both having attempts at goal. Brentford were relieved to see Ronaldo’s strike just before half time ruled out by VAR for offside. However, the Bees were soon left with a bigger mountain to climb after the restart. The Red Devils were awarded a penalty after Rico Henry attempted to win the ball back in the box and collided with Ronaldo having been barged off it by the Portuguese seconds earlier. Sure enough, United’s talisman grasped the opportunity after Chris Kavanagh pointed to the spot, making no mistake as he sent a thumping effort past David Raya from the spot. United’s final goal of the evening came from an unlikely source as Raphael Varane netted his first goal when he latched onto Alex Telles’ inswinging corner from the right.    Prior to the game, United fans had organised another another protest against the Glazer family ownership, which was due to result in a mass walkout in the 73rd minute of the match. However, whilst there were banners displaying their discontent towards those running the club, there wasn’t a noticeable walkout from those who attended. Juan Mata received a standing ovation as he made his way for Phil Jones, as the Spaniard made what will likely be his final appearance at Old Trafford, with him expected to leave in the summer. Roy Keane was asked if Man United’s clash against Brentford could have also been Ronaldo’s Red Devils swansong. However, the United legend wasn’t convinced. “We want Glazers Out”#MUFC fans protest the Glazers on the 72nd minute during #MUNBRE pic.twitter.com/kOYxvHNl7r Roy Keane was asked if Man United’s clash against Brentford could have also been Ronaldo’s Red Devils swansong. However, the United legend wasn’t convinced. “I wouldn’t have thought so,” he said. “I know there’s speculation but I can’t imagine Ronaldo not being at Man United next year unless something drastic changes in the summer. “If you look at the goals he’s got, he’s a threat and any manager would want to work with him. Simple as that.” United’s victory effectively cements their place in the European spots as they sit in sixth, whilst Brentford remain on 40 points, eight points from the drop. Sky Bet: Bet £10 on Football, Get £30 in Free Bets* – CLAIM HERE NEW CUSTOMERS ONLY. FIRST SINGLE & E/W BET ONLY. ODDS OF 1/1 OR GREATER. 3 x £10 BET TOKENS. FREE BET STAKES NOT INCLUDED IN RETURNS. FREE BETS ONLY REDEEMABLE ON FOOTBALL. FREE BETS ARE NON-WITHDRAWABLE. NO FREE BET EXPIRY. ELIGIBILITY RESTRICTIONS AND FURTHER T&CS APPLY. 18+. BEGAMBLEAWARE.ORG ",positive
15,https://talksport.com/football/1099751/manchester-united-v-brentford-live-stream-kick-off-time-team-news-tv-channel-premier-league-rangnick-ronaldo/,"Manchester United v Brentford live stream: Red Devils need victory in final home game of the season – kick-off time, team news and TV channel","Manchester United host Brentford in their final home game of the season tonight as they look to consolidate their spot in the Europa League places. United have three games left this term and are now eight points off Arsenal in fourth. It means their Champions League hopes are effectively over but they will still be eager to claim European football for next term. The Red Devils have been in poor form recently and have only won once in their last six league games. Ralf Rangnick needs to put that right as Brentford travel to the Theatre of Dreams. The Bees, who drew with Tottenham last time out, are on a good run and have all but secured safety for next season. This Premier League clash will take place on Monday, May 2. The match at Old Trafford will kick off at 8pm. United beat Brentford 3-1 in January’s reverse fixture thanks to goals from Anthony Elanga, Mason Greenwood and Marcus Rashford.  This match will be broadcast live on Sky Sports Main Event and Sky Sports Premier League with coverage starting from 7pm. Sky Sports customers can live stream this via the app using their mobile, tablet or computer devices. If not, you can purchase a Sky Sports Day Pass from NowTV for £9.99. Updates will also be on talkSPORT throughout the evening while talkSPORT.com will also be running a live blog. To tune in to talkSPORT or talkSPORT 2, click HERE for the live stream.  Man United: De Gea, Dalot, Lindelof, Varane, Telles, McTominay, Matic, Elanga, Fernandes, Mata, Ronaldo Subs: Bailly, Jones, Rashford, Lingard, Fred, Cavani, Henderson, Fernandez, Garnacho Brentford: Raya, Ajer, Roerslev, Jansson, Sorensen, Henry, Janelt, Norgaard, Eriksen, Mbeumo, Toney Subs: Jensen, Dasilva, Wissa, Jeanvier, Fosu, Baptiste, Stevens, Fernandez, Young-Coombes Referee: Chris Kavanagh  Sky Bet: Bet £10 on Football, Get £30 in Free Bets* – CLAIM HERE NEW CUSTOMERS ONLY. FIRST SINGLE & E/W BET ONLY. ODDS OF 1/1 OR GREATER. 3 x £10 BET TOKENS. FREE BET STAKES NOT INCLUDED IN RETURNS. FREE BETS ONLY REDEEMABLE ON FOOTBALL. FREE BETS ARE NON-WITHDRAWABLE. NO FREE BET EXPIRY. ELIGIBILITY RESTRICTIONS AND FURTHER T&CS APPLY. 18+. BEGAMBLEAWARE.ORG ",positive
16,https://talksport.com/football/1099858/mitrovic-championship-fulham-luton-title-goal-record/,Aleksandar Mitrovic breaks stunning 46-game Championship season goal record as Fulham seal league title after hitting SEVEN against play-off hopefuls Luton,"Fulham secured the Championship title in style as they thrashed in-form Luton Town 7-0 in a match that saw Aleksandar Mitrovic break the division’s 46-game season goalscoring record. The champions-elect took on the play-off contending Hatters in front of a packed Craven Cottage following a poor run of form, winning just one in their last five.  A win would seal Marco Silva’s side the title, having already achieved promotion in April. Meanwhile, Championship manager of the season Nathan Jones’s side were unbeaten in three entering into the clash, as the Hatters searched for a win to secure their place in the top six. Luton competed well with the league leaders in the opening stages, demonstrating their physical prowess and showing why they’ve earnt their spot in the league’s coveted play-off spots. However, it was the Cottagers who got the party started in the 28th minute, with captain Tom Cairney netting his third goal of the season from the edge of the box after the ball was pulled back by Harry Wilson. Fulham skipper’s goal marked the west Londoner’s 100th goal of the campaign, a record last set in the division by Manchester City back in 2001/02. Jones’ side were soon dealt another injury blow to add to their ever-increasing list as Fred Onyedinma was taken off with a hamstring injury.   Fulham then went 2-0 up thanks to a thumping, long range effort from Kenny Tete from outside the area, that left Hatters keeper Matt Ingram unsighted and the rest of his side shellshocked. The half time whistle couldn’t have come faster for the Bedfordshire side, with Tom Lockyer having to clear Wilson’s effort off the line to prevent the home side going 3-0 up just before the break. Jones’ side earnt themselves four yellow cards in the opening 45 minutes after battling against an increasingly rampant Fulham side as the chance to seal their play-off spot looked to be sliding away. Unfortunately for Luton, Silva’s side weren’t finished there, though. Top scorer Mitrovic played the ball to Wilson before Liverpool target Fabio Carvalho netted the Premier League new boys’ third. Not long after, Fulham scored their fourth through who else but Mitrovic. The Serbian timed his run to perfection as he calmly slotted his rebounded chance into the back of the net.   Mitrovic’s goal marked his 42nd of the campaign, meaning he went level with the league’s 46-game-a-season’s record holder Guy Whittingham, who achieved the feat with Portsmouth in the 1992/93 season. Bobby De Cordova-Reid then found himself on the scoresheet, with Jean Michael Seri also doing so soon after. There couldn’t have been a more fitting way for the champions to end the game than Mitrovic breaking Whittingham’s record, though. Fulham’s star striker rounded the night off with his side’s seventh goal of the evening, beating Whittingham’s record and summing up an incredible season for Silva’s side. Only former Middlesbrough player George Camsell’s tally remains superior to Mitrovic’s in the division’s history, setting the record of 59 back in 1927/28. Fulham’s demolition of Luton sees the Hatters drop to sixth, denting their goal difference and leaving them just two points above play-off pushers Middlesbrough. Sky Bet: Bet £10 on Football, Get £30 in Free Bets* – CLAIM HERE NEW CUSTOMERS ONLY. FIRST SINGLE & E/W BET ONLY. ODDS OF 1/1 OR GREATER. 3 x £10 BET TOKENS. FREE BET STAKES NOT INCLUDED IN RETURNS. FREE BETS ONLY REDEEMABLE ON FOOTBALL. FREE BETS ARE NON-WITHDRAWABLE. NO FREE BET EXPIRY. ELIGIBILITY RESTRICTIONS AND FURTHER T&CS APPLY. 18+. BEGAMBLEAWARE.ORG ",positive
17,https://talksport.com/football/1099806/declan-rice-west-ham-transfer-teammates-man-utd-chelsea-links/,West Ham teammates ‘wind up’ Declan Rice about Chelsea and Manchester United links as England star admits he gets ‘battered’ on social media about £150m price tag,"Declan Rice revealed his West Ham teammates ‘wind him up’ about speculation linking him with a move away from the club. The 23-year-old has been incredible for the Hammers in midfield as they continue to perform well in the Premier League, while also reaching the semi-finals of the Europa League. This, coupled with his standout displays when playing for England, have made him one of the most highly-rated young talents in the game. Chelsea and Manchester United have both been linked with moves for the player who West Ham would want around £150million for. It has been reported that Rice has turned down three contract offers from the club with his future looking set to be away for east London. “I feel like playing well comes with speculation,” Rice told Sky Sports. “I’ve had two or three top seasons with West Ham and the top clubs around the country are always going to be watching. It’s not just me, it’s the same for every player. “I think it’s important not to get too carried away with that. We’ve had a good season with West Ham and there have been big games I’ve had to play in so I feel like my focus has always been on that. If I thought about other things, I’d get carried away and that wouldn’t be fair on the team or the manager. “I can’t help speculation, even with the numbers that get talked about. I get battered for it all the time on social media, but I can’t help that. I can help by going on the pitch and performing as best as I can. “They [West Ham teammates] wind me up all the time. It’s crazy to speak about to be honest, so I just kind of block it out and do what I do best and that’s play football.”   “They [West Ham teammates] wind me up all the time. It’s crazy to speak about to be honest, so I just kind of block it out and do what I do best and that’s play football.” Rice came third in the prestigious Football Writers’ Association Men’s Player of the Year award, behind only Mohamed Salah and Kevin De Bruyne, when the results were announced on Friday. It gives an indication of just how good Rice has been this term and the midfielder thinks he can only get better. “It’s not bad,” Rice said on finishing third in the FWA awards. “I would like to have won it, but obviously up against Salah and De Bruyne it’s hard to say, because I can never imagine putting my name with those types of players. “To come third, it shows that people have appreciated what I’ve done on the football pitch. This season, I feel like I’ve taken another step in the right direction in my career, but I’m still only 23 and trust me, I know myself and I’ve got so much more that I can let out of the bag. “I know that, my coaches tell me that and I think it just comes with time and as I get older, it’ll keep coming and coming. I feel like you’re only seeing the start of me. I’m going to keep pushing and getting better.” Sky Bet: Bet £10 on Football, Get £30 in Free Bets* – CLAIM HERE NEW CUSTOMERS ONLY. FIRST SINGLE & E/W BET ONLY. ODDS OF 1/1 OR GREATER. 3 x £10 BET TOKENS. FREE BET STAKES NOT INCLUDED IN RETURNS. FREE BETS ONLY REDEEMABLE ON FOOTBALL. FREE BETS ARE NON-WITHDRAWABLE. NO FREE BET EXPIRY. ELIGIBILITY RESTRICTIONS AND FURTHER T&CS APPLY. 18+. BEGAMBLEAWARE.ORG ",positive
18,https://talksport.com/football/1099744/man-utd-fan-protest-glazer-family-brentford-simon-jordan/,Manchester United fans plotting protest against Glazers accused of ‘getting ahead of themselves’ as Simon Jordan says they wouldn’t be as angry if team was winning,"Simon Jordan believes that Manchester United fans are overestimating their influence ahead of yet another protest against the Glazer ownership. It’s understood fans are preparing a march before the Monday night clash with Brentford. It’s understood supporters are being urged to walk out of Old Trafford on 73 minutes, 17 minutes from the end, to signify the 17 years in which the club has been under the current ownership. While admitting that United fans are more than entitled to make their feelings known in a peaceful manner, Jordan believes that there’s only so much that supporters can do when dealing with vast sums of money within the game. He told White and Jordan: “I do think that some fans are getting ahead of themselves and getting carried away with what they’re entitled to do, how to represent their discontent, how influential they are in the world of football and how the European Super League was stopped by fans. “There’s a balance between expressing dissatisfaction, and then engineering disruption and your reach exceeding your grasp. “Man United fans are fully entitled to express their feelings. It’s not my right to tell them how to feel about their ownership model, they’ve every right to be as unhappy as they want to be, but if you’re going to realistically oust the Glazers, you need a proper solution. “But if you’re just going to bark at the moon because you don’t like something… everyone knows they’re unhappy about it. “Do you think this dissatisfaction would be anywhere near as acute if they were winning on the pitch?”   “I acknowledge their point, but if the club were doing well on the pitch, it would be nowhere near the level it is now.” Jordan added: “The Glazers need that team to win too. They’re not stupid. They know that when they’re not in the Champions League their share price is deflated. “Of course their hearts are not with United, they’re American. Do you think Roman Abramovich cared that much about Chelsea? He cared because it was a reflection of him and he wanted to win and he wanted to buy Chelsea to legitimise his position in the world. “What you’re looking for is the perfect circle where someone buys your football club, gives you exactly what you want and when you want it. Even then there will be a segment of Man United fans who won’t be happy if the team doesn’t win.”  But stepping outside of the situation at Old Trafford, Jordan believes that fans must start understanding that football is ‘a money business’. He said: “Man City wasn’t bought because Sheikh Mansour cared about Manchester, he wanted to legitimise a particular regime. “Newcastle hasn’t been bought because the Saudis are wonderful people, they’re being bought for the exact same purpose. “This notion that football clubs aren’t commercial animals, people have to grow up and accept that. “We’ve got to live in the real world where footballers are getting £200k a week, big businesses are broadcasting it around the world, it is now a money business.”  Sky Bet: Bet £10 on Football, Get £30 in Free Bets* – CLAIM HERE NEW CUSTOMERS ONLY. FIRST SINGLE & E/W BET ONLY. ODDS OF 1/1 OR GREATER. 3 x £10 BET TOKENS. FREE BET STAKES NOT INCLUDED IN RETURNS. FREE BETS ONLY REDEEMABLE ON FOOTBALL. FREE BETS ARE NON-WITHDRAWABLE. NO FREE BET EXPIRY. ELIGIBILITY RESTRICTIONS AND FURTHER T&CS APPLY. 18+. BEGAMBLEAWARE.ORG ",positive
19,https://talksport.com/football/1099694/man-utd-transfer-ward-prowse-beckham-free-kick-record-world-cup-2022/,"‘Phenomenal’ James Ward-Prowse is a Manchester United transfer target, has David Beckham free-kick record in his sights, and wants World Cup 2022 role","Manchester United transfer target James Ward-Prowse has been tipped to leave Southampton this summer by former teammate Charlie Austin. The England international is enjoying his most prolific season of his career, netting 10 goals in all competitions, and a £75million deal has now been mooted ahead of the Old Trafford overhaul. His set-piece taking has always been lavished with praise and this season a raft of fantastic free-kicks see him now hot on the heels of David Beckham’s Premier League record. The England icon netted 18 in the English top flight and Ward-Prowse now has 14 to his name. But as a potential battle with Man City for his signature beckons, the clubs challenging for the midfielder have been told that the ‘underrated’ schemer would not only be valuable because of his deadball abilities. Austin, who played with Ward-Prowse 46 times over a four-season spell, reckon his all-round game make him a ‘phenomenal’ acquistion, despite the midfielder taking his time to reach his peak. Asked why he had taken so long to reach this level, he told Drive Time last week: “I don’t know. When I was there with him he played second fiddle to [Victor] Wanyama, to Pierre-Emile Hojbjerg, Jordy Clasie, Oriol Romeu and Steven Davis. “Maybe he just took his time and then over the last two years he’s cemented himself as club captain but certainly know I think it’s time to leave.”  So why would Ward-Prowse want to leave having reached new heights at St Mary’s? Austin thinks he may well have ambitions for later in the year. He said: “I think, if he wants to go to the World Cup, he needs to be at a different football club [compared] to what Southampton are offering and how they are performing. “I think he’s more appealing if he’s at a different club.” Pressed again on why he didn’t move earlier in his career, Austin added: “He’s come throught the academy there and has been there for so many years. I just think that it hasn’t been the right opportunity. “I think now is the time for him to move. “His set-pieces and that are brilliant. He’s probably going to beat David Beckham’s record but, the nuts and bolts of his game, running hard, winning the ball back, and leading his team are phenomenal.”  And former Newcastle and Crystal Palace star Darren Ambrose also believes that Ward-Prowse is capable of playing for a side outside of the top three – which is definitely the case right now for United. He toldtalkSPORT:“I’ve been a massive advocate of James Ward-Prowse, and I think he gets into any team. “If you look at the Premier League table with Manchester City, Liverpool and Chelsea as the top three, anybody below that he would get in the team as a starter and not make them worse, absolutely.  “The argument of what happens if you take the free-kicks out of it, you can’t because that’s a massive part of the game. “Not many clubs have a set-piece taker like him so you can’t argue about what happens if you take that element out of his game.” He added: “When you’ve got a player like James Ward-Prowse, there’s no one better as a deliverer of balls into the box and when you get a free-kick around the box, you think it’s a goal. I think he’s massively underrated.” Sky Bet: Bet £10 on Football, Get £30 in Free Bets* – CLAIM HERE NEW CUSTOMERS ONLY. FIRST SINGLE & E/W BET ONLY. ODDS OF 1/1 OR GREATER. 3 x £10 BET TOKENS. FREE BET STAKES NOT INCLUDED IN RETURNS. FREE BETS ONLY REDEEMABLE ON FOOTBALL. FREE BETS ARE NON-WITHDRAWABLE. NO FREE BET EXPIRY. ELIGIBILITY RESTRICTIONS AND FURTHER T&CS APPLY. 18+. BEGAMBLEAWARE.ORG ",positive
