,URL,Content_title,Contents,Sentiment
7,https://talksport.com/football/1075375/premier-league-relegation-run-in-fixtures-permutations-predicted-finishes-leeds-everton-watford-burnley-norwich/,"Premier League relegation run-in: Remaining fixtures, key clashes, permutations and predicted finishes for bottom five as Everton battle Leeds and co to survive, Norwich already relegated","We are into May, which means we are nearing the end of the 2021/22 Premier League campaign and the relegation battle looks like it will go down to the wire. At the end of the year, three teams will be relegated from the top flight and into the Championship. Norwich City’s demotion has already been confirmed, but who will join them? Assuming Southampton and Brentford are now safe, the fight to survive is down to four teams. Most sides have four games remaining this season but Everton have five, which could cause heartbreak for some. Here, talkSPORT looks at how the Premier League relegation picture is shaping up as we enter the final weeks of the campaign.   Burnley have been in the Premier League for six seasons and they now look capable of securing a seventh. The Clarets have won three league games in a row to move out of the drop zone and above Leeds United. They have still only scored 31 goals but they have found a way to win games at this crucial stage of the season. It now looks possible they will stay up after Michael Jackson replaced Sean Dyche and the Clarets are unbeaten in his four matches so far. They have what looks to be a favourable fixture list, with Tottenham the only fixture you would think they would struggle to take anything from. The ties against Aston Villa and Newcastle at Turf Moor look huge, and if they can win both of them, Burnley should remain in the Premier League. Predicted finish – 17th Aston Villa – H – 7 May Tottenham – A – 15 May Aston Villa – A – 19 May Newcastle – H – 22 May  Leeds have conceded the most goals in the Premier League (72), one more than Norwich, and because of that, relegation is still a threat. This year has been a struggle for Leeds and they have been in a dog-fight all season. Injuries to key players have exposed their squad and, after heavy defeats to the likes of Liverpool, Everton and Tottenham, Marcelo Bielsa was sacked and replaced by Jesse Marsch. The American made a poor start but the Whites were unbeaten in five. However, they were thrashed by Manchester City at the weekend and are only two points clear of the drop zone. Leeds still have to play Chelsea and Arsenal, while they travel to Brentford on the last day of the season. The Whites also take on Brighton, with the Seagulls in decent form at the moment. Leeds’ recent wins over Norwich, Wolves and Watford looked to have been enough to keep them up. But Burnley’s resurgence means they will probably need at least one more victory from their final four to seal their place in the Premier League next season. Predicted Finish – 16th Arsenal – A – 7 May Chelsea – H – 17 April Brighton – H – 15 May Brentford – A – 22 May  Everton have never been relegated from the Premier League but there is a real danger of that happening this year. Poor decisions have hit the Toffees hard and they are now relying on Frank Lampard to save them. Everton replaced Carlo Ancelotti with former Liverpool boss Rafael Benitez, and despite a good start, it was never going to end well, and the Spaniard was dismissed in January. Lampard has arrived in his place and the Toffees are unbeaten in four at Goodison Park, but defeats away from home to Burnley, West Ham and Liverpool have plunged them into deep trouble. At the moment, it is hard to see Everton picking up another point on the road, given they have lost their last seven away fixtures. So, the home games against Brentford and Crystal Palace are huge. Predicted finish – 18th Leicester – A – 7 May Watford – A – 11 May Brentford – H – 15 May Crystal Palace – H – 19 May Arsenal – A – 22 May  Watford are onto their third manager of the season and they hope Roy Hodgson can keep them in the Premier League. The Hornets started well with Emmanuel Dennis impressing, but things turned sour, and Xisco Munoz was sacked and replaced by Claudio Ranieri. The Italian managed just one league win against Man United and was dismissed after a 3-0 defeat to Norwich. Hodgson has tried to sort out the defence and Watford have managed two wins since he arrived, but they have lost five games in a row and are 12 points from safety. The Hornets still have four matches to play and face Chelsea. But the big clash is against Everton. However, they lost to Leeds, Brentford and Burnley, which means an escape is looking very unlikely. Hodgson knows how to keep teams up, but he might have arrived too late to save Watford… Predicted finish – 19th Crystal Palace – A – 7 May Everton – H – 11 May Leicester – H – 15 May Chelsea – A – 22 May  Norwich have been in the relegation zone the whole season, and on Saturday after defeat to Aston Viilla, they were officially relegated. The Canaries have managed five wins but have lost 23 of their 34 games and have conceded 71 goals. Smith tried his best, but an escape never looked likely and they have to reflect on a very disappointing campaign. Norwich were active in the summer transfer market and brought in 11 players, but it wasn’t enough. Smith’s side still have West Ham and Tottenham to face, so there could be a bit more pain for supporters to endure before they can forget about this campaign altogether. Predicted finish – 20th West Ham – H – 7 May Leicester – A – 11 May Wolves – A – 15 May Tottenham – H – 22 May Sky Bet: Bet £10 on Football, Get £30 in Free Bets* – CLAIM HERE NEW CUSTOMERS ONLY. FIRST SINGLE & E/W BET ONLY. ODDS OF 1/1 OR GREATER. 3 x £10 BET TOKENS. FREE BET STAKES NOT INCLUDED IN RETURNS. FREE BETS ONLY REDEEMABLE ON FOOTBALL. FREE BETS ARE NON-WITHDRAWABLE. NO FREE BET EXPIRY. ELIGIBILITY RESTRICTIONS AND FURTHER T&CS APPLY. 18+. BEGAMBLEAWARE.ORG ",positive
8,https://talksport.com/football/1100095/man-utd-roy-keane-all-time-xi-cristiano-ronaldo-paul-scholes/,Roy Keane names all-time Manchester United XI and includes legends Cristiano Ronaldo and Wayne Rooney but explains why Paul Scholes misses out,"Roy Keane shared a dressing room with some unbelievable players during his time at Manchester United. So when the time came to pick his ultimate Red Devils Premier League XI, he was always going to be spoilt for choice.  Sky Sports asked the United legend to pick his team on Monday Night Football after watching his former club beat Brentford 3-0. Keane admitted he was reluctant to do so because of the risk of upsetting people, but did what he was told, and there was inevitably going to be some huge names left out. “I’ve told you before, I don’t like doing this,” Keane said. “I don’t like upsetting some of my teammates. It’s not easy. “I had to leave out some brilliant characters and brilliant players.” The most notable omissions were the likes of Paul Scholes, Rio Ferdinand and Eric Cantona, while also picked some he didn’t exactly get on with.  Keane and Schmeichel famously did not get on, with the pair once having a scuffle in a hotel before a big match, but he was still the pick over Edwin van de Sar and David de Gea in between the sticks. “He was very good… not as good as everyone thought,” Keane said. “He was a good character in the dressing room. The most important thing I had for him was huge respect. He produced big moments and got us through big matches. Peter would produce and help us get trophies. “Being good characters, making important saves. Because we were a decent team, Peter wasn’t called upon much, but he made some big saves for us. He was lively and he produced in the important moments. “Who won the fight? We say it was a draw.”  Neville dominated the right-back position for so many years at Old Trafford, so this decision – with respect to the likes of Wes Brown, Raphael and Paul Parker – was perhaps one of Keane’s easiest. The former midfielder said about Neville: “Brilliant. He was a brilliant player. He was a brilliant character in a sense, he would go to bed at 8.30pm in the evening and we would criticise him. We all embraced Gary. Gary fell into the group, no problem. “In fairness, when you get into the first team, Gary became more vocal. There’s no stopping him now. Looked after himself. You have to have quality to do what he did.”  Republic of Ireland international Irwin and Keane were good friends so there’s no surprise he made it to left-back, and was a pretty decent player to go with it. Kean said: “I roomed with Dennis at United and Ireland. Brilliant trainer, very rarely injured, turned up to the big matches. If he was playing now, Dennis would be up there with the best. He was a good fella.”  Now is where some of the controversial picks start. United had some fantastic centre-backs from Rio Ferdinand, Nemanja Vidic and Steve Bruce, but Keane explained why he had to go for Stam and Pallister. “I couldn’t leave Jaap Stam out. Big strong, brave, brilliant in the one vs ones. I’ve also gone with Garry Pallister. Rio was a good athlete and read the game well, but my relationship with Pally was good. When I first went to United, there were certain lads who went out their way to help and [Lee] Sharpey and Pally were always on the scene. “I was not surprised [when Stam left]. Jaap had a bad injury. But when you’re at a big club, players do come and go quickly. It was a case of moving on.”  United had some brilliant midfielders during the Premier League era and perhaps none more memorable than Beckham. Keane said: “He was younger. He was from London, he loved his gear and his cars. They all have hobbies, but the key for me was are they training properly and giving everything for the cause? Becks did that. “I don’t think I once fell out with him over anything because he turned up every day and put a shift in.”  Giggs is perhaps the greatest Manchester United player of the Premier League era with an incredible 963 appearances in all competitions and a remarkable 13 league titles. “Where do you want to start? He could assist. Everything you want from a wide player. The amount of goals they got from each others’ crosses. “I never felt, even with Giggsy, they were distracted by the off-the-field stuff. Giggs was a superstar in a sense but he was a good teammate to have.”  There were plenty of names Keane could have named in here and one of the most surprising is perhaps leaving out Scholes in favour of Ince. Keane said: “Robson has to go in there. He was a great player for Man United. Scored some big goals for the club. I’m going to put Paul Ince. Another very good player. Tarnished his reputation a bit, he ended up playing forLiverpool. He was a really good teammate. “Tough leaving Scholes out. But I thought Incey was brilliant in midfield. Good teammate to have next to you. He could head it and score goals. I enjoyed his company.”  From Eric Cantona to Ole Gunnar Solskjaer, Andy Cole and Ruud van Nistelrooy, Keane probably could have picked several strikers in his best XI, but the two he went for were Rooney and Ronaldo. “Yorkie was brilliant, Cantona was brilliant, Ruud, Mark Hughes, Ole. Oh my goodness. Ronaldo and Wayne have to go for what they achieved in the game. All the other brilliant lads I’ve played with, I couldn’t leave any of them two out. “It was easy. You see these young lads coming through, as long as they’re giving their all, that’s part of learning. “These lads, Wayne and Ronaldo, I always felt their priority was football at Man United. If they make a mistake, you try and help them. “Sometimes players have to learn from their mistakes, we certainly wouldn’t be coming down hard.”   When asked if he was happy with his choices, Keane said: “Yeah I’m okay with that. Put it this way, you’ve got a chance [of winning the Premier League]. That’s all you want. “You’ve got players turning up, you’ve got goals in the team, you’ve got characters, you’ve got height, physicality, pace. When asked who would be the manager, Keane joked: “Big Ron Atkinson.” Sky Bet: Bet £10 on Football, Get £30 in Free Bets* – CLAIM HERE NEW CUSTOMERS ONLY. FIRST SINGLE & E/W BET ONLY. ODDS OF 1/1 OR GREATER. 3 x £10 BET TOKENS. FREE BET STAKES NOT INCLUDED IN RETURNS. FREE BETS ONLY REDEEMABLE ON FOOTBALL. FREE BETS ARE NON-WITHDRAWABLE. NO FREE BET EXPIRY. ELIGIBILITY RESTRICTIONS AND FURTHER T&CS APPLY. 18+. BEGAMBLEAWARE.ORG ",positive
9,https://talksport.com/football/1099792/william-saliba-marseille-loan-transfer-arsenal-return-thierry-henry/,"Thierry Henry criticises Arsenal for William Saliba treatment, as on-loan defender brands Marseille ‘my club’ and comments on future","Arsenal defender William Saliba has hinted he wants to stay at Marseille beyond the end of the season, as a Gunners icon hit out at the club for their treatment of him. The French centre-back is currently starring for the French club, having arrived on loan from the Gunners at the start of the season. The 21-year-old has been hailed as a ‘future great of French football’ by his current Marseille manager Jorge Sampaoli, with Saliba hugely impressing across his 49 appearances for the club this season, including 34 Ligue 1 starts. His form this term has placed a big question mark over his future, and whether he will return to Arsenal or, like former Gunners teammate and fellow Frenchman Matteo Guendouzi, seal a permanent move to his on-loan side. Saliba is yet to play a competitive game forMikel Artetain more than two years at the club, and has recently called Marseille ‘my club’ – implying he may not be keen on a return to north London. “My wish is to finish the season well, to leave on a good note in case I don’t come back,” Saliba said in a recent interview. “It would be my pleasure to come back no matter what, it’s not as if I know I’m not going to come back, it’s Marseille, it’s my club.” Having helped Marseille to second place in Ligue 1 and a place in next season’s Champions League, Saliba admitted he would love to get a taste of that atmosphere.  He added: “[Playing in] the Champions League with OM? When you see the atmosphere in the Conference League or in Ligue 1, I can’t even imagine what it would be like on a Tuesday or Wednesday evening.” Meanwhile, Arsenal legend Thierry Henry has revealed his confusion and frustration with his former club’s handling of Saliba’s situation. The north London club’s all-time top goalscorer has questioned why the young defender was forced out of the Emirates Stadium before being given a real opportunity in the first team. “They didn’t even let him make a mistake,” the Arsenal legend toldAmazon Primeof his old club’s treatment of Saliba.  “He left before an error. He didn’t even have the chance to compete for his place. “What he is doing here is extraordinary. He was rewarded with a selection for the France team. “At the moment, he belongs to Arsenal, I don’t know where he will end up. We have seen that it was a little difficult for him to express himself on the subject. “What I know is that he could have been in the Arsenal group. I am not Mikel Arteta, but I found it difficult for him. Anyway, he responded well and that’s the most important thing.” Sky Bet: Bet £10 on Football, Get £30 in Free Bets* – CLAIM HERE NEW CUSTOMERS ONLY. FIRST SINGLE & E/W BET ONLY. ODDS OF 1/1 OR GREATER. 3 x £10 BET TOKENS. FREE BET STAKES NOT INCLUDED IN RETURNS. FREE BETS ONLY REDEEMABLE ON FOOTBALL. FREE BETS ARE NON-WITHDRAWABLE. NO FREE BET EXPIRY. ELIGIBILITY RESTRICTIONS AND FURTHER T&CS APPLY. 18+. BEGAMBLEAWARE.ORG ",positive
10,https://talksport.com/football/1100088/cristiano-ronaldo-age-stats-manchester-united-premier-league/,Cristiano Ronaldo proves that age is but a number as key Manchester United stat emerges following goal against Brentford in Premier League win,"Manchester United have lacked much in the way of success this term, but Cristiano Ronaldo might just be the exception. In a largely disappointing season, the 37-year-old has been one of the few bright spots after completing a move from Juventus last summer and proving to the football world he very much still has it. Given Ronaldo’s age, plenty of pundits suggested the Portugal star might struggle to thrive in the elite environment of the Premier League, but if there’s one thing CR7 enjoys it’s the pressure of proving people wrong. After scoring twice on his second United debut in the 4-1 victory over Newcastle, supporters knew their former hero had not lost any of his sparkle and that’s become abundantly clear in the months since. In fact, there’s even a suggestion that he’s got better since he was last at the club. Ronaldo’s last season at Old Trafford was in the 2008/09 campaign in which the forward racked up 18 goals in 33 Premier League appearances. This term, he’s exceeded that with time to spare. In 29 league appearances, three of which have come from the bench, Ronaldo has already scored 18 times.  With three top flight fixtures remaining, it would take a brave person to bet against Ronaldo exceeding that tally. Of course there’s ongoing speculation about whether the experienced forward will remain at United next term, but regardless of what the future holds, it’s clear that Ronaldo’s Old Trafford legacy is well and truly intact after his hugely successful swansong. With his immediate future in doubt, Piers Morgan made a rather bold call during his appearance on talkSPORT as he called for the player to leave United and move to his beloved Arsenal instead. Speaking ontalkSPORT Breakfast, Morgan said: “When it comes down to money and owners and riches and banking, we’ve got the richest of all of them.  “Stan Kroenkehas got £10billion, he’s married to a woman who has got even more in the Walmart heiress who has £15billion. He’s just bought a ranch for £750million, he can afford to buy a couple of strikers! “Do you know what I’d do if I was Arsenal manager? I’d go in, get Cristiano Ronaldo and put him up front. I’ve had this conversation with him last week. I said ‘come to Arsenal’. “The Arsenal and Manchester United thing is very interesting. On paper, United have far more talented players and far more experienced, talented players but they don’t have the right attitude. “The mental attitude is shocking. Whatever is going on in that club…if they didn’t have Ronaldo in the team they wouldn’t be winning, whereas Arsenal have young, hungry, really promising guys who have a great attitude. People like [Bukayo] Saka, [Emile] Smith Rowe, [Kieran] Tierney and all of these guys.  “That’s what’s encouraging. If you combined the United talent with our mentality then both clubs would be sorted. “I’m not even joking. I’d love to bring Cristiano Ronaldo to Arsenal. If he’s not going to stay at United, I’d take him in a heartbeat. “I watched that game at the weekend and he was the best player on the pitch. “As a striker, when you watch Ronaldo’s movement and his goalscoring record at 37, I’d put Ronaldo at the front and let these kids learn from him.” However, for now it appears he is staying put judging by his most recent celebration at Old Trafford. Sky Bet: Bet £10 on Football, Get £30 in Free Bets* – CLAIM HERE NEW CUSTOMERS ONLY. FIRST SINGLE & E/W BET ONLY. ODDS OF 1/1 OR GREATER. 3 x £10 BET TOKENS. FREE BET STAKES NOT INCLUDED IN RETURNS. FREE BETS ONLY REDEEMABLE ON FOOTBALL. FREE BETS ARE NON-WITHDRAWABLE. NO FREE BET EXPIRY. ELIGIBILITY RESTRICTIONS AND FURTHER T&CS APPLY. 18+. BEGAMBLEAWARE.ORG ",positive
11,https://talksport.com/football/1100030/erik-ten-hag-cristiano-ronaldo-man-utd-transfer-news/,"Erik ten Hag told to ‘find a way’ to get ‘phenomenal’ Cristiano Ronaldo in Manchester United team, and Ralf Rangnick wants quality strikers","talkSPORT host Jason Cundy believes incoming Manchester United manager Erik ten Hag must prioritise getting Cristiano Ronaldo into his team. The Ajax manager will take the reins at Old Trafford in the summer, and after underwhelming Premier League season, with the new man expected to oversee a squad overhaul. Ten Hag’s favoured style of play centres around dominating possession and pressing from the front which doesn’t necessarily suit 37-year-old Ronaldo, who’s Man United’s top scorer this season. But despite this, Cundy believes that whilst United do need to bolster their attacking options, Ten Hag must still build his team around Ronaldo given his impressive displays, which has seen him notch up 24 goals so far this season. “If Ten Hag is going to play the way he has done at Ajax, you would’ve thought that Ronaldo cannot play every single game,” the former Chelsea player said on The Sports Bar following Man United’s 3-0 win over Brentford. “But then you find a way. His goals have been phenomenal again. His goals to game ratio is phenomenal, greatest goal scorer ever. “So you find a way to have Ronaldo in and around the squad. Whether he’s going to start 38 Premier League games I very much doubt, I can’t see that happening. “United do need help up top, they do.”  United legend Gary Neville echoed Cundy’s thoughts, saying on commentary for Sky Sports: “This is the best they have played this season. “They have looked more connected as a team. “My man of the match is Cristiano Ronaldo. The penalty, the build-up to it, and he had one disallowed in the first half. “Just his all-round performance has been outstanding.” The Portuguese’s future at the club has been questioned over the last few months after his side have suffered yet another disappointing season, with hopes of silverware fading after their defeat to Atletico Madrid in the last-16 of the Champions League in March. However, despite this, Red Devils hero Roy Keane doesn’t believe his former teammate Ronaldo is heading for the exit, agreeing that Ten Hag needs to keep him at Old Trafford.  “I don’t think his body language was suggesting that he was leaving,” Keane explained. “I just look at the goals he’s got, his performances warrant him staying at the club.” Keane continued: “But Man United need to get other strikers in there, there has to be competition for places. If your leading goal scorer, who you’re depending on is 37 years of age, then that’s certainly not good. “But I’d certainly be hanging on to Ronaldo. You might have to have a conversation about the way you’re going to play, or that he won’t be playing week, in week out. But why would you get rid of a player that scores that many goals?” And the need for additional firepower is something current boss Ralf Rangnick is well aware of.  “For me, it is obvious Manchester United needs two more quality strikers that just give this team more options, more quality and more weapons,” he said. Asked what he meant, he explained: “Strikers. Modern strikers do not necessarily have to be wingers. If you look to Liverpool or Manchester City and look at their strikers, they have five or six top-class strikers. “Gabriel Jesus, until four or five weeks ago, he hardly played. Now he is playing again regularly and if you look at the number of players they have and ask me if Gabriel Jesus is a central striker or a winger, is Grealish a central striker or a winger, they are all strikers who can play in different positions, they can also switch and they can rotate. “That kind of players, we don’t have that many. Mason Greenwood would have been one of those players who regularly played but then after the West Ham game he was no longer part of the squad. “Martial was on loan at Sevilla, Edinson Cavani was injured most of the time so we didn’t have that many alternatives up front.” Sky Bet: Bet £10 on Football, Get £30 in Free Bets* – CLAIM HERE NEW CUSTOMERS ONLY. FIRST SINGLE & E/W BET ONLY. ODDS OF 1/1 OR GREATER. 3 x £10 BET TOKENS. FREE BET STAKES NOT INCLUDED IN RETURNS. FREE BETS ONLY REDEEMABLE ON FOOTBALL. FREE BETS ARE NON-WITHDRAWABLE. NO FREE BET EXPIRY. ELIGIBILITY RESTRICTIONS AND FURTHER T&CS APPLY. 18+. BEGAMBLEAWARE.ORG ",positive
