,URL,Content_title,Contents,Sentiment
0,https://talksport.com/football/1099401/man-utd-liverpool-villarreal-arsenal-ronaldo-news-transfer-gossip-live/,"Football news and transfer gossip LIVE: Reaction as Ronaldo inspires Manchester United again, but Rangnick ‘not happy’, Liverpool in Champions League semi-final build-up, Arsenal step up new striker search","talkSPORT.com brings you all the latest news and gossip from the world of football… Cristiano Ronaldo rose to the occasion again for Manchester United as they beat Brentford 3-0 in the Premier League last night, and we’ll being you all the latest reaction to the Portuguese superstar’s stunning display. It was a good night for the Red Devils in their final Old Trafford game of the season, but not for everyone – with Jesse Lingard’s brother hitting out  at the club for not giving the England international a chance of a sendoff, unlike departing teammates Nemanja Matic and Juan Mata. And we also build-up to the start of the crucial second legs of the Champions League semi-finals, with Liverpool up first as they travel to Villarreal with a 2-0 lead – with LIVE COMMENTARY on talkSPORT. We’ll also bring you live Championship commentary from Bournemouth vs Nottingham Forest in the battle for second place and automatic promotion to the top flight, after Fulham were crowned champions last night. Presented by Adrian Durham. Commentary from Jim Proudfoot and former Republic of Ireland midfielder Andy Townsend. Commentary from Ian Danter and former West Ham and Wimbledon striker David Connolly. ",positive
1,https://talksport.com/football/1100251/man-utd-gary-neville-scarf-roy-keane-jamie-carragher/,‘There must have been a sale on’ – Roy Keane and Jamie Carragher crack jokes as Manchester United fan spotted wearing Gary Neville scarf,"Roy Keane and Jamie Carragher couldn’t help but crack a few jokes after spotting a Manchester United fan wearing a Gary Neville scarf. Neville is a Red Devils legend and made more than 600 appearances for the club in an illustrious career that spanned from 1992 to 2011. He won 20 trophies during his time at the club, which included eight Premier League titles. There is still plenty of affection for the former right-back at Old Trafford and one fan was even sporting a unique scarf in Neville’s honour during their 3-0 win over Brentford on Monday. The Sky Sports cameras panned to the man in question, and Keane and Carragher couldn’t let the opportunity pass. “There must have been a sale on,” former Manchester United captain Keane said. Host David Jones said: “I’m sure they’ll catch on.” Liverpool legend Jamie Carragher added: “Gary Neville or Teabag?”  The Liverpool legend referencing that Neville has an uncanny likeness to the Prison Break character. Keane had some very kind words about Neville later on in Monday Night Football, though, as he picked him in his all-time Manchester United XI. The former midfielder said about the former England right-back: “Brilliant. He was a brilliant player. “He was a brilliant character in a sense, he would go to bed at 8.30pm in the evening and we would criticise him. We all embraced Gary. Gary fell into the group, no problem. “In fairness, when you get into the first team, Gary became more vocal. There’s no stopping him now. Looked after himself. You have to have quality to do what he did.” talkSPORT's new sport trivia game is live! Win cash prizes every fortnight with talkSPORT’s new sportstriviagame. Enter today HERE for your chance to win £2,500 CASH! All you need to do is answer at least three quiz questions correctly for a chance to enter into the main prize draw. If you play everyday you could win one of our daily prizes, so what are you waiting for? Own the game and join talkSPORTTriviatoday. Play now HERE 18+. Terms and Conditions and Competition rules apply. See full details here. ",positive
2,https://talksport.com/football/1100217/arsenal-transfer-news-lautaro-martinez/,Arsenal to renew interest in Inter Milan star Lautaro Martinez with transfer hinging on Champions League with Man United also keen,"Arsenal have renewed their interest in signing Inter striker Lautaro Martinez. According to The Times, the Gunners are hoping their improved chances of playing in next season’s Champions League could help them in luring the 24-year-old to the Premier League. Martinez has been hugely impressive for the Italian giants this term having scored 21 goals for Simone Inzaghi’s side, which has kept a number of European rivals on alert. This includes Manchester United who could reportedly offer Anthony Martial in exchange. And while Martinez is among the top targets for Mikel Arteta’s side, he’s not the only player whom the Spaniard is after. Gabriel Jesus of Manchester City and Everton’s Dominic Calvert-Lewin are also said to be on the club’s radar as they prepare to revamp their forward line this summer. Arsenal’s hopes of signing Martinez could hinge on their ability to finish the season in the top four. The Gunners are sitting in fourth in the Premier League at present, two points clear of rivals Tottenham, however, with a north London derby just around the corner, talkSPORT host and former Tottenham midfielder Jamie O’Hara believes it’s Spurs who will pip Arsenal to the final Champions League spot.  He told thetalkSPORT Breakfast: “We’ve got to get through Liverpool which is a tough fixture and I’ll be surprised if we get anything from that, but both Arsenal and Tottenham are where they are because they have inconsistent performances. “If we’re talking about winning all of our games between now and the end of the season, we’d be like Chelsea and Liverpool. “We’ll slip up and Arsenal will slip up. We’ve got the north London derby which will be the biggest north London derby in recent times and that is a huge, huge fixture. “I just fancy us, under the lights with the players that we’ve got and the front three that we’ve got. If we step up I think we can turn them over, I really do. “This is a young Arsenal side and credit to them, no one expected them to be where they are and it was a big performance against West Ham and they’re a good young team. “But I think that Spurs have just got a little bit more experience than them and when the pressure’s on, we might just find a way to get it done.” Sky Bet: Bet £10 on Football, Get £30 in Free Bets* – CLAIM HERE NEW CUSTOMERS ONLY. FIRST SINGLE & E/W BET ONLY. ODDS OF 1/1 OR GREATER. 3 x £10 BET TOKENS. FREE BET STAKES NOT INCLUDED IN RETURNS. FREE BETS ONLY REDEEMABLE ON FOOTBALL. FREE BETS ARE NON-WITHDRAWABLE. NO FREE BET EXPIRY. ELIGIBILITY RESTRICTIONS AND FURTHER T&CS APPLY. 18+. BEGAMBLEAWARE.ORG ",positive
3,https://talksport.com/football/1100129/aleksandar-mitrovic-goal-record-fulham-newcastle-premier-league-promotion-relegation-championship/,Fulham striker Aleksandar Mitrovic holds astonishing record as former Newcastle man records fourth promotion of his career… and will hope to avoid another Premier League relegation,"Fulham are facing the challenge of adapting to life back in the Premier League after securing promotion from the Championship. Thankfully, in Aleksandar Mitrovic, they have a player who is used to making that transition – although the Serbian striker will now want to buck the trend of his unwanted record. A stunning 7-0 victory over Luton on Monday evening saw the Cottagers cement top spot in the second tier, with Mitrovic earning plaudits of his own. Scoring a brace at Craven Cottage, the 27-year-old frontman scored his 43rd goal of the season, becoming the Championship’s highest-ever goalscorer in a single campaign and the highest-scoring player in a single season in English football for over half a century. He surpassed Guy Whittingham’s 42 goals for Portsmouth in 1992/93, the most in the current 46-game league format, and only former Middlesbrough player George Camsell’s tally remains superior to Mitrovic’s in the division’s history, setting the frankly unbeatable record of 59 back in 1927/28. As a result, Mitrovic will be hoping to use some of those goals to help Fulham avoid relegation from the top flight next season. Unfortunately, based on his track record, facing the drop next term could be written in the stars. Mitrovic has spent seven years playing in English football, with the striker earning either promotion or suffering relegation in every one of those campaigns.   The former Newcastle United’s striker’s first season at St James’ Park saw the club relegated from the top flight in 2015/16, before being promoted again the next year. In 2017/18, Mitrovic spent the second half of the season on loan with Fulham, where he helped the club to earn promotion via the play-offs  with 12 goals in 20 matches. Since then, the 27-year-old has been part of the yo-yo culture at Craven Cottage, with two demotions and two promotions putting Fulham firmly in the category of inbetweeners. While surely proud of the promotions achieved, Mitrovic will no doubt be hoping that he can end this run next term by helping Fulham finally establish themselves as a Premier League club for more than just one year. talkSPORT's new sport trivia game is live! Win cash prizes every fortnight with talkSPORT’s new sportstriviagame. Enter today HERE for your chance to win £2,500 CASH! All you need to do is answer at least three quiz questions correctly for a chance to enter into the main prize draw. If you play everyday you could win one of our daily prizes, so what are you waiting for? Own the game and join talkSPORTTriviatoday. Play now HERE 18+. Terms and Conditions and Competition rules apply. See full details here. ",positive
4,https://talksport.com/football/1100102/cristiano-ronaldo-man-utd-jamie-carragher-liverpool-erling-haaland-transfers/,"‘Small club’ – Jamie Carragher slams Manchester United’s decision to re-sign Cristiano Ronaldo, saying Erik ten Hag should look to sign Erling Haaland this summer","Manchester United’s move to re-sign Cristiano Ronaldo last summer made Jamie Carragher think they were ‘a small club’, the Liverpool legend has revealed. The Red Devils have endured a difficult season by their own high standards, but the 37-year-old has been a rare shining light with his tally of 18 Premier League goals this term matching his final season at Old Trafford before leaving for £80miilion in 2009. Speculation is building about Ronaldo’s future at the club with a return to Real Madrid suggested as a potential solution, however that will depend on Erik ten Hag’s plans when he arrives this summer. With a big rebuild tipped, talk has started about how United can close the gap on the likes of Liverpool and Manchester City who are running away at the top of the tabl. And, according to Carragher, it’s time that United started focusing on long-term solutions if they’re to restore their status as one of Europe’s top teams. Speaking to Sky Sports, Carragher said: “I see Manchester United as one of the super clubs of world football, and I just look at the others ones like Bayern Munich, Real Madrid, Juventus, Barcelona; the ones who have won Champions Leagues. “Even Liverpool right now. Would Liverpool go and bring back Luis Suarez? I don’t think they would, even if they knew he was going to get 20 goals. “Manchester United, for me, should be signing [Erling] Haaland this summer. Man City are getting Haaland, while United have got Ronaldo.   “He is a legend and one of the best goalscorers of all time, and I get that – but it almost made me think that United are a small club. “It reminded me of Wayne Rooney going back to Everton. They knew they weren’t going to win something when Rooney came back but it gives everyone a lift, Wayne’s happy to go back.” Former Man United captain Roy Keane chimed in, saying: “It felt like a short-term fix. [ “[It was] for the fans, the share price and all that, but yeah, he’s still scored the goals that you thought he would do. “As you’ve said, Jamie, I think Man United have got bigger problems than Ronaldo, but it’s something that has to be looked at.”  Signing a new-look attack will be the main priority for United this summer but, according to Ralf Rangnick, that may not come in the form of a traditional number nine. The interim head coach explained: “For me, it is obvious Manchester United needs two more quality strikers that just give this team more options, more quality and more weapons.” Asked for specifics, Rangnick added: “Strikers. Modern strikers do not necessarily have to be wingers. If you look to Liverpool or Manchester City and look at their strikers, they have five or six top-class strikers. “Gabriel Jesus, until four or five weeks ago, he hardly played. Now he is playing again regularly and if you look at the number of players they have and ask me if Gabriel Jesus is a central striker or a winger, is Grealish a central striker or a winger?  “They are all strikers who can play in different positions, they can also switch and they can rotate. “That kind of players, we don’t have that many. Mason Greenwood would have been one of those players who regularly played but then after the West Ham game he was no longer part of the squad. “Martial was on loan at Sevilla, Edinson Cavani was injured most of the time, so we didn’t have that many alternatives up front.” Sky Bet: Bet £10 on Football, Get £30 in Free Bets* – CLAIM HERE NEW CUSTOMERS ONLY. FIRST SINGLE & E/W BET ONLY. ODDS OF 1/1 OR GREATER. 3 x £10 BET TOKENS. FREE BET STAKES NOT INCLUDED IN RETURNS. FREE BETS ONLY REDEEMABLE ON FOOTBALL. FREE BETS ARE NON-WITHDRAWABLE. NO FREE BET EXPIRY. ELIGIBILITY RESTRICTIONS AND FURTHER T&CS APPLY. 18+. BEGAMBLEAWARE.ORG ",positive
5,https://talksport.com/football/1079953/premier-league-top-four-race-champions-league-key-clashes-fixtures-predicted-finishes-permutations-arsenal-tottenham-manchester-united-chelsea-west-ham/,"Premier League top four run-in: Remaining fixtures, key clashes, permutations and predicted finishes for contenders including Arsenal, Tottenham and Manchester United","The race for the Premier League top four this season has the potential to go right to the wire as five clubs battle it out for the remaining European places. We are now into May, which means the business end of the year is fast approaching and the race for the Champions League spots is at fever pitch. With Manchester City and Liverpool well clear at the top, there are five more teams in contention for the final two Champions League places plus the Europa League spots, with some massive ties ahead. Most of the sides involved only have four games left, but Manchester United only have two. Here talkSPORT takes a look at the Premier League top-four battle as we approach the end of the campaign…   Chelsea have been in the top four the whole season, and are five points clear of fifth. However, their place in the top four isn’t secure yet and they are going to need a few more results from their last four league games. Thomas Tuchel’s side started the campaign as genuine title contenders, but four wins in 11 saw them drop well behind City and Liverpool. From there, it looked as if the Blues would comfortably seal third, but after defeats to Brentford, Arsenal and Everton, that doesn’t look to be guaranteed yet. Chelsea have had to deal with carnage away from the pitch this season, which would likely mean the Blues will have to cap their spending this summer. So, if they were to miss out on the Champions League, who knows what could happen to the club without that income? In their remaining games, Chelsea face Wolves and Leeds. If they manage to avoid defeat in these fixtures, they should do enough to secure their place in the top four. But a season that had so much promise looks like it will end in slight disappointment. Predicted finish – 3rd Wolves – H – May 8 Leeds – A – May 11 Leicester – H – May 19 Watford – H – May 22  Arsenal have turned it around after a nightmare start that saw them at the bottom of the table after three defeats. Since then, the Gunners have pushed on and they are right in the race for the top four. The North Londoners haven’t played in the Champions League since the 2016/17 campaign, and Mikel Arteta has put his faith in a lot of young and very talented footballers. This group of players have been brilliant for the Gunners, but they lost three games in a row recently against Crystal Palace, Brighton and Southampton. However, just when things could have turned sour, they managed to beat Chelsea, Man United and West Ham to move two points clear of Spurs. The Gunners still have some massive games to play against the likes of Tottenham and Everton, so Arsenal could yet miss out on a place in the top four. Predicted finish – 5th Leeds United – H – May 8 Tottenham – A – May 12 Newcastle – A – May 15 Everton – H – May 22  Tottenham have had a very odd season but they are still in the race for the Champions League. Spurs started the campaign with Nuno Espirito Santo in charge, but after winning his first three league games, things quickly went wrong and he was dismissed well before Christmas. Antonio Conte arrived as his replacement, and after a solid start in which Tottenham were unbeaten in the league for nine matches, they lost four of their next five, including a 1-0 defeat to Burnley. Things didn’t look great, but on transfer deadline day, Dejan Kulusevski and Rodrigo Bentancur arrived from Juventus and have helped turn the season around. Spurs then scored 25 goals in seven league matches, winning six of those. However, they then lost to Brighton and only managed a 0-0 draw against Brentford, which halted their season. But they got back to winning ways on Sunday with a 3-1 victory over Leicester City, so they are back on track. If we look at their remaining fixtures, we can see they still have to play Liverpool and Arsenal. The North London derby against the Gunners could decide who lands that final Champions League spot, but Spurs should still have enough to finish fourth if they turn it on again. Predicted finish – 4th Liverpool – A – May 7 Arsenal – H – May 12 Burnley – H – May 15 Norwich – A – May 22  Man United have had a season to forget – they are out of all the cup competitions and look unlikely to get a place in the top four. The season started with so much optimism after the signings of Cristiano Ronaldo, Raphael Varane and Jadon Sancho. However, things quickly went wrong, and Ole Gunnar Solskjaer was dismissed early into the campaign. The Red Devils then brought Ralf Rangnick in until the end of the year as interim manager, but he has never performed that role before and has struggled to get a tune out of this squad. The German has only lost five of his 22 league games in charge but seven draws in that time have cost the Red Devils valuable points, and it looks increasingly likely they won’t finish in the top four. Man United still have to play Crystal Palace and a resurgent Brighton in their last two, but Arsenal and Tottenham have two games in hand on the Red Devils. Therefore, this campaign has the potential to end terribly for the world’s most famous club. Predicted finish – 7th Brighton – A – May 7 Crystal Palace – A – May 22  West Ham have not been outside of the top ten this season and have been as high as third on some occasions. It’s been highly impressive given that David Moyes has a small squad to work with and has one first-team striker in Michail Antonio. The Hammers are also deep into the Europa League, so the fact they have kept up with the likes of Arsenal and Tottenham is commendable, and they should finish in a Europa League spot no matter what. This season has seen the Irons beat the likes of Liverpool and Chelsea but the top four might just be out of their reach. However, given they are in the semi-finals of the Europa League, you would have to make them one of the favourites for that competition, so they could end up in the Champions League anyway. West Ham still have to play Manchester City, so they could still have a big impact on the title race. Predicted finish – 6th Norwich – A – May 7 Manchester City – H – May 15 Brighton – A – May 22 Sky Bet: Bet £10 on Football, Get £30 in Free Bets* – CLAIM HERE NEW CUSTOMERS ONLY. FIRST SINGLE & E/W BET ONLY. ODDS OF 1/1 OR GREATER. 3 x £10 BET TOKENS. FREE BET STAKES NOT INCLUDED IN RETURNS. FREE BETS ONLY REDEEMABLE ON FOOTBALL. FREE BETS ARE NON-WITHDRAWABLE. NO FREE BET EXPIRY. ELIGIBILITY RESTRICTIONS AND FURTHER T&CS APPLY. 18+. BEGAMBLEAWARE.ORG ",positive
6,https://talksport.com/football/1100162/jesse-lingard-man-utd-instagram-post-brother-classless/,Jesse Lingard’s brother hits out at ‘classless’ Manchester United as academy product is denied Old Trafford send off… but pundit questions if he deserves one,"Jesse Lingard’s brother hit out at Manchester United after the midfielder was denied a send off at Old Trafford. Lingard has been at the Red Devils for more than 20 years after first joining as a seven-year-old.  His time at United is set to end this summer when his contract expires, with the midfielder frustrated at the lack of first-team opportunities. The 29-year-old was left on the bench in United’s final home game of the season, which they won 3-0 against Brentford. Other players who are also leaving this summer, like Juan Mata and Nemanja Matic, were given the given the opportunity of a send off – with both named in the starting XI This prompted a furious reaction from Lingard’s brother, Louie Scott, on Instagram – which has since been deleted. “Twenty years of blood sweat and tears, four domestic trophies, three cup final goals, not even a farewell,” his post read. “No wonder it’s [Europa] Conference League next year. “Attacking players for celebrations when the club’s being sold to the super league, OK. “Class of 92, Busby Babes, you’re ran by people who don’t even know the offside trap. “Classless and the fans need to realise. Goodnight, God bless! “Been there since nine years of age and didn’t even get a send off!!! Well done bro your family are proud.” Not everyone shares that sentiment, though, as former West Ham striker Carlton Cole believes Lingard was not enough of a club legend to deserve such a huge send off. He told the talkSPORT Breakfast: “He’s a good player, Jesse Lingard, but Man United have had lots of top players in the past and did they get a send off?  “Is it different for academy boys? No. You are playing for Man United, they are one of the biggest clubs in the world. “They don’t need to pander to anyone. Unless you’ve served the club and been the main man. “If he was a Roy Keane or a Rooney, then I could understand. They’ve gone on to do big things with the club and broken records. That’s when I think clubs do that. “Jesse is a homeboy, but I don’t think there’s a lot in it.” talkSPORT's new sport trivia game is live! Win cash prizes every fortnight with talkSPORT’s new sportstriviagame. Enter today HERE for your chance to win £2,500 CASH! All you need to do is answer at least three quiz questions correctly for a chance to enter into the main prize draw. If you play everyday you could win one of our daily prizes, so what are you waiting for? Own the game and join talkSPORTTriviatoday. Play now HERE 18+. Terms and Conditions and Competition rules apply. See full details here. ",positive
