,URL,Content_title,Contents,Sentiment
96,https://www.skysports.com/football/news/11095/12578904/premier-league-to-introduce-five-subs-per-match-from-next-season-as-summer-transfer-window-dates-announced,Premier League to introduce five subs per match from next season as summer transfer window dates announced,"Premier League clubs have agreed to five substitutes being permitted per match from next season, while the summer transfer window dates have been revealed. Top-flight clubs voted in favour of the substitution rule change at a shareholder meeting of all 20 Premier League clubs on Thursday. Five substitutes were originally introduced in May 2020 due to the coronavirus pandemic, but the league reverted back to three subs for the 2020/21 season and this campaign. Previously, teams had voted against the introduction of five substitutes on several occasions in the past two years. The Premier League have also confirmed the summer transfer window will open on Friday June 10 and will close at 11pm on Thursday September 1. The league also announced a change to Covid-19 testing, with only symptomatic individuals to be tested from Monday. A Premier League statement said: ""Premier League Shareholders met today and discussed a range of matters. ""Clubs agreed to change the rules relating to substitute players. From next season, clubs will be permitted to use five substitutions, to be made on three occasions during a match, with an additional opportunity at half-time. A total of nine substitutes can be named on the team sheet. Get Sky Sports Get NOW to stream big moments Live football on Sky Sports this week Premier League fixtures ""It was also confirmed that the Summer 2022 Transfer Window will open on 10 June and will close at 23:00 BST on 1 September in line with other European leagues. ""In addition, the Premier League has today updated its remaining COVID-19 measures. ""From 4 April, the League will remove twice-weekly COVID-19 testing of players and staff and move to symptomatic testing only. Other key updates include the removal of the requirement for clinical passports to access previously restricted areas at training grounds and on match days as the Premier League returns to business-as-usual operations. ""The wellbeing of players and staff remains a priority and the Premier League will continue to monitor the national COVID-19 situation and adapt League-wide protocols as required, in line with the latest guidance from public health authorities and medical experts."" Maheta Molango, chief executive of the PFA, said the implementation of the five substitution rule would help tackle issues surrounding player fatigue. Please use Chrome browser for a more accessible video player ""When meeting our members, the most common issue they want to discuss is the impact of fixture congestion,"" Molango said. ""It's clear to me that the number of games being played is directly affecting players' health and wellbeing. ""The adoption of this rule is a welcome step forward in what needs to be an ongoing effort to address issues with player fatigue, making sure they have the opportunity to perform at their best and to maintain the competitive edge that makes English football the best in the world."" In December 2021, Liverpool manager Jurgen Klopp said players were ""at the edge"" due to the demands of the fixture schedule and absences caused by Covid, and called for five subs. Please use Chrome browser for a more accessible video player  ""We have to put the competition aside and don't say that Man City has better subs than Burnley or whatever,"" said the German. ""Yes that's probably true. But the problem is the intensity for a top-class footballer in England is definitely at the edge. ""You bring players back after Covid or after an injury, and because of the games we have to play they have to play immediately. Then they are out again because you cannot get them off after 60 minutes because you have to change other things. ""This wonderful game is so wonderful because usually the players on the pitch are in good shape, are well-trained, have recovered and go for it. That's why we love the game. ""The best league in the world, and the most intense league in the world, is the only league with still three subs. That's not right. We should change it."" Please use Chrome browser for a more accessible video player  Man City boss Pep Guardiola and Chelsea head coach Thomas Tuchel are also both strong advocates of five substitutions. In December 2020, Guardiola said: ""All around the world it's five substitutions, but here we believe we are more special people. ""We don't protect the players, and that's why it's a disaster. In this calendar, especially. I will demand, if the people allow, we have to come back to five substitutions. If not, it's difficult to sustain it."" Meanwhile, Tuchel said in December 2021: ""I would love to push for five substitutions because five substitutions were made to protect the players when coronavirus popped up and made life difficult. ""I think the situation is very serious and very challenging so if we decided to keep on playing at least we should have five changes to control the load."" Please use Chrome browser for a more accessible video player  But some - such as Sean Dyche, the Burnley manager - believed allowing five subs disproportionately benefits bigger clubs, such as Liverpool. ""I think it quite obviously favours the big clubs because they can keep more players happy and more players involved by making more changes,"" Dyche said in July 2020. ""A lot of football often does. We all had to change the size of our home pitches to make sure they aligned with the big clubs who were in Europe. Please use Chrome browser for a more accessible video player  ""We all had to cut the grass the same length. So most things are pushed forward by the big clubs in the division.""But equally the big clubs are part of what sells the division to the world. They are fantastic clubs in their own right, they have got amazing histories and a lot of prowess in football. ""It could be a slightly calmer situation for managers [of bigger clubs] with players who get slightly disgruntled than if they're out of the team and out of the squad."" As we approach what promises to be a busy transfer window, Sky Sports takes a look at 50 players who could be on the move this summer... Paris Saint-Germain forward Kylian Mbappe, who became the world's most expensive teenager when signed from Monaco for £166m in 2018, is out of contract at the end of the season, with Real Madrid the favourites to sign him. Real had a £145m bid for Mbappe rejected last summer - after he requested to leave PSG - and the French club are still holding out hope of convincing their star forward to stay. Borrusia Dortmund striker Erling Haaland is expected to be on the move this summer when his £64m release clause comes into effect, with top clubs across Europe fighting for his signature. Manchester City are in pole position to sign the 21-year-old, who has a contract with Dortmund until the summer of 2024, should he move to the Premier League. Barcelona and Real Madrid are reportedly also in the running to sign Haaland, and there is a suggestion Bayern Munich could be interested with Robert Lewandowski's future seemingly up in the air. Harry Kane asked to leave Tottenham last summer but ended up staying in north London after the club resisted multiple offers from Manchester City. Spurs are in no rush to sell Kane, who has a contract until 2024, but there have been reports Manchester United are set to reignite their interest in the 28-year-old England striker this summer. Another Saturday, another chance to win £250,000 with Super 6. Play for free, entries by 3pm. ",positive
97,https://www.skysports.com/football/news/30778/12599565/paul-pogba-manchester-united-midfielder-yet-to-decide-next-club-amid-real-madrid-and-barcelona-interest,Paul Pogba: Manchester United midfielder yet to decide next club amid Real Madrid and Barcelona interest,"Paul Pogba is yet to decide on his next club as he prepares to leave Manchester United when his contract expires at the end of the season. Pogba has not received any contract offer from United since last summer and is set to leave Old Trafford on a free transfer for the second time. A host of Europe's biggest clubs, including Real Madrid, Barcelona, Paris Saint-Germain and Juventus, are interested in the 29-year-old. Sky Sports News has been told Pogba's final choice over his next move will be a ""football decision"", and remaining in the Premier League has not been ruled out by the France international. If Pogba goes to a European club, it is unlikely he will be offered more money than United were willing to pay when they offered him a new deal last summer. Sky Sports reported last week that Pogba was hurt by the reaction of United supporters who booed him when he was substituted during their 3-2 win over Norwich earlier this month. Please use Chrome browser for a more accessible video player Ralf Rangnick, United's intertim manager, said after the game: ""I don't think it makes sense to take on and to target any individual person or players."" Transfer Centre LIVE! Paper Talk: Pogba sends final message to Man Utd team-mates Get Sky Sports Get NOW to stream big moments Pogba was also substituted during United's 4-0 hammering at the hands of Liverpool last week due to injury and is set to miss the rest of the season, meaning he has likely played his last game for the club. Pogba first joined United from Le Havre as a teenager in 2009 but ran down his contract before he had broken into the first team in order to join Juventus. The midfielder rejoined United from the Italian club for a then-world record fee in 2016 and won the League Cup and the Europa League during his first season back at Old Trafford. Please use Chrome browser for a more accessible video player  But while he has lifted the World Cup and Nations League with France since then, further silverware at club level has failed to materialise. Pogba previously appeared close to a United exit towards the end of Jose Mourinho's spell as manager after their relationship deteriorated. Mourinho prevented Pogba from captaining the club, while the pair were also filmed having a confrontation during training. However, Mourinho was sacked just months later and Pogba was reintegrated into the squad by Ole Gunnar Solskjaer. Injury has limited Pogba to just 21 starts in all competitions this season, and he and the club will end the season empty-handed again. Please use Chrome browser for a more accessible video player  Speaking last week, Rangnick admitted Pogba was unlikely to renew his United deal, and said he and other coaches would struggle to explain why the World Cup winner has struggled for consistency at Old Trafford. Asked whether it was fair to describe Pogba as ""enigmatic"", Rangnick replied: ""It doesn't make sense to talk about that - right now he's injured. ""But I mean, he's a player that won the World Cup with France. We all know what kind of potential he has and the good player he can be. ""But like quite a few other players, he was just struggling to get his best performances sustainably on the pitch for United matches. This was not only the case this season, or in the last couple of weeks. As far as I remember, this was also the case in earlier years."" Rangnick said it was ""difficult to say"" why that was the case. ""If myself or other coaches knew that, it would probably have been easier to change that,"" he added. ""But right now it doesn't make sense to think about that. As it seems right now, he will not renew his contract. It's most likely that he won't be here anymore next season."" Another Saturday, another chance to win £250,000 with Super 6. Play for free, entries by 3pm Another Saturday, another chance to win £250,000 with Super 6. Play for free, entries by 3pm ",positive
98,https://www.skysports.com/football/news/11095/12598736/manchester-united-vote-results-who-do-fans-want-out-of-the-club,Manchester United vote results: Who do fans want out of the club?,"Manchester United fans want to axe a raft of first-team players this summer, according to a Sky Sports poll. Supporters' patience has been wearing thin with players as the club's top-four tilt wilted with a 3-1 defeat at Arsenal - just four days after the humiliating 4-0 defeat to Liverpool. Please use Chrome browser for a more accessible video player Interim manager Ralf Rangnick has suggested up to 10 new players are needed for the impending rebuild, but we asked Sky Sports readers to decide who should stay or leave this summer. With United facing another crucial clash at home to Chelsea on Thursday, fans have been voting in our poll to determine who is good enough for the club, and who isn't. Collectively, we received 1.7m votes on 30 different United first-team players, so let's take a look at the results below… Please use Chrome browser for a more accessible video player  Paul Pogba, who is out of contract this summer and remains the second-most expensive player in Premier League history following his £93.25m transfer from Juventus in 2016, was axed by 91 per cent of fans - with the sentiment reflecting the hostile reception he received from fans after the 3-2 win over Norwich. Please use Chrome browser for a more accessible video player  Club captain Harry Maguire joined the list of axed players, with more than three-quarters of voters opting to offload the England centre-back, while regular defensive partners Aaron Wan-Bissaka (65 per cent) and Victor Lindelof (52 per cent) were also jettisoned from the squad. Latest Man Utd news Get Sky Sports Get NOW to stream big moments Live football on Sky Sports this week A host of bit-part and loaned players were also discarded by fans, including Nemanja Matic (94 per cent), Phil Jones (90 per cent), Juan Mata (89 per cent), Andreas Pereira (87 per cent), Anthony Martial (86 per cent), Edinson Cavani (86 per cent) and Jesse Lingard (82 per cent). Most poignantly, 85 per cent of fans voted to ditch the Glazers - who took control of the club 17 years ago in 2005 and have come under growing scrutiny during the club's five-year barren run without a trophy. Which players still have the vote of confidence from the United faithful? At the top of our keep list is Jadon Sancho, who enjoyed a one-month purple patch until mid-March - with 94 per cent of fans backing the England winger, while talisman Bruno Fernandes (91 per cent) received a similar share of votes. Fernandes has nine goals and 13 assists in all competitions this season and signed a contract extension until 2026 earlier this month. The statistics do prove, however, that the midfielder is having a weaker season compared to last term across several attacking factors - but that could be down to United having a poorer campaign across the board. In terms of regular starters, David de Gea (88 per cent), Raphael Varane (85 per cent), Scott McTominay (75 per cent), Luke Shaw (69 per cent), Cristiano Ronaldo (64 per cent) and Fred (62 per cent) were retained by fans, while Marcus Rashford (57 per cent) and Alex Telles (53 per cent) made the cut by the skin of their teeth. Anthony Elanga, who has moved above Rashford in the pecking order under Rangnick, has endured a mixed start to 2022 but is still liked by his club's supporters with 90 per cent voting to keep him for next term - with fellow youngsters Hannibal Mejbri (80 per cent) and Amad Diallo (67 per cent) also proving to be fan favourites. Elanga missed the crucial penalty in the FA Cup exit to Middlesbrough in February, but redeemed himself by being the hero in United's Champions League last-16 first-leg draw at Atletico Madrid before Diego Simeone's side dumped United out of the competition in the return leg. Watch Manchester United vs Chelsea live on Sky Sports Premier League and Main Event this Thursday from 7pm; kick-off 7.45pm Another Saturday, another chance to win £250,000 with Super 6. Play for free, entries by 3pm. ",positive
99,https://www.skysports.com/football/news/11667/12594337/paul-pogba-cristiano-ronaldo-marcus-rashford-and-more-18-players-who-could-leave-in-man-utd-exodus-this-summer,"Paul Pogba, Cristiano Ronaldo, Marcus Rashford and more - 18 players who could leave in Man Utd exodus this summer","Ralf Rangnick said Manchester United need to sign as many as 10 new players after their 4-0 thrashing by Liverpool on Tuesday night, but which players could leave in their rebuild? Sky Sports News understands United will prioritise a new centre-back, two central midfielders, a winger and a striker this summer, while also examining their full-back and goalkeeping options. But in order to strengthen their squad under their next manager - Ajax boss Erik Ten Hag - the club must first make room by clearing the decks. Here, we take a look at the players facing uncertain futures at Old Trafford, from those who are approaching the ends of their contracts, to those who simply don't seem to fit in any longer. Please use Chrome browser for a more accessible video player Pogba has not been offered new terms by United since last summer. In March, Sky Sports News reported that Real Madrid, Paris Saint-Germain and Juventus were all in talks with his representatives, as well as two Premier League clubs. He came off with a knock in the early stages of Tuesday's game against Liverpool and Sky Sports pundit Gary Neville questioned whether it was the last time we would see Pogba in a United shirt. VOTE: Who should stay or leave Man Utd this summer? Premier League table Live football on Sky Sports Get Sky Sports His future at Old Trafford has been uncertain for several seasons. He spent the second half of last term on loan at West Ham and they wanted to sign him permanently last summer. He stayed but has again failed to cement a first-team place. He was also a target for Newcastle in January. He is expected to leave this summer, with Tottenham one of a number of clubs who have been monitoring his situation. On Tuesday night, Roy Keane said he should have left two years ago. The 33-year-old Spaniard looks set to end an eight-year spell at Old Trafford having been on the periphery of the first team all season. Please use Chrome browser for a more accessible video player  Mata has made only seven appearances in all competitions this term. There are no options left in his contract and no talks about a renewal. Reports in Spain claim he is not ready to retire and could return to play in La Liga. Matic has already confirmed publicly he will not take up the option he has in his contract of a further year, and will leave the club on a free at the end of the campaign. The Sky Sports punditry team questioned why he announced this before the end of the season with the team still fighting to finish fourth. The 35-year-old agreed to ignore interest from his native South America and sign another one-year deal last summer but has not featured regularly, making just 12 Premier League appearances and struggling with injuries. He reportedly fancies a move to Spain this summer. English goalkeeper who has made up the homegrown quota and provided extra cover in goal, but has not played this season and is expected to find a new club. De Gea, who has an option for an additional year in his contract ending in 2023, recently said he does not see himself away from Manchester United but he has flirted with a return to Madrid in the past, both to his former club Atletico and their rivals Real. Please use Chrome browser for a more accessible video player  His wife is a successful television presenter there and is believed to spend most of her time in the city. He has remained one of United's better players this season but Ten Hag likes a 'keeper who can build from the back in the same way Ederson and Alisson do for City and Liverpool. Does De Gea fit that mould? Regardless, he would be hard to replace. In January, Ronaldo's representatives were quick to shut down reports he was unhappy at United and already considering leaving in the summer, less than a year since his return to the club. He has been stellar when he has played, scoring match-winning hat-tricks against Tottenham and Norwich in recent months, and he will want to see his team-mates match his incredibly high standards between now and the end of the season. He will have no shortage of lucrative options should he indicate he is ready to go this summer. His contract ends in 2023 but he has an option to extend it by another year. Rashford has struggled to find his best form again this season under both Ole Gunnar Solskjaer and Rangnick, and it seems he has been impacted by the arrivals of Ronaldo and Jadon Sancho in two of the positions in which he thrives. He is young and dynamic enough that he should be one Ten Hag will want to have a close look at. But recent reports claim Rashford is considering his future at Old Trafford. Should he stay, the club have an option to extend his contract by a year. Shaw, another player whose contract includes a one-year extension option for the club, is reportedly happy at United and willing to extend his deal further. Please use Chrome browser for a more accessible video player  However, like most of the squad, his form has been sporadic this season and Rangnick has appeared to prefer Alex Telles or Diogo Dalot at left-back. Shaw has been injured recently and will almost certainly be another player Ten Hag will want to assess first before making any decisions on his future. One of United's priorities this summer is to sign at least one new central midfielder, given Pogba and Matic are set to leave. What these new additions will mean for Fred remains to be seen, but he has been one of the better performers when he has played this season. His energetic style ought to fit with Ten Hag's philosophy and there is a one-year extension option in his contract. Surprised everybody when he signed a new contract until 2023 in 2019, which also contains an option until 2024. He has made only three appearances this season and looked far short of a level required in Tuesday's thrashing by Liverpool. It is very hard to see how he would fit into Ten Hag's plans. Signing a new centre-back is definitely on the cards for United this summer. Heaton was brought in to add further cover in goal and has an option to extend his time at Old Trafford, but United are expected to be in the market for another goalkeeper this summer, meaning his future is up in the air. He has made only one first-team appearance. Dalot's situation at United has been up and down since he arrived under Jose Mourinho. He was on loan at AC Milan last season and did exceptionally well, and was expected to head there permanently. Please use Chrome browser for a more accessible video player  Instead, he stayed and had a good start to the campaign but dropped off again before another minor resurgence under Rangnick. Nevertheless, with just a year left on his deal, it might be time to cash in on the Portugal international and sign a right-back fully in the Ten Hag mould. The England goalkeeper has been frustrated with his lack of opportunities at United for several seasons, especially after thriving during two loan spells at Sheffield United. He is of interest to a string of other Premier League clubs where he could expect to be in line for the No.1 shirt, so he is expected to push again for an exit this summer. Bailly has made only seven appearances this season, despite signing a new contract until 2025 (if its option is taken into account) last year. United want to sign another new centre-back this summer, despite signing Raphaël Varane from Real Madrid last year, which would push Bailly even further down the pecking order. Martial is currently on loan at Sevilla having fallen out of favour under both Ole Gunnar Solskjaer and Ralf Rangnick this season. Sky Sports News exclusively revealed in December that he wanted to join the Spanish club in January to get more first-team games. It remains to be seen whether Sevilla want to keep him permanently, but there were other clubs also interested in signing him and his future at Old Trafford looks far from certain. The young left-back, who has been fourth in the pecking order behind Shaw, Telles and Dalot, has been on loan with relegation-battlers Norwich City this season. For his development, he will need to continue playing regular games next season which - at United - is unlikely. Another Saturday, another chance to become a millionaire! Super 6. Play for free, entries by 3pm ",positive
