,URL,Content_title,Contents,Sentiment
66,https://www.skysports.com/football/news/11667/12582098/erik-ten-hag-manchester-united-appoint-ajax-boss-as-new-manager,Erik ten Hag: Manchester United appoint Ajax boss as new manager,"Manchester United have appointed Ajax boss Erik ten Hag as their new manager, to replace interim Ralf Rangnick at the end of the season. Sky Sports News reported on March 31 Ten Hag was in pole position to land the job over Mauricio Pochettino, with sources close to the manager and Ajax revealing compensation is below £2m. The 52-year-old has signed a three-year deal with the option of a further 12 months. He told United's website: ""It is a great honour to be appointed manager of Manchester United and I am hugely excited by the challenge ahead. ""I know the history of this great club and the passion of the fans, and I am absolutely determined to develop a team capable of delivering the success they deserve. ""It will be difficult to leave Ajax after these incredible years, and I can assure our fans of my complete commitment and focus on bringing this season to a successful conclusion before I move to Manchester United."" Mitchell van der Gaag, Ten Hag's assistant at Ajax, is likely to join him at Old Trafford with advanced negotiations already under way. Please use Chrome browser for a more accessible video player Edwin van der Sar, Ajax's chief executive and a former United goalkeeper, said, ""we would have liked to have kept Erik for longer"", but added, ""he is going to make the step to one of the biggest clubs in the world"". VOTE: Who should stay or leave Man Utd this summer? Why the scale of Man Utd rebuild is frightening Man Utd exodus: 18 players who could leave this summer Ten Hag Q&A: Carra's verdict on incoming Man Utd boss Ten Hag told Ajax's website: ""I'm happy that it has been finalised and that it has been officially announced. That clarity is important."" John Murtough, United's football director, said: ""During the past four years at Ajax, Erik has proved himself to be one of the most exciting and successful coaches in Europe, renowned for his team's attractive, attacking football and commitment to youth. ""In our conversations with Erik leading up to this appointment, we were deeply impressed with his long-term vision for returning Manchester United to the level we want to be competing at, and his drive and determination to achieve that. ""We wish Erik the best of luck as he focuses on achieving a successful end to the season at Ajax and look forward to welcoming him to Manchester United this summer."" Ten Hag was understood to be the unanimous choice at United following a rigorous recruitment process that was led by Murtough and Darren Fletcher, the technical director. Richard Arnold, the executive vice-chairman, was also involved and the trio are understood to have agreed Ten Hag was the best candidate for the job. Mauricio Pochettino, the Paris Saint-Germain manager who previously coached Tottenham and Southampton, and Julen Lopetegui, the Sevilla boss, were also interviewed by United, but the club are believed to have felt the Dutchman was the one that most closely aligned with their plans for the future. Pochettino and Lopetegui are understood to have interviewed well, while Luis Enrique was also considered until it quickly became apparent he was committed to Spain ahead of this year's World Cup. United were looking for a number of attributes from their new manager, including proven success, a commitment to youth, the ability to improve players and the will to introduce an attractive style of play. Ten Hag is said to have set out his long-term vision to build a successful and exciting team during conversations with United, in which he is also said to have shown enthusiasm for the challenge he now faces at Old Trafford. Sky Sports News understands Ten Hag will tell United players he does not want any passengers at the club. His key message to them will be that he is the manager, there is a new regime and United are going to go back to playing like Manchester United. If there are any players who are not up for the challenge, they are welcome to leave, but everyone will start with a clean slate. He has not been given any specific targets, but he knows his job is to make United great again. Ten Hag also wants Steve McClaren to return to United and talks about making that happen are ongoing. The good relationship between United and Ajax helped smooth the process to appoint Ten Hag. It is believed potential negotiations with PSG, had United opted for Pochettino, would have proved more problematic. Please use Chrome browser for a more accessible video player  Ten Hag will be United's fifth permanent manager since Sir Alex Ferguson retired in 2013. The club have won only three trophies in the following nine years - the FA Cup, League Cup and Europa League - while they are currently in danger of missing out on qualification for the Champions League next season. Ten Hag is set to oversee a much-needed rebuild at United, with Rangnick - who is due to take up a consultancy role at Old Trafford this summer - saying after the 4-0 thrashing at rivals Liverpool on Tuesday that the side may need up to 10 new players. A number of first-team players, including Paul Pogba, Jesse Lingard and Edinson Cavani, could be set to leave as part of the overhaul, with their contracts expiring at the end of the season. On Wednesday, the departures of Jim Lawlor, United's chief scout, and Marcel Bout, the head of global scouting, were announced. Ralf Rangnick said Manchester United need to sign as many as 10 new players after their 4-0 thrashing by Liverpool on Tuesday night, but which players could leave in their rebuild? Man Utd are currently sixth in the Premier League, three points off the top four but having played a game more than both Tottenham (fourth) and Arsenal (fifth). Will they squeeze into the top four? Here are their remaining fixtures... Please use Chrome browser for a more accessible video player  Please use Chrome browser for a more accessible video player  Sky Sports News' senior reporter Melissa Reddy: ""Manchester United's interest in Erik ten Hag came as no surprise given his status as one of the most progressive coaches in Europe, and his long links to their managerial vacancy. ""The 52-year-old has had admirers at Old Trafford stretching back to 2018/19, when his Ajax side knocked out Real Madrid in the last 16 of the Champions League, before then stunning Juventus and only being denied a place in the final after Lucas Moura's last-minute goal for Mauricio Pochettino's Tottenham. ""Ten Hag is a popular choice to take charge at Old Trafford and represents what is seen as a ""fresh, exciting future"", although there is an acceptance risk is involved as it is a sizeable leap for him. ""The last highly-successful Ajax coach to move to England's top flight - via Inter - was Frank de Boer, who lasted just 77 days at Crystal Palace. ""The expectations, global glare placed on United, and level of competition at the top end of the Premier League is like nothing he would have previously experienced."" Kaveh Solhekol, Sky Sports' chief reporter: ""The timing is not ideal if you are an Ajax supporter as they are in a race to win the Dutch title, but when Man Utd came calling, Erik ten Hag really could not turn down the club. ""It suits Man Utd to make this statement today for a variety of reasons: from a PR point of view, everybody connected with Man Utd wants some good news at the moment and also, it makes it clear what is happening at Man Utd over the next few months. There is clarity now - all the players who are thinking of leaving, or who Man Utd want to sign, know Ten Hag is going to be the new manager. ""He is also going to have the whole of the summer and pre-season with the players, so that is perfect preparation as far as he is concerned. Please use Chrome browser for a more accessible video player  ""I also think it is very significant he is being called the manager - we know one of the things he has been asking for is to be in control of everything. He does not just want to be a head coach - he wants to have control over the transfer strategy and recruitment as well. ""I think Man Utd have made a lot of mistakes when it has come to appointing managers since Sir Alex Ferguson left, but this time round they think they have the right man and obviously he has a big, big job to do. ""But people need to retain a sense of perspective as well - I know the team are not playing as well or in the kind of way a Man Utd team should be playing. But let's not forget, less than 12 months ago, Man Utd finished second in the Premier League, they finished above Liverpool and over the past decade, six of the last 10 seasons they have finished above Liverpool. ""Man Utd are still a massive, massive club - one of the biggest clubs in the world. There are obviously still issues with the ownership structure, the way the club is run, but the big problem is they have not had the right manager in charge, and when they have had the right man, they have not given that manager enough time. ""This time round, when Ole Gunnar Solskjaer lost his job five months ago, we told you the replacement was going to be either Mauricio Pochettino or Erik ten Hag. I know a lot of people would have preferred Pochettino as he had Premier League experience with Southampton and Spurs, so it is a bit of a risk going for Ten Hag. ""Yes, he has done very well in Holland, but he has been managing the biggest club in Holland, he does not have any Premier League experience, but United have spoken to various candidates, they have interviewed Ten Hag, they interviewed Pochettino as well, and they have decided to go for Ten Hag. From United's point of view, it is great they have been able to get Ten Hag and announce it so quickly."" Please use Chrome browser for a more accessible video player  Sky Sports' Gary Neville speaking on The Overlap in March: ""Ten Hag worked in Bayern Munich when Pep Guardiola was there. We know the impact that had. He's won a couple of titles and cups in Holland. His style of play is good. He's got more experience than I think most people think at the age of 52. ""It's a massive jump but he's got a good coaching pedigree. He's not scarred and that's a good thing - he comes in fresh. I did a poll the other week and I was absolutely stunned - 220,000 people voted and 82 per cent were in favour of bringing him in over [Mauricio] Pochettino. ""I knew that he would be favourite because you can smell it on social media. I think Manchester United fans are demanding a fresh start and a fresh name. They want something that's completely different that they've not had before, and that's probably gone against Pochettino in some ways."" Sky Sports' Adam Bate: ""Erik ten Hag will go to Manchester United as an outsider tasked with implementing cultural change at one of the world's most famous clubs. But that is a job that he has done before. ""At Ajax, they mocked his accent. He was a Tukker - a man from the east of the country, a region known for a down-to-earth approach. There were those in sophisticated Amsterdam who did not believe the great Ajax had anything to learn from him. They were wrong. ""Two domestic doubles and one kick away from a Champions League final later and there is an acceptance Ten Hag has brought some of the best football that Ajax have seen in years. His methods have delivered success, his manner has won over the doubters."" Ten Hag's coaching journey from Twente to Ajax via Go Ahead Eagles explained in-depth by those who were there from the start... Erik ten Hag must waste no timing in tackling the pressing issues at Manchester United. Interim manager Ralf Rangnick - who is due to take up a consultancy role at Old Trafford this summer - believes the team could require 10 new players as part of a huge rebuild. With United having finally confirmed the appointment of their new manager, Sky Sports takes a look at some of the key problem areas he must rectify... Erik Ten Hag's announcement as Manchester United's new manager means we've ripped up the script for the Essential Football Podcast, with the Dutchman's unveiling heralding - yet another - new era at Old Trafford. Host Ron Walker is joined by Sky Sports' Jamie Carragher as well as senior football writer Peter Smith and features writer Adam Bate to talk about the new man, what United can expect from him and the challenges he faces at Old Trafford. The podcast also looks ahead to the weekend meeting at the Emirates, when a resurgent Arsenal host United on the back of a 4-2 win at Chelsea on Wednesday night. Another Saturday, another chance to become a millionaire! Super 6. Play for free, entries by 3pm ",positive
67,https://www.skysports.com/football/news/11661/12599944/where-could-each-premier-league-team-finish,Premier League clubs' best and worst possible final positions in table,"Manchester City and Liverpool are locked in a two-horse race for the Premier League title - but how high or low could your club finish this season? Clubs have between two and five games left to seal their fate but 19 out of 20 clubs are still challenging for the title, qualification for the Champions League, Europa League or Europa Conference League, or to avoid the drop. Data guru Ben Mayhew has calculated each club's range of possible final league positions and found only Norwich have nothing to play for besides pride during the remainder of this season. Chelsea, Arsenal, Tottenham and Manchester United are all in the hunt to join title-tussling Manchester City and Liverpool in the top four - with Spurs and United potentially slipping as low as eighth to miss out on Europe next season altogether. With seventh spot being the lowest position to potentially offer a European berth, if permutations play out across competitions, it means all teams from fifth to 13th-placed Aston Villa retain the potential to qualify for Europe. Norwich were relegated on Saturday after a 2-0 defeat to Villa and results conspired against them elsewhere, but, theoretically, every single team sitting above the Canaries up to ninth-placed Brighton could finish in the drop zone. Watford have been widely written off in the survival race but the Hornets could still finish in 16th, while the attention for that final relegation spot centres on Everton, Leeds and Burnley - but all three could still secure a top-half finish. Get Sky Sports Live football on Sky Sports this week Premier League table Premier League fixtures Mayhew has also simulated every possible result from the remaining games and calculated the probabilities of each club's possible final positions. The results suggest Manchester City have a 69-per-cent chance of retaining their Premier League crown, while Liverpool have almost the same chance of finishing as runners-up. Chelsea are nailed down for third spot at 93 per cent, with Arsenal pipping Tottenham to the final Champions League berth at 74 per cent - while Manchester United have a whopping 94-per-cent-chance of finishing in their current sixth spot. Each club’s attacking and defensive strength have been rated using an expected goals model, which measures the quality of chances they create and allow.  These ratings were then used to simulate the rest of the season 10,000 times to measure the probability of each club finishing in each league position. Further down the table - between Brighton and Southampton - things become far less predictable, with fairly even spreads between ninth and 15th. The probabilities consign Watford to the Championship but the pressure ramps up for the final drop spot, with Leeds favourites to finish in 18th (46 per cent), followed by Everton (31 per cent) and Burnley (23 per cent). Do not miss your chance to land the £250,000 in Saturday's Super 6 round. Play for free, entries by 3pm. ",negative
68,https://www.skysports.com/football/news/11727/12544106/six-into-four-doesnt-go-a-final-day-championship-play-off-battle-awaits,"Championship: Nottingham Forest, Huddersfield, Sheffield United among teams in play-off contention","With the automatic promotion places wrapped up, the battle to secure a place in the Sky Bet Championship play-offs will continue until the final day of the season. Runaway leaders Fulham secured promotion to the Premier League at the first time of asking after a 3-0 win over Preston on April 19 and then lifted the title after a crushing 7-0 win over play-off chasing Luton on May 2. They were then joined by Bournemouth on May 3, after Scott Parker's side scored a late goal to sink Nottingham Forest and make their six-point cushion inside the top two unassailable with one game to spare. And with the relegation places having been settled for weeks now, too, that leaves just the remaining four places in the top six up for grabs. But with Huddersfield having secured one and Forest another, there are two berths remaining, with Sheffield United, Luton, Middlesbrough and Millwall left to contest them. Just three points separate the fifth-placed Blades from the eighth-placed Lions. Here, we take a look at the runners and riders, their form and their key remaining fixtures as they bid to break free of the Championship's clutches and reach the Premier League... Position: 3rdGames played: 45Points: 79Form (most recent first): LWWWWSky Bet promotion odds: 7/4 Championship table Get NOW to stream big moments Sky Sports EFL Podcast Get Sky Sports Remaining fixtures: Hull (A) (May 7, 12.30pm) Please use Chrome browser for a more accessible video player Position: 4thGames played: 45Points: 79Form (most recent first): WWWDWSky Bet promotion odds: 4/1 Remaining fixtures: Bristol City (H) (May 7, 12.30pm) Please use Chrome browser for a more accessible video player  Position: 5thGames played: 45Points: 72Form (most recent first): WDWLDSky Bet promotion odds: 5/2 Remaining fixtures: Fulham (H) (May 7, 12.30pm) Please use Chrome browser for a more accessible video player  Position: 6thGames played: 45Points: 72Form (most recent first): LDWWLSky Bet promotion odds: 5/1 Remaining fixtures: Reading (H) (May 7, 12.30pm) Please use Chrome browser for a more accessible video player  Position: 7thGames played: 45Points: 70Form (most recent first): WWDLDSky Bet promotion odds: 8/1 Remaining fixtures: Preston (A) (May 7, 12.30pm) Please use Chrome browser for a more accessible video player  Position: 8thGames played: 45Points: 69Form (most recent first): WDWDWSky Bet promotion odds: 80/1 Remaining fixtures: Bournemouth (A) (May 7, 12.30pm) Please use Chrome browser for a more accessible video player  Another Saturday, another chance to win £250,000 with Super 6. Play for free, entries by 3pm Another Saturday, another chance to win £250,000 with Super 6. Play for free, entries by 3pm Another Saturday, another chance to win £250,000 with Super 6. Play for free, entries by 3pm ",positive
69,https://www.skysports.com/football/news/11095/12601527/ralf-rangnick-confirmed-as-new-austria-manager-but-will-remain-in-man-utd-consultancy-role,Ralf Rangnick confirmed as new Austria manager but will remain in Man Utd consultancy role,"Ralf Rangnick has been confirmed as Austria's new manager on a two-year contract, with the Manchester United interim manager staying on at Old Trafford in a consultancy role. In a press conference by the Austrian FA, Rangnick was appointed the new national team manager until 2024, with a clause inserted into the contract which states that the deal will be renewed for another two years if the country qualifies for Euro 2024. Rangnick was quoted by the Austrian FA website as saying: ""It's an honour for me to take on the role of team boss. I'm particularly excited about the prospect of contesting the European Championships in Germany with a young team hungry for success."" The 63-year-old replaced Ole Gunnar Solskjaer at United at the end of November, agreeing to take temporary charge of the team until the summer, before remaining in a consultancy role. However, results have been disappointing under Rangnick, with United currently sixth in the Premier League, five points behind Arsenal in the fourth and final Champions League spot for next season as the campaign draws to a close. Ajax manager Erik ten Hag was recently announced as United's permanent boss for next season, although Rangnick will, as planned, still stay on as a consultant. That role will encompass six days a month for the next two years, meaning the German would be able to combine the work with his Austria duties. ""I'm very much looking forward to it,"" said Rangnick, when asked about his United consultancy role. ""We haven't spoken, Erik and myself, we've spoken with the board about the contract and the profile of the job, the content of the consultancy role."" Man Utd fixtures Latest Man Utd news Premier League table How to watch Premier League highlights Please use Chrome browser for a more accessible video player Ranginck's predecessor as Austria manager, Franco Foda, resigned from his position following their 2-0 defeat to Wales earlier this month which denied them a spot at the World Cup in Qatar. Sky Sports' Gary Neville on the Gary Neville Podcast: ""As Manchester United's sporting director, or consultant, can he really be going to look at Austrian players week in, week out and then selecting them for a national team? ""The Austrian national team have got pride, it's a great country with great players, so he'll have to watch them play every week. Then he's going to go and coach them two weeks in September, October, November and March. ""So then you're thinking 'what's happening to the Man United consultancy and advice? Where's the priority?' because there's a conflict there. Please use Chrome browser for a more accessible video player  ""I don't see how that can work because if you're a national team manager - and I've worked under a national team manager - I know that they have got to be present watching their players play week in, week out. And he can't be at Old Trafford every single week - not watching an Austrian player play. ""I don't know how that's going to work if it is something that's true. ""It's messy. Man United can't afford to have distractions at this moment in time, they can't afford to have a poor communications plan around the idea that Rangnick's the football consultant, but he's seen watching German football three times a month and then going off to coach the Austrian team. ""There needs to be laser focus, clean lines, people staying in their lanes, understanding what their jobs are and communicating to the fan base that this is a real change and different than it has been for the last 10 years."" Another Saturday, another chance to win £250,000 with Super 6. Play for free, entries by 3pm ",positive
