,URL,Content_title,Contents,Sentiment
0,https://www.skysports.com/football/news/11095/12605017/luis-diaz-is-liverpools-game-changer-as-geronimo-rulli-costs-villarreal-champions-league-hits-and-misses,Luis Diaz is Liverpool's game-changer as Geronimo Rulli costs Villarreal - Champions League hits and misses,"Liverpool's players walked off the pitch in stunned silence as the home crowd roared with delight. It was half-time at the Estadio de la Ceramica and Villarreal had hauled themselves level on aggregate. Jurgen Klopp' side looked in serious trouble but fortunately for them, that was as bad as it got. By the end, a night which threatened disaster had turned into one of celebration. A third Champions League final in five years beckons and it owes a lot to Luis Diaz. The Colombian, outstanding since his arrival from Porto in January, changed the game after replacing Diogo Jota at the interval, scoring Liverpool's second goal when he headed home Trent Alexander-Arnold's cross and causing near-constant panic in Villarreal's previously untroubled defence. Within 15 minutes of his introduction, he had touched the ball more times than Jota did in the whole of the first half and every one of those touches seemed to strike fear into the yellow-shirted defenders unfortunate enough to find themselves in his vicinity. Juan Foyth, in particular, will be eager to forget his evening up against Diaz, whose explosive pace and sheer relentlessness gave the former Tottenham right-back no end of difficulties. Villarreal 2-3 Liverpool (2-5 agg) - Match report Liverpool fixtures Get Sky Sports Get NOW to stream big moments Diaz was a whirlwind of activity on Liverpool's left flank, completing four dribbles and attempting four shots - twice as many as any of his team-mates despite only playing one half. But in addition to the chaos factor which destabilised Villarreal so effectively, there was composure in how he used the ball, with all but two of his 20 attempted passes finding a red shirt. Afterwards, Virgil van Dijk lauded his impact as ""incredible"" and the centre-back was not the only one grateful for the 25-year-old's contribution. He was Liverpool's game-changer. Just don't expect him to start on the bench again in Paris.Nick Wright It is a good time to be a Liverpool fan, who can look forward to two more finals this season. Indeed, Jurgen Klopp has guided them into an eighth final during his time as manager and they are just six games away now from an historic quadruple. Liverpool came here to complete the job, show professionalism and to finish what they started a week ago in the face of a crackling atmosphere - but they showed signs of frailty in the opening 45 minutes. Experience would eventually tell, aided and abetted by a distinctly ordinary goalkeeping performance from the hosts' Geronimo Rulli. Liverpool had been in this position twice before under Klopp, progressing on both occasions before losing the 2018 final to Real Madrid and winning a sixth European Cup against Tottenham the following year. Only one team has ever overturned a two-goal deficit from a Champions League semi-final - Klopp's Liverpool against Barcelona that season. Their know-how, particularly in 2019, certainly helped here in spite of Unai Emery's own very proud knockout history in European competition. He was the PSG manager on the receiving end of Barcelona's infamous 'Remontada' in 2017 - and was described as the ""king of the cups"" by Klopp - but this proved a step too far even for him to mastermind his own turnaround for a team currently seventh in La Liga. Ending May with four trophies in the cabinet is becoming an increasing possibility for Liverpool. The Carabao Cup was secured in February, and they can also look forward to an FA Cup final in just under a fortnight's time; underlying all of that is another epic title race which is set to go right down to the wire with Manchester City only one point ahead with four matches. The relentless pursuit of a quadruple - and a seventh European Cup - rolls on.Ben Grounds It is a stat that says it all about Villarreal goalkeeper Geronimo Rulli. The Argentine has made the most errors leading to goals of any player in the Champions League this season with three. Two of those came in the second leg defeat to Liverpool as he weakly let Fabinho's shot through his legs despite it being hit straight at him. A top-class goalkeeper would have definitely stopped the Brazilian's shot and kept Liverpool scoreless at the time. He could do little about Luis Diaz's goal that drew Liverpool level, as his powerful downward header went through his legs. But Rulli was entirely at fault once again for the third and final goal as he madly rushed out to clear the ball, but was beaten by Mane, who then rounded Juan Foyth to tap into an empty net for a simple finish. The 29-year-old was always going to be a major weak link following the first leg. He was incredibly shaky at Anfield as he constantly punched the ball and inspired the Liverpool attack more than his defence. Indeed, he was at fault for Liverpool's opener at Anfield as Jordan Henderson's deflected cross somehow looped over him following some poor footwork as he misjudged the flight of the ball. Over the two legs in this semi-final, Rulli cost his side three goals and things may have been tighter for Liverpool had Villarreal had a better goalkeeper. In fact, Rulli became the first goalkeeper to make two errors in the same knockout Champions League game since Liverpool's Loris Karius. Villarreal boss Unai Emery could certainly learn from how Jurgen Klopp moved on from Karius after that 2018 Champions League final defeat to sign Alisson and fix their goalkeeping issue.Declan Olley Another Saturday, another chance to win £250,000 with Super 6. Play for free, entries by 3pm ",positive
1,https://www.skysports.com/football/news/11669/12604865/jurgen-klopp-admits-reaching-champions-league-final-feels-like-the-first-time-as-mohamed-salah-eyes-real-madrid-revenge,Jurgen Klopp admits reaching Champions League final 'feels like the first time' as Mohamed Salah eyes Real Madrid revenge,"Jurgen Klopp said reaching his fourth Champions League final as a coach felt almost like a new experience as his Liverpool side came back from two goals down against Villarreal to secure a 5-2 aggregate win in their semi-final on Tuesday. While the three-goal cushion may look comfortable, this was a test of Liverpool's nerve and powers of recovery as an awful first half by their standards saw their first-leg advantage wiped out by debut goals in the competition from Boulaye Dia and Francis Coquelin. But the half-time introduction of £37.5m January signing Luis Diaz, who has reinvigorated 2022 for Klopp's side, changed the game - aided by a poor goalkeeping performance from the hosts' Geronimo Rulli. Both Fabinho and Diaz's goals went through Rulli's legs, while the goalkeeper was beaten to the ball by Sadio Mane when he came charging out to leave the Senegalese forward with an unguarded net to seal the win on the night. ""It feels like the first in 20 (years),"" Klopp, who led Borussia Dortmund to the final of the competition in 2013 and Liverpool in 2018 and 2019, told BT Sport. ""It's outstanding, because we obviously made it a little tricky for ourselves, but we knew these kind of things could happen."" Liverpool head to the final in Paris to face either Real Madrid or Manchester City, who play their second leg in Madrid on Wednesday with City holding a slender 4-3 lead on aggregate. Klopp's side were shocked by Villarreal's aggressive man-marking in the first half which took them out of their own pressing game, and the coach conceded that he struggled to find highlights from the opening 45 minutes to show his players. Villarreal 2-3 Liverpool (2-5 agg) - Match report How the teams lined up Match stats Get Sky Sports ""We knew what was wrong because it was obvious, but we didn't have a situation to show them where we got it right,"" Klopp explained. ""I said (to my staff) 'find one where we do it well and we can show it', and we come in and they said 'no, we don't have it'."" The introduction of Colombian winger Diaz at the break seemed to liven up Liverpool's attack. ""Obviously Luis, what a player he is, but it's not about who came on, it was about how we started to play,"" Klopp explained. The 54-year-old coach said he had no preference for who his team would face in the final on May 28, saying ""whoever it will be, it will be massive"". Mohamed Salah admitted he would rather face Real Madrid than Manchester City in Paris in order to take revenge for Liverpool's 3-1 loss to the Spanish giants in the 2018 final in Kiev. Salah left the field in tears when he was forced off with a shoulder injury in the first half of that game and said he would relish the opportunity to face Madrid again. ""I want to play Madrid, I have to be honest,"" Salah told BT Sport. ""City is a really tough team. We played against them a few times this season. ""But I think, if you ask me personally, I prefer Madrid, because we lost in the final [to them], so I want to play against them and hopefully we will win it."" Salah, who provided the assist for Fabinho's crucial goal early in the second half against Villarreal, felt Liverpool's comeback in Spain underlined their strong mentality. Please use Chrome browser for a more accessible video player ""It was tough in the first half but then we went to the dressing room. The gaffer talked and we talked to each other as well. ""That shows character and personality in the dressing room. It shows that we are a top team. That's why we can strike back after losing 2-0 in the first half. I think it makes the win more exciting."" Asked if he is motivated by the possibility of winning the Quadruple, he added: ""For sure. Maybe not at the beginning of the season because I always focus on the Premier League and the Champions League but now we are close for everything, so why not?"" Liverpool's hectic schedule continues as they host Tottenham in the Premier League on Saturday at 7.45pm knowing they cannot afford to slip up if they are to catch Manchester City. The Champions League final takes place on May 28 at Saint-Denis's Stade de France in Paris, against either Real Madrid or Manchester City. May 7 - Tottenham (H) Premier League May 10 - Aston Villa (A) Premier League, live on Sky Sports May 14 - FA Cup final vs Chelsea May 17 - Southampton (A) Premier League May 22 - Wolves (H) Premier League May 28 - Champions League final Another Saturday, another chance to win £250,000 with Super 6. Play for free, entries by 3pm ",positive
2,https://www.skysports.com/football/news/11668/12604888/chelsea-sale-in-doubt-as-roman-abramovich-attempts-to-restructure-deal-to-regain-his-1-5billion-loan,Chelsea sale in doubt as Roman Abramovich attempts to restructure deal to regain his £1.5billion loan,"The sale of Chelsea has been thrown into doubt over disagreements about what will happen to the £2.5billion the club is expected to be sold for. The consortium led by US businessman Todd Boehly is the preferred bidder to buy Chelsea, but the UK government will not allow the sale to go through unless it is completely certain Roman Abramovich will not receive any of the proceeds. Two months ago Abramovich put Chelsea up for sale and said he would not be asking for his loans to the club to be repaid and all the proceeds would go to a charitable foundation for ""all the victims of the war in Ukraine"". Abramovich was sanctioned by the government on March 10, preventing him from doing any business in the UK. But the sale of Chelsea is being conducted by the Raine Group, an investment bank appointed by Abramovich, and he will have the final say on who buys the club. The government is aware of attempts to restructure any potential deal in a way which could see Abramovich receive the £1.5billion he has loaned the club through its parent company Fordstam Limited. The government has to issue a special licence for Chelsea to be sold and it would not do so if any of the proceeds were going to Abramovich or towards paying back the loans he is owed by the club. Chelsea fixtures Get Sky Sports Get NOW to stream big moments Live football on Sky Sports this week Chelsea's government licence to operate runs out on May 31 and they are facing the prospect of going out of business unless the club is sold or the licence is extended. The Premier League are meeting on June 8 to constitute the new season, by which time Chelsea would need to have a licence to be part of the next campaign. Chelsea and Abramovich have declined to comment. Analysis by Kaveh Solhekol, Sky Sports News Chief Reporter Last week some of the bidders were told Abramovich or a company linked to him actually wanted to be repaid the loans he'd made to Chelsea. What that would mean is Roman Abramovich was not writing off his loans of £1.5billion and, ultimately, that money could find its way back to Roman Abramovich. There's no way the UK government are going to stand for that, because Abramovich is sanctioned. So what is going to happen to the money? And who's going to have control of that money? Is it going to be the UK government or is it going to be Abramovich? It can't be Abramovich, because he is sanctioned. The UK government are not allowing him to do any business in the UK. So we could have a potential situation where we've got a standoff between Abramovich and the government. And all the while the clock is ticking. The clock is ticking because Chelsea's licence to operate runs out at the end of this month, May 31. There are two sides to this. If you see it from Abramovich's point of view, he is thinking: ""They want me to sell Chelsea for £2.5billion and I'm not going to get any of that money. I'm going to lose all that money. I'm going to lose the club as well and I'm going to lose the £1.5billion I've lent the club"". From the other point of view, the UK government are saying: ""Look at what is happening in Ukraine, look at what Russia is doing in Ukraine. Abramovich is somebody who is linked to the Russian government. He's linked to Vladimir Putin. That is why he's sanctioned. We cannot have him doing any business in the UK. We cannot have him making 1p in the UK"". And in the middle of all this is a stuck Chelsea Football Club. What happens to Chelsea if Abramovich refuses to sell? And of course he could do that. He's got other business interests. He's got a house in Kensington that's worth £150m. He's not selling that at the moment and giving the proceeds away to charity. He's sitting tight. But the only problem is, if he sits tight and refuses to sell Chelsea then Chelsea will go out of business. Chelsea will not exist anymore and, of course, he's always maintained Chelsea are very, very close to his heart and he does not want that to happen. But if that was to happen, who would Chelsea supporters blame? Would they blame Abramovich or would they blame the UK government? So the clock is ticking not just for Abramovich, but also for the UK government because they can't have a situation on their hands when at the end of this month Chelsea's licence to operate expires and potentially one of the biggest clubs in the world could go out of business. Chelsea bidders were told last week they would be allowed to borrow money to finance their offers for the club. A source close to the sale process says the advice on debt was changed at the same time as the bidders were asked to increase their offers by £500m. The bidders are believed to have been told there would be an element of flexibility when it came to debt. The Glazer family bought Manchester United in 2005 in a leveraged buyout which has so far cost the club more than £1billion in interest and repayments. The consortium led by Todd Boehly is the preferred bidder to take over Chelsea and they have until the end of this week to finalise the terms of an agreement to buy the club. The bid is already being scrutinised by the Premier League to see if it passes their owners and directors test. Like the other bids, they have presented their extensive plans for the club to the Raine Group and they have given guarantees they will not sell the club for at least a decade. They have also given assurances they will invest at least £1billion in the club and infrastructure, including redeveloping Stamford Bridge. Please use Chrome browser for a more accessible video player The Sir Martin Broughton and Steve Pagliuca bids are still very much in play, with both consortiums still interested in buying the club. They are on standby to re-enter the process if the Boehly bid is unsuccessful. Both believe they have made very compelling bids for the club and both believe the club will thrive and flourish in their hands. It emerged last week that Sir Jim Ratcliffe, Britain's richest man, had tabled a last-minute £4.25billion bid to buy the west London club. But, the consortium of LA Dodgers part-owner Boehly was still named as the preferred bidder. Ratcliffe has not engaged in the process set out by the Raine Group, making it difficult for his bid to be considered. Irrespective of that, his bid remains on the table and Ratcliffe is still interested in buying Chelsea. Another Saturday, another chance to win £250,000 with Super 6. Play for free, entries by 3pm Another Saturday, another chance to win £250,000 with Super 6. Play for free, entries by 3pm ",positive
3,https://www.skysports.com/football/news/11727/12544106/championship-bournemouth-nottingham-forest-luton-among-teams-in-hunt-for-promotion-to-premier-league,"Championship: Nottingham Forest, Huddersfield, Sheffield United among teams in play-off contention","With the automatic promotion places wrapped up, the battle to secure a place in the Sky Bet Championship play-offs will continue until the final day of the season. Runaway leaders Fulham secured promotion to the Premier League at the first time of asking after a 3-0 win over Preston on April 19 and then lifted the title after a crushing 7-0 win over play-off chasing Luton on May 2. They were then joined by Bournemouth on May 3, after Scott Parker's side scored a late goal to sink Nottingham Forest and make their six-point cushion inside the top two unassailable with one game to spare. And with the relegation places having been settled for weeks now, too, that leaves just the remaining four places in the top six up for grabs. But with Huddersfield having secured one and Forest another, there are two berths remaining, with Sheffield United, Luton, Middlesbrough and Millwall left to contest them. Just three points separate the fifth-placed Blades from the eighth-placed Lions. Here, we take a look at the runners and riders, their form and their key remaining fixtures as they bid to break free of the Championship's clutches and reach the Premier League... Position: 3rdGames played: 45Points: 79Form (most recent first): LWWWWSky Bet promotion odds: 7/4 Championship table Get NOW to stream big moments Sky Sports EFL Podcast Get Sky Sports Remaining fixtures: Hull (A) (May 7, 12.30pm) Please use Chrome browser for a more accessible video player Position: 4thGames played: 45Points: 79Form (most recent first): WWWDWSky Bet promotion odds: 4/1 Remaining fixtures: Bristol City (H) (May 7, 12.30pm) Please use Chrome browser for a more accessible video player  Position: 5thGames played: 45Points: 72Form (most recent first): WDWLDSky Bet promotion odds: 5/2 Remaining fixtures: Fulham (H) (May 7, 12.30pm) Please use Chrome browser for a more accessible video player  Position: 6thGames played: 45Points: 72Form (most recent first): LDWWLSky Bet promotion odds: 5/1 Remaining fixtures: Reading (H) (May 7, 12.30pm) Please use Chrome browser for a more accessible video player  Position: 7thGames played: 45Points: 70Form (most recent first): WWDLDSky Bet promotion odds: 8/1 Remaining fixtures: Preston (A) (May 7, 12.30pm) Please use Chrome browser for a more accessible video player  Position: 8thGames played: 45Points: 69Form (most recent first): WDWDWSky Bet promotion odds: 80/1 Remaining fixtures: Bournemouth (A) (May 7, 12.30pm) Please use Chrome browser for a more accessible video player  Another Saturday, another chance to win £250,000 with Super 6. Play for free, entries by 3pm Another Saturday, another chance to win £250,000 with Super 6. Play for free, entries by 3pm Another Saturday, another chance to win £250,000 with Super 6. Play for free, entries by 3pm ",positive
4,https://www.skysports.com/football/news/11095/12364379/championship-table-with-live-updates-as-the-goals-go-in,Championship table with live updates as the goals go in,"Do not miss your chance to land the £250,000 in Saturday's Super 6 round. Play for free, entries by 3pm. ",positive
5,https://www.skysports.com/football/news/11095/12604635/premier-league-clubs-concerned-over-unfeasible-champions-league-reform-and-fixture-congestion,Premier League clubs concerned over 'unfeasible' Champions League reform and fixture congestion,"Premier League clubs have major concerns that plans to expand the Champions League will lead to ""unfeasible"" fixture congestion, and the potential for European matches to be staged on the same day as top-flight domestic games. Up until now, there has been an agreement with UEFA that there should be no clash between Champions League matches and Premier League games, with the weekend protected for domestic fixtures. But Sky Sports News has been told there are widespread concerns that UEFA's plans will be unworkable, and may lead to European and domestic games going head to head - especially if proposals are pushed through for 10 Champions League group matches per team from 2024 instead of the six matches currently played. UEFA has already committed to expanding the Champions League from 32 teams to 36 from 2024. That was voted through without fanfare at their executive committee meeting last month. We understand the Premier League is currently lobbying UEFA for only two extra matches per team in the group stages instead of the proposed four. That would take the total number of games in the group stages to eight per team. Under the current system, there are 125 Champions League games in total per season. If the tournament is expanded to include eight group games per team, that would mean 64 more matches - 189 in total (a 50 per cent increase), while 10 group games would lead to 100 more games, and a total of 225 Champions League matches throughout Europe, over the course of the tournament - a 80 per cent increase. Some officials have told Sky Sports News that such a sizeable expansion could well lead to a drop in UEFA revenue, because broadcasters across Europe might be put off from bidding for the rights to host the tournament. UEFA rules dictate that broadcasters who win the rights must show all matches, and not cherry-pick the best. Big Six all to qualify for CL? Why many PL clubs oppose new plans Latest Champions League news Champions League fixtures Get Sky Sports Please use Chrome browser for a more accessible video player The new ""Swiss format"" which UEFA has proposed is expected to be ratified next month by its executive committee - though there are murmurings among European officials that UEFA may be forced to compromise. The plans include 36 clubs all in one ""conference"", whereby each team is drawn to play eight or ten different opponents, based on UEFA's ""coefficient"" - which means those teams who have done better in European competitions historically will be seeded higher, and play more of their group games against lesser opposition. The top 16 teams in the conference will then progress to the knockout stages, where the format will remain the same as now. There will no longer be home and away games against the same opposition until the knockout stages. Elsewhere in Europe, there are concerns that UEFA is pandering to the elite English clubs by offering them more and more places in the Champions League, at the expense of smaller footballing nations. Currently, the champions of 44 European countries have to pre-qualify for the Champions League before they have the chance of reaching the group stages. Another Saturday, another chance to win £250,000 with Super 6. Play for free, entries by 3pm ",positive
