,URL,Content_title,Contents,Sentiment
30,https://www.skysports.com/football/news/11669/12604865/klopp-feels-like-reaching-first-cl-final-salah-i-want-real-madrid,Jurgen Klopp admits reaching Champions League final 'feels like the first time' as Mohamed Salah eyes Real Madrid revenge,"Jurgen Klopp said reaching his fourth Champions League final as a coach felt almost like a new experience as his Liverpool side came back from two goals down against Villarreal to secure a 5-2 aggregate win in their semi-final on Tuesday. While the three-goal cushion may look comfortable, this was a test of Liverpool's nerve and powers of recovery as an awful first half by their standards saw their first-leg advantage wiped out by debut goals in the competition from Boulaye Dia and Francis Coquelin. But the half-time introduction of £37.5m January signing Luis Diaz, who has reinvigorated 2022 for Klopp's side, changed the game - aided by a poor goalkeeping performance from the hosts' Geronimo Rulli. Both Fabinho and Diaz's goals went through Rulli's legs, while the goalkeeper was beaten to the ball by Sadio Mane when he came charging out to leave the Senegalese forward with an unguarded net to seal the win on the night. ""It feels like the first in 20 (years),"" Klopp, who led Borussia Dortmund to the final of the competition in 2013 and Liverpool in 2018 and 2019, told BT Sport. ""It's outstanding, because we obviously made it a little tricky for ourselves, but we knew these kind of things could happen."" Liverpool head to the final in Paris to face either Real Madrid or Manchester City, who play their second leg in Madrid on Wednesday with City holding a slender 4-3 lead on aggregate. Klopp's side were shocked by Villarreal's aggressive man-marking in the first half which took them out of their own pressing game, and the coach conceded that he struggled to find highlights from the opening 45 minutes to show his players. Villarreal 2-3 Liverpool (2-5 agg) - Match report How the teams lined up Match stats Get Sky Sports ""We knew what was wrong because it was obvious, but we didn't have a situation to show them where we got it right,"" Klopp explained. ""I said (to my staff) 'find one where we do it well and we can show it', and we come in and they said 'no, we don't have it'."" The introduction of Colombian winger Diaz at the break seemed to liven up Liverpool's attack. ""Obviously Luis, what a player he is, but it's not about who came on, it was about how we started to play,"" Klopp explained. The 54-year-old coach said he had no preference for who his team would face in the final on May 28, saying ""whoever it will be, it will be massive"". Mohamed Salah admitted he would rather face Real Madrid than Manchester City in Paris in order to take revenge for Liverpool's 3-1 loss to the Spanish giants in the 2018 final in Kiev. Salah left the field in tears when he was forced off with a shoulder injury in the first half of that game and said he would relish the opportunity to face Madrid again. ""I want to play Madrid, I have to be honest,"" Salah told BT Sport. ""City is a really tough team. We played against them a few times this season. ""But I think, if you ask me personally, I prefer Madrid, because we lost in the final [to them], so I want to play against them and hopefully we will win it."" Salah, who provided the assist for Fabinho's crucial goal early in the second half against Villarreal, felt Liverpool's comeback in Spain underlined their strong mentality. Please use Chrome browser for a more accessible video player ""It was tough in the first half but then we went to the dressing room. The gaffer talked and we talked to each other as well. ""That shows character and personality in the dressing room. It shows that we are a top team. That's why we can strike back after losing 2-0 in the first half. I think it makes the win more exciting."" Asked if he is motivated by the possibility of winning the Quadruple, he added: ""For sure. Maybe not at the beginning of the season because I always focus on the Premier League and the Champions League but now we are close for everything, so why not?"" Liverpool's hectic schedule continues as they host Tottenham in the Premier League on Saturday at 7.45pm knowing they cannot afford to slip up if they are to catch Manchester City. The Champions League final takes place on May 28 at Saint-Denis's Stade de France in Paris, against either Real Madrid or Manchester City. May 7 - Tottenham (H) Premier League May 10 - Aston Villa (A) Premier League, live on Sky Sports May 14 - FA Cup final vs Chelsea May 17 - Southampton (A) Premier League May 22 - Wolves (H) Premier League May 28 - Champions League final Another Saturday, another chance to win £250,000 with Super 6. Play for free, entries by 3pm ",positive
31,https://www.skysports.com/football/news/11095/12605011/papers-adeyemi-rejects-huge-man-utd-offer-in-favour-of-dortmund,Man Utd rejected by Karim Adeyemi despite huge offer as striker favours Borussia Dortmund move - Paper Talk,"All the top stories and transfer rumours from Wednesday's national newspapers... DAILY MIRROR Manchester United made a huge offer to Red Bull Salzburg striker Karim Adeyemi to try and hijack his move to Borussia Dortmund but were rebuffed as the player had set his heart on a move to Germany. Crystal Palace could make a summer move to bring Aaron Wan-Bissaka back to Selhurst Park but his wages, which increased to £90,000-a-week at Old Trafford, are likely to be a big issue. Lucas Torreira is closing on a permanent move to Fiorentina, a deal that would add around £13m to Mikel Arteta's summer spending war chest. Incoming Manchester United boss Erik ten Hag has identified eight players he can build his team around ahead of starting work at Old Trafford this summer. Gary Player's son Wayne has been handed a lifetime ban from The Masters after a golf ball marketing stunt during last year's ceremonial tee-off. Transfer Centre LIVE! Get Sky Sports Download the Sky Sports App Get NOW to stream big moments DAILY MAIL Tottenham's players will share a bonus pot of £3.5m if they qualify for the Champions League this season, while manager Antonio Conte will reportedly pocket £2m. Premier League clubs have been handed a boost after Monaco's £60m price tag on Aurelien Tchouameni reportedly put Real Madrid off a move for the in-demand midfielder. THE SUN Football fans are certain Kylian Mbappe will leave PSG this summer after leaked photos showed the Real Madrid target packing up his possessions at home. Tottenham could make a third raid on Juventus this summer, with USA international midfielder Weston McKennie reported to be the player they are interested in. Newcastle are in pole position to land AC Milan winger Rafael Leao this summer and are reportedly willing to quadruple his wages to secure a deal. DAILY TELEGRAPH The ""rebel"" Saudi golf series has moved on to targeting the world's leading amateur players and is offering huge sums of money to tempt them into joining up. Frankfurt Police will place officers ""on every corner"" to try and deter any clashes with West Ham supporters when they arrive for the Europa League clash with Eintracht. DAILY EXPRESS Tottenham could re-ignite their interest in Wolves winger Adama Traore this summer with Barcelona set to turn down the chance to turn his loan move into a permanent one for £25m. Divock Origi's move to AC Milan is being delayed because of takeover talks at the Serie A club who are keen to sign the Liverpool forward on a free. DAILY RECORD Jota has already opened talks with Celtic over turning his loan move from Benfica into a permanent £6.5m deal, according to a report in Portugal. Celtic youngster Brody Paterson hopes to secure a summer move by impressing for loan club Airdrie in their two playoff games against Montrose. Hearts face a wait to see if their ""B"" team will be accepted alongside Rangers and Celtic in the Lowland League next season with a possible stumbling block of the league being left with an odd number of teams. Another Saturday, another chance to win £250,000 with Super 6. Play for free, entries by 3pm ",positive
32,https://www.skysports.com/football/news/19531/12605017/cl-hits-and-misses-diaz-is-liverpools-game-changer,Luis Diaz is Liverpool's game-changer as Geronimo Rulli costs Villarreal - Champions League hits and misses,"Liverpool's players walked off the pitch in stunned silence as the home crowd roared with delight. It was half-time at the Estadio de la Ceramica and Villarreal had hauled themselves level on aggregate. Jurgen Klopp' side looked in serious trouble but fortunately for them, that was as bad as it got. By the end, a night which threatened disaster had turned into one of celebration. A third Champions League final in five years beckons and it owes a lot to Luis Diaz. The Colombian, outstanding since his arrival from Porto in January, changed the game after replacing Diogo Jota at the interval, scoring Liverpool's second goal when he headed home Trent Alexander-Arnold's cross and causing near-constant panic in Villarreal's previously untroubled defence. Within 15 minutes of his introduction, he had touched the ball more times than Jota did in the whole of the first half and every one of those touches seemed to strike fear into the yellow-shirted defenders unfortunate enough to find themselves in his vicinity. Juan Foyth, in particular, will be eager to forget his evening up against Diaz, whose explosive pace and sheer relentlessness gave the former Tottenham right-back no end of difficulties. Villarreal 2-3 Liverpool (2-5 agg) - Match report Liverpool fixtures Get Sky Sports Get NOW to stream big moments Diaz was a whirlwind of activity on Liverpool's left flank, completing four dribbles and attempting four shots - twice as many as any of his team-mates despite only playing one half. But in addition to the chaos factor which destabilised Villarreal so effectively, there was composure in how he used the ball, with all but two of his 20 attempted passes finding a red shirt. Afterwards, Virgil van Dijk lauded his impact as ""incredible"" and the centre-back was not the only one grateful for the 25-year-old's contribution. He was Liverpool's game-changer. Just don't expect him to start on the bench again in Paris.Nick Wright It is a good time to be a Liverpool fan, who can look forward to two more finals this season. Indeed, Jurgen Klopp has guided them into an eighth final during his time as manager and they are just six games away now from an historic quadruple. Liverpool came here to complete the job, show professionalism and to finish what they started a week ago in the face of a crackling atmosphere - but they showed signs of frailty in the opening 45 minutes. Experience would eventually tell, aided and abetted by a distinctly ordinary goalkeeping performance from the hosts' Geronimo Rulli. Liverpool had been in this position twice before under Klopp, progressing on both occasions before losing the 2018 final to Real Madrid and winning a sixth European Cup against Tottenham the following year. Only one team has ever overturned a two-goal deficit from a Champions League semi-final - Klopp's Liverpool against Barcelona that season. Their know-how, particularly in 2019, certainly helped here in spite of Unai Emery's own very proud knockout history in European competition. He was the PSG manager on the receiving end of Barcelona's infamous 'Remontada' in 2017 - and was described as the ""king of the cups"" by Klopp - but this proved a step too far even for him to mastermind his own turnaround for a team currently seventh in La Liga. Ending May with four trophies in the cabinet is becoming an increasing possibility for Liverpool. The Carabao Cup was secured in February, and they can also look forward to an FA Cup final in just under a fortnight's time; underlying all of that is another epic title race which is set to go right down to the wire with Manchester City only one point ahead with four matches. The relentless pursuit of a quadruple - and a seventh European Cup - rolls on.Ben Grounds It is a stat that says it all about Villarreal goalkeeper Geronimo Rulli. The Argentine has made the most errors leading to goals of any player in the Champions League this season with three. Two of those came in the second leg defeat to Liverpool as he weakly let Fabinho's shot through his legs despite it being hit straight at him. A top-class goalkeeper would have definitely stopped the Brazilian's shot and kept Liverpool scoreless at the time. He could do little about Luis Diaz's goal that drew Liverpool level, as his powerful downward header went through his legs. But Rulli was entirely at fault once again for the third and final goal as he madly rushed out to clear the ball, but was beaten by Mane, who then rounded Juan Foyth to tap into an empty net for a simple finish. The 29-year-old was always going to be a major weak link following the first leg. He was incredibly shaky at Anfield as he constantly punched the ball and inspired the Liverpool attack more than his defence. Indeed, he was at fault for Liverpool's opener at Anfield as Jordan Henderson's deflected cross somehow looped over him following some poor footwork as he misjudged the flight of the ball. Over the two legs in this semi-final, Rulli cost his side three goals and things may have been tighter for Liverpool had Villarreal had a better goalkeeper. In fact, Rulli became the first goalkeeper to make two errors in the same knockout Champions League game since Liverpool's Loris Karius. Villarreal boss Unai Emery could certainly learn from how Jurgen Klopp moved on from Karius after that 2018 Champions League final defeat to sign Alisson and fix their goalkeeping issue.Declan Olley Another Saturday, another chance to win £250,000 with Super 6. Play for free, entries by 3pm ",positive
33,https://www.skysports.com/football/news/29326/12604012/neville-man-citys-monstrous-madrid-mission,"Man City face 'monstrous' Real Madrid mission to reach Champions League final, says Gary Neville","Manchester City's ""monstrous"" Champions League semi-final task against Real Madrid at the Bernabeu presents Kevin De Bruyne with the platform to deliver the success to match his world-class talent, says Gary Neville. One week on from City's astounding 4-3 first-leg triumph at the Etihad Stadium, the champions of England and Spain lock horns in Madrid with their Champions League semi-final on a knife edge. Sky Sports pundit Neville believes Pep Guardiola's side must produce the ""performance of their lives"" to reach successive European finals at the expense of the 13-time winners, and keep their hopes of a Premier League and Champions League double alive. ""This is a monstrous game in midweek for City,"" Neville said. ""Manchester City versus Real Madrid is an event. The game last week was, but this on Wednesday is like a heavyweight boxing clash of the century. ""You have one every few years whereby you've got this historic club that has basically got this inbuilt resilience in this competition that punches well above its actual ability. ""Real Madrid were on the canvas a couple of times [against PSG, Chelsea, and at Man City] but they got up, and that is the thing Pep will fear most. ""However well City play, however good their football is, how much possession they keep, there will be a dangerous beast facing them that doesn't know how to give in, how to stop, or call it a day. That is what is coming on Wednesday. Nev: City, Liverpool never feel pressure Man City and Liverpool run-ins compared Download the Sky Sports app Please use Chrome browser for a more accessible video player ""Whereas Liverpool need a goal [against Villarreal], Manchester City need the performance of their lives in the Bernabeu. ""This game will have huge impact on Manchester City for the rest of the season, because if they do go out on Wednesday after losing last season's final to Chelsea disappointingly, there will be a drain on Pep Guardiola and what he and the players want to achieve. It's a big week."" Madrid's staying power has seen them dump Paris Saint-Germain and holders Chelsea out en route to the last four and that never-say-die attitude weathered a relentless barrage from Manchester City in last week's semi-final first leg to keep their hopes of reaching another final alive. It is that spirit which Neville cites as the reason for his reluctance to rule out Real Madrid's chances of progressing, despite believing Manchester City's superior quality will help them navigate this latest, greatest hurdle to reach the Champions League final. ""I think City will go through, but you cannot write off Real Madrid because of the historic resilience they prove time and time again,"" Neville added. Please use Chrome browser for a more accessible video player  ""Real Madrid were done in the first half at the Etihad, weren't they? We thought City were going to do them 3, 4, 5, 6 without reply. But there's something in the Real Madrid team. ""Real Madrid have a spirit in the Champions League that City don't. It's a big moment for City - a very big moment. Manchester City haven't got that Champions league spirit yet, that history. They've struggled to come to terms with the competition, the fans have in terms of the early days getting used to it. Real are without key defender David Alaba through injury but the Casemiro is fit to feature in midfield.   Casemiro’s availability, having only been fit enough for the bench last week, gives Carlo Ancelotti a selection poser over whether or not to retain the in-form Rodrygo, who has scored four goals in his last five games.   Man City could have Kyle Walker back in action. The defender, who has been absent for the last five matches while recovering from an ankle issue, has trained and was due to travel with the squad to Spain, with a late decision to be made.   John Stones remains sidelined after coming off in the first half of the 4-3 first-leg victory last week, while Joao Cancelo, suspended for that match, is available. ""Losing to Chelsea last year has given them the motivation - like hang on, we need this now! They'll need everything and more. They needed it against Atletico to get through that. They'll need everything and even more to get past Real Madrid because they are going to have to go to the end. ""City are favourites because they will score goals at the Bernabeu. Chelsea scored goals over there, they were outstanding, and City play very well. They pass the ball well and when you do that in an away stadium with the home team getting drawn forward by the crowd, City will get chances and flood them open."" De Bruyne played an instrumental role as Manchester City established their slender first-leg advantage with his side's second-minute opener and an assist in last week's absorbing 4-3 victory. Neville insists De Bruyne's world-class talent is irrefutable but believes Wednesday's clash at the Bernabeu presents the Belgian with the opportunity to cement his legacy by guiding City to an elusive Champions League crown. ""Kevin De Bruyne is the man you know can be the difference,"" Neville added. ""He was brilliant, sensational in the first leg against Real Madrid and he's going to have to be that again. This is his moment. ""De Bruyne has always been respected, loved by everyone in the Premier League, he's a joy to watch, but to get to that next level of winning your team the Champions League, go and score the winner in the Bernabeu, put the performance in which brings him the success to go with his world-class talent. This is Kevin De Bruyne's moment."" Please use Chrome browser for a more accessible video player  A staggering 11 years have passed since Guardiola last got his hands on the Champions League trophy when his iconic Barcelona team dismantled Manchester United in the 2011 final at Wembley. Having revolutionised the game at Barcelona, the different challenge undertaken by Guardiola in Manchester has produced similar results with the exception of that elusive Champions League crown, which Neville believes stands between the Spaniard and City greatness. ""Pep had the greatest football team of all time at Barcelona,"" he added. ""I've never seen a football team like that over a three- to four-year period. But he's doing it differently at Manchester City, he is doing it differently. ""He hasn't got Messi, this phenomenon that existed in that team, and he probably wants to do it again. He needs to win that Champions League and if Pep Guardiola could win the Champions League and the Premier League this season, it would be sensational. City, along with Liverpool, are on the brink of greatness."" Follow every Man City game in the Premier League this season with our live blogs on the Sky Sports website and app, and watch match highlights for free shortly after full-time. Want the Man City latest? Bookmark our Man City news page, check out Man City's fixtures and Man City's latest results, watch Man City goals and video, keep track of the Premier League table and see which Man City games are coming up live on Sky Sports. Get all this and more - including notifications sent straight to your phone - by downloading the Sky Sports Scores app and setting Man City as your favourite team. Hear the best Premier League reaction and expert analysis with the Essential Football and Gary Neville podcasts, keep up-to-date with our dedicated Transfer Centre, follow the Sky Sports social accounts on Twitter, Instagram and YouTube, and find out how to get Sky Sports. Another Saturday, another chance to win £250,000 with Super 6. Play for free, entries by 3pm ",positive
