,URL,Content_title,Contents,Sentiment
73,https://www.bbc.co.uk/sport/football/61198227,Barnsley 1-3 Preston North End: Daniel Johnson scores twice for Lilywhites,"Daniel Johnson's double gave Preston the points in the Championship at already-relegated Barnsley. Aiden Marsh gave the home side the lead when he in volleyed from Victor Adeboyejo's cutback - a first goal for the promising youngster. But after that it was Preston who made the better chances and were level a few minutes later after Emil Riis Jakobsen played in Johnson to score in the bottom right corner. Johnson repeated the trick with an even better strike into the same side of the goal 10 minutes into the second half. And Riis Jakobsen made the game safe when he scored his 19th goal of the season, finishing from a tight angle. With Barnsley already resigned to League One football next term and Preston in mid-table, there was little to play for in the penultimate game of the league season at Oakwell. Preston created the better chances after their equaliser with Ben Whiteman hitting the bar just before the break and Jack Walton pushing Patrick Bauer's header past the post. The visitors should have added a third when Jakobsen side-footed his effort straight at Walton after being played in by Cameron Archer. Preston used the match to mark Gentry Day, an annual event organised by the fans to remember any North End follower or player who has passed away in the previous 12 months. Formation  3-4-2-1 Formation  3-1-4-2 Match ends, Barnsley 1, Preston North End 3. Second Half ends, Barnsley 1, Preston North End 3. Attempt missed. Carlton Morris (Barnsley) left footed shot from outside the box misses to the left. Assisted by Jordan Helliwell. Corner,  Preston North End. Conceded by Jack Walton. Attempt saved. Sean Maguire (Preston North End) right footed shot from the centre of the box is saved in the top right corner. Assisted by Mikey O'Neill. Attempt blocked. Callum Styles (Barnsley) left footed shot from outside the box is blocked. Assisted by Matthew Wolfe. Attempt blocked. Callum Styles (Barnsley) left footed shot from the centre of the box is blocked. Corner,  Barnsley. Conceded by Alan Browne. Attempt blocked. Cauley Woodrow (Barnsley) right footed shot from a difficult angle on the right is blocked. Assisted by Callum Styles. Attempt saved. Carlton Morris (Barnsley) header from the centre of the box is saved in the top centre of the goal. Assisted by Callum Styles with a cross. Corner,  Barnsley. Conceded by Benjamin Whiteman. Attempt missed. Brad Potts (Preston North End) left footed shot from the right side of the box is close, but misses to the right. Assisted by Alistair McCann. Substitution, Preston North End. Sean Maguire replaces Emil Riis Jakobsen. Corner,  Preston North End. Conceded by Jordan Helliwell. Attempt missed. Mikey O'Neill (Preston North End) right footed shot from the right side of the box misses to the left. Assisted by Alan Browne. Attempt missed. Callum Styles (Barnsley) right footed shot from outside the box is high and wide to the right. Substitution, Preston North End. Mikey O'Neill replaces Cameron Archer. Foul by Alan Browne (Preston North End). Callum Styles (Barnsley) wins a free kick in the defensive half. Matthew Wolfe (Barnsley) hits the bar with a right footed shot from the right side of the box. ",positive
74,https://www.bbc.co.uk/sport/football/61198200,Blackburn Rovers 0-3 Bournemouth: Solanke & Billing shine in Cherries victory,"Dominic Solanke's 30th goal of a prolific season and a double from Philip Billing kept Bournemouth on track for promotion to the Premier League and put an end to Blackburn's play-off hopes. Solanke slotted low into the corner to put the away side on their way to a win which sets up a tantalising meeting with in-form Nottingham Forest, who, following their 5-1 victory over Swansea, would go above Bournemouth with victory on Tuesday evening with just one game left to play. The Cherries were equally impressive in their win and will go into the fixture full of confidence thanks to a clinical attacking display at Ewood Park. Solanke shone throughout and teed up Billing, who fired the ball home from inside the box, and a routine victory was sealed when Billing slotted in his second from close range with just over 10 minutes remaining. Huddersfield beat Coventry 2-1 and can still mathematically sneak into the automatic promotion spots, but need to win their final game, hope Forest beat Bournemouth, both sides lose their final game, while the Terriers must also overturn a huge goal difference. Bournemouth will be sure of securing automatic promotion if they beat Forest in midweek, while two draws from their final two games will also be enough to take them back to the Premier League. The Cherries were good value for their half-time lead against a side who did not manage an attempt on target and never looked in serious danger against a Rovers side who realistically had to win to keep alive their slim play-off chances. Solanke was involved in much of the away side's most dangerous moments, finding Billing who saw his early shot blocked before the same duo combined neatly to put the Cherries ahead when Billing put Solanke through and the former Liverpool striker finished coolly. The lead should have been doubled soon after when Jaidon Anthony's fierce strike crashed back off the bar following another cute pass from Solanke. Bournemouth continued to remain on top after the break, although Ben Brereton Diaz did force keeper Mark Travers into a decent save after working his way into the box. But, after Jefferson Lerma had an effort cleared off the line and Solanke went close, the visitors did go further ahead thanks to two goals in 10 minutes from Billing to seal a result which keeps them in prime spot in a thrilling promotion race. Blackburn boss Tony Mowbray: ""It's ok running, chasing and tackling, but sometimes you play against better teams. We've already beaten Bournemouth this season, I get that, but they do have some really high-quality players. ""We had some chances and they had some chances to score. We didn't take ours and they took theirs. ""The more you try to attack to win a game, you leave yourself more vulnerable and I think that's what happened today. ""Against the quality of Bournemouth, they punished us today, but I couldn't question the desire of our team. We needed one of our chances to go in. ""Mid-February we were sitting second in the league and it's obviously frustrating we've missed out on the play-offs with a game to go. I feel as if I'm leaving them with some talent in that squad and some assets there and hopefully they can continue to grow."" Bournemouth boss Scott Parker: ""Overall, it was a day that went to plan in every aspect. ""We knew Blackburn would have to come at us. They needed a result with the position they were in. ""We needed to be solid and diligent and all that side of the game, which we showed. We also knew if it opened up, we needed to be clinical . And we were definitely that as well. ""We needed every single player one pulling in the right direction and that has certainly been the case for large parts of the season.  It was a high-pressure game. The result was key. Performance is secondary at this part of the season. But we got a result and we got a performance. We were deadly in our moments. ""I've been in football for a long time and there's only limited teams that get to a point where they have opportunities to be successful. We have that opportunity, we need to embrace that, play with a freedom. I thought we did that very well."" Formation  4-2-3-1 Formation  4-2-3-1 Match ends, Blackburn Rovers 0, Bournemouth 3. Second Half ends, Blackburn Rovers 0, Bournemouth 3. Foul by Bradley Dack (Blackburn Rovers). Siriki Dembélé (Bournemouth) wins a free kick on the left wing. Jordan Zemura (Bournemouth) is shown the yellow card for a bad foul. Ian Poveda-Ocampo (Blackburn Rovers) wins a free kick on the right wing. Foul by Jordan Zemura (Bournemouth). Offside, Blackburn Rovers. Bradley Dack tries a through ball, but Ben Brereton Díaz is caught offside. Substitution, Bournemouth. Jamal Lowe replaces Dominic Solanke. Offside, Blackburn Rovers. Darragh Lenihan tries a through ball, but Bradley Dack is caught offside. Goal!  Blackburn Rovers 0, Bournemouth 3. Philip Billing (Bournemouth) left footed shot from the centre of the box to the bottom left corner. Assisted by Siriki Dembélé. Offside, Blackburn Rovers. Darragh Lenihan tries a through ball, but Ben Brereton Díaz is caught offside. Substitution, Bournemouth. Chris Mepham replaces Ryan Christie because of an injury. Corner,  Blackburn Rovers. Conceded by Nathaniel Phillips. Attempt blocked. Bradley Dack (Blackburn Rovers) right footed shot from the centre of the box is blocked. Assisted by Lewis Travis with a cross. Goal!  Blackburn Rovers 0, Bournemouth 2. Philip Billing (Bournemouth) left footed shot from the centre of the box to the top left corner. Assisted by Dominic Solanke. Substitution, Blackburn Rovers. Bradley Dack replaces Sam Gallagher. Attempt saved. Dominic Solanke (Bournemouth) left footed shot from the centre of the box is saved in the centre of the goal. Attempt missed. Jefferson Lerma (Bournemouth) header from the centre of the box misses to the left. Assisted by Ryan Christie with a cross following a corner. Corner,  Bournemouth. Conceded by Scott Wharton. ",positive
75,https://www.bbc.co.uk/sport/football/61198215,Blackpool 0-2 Derby: Malcolm Ebiowei and Eiran Cashin earn victory for Rams,"Malcolm Ebiowei and Eiran Cashin scored their first senior goals as already relegated Derby County ended a run of nine consecutive away defeats with a battling victory over Blackpool. A first half lacking in quality saw both sides struggle to create opportunities, but the Seasiders squandered the best chance to go ahead when Gary Madine saw his penalty saved by Kelle Roos after James Husband had been felled in the area by Festy Ebosele. Both sides improved after the interval, with Kirk and Madine both going close for the hosts. But Ebiowei fired home the opening goal from inside the box after a smart cross by Ravel Morrison. Victory in front of more than 4,000 travelling fans was all but assured when the excellent Ebiowei sent in an inviting free-kick which Cashin converted past keeper Chris Maxwell. Third-from-bottom Derby's 14th win of the season capped a more encouraging week for Wayne Rooney's troubled side, with the Rams boss saying that he expects to have the club's takeover agreed in the next 10 days. Chris Kirchner was earlier this month named as the preferred bidder to buy the Rams and take them out of administration. Meanwhile, Blackpool are 16th in the table but could still climb as high as 10th with victory against Peterborough United on the final day of the season on Saturday, 7 May. Blackpool boss Neil Critchley: ""When you get a crowd like we had today, you want to give them a day to remember with some goals and a win. Unfortunately, we've not been able to do that. ""The game probably epitomised our season a bit. We were the better team in large parts, but didn't finish our chances. We conceded two really poor goals, and that was frustrating. ""Gary had his penalty saved - the goalkeeper pulled off a very good save. We've had other chances and lots of moments in the final third which we didn't finish. ""It's obviously disappointing to lose but it doesn't change my opinion of the season as a whole. We've had a very good season."" Derby boss Wayne Rooney: ""I'm delighted. We weren't at our best. It's as poor a performance as we've had for while. ""But football's a funny game.  We kept a clean sheet. Kelle kept us in a with a great penalty save. We got the first goal, which is so important, saw the game out and came away with three points. ""We dug in. The lads have showed spirit and togetherness all season. It was a big moment for Malcom and Cash to get their first goals. ""We've had incredible support all season. The fans deserve a lot of credit. We are proud of the fans and I'd like to say thank you to the Blackpool fans for clapping the players off."" Formation  4-4-2 Formation  4-2-3-1 Match ends, Blackpool 0, Derby County 2. Second Half ends, Blackpool 0, Derby County 2. Attempt missed. Jerry Yates (Blackpool) left footed shot from the centre of the box is close, but misses to the right. Assisted by Shayne Lavery. Richard Keogh (Blackpool) wins a free kick in the defensive half. Foul by Osazee Aghatise (Derby County). Festy Ebosele (Derby County) is shown the yellow card for a bad foul. Shayne Lavery (Blackpool) wins a free kick on the left wing. Foul by Festy Ebosele (Derby County). Substitution, Derby County. Osazee Aghatise replaces Malcolm Ebiowei. Corner,  Blackpool. Conceded by Craig Forsyth. Attempt blocked. Jerry Yates (Blackpool) header from the centre of the box is blocked. Assisted by Kenneth Dougall with a headed pass. Curtis Davies (Derby County) is shown the yellow card for a bad foul. Shayne Lavery (Blackpool) wins a free kick on the left wing. Foul by Curtis Davies (Derby County). Foul by Oliver Casey (Blackpool). Louie Sibley (Derby County) wins a free kick in the defensive half. Goal!  Blackpool 0, Derby County 2. Eiran Cashin (Derby County) header from the centre of the box to the bottom right corner. Assisted by Malcolm Ebiowei with a cross   following a set piece situation. Callum Connolly (Blackpool) is shown the yellow card for a bad foul. Foul by Callum Connolly (Blackpool). Jason Knight (Derby County) wins a free kick on the left wing. ",positive
76,https://www.bbc.co.uk/sport/football/61198199,Bristol City 5-0 Hull City: Five-goal Bristol City thrash Hull,"Chris Martin and Andreas Weimann scored twice as Bristol City romped to a 5-0 win over Hull City, securing back-to-back victories for the first time this season. Weimann open the Robins' account after only five minutes with his 21st goal of the campaign. Antoine Semenyo doubled the lead with a strike into the bottom corner and Chris Martin capped a fine attacking display 60 seconds later, after being set up by the 22-year-old. Martin then made it four early in the second half, before Austria striker Weimann added a fifth with a chip over Nathan Baxter as Bristol City recorded their biggest win of the season. Nigel Pearson's side have struggled with consistency all season but one major positive has been the improvement to their threat in front of goal. Weimann, Martin and Semenyo now have 42 goals between them. The Austrian struck first with a goal that started from Bristol City keeper Dan Bentley at the back, from which Semenyo set up Weimann who took the ball over Nathan Baxter. Semenyo then put his own name on the scoresheet, pouncing on a Hull mistake in midfield and rifling the ball into the left corner. He was involved again a minute later, playing in Martin who only had to tap in as the home side ripped Hull's defence to pieces. Martin got his second before the hour mark, stealing the ball off Sean McLoughlin and running down half of the pitch before stroking the ball beyond Baxter in a one-on-one. Weimann completed the rout eight minutes from time with a delicate chip into the net from close range as Bristol City successfully backed up their win over Derby last week. The Robins stay 17th, but are now five points clear of 18th-placed Hull. Bristol City manager Nigel Pearson told BBC Radio Bristol: ""It's a really positive way to finish the season at home. I suppose one of the questions will be why has it not happened earlier. I always like to concentrate on what the positives are and I think today was such a comprehensive win, it's important that we enjoy it. ""For all three of the strike force to get on the scoresheet again is very, very important. Andi getting two, Chrissy getting two, Antoine one, it's just shows you where we are and the types of players that we have and to keep a clean sheet too was very important. ""I think the message for our fans to go home with is also very important too and that is that we'll do everything we can to improve on where we are at the moment."" Hull City manager Shota Arveladze told BBC Radio Humberside: ""There's too short time to find out what happened today and give you an answer. There was a little bit the impression that says the season is over or something like that; get soft, get easy. Starting with myself I gave the wrong impression last week. ""Even though we tried to prepare the same way as we've done all the time, our work analysing, but it was not enough probably and it cost us what it cost. ""Maybe my body language, my voice, I was quiet maybe on the field giving the messages. There's no point giving this performance like the season is just over before the game. Our season is not over and these boys they've never done this, shown this. ""But today was very slow, sloppy, easy everything slow, everything slow, thinking slow, actions slow, give the opponent anything they wish to play the game they do. ""I'm angry but of course I'm disappointed as well."" Formation  3-4-1-2 Formation  3-4-2-1 Match ends, Bristol City 5, Hull City 0. Second Half ends, Bristol City 5, Hull City 0. Matty James (Bristol City) wins a free kick on the left wing. Foul by Richard Smallwood (Hull City). Alfie Jones (Hull City) is shown the yellow card for a bad foul. Foul by Alfie Jones (Hull City). Ayman Benarous (Bristol City) wins a free kick in the defensive half. Richard Smallwood (Hull City) is shown the yellow card for a bad foul. Joe Williams (Bristol City) wins a free kick in the attacking half. Foul by Richard Smallwood (Hull City). Offside, Bristol City. Nahki Wells tries a through ball, but Tommy Conway is caught offside. Substitution, Bristol City. Tommy Conway replaces Andreas Weimann. Goal!  Bristol City 5, Hull City 0. Andreas Weimann (Bristol City) right footed shot from the right side of the box to the top left corner. Assisted by Chris Martin. Attempt blocked. Ayman Benarous (Bristol City) right footed shot from the left side of the box is blocked. Assisted by Matty James. Attempt saved. Lewie Coyle (Hull City) left footed shot from outside the box is saved in the bottom left corner. Assisted by Richard Smallwood. Attempt missed. Keane Lewis-Potter (Hull City) right footed shot from outside the box is close, but misses the top right corner. Assisted by Ryan Longman. Substitution, Bristol City. Nahki Wells replaces Antoine Semenyo. Substitution, Hull City. Ryan Longman replaces Brandon Fleming. Foul by Brandon Fleming (Hull City). Jay Dasilva (Bristol City) wins a free kick in the defensive half. ",positive
77,https://www.bbc.co.uk/sport/football/61198204,Cardiff City 1-1 Birmingham City: Will Vaulks penalty cancels out Jeremie Bela strike,"Cardiff City and Birmingham City both saw late-season winless runs continue as Will Vaulks' late penalty denied the Blues a rare away win. Lee Bowyer's team were on course for just a fifth travelling triumph of the Championship season after Jeremie Bela's precise finish. But Vaulks' spot-kick saw Cardiff end a four-game losing streak in their last home match of the campaign. The hosts' fightback means Birmingham are also without a win in five matches. Birmingham stay 20th in the table, with Steve Morison's Cardiff one place and three points better off going into the final weekend of what has proved an arduous campaign for both clubs. But for the points deductions at Derby County and Reading, this would have been a hugely significant fixture in the Championship relegation scrap. Birmingham would have started the day in the bottom three, with Cardiff just three points above them. Instead there was little at stake in a contest between two clubs who will hope for much better next season. There were chances at both ends in the first half, with Perry Ng forcing Neil Etheridge to shovel his long-range effort away before Cody Drameh's follow-up shot was beaten away by the ex-Cardiff goalkeeper. At the other end, Dillon Phillips made fairly routine saves from Juninho Bacuna and Onel Hernandez before Birmingham scored on the counter. The goal came from an attacking Tommy Doyle set-piece which was headed clear by Maxime Colin. Bacuna threaded a perfect pass through a ragged Cardiff rearguard for Bela and the Frenchman finished in style, guiding his shot into the bottom corner. Birmingham threatened to double their advantage early in the second period when Gary Gardner headed narrowly wide of the far post, before Jordan Hugill stroked home from close range only for an offside flag to stifle home celebrations. Cardiff kept plugging away, with Mark Harris' penalty appeal ignored before Vaulks' crisp drive flew too close to Etheridge. Jordan James wasted a chance to settle the contest as he shot narrowly wide from Hernandez's pull-back, and Birmingham were made to pay when Ng chipped a pass into the visitors' box and Etheridge raced off his line and collided with Max Watters. There was no debate about the award of Cardiff's first penalty of the season - and there was no doubt about the finish, either, as Vaulks smashed high into the net from 12 yards. Cardiff manager Steve Morison: ""They had one counter-attack in the first half and a moment after that, but we dominated from start to finish. ""We have just got to get better in the final third, you can see that - it's as clear as day. We haven't had a penalty all year. It was nice to get one and Will put it away. ""I am pleased that they stuck at it and gave it a right go. It's nice to not end with a loss in the last home game of the season. ""They had a couple of hairy moments in the second half where they could have scored, but we could have scored plenty as well."" Birmingham manager Lee Bowyer: ""We're disappointed not to win the game. I felt we were the better side for large periods. I didn't see them scoring from open play and I thought we handled them well. ""I thought we controlled the game. We should have taken more advantage in the first half and scored another goal. We had chances in the second half as well but we didn't score and at 1-0 you always leave yourself open for them to nick a draw and that's what they did. ""We didn't do too much wrong but it's another case of dropping two points. ""We didn't take our chances but I've said that too many times this season. We didn't lose, the players gave everything from start to finish but it wasn't a win."" Formation  5-3-2 Formation  3-4-1-2 Match ends, Cardiff City 1, Birmingham City 1. Second Half ends, Cardiff City 1, Birmingham City 1. Attempt missed. Curtis Nelson (Cardiff City) right footed shot from the left side of the box is high and wide to the left. Corner,  Cardiff City. Conceded by Nico Gordon. Foul by Perry Ng (Cardiff City). Lyle Taylor (Birmingham City) wins a free kick on the right wing. Attempt blocked. Max Watters (Cardiff City) left footed shot from the centre of the box is blocked. Assisted by Curtis Nelson. Corner,  Cardiff City. Conceded by Nico Gordon. Attempt missed. Lyle Taylor (Birmingham City) right footed shot from the left side of the box is too high. Assisted by Jordan Graham with a cross following a corner. Corner,  Birmingham City. Conceded by Mark McGuinness. Attempt missed. Mark McGuinness (Cardiff City) header from the centre of the box misses to the left. Assisted by Will Vaulks. Attempt missed. Mark Harris (Cardiff City) right footed shot from outside the box is high and wide to the right. Goal!  Cardiff City 1, Birmingham City 1. Will Vaulks (Cardiff City) converts the penalty with a right footed shot to the high centre of the goal. Neil Etheridge (Birmingham City) is shown the yellow card for a bad foul. Penalty Cardiff City. Max Watters draws a foul in the penalty area. Penalty conceded by Neil Etheridge (Birmingham City) after a foul in the penalty area. Substitution, Cardiff City. Max Watters replaces Tommy Doyle. Will Vaulks (Cardiff City) is shown the yellow card for a bad foul. Foul by Will Vaulks (Cardiff City). Jordan James (Birmingham City) wins a free kick in the defensive half. ",positive
