,URL,Content_title,Contents,Sentiment
35,https://www.bbc.co.uk/sport/football/61198625,Watford 1-2 Burnley: Two late goals lift Clarets five points clear of relegation zone,"Burnley scored twice in the final seven minutes to complete a dramatic comeback that pulled them five points clear of the Premier League relegation zone and left hosts Watford on the brink of the drop. Jack Cork's diving header from Charlie Taylor's left-wing cross cancelled out James Tarkowski's early own goal, before Josh Brownhill found the bottom corner from the edge of the box to spark jubilant scenes among the travelling fans and in the away dugout at Vicarage Road. Watford had taken a deserved early lead when Juraj Kucka's fierce effort struck the crossbar before rebounding off the unfortunate Tarkowski and into the unguarded net. The Hornets carried the greater threat in the first half, Kiko Femenia striking the near post from an inswinging corner and Joao Pedro blazing over the crossbar after escaping the Clarets defence. Aaron Lennon and Ashley Barnes forced fine saves out of Ben Foster in the second half, but there was little the veteran goalkeeper could do about either of the visitors' late goals, which came in the space of three minutes and stretched Mike Jackson's unbeaten start as Clarets caretaker manager to four matches. The Hornets' 11th consecutive home defeat leaves them 12 points adrift of Burnley and Leeds with only four games remaining. Before Saturday, the only side in the top four tiers of English football to have lost more than 10 consecutive home league games were Rochdale, who suffered 14 straight defeats in Division Three North between 1931 and 1932. It was all going so well for Watford, who were full of energy in the early stages and could have added to Tarkowski's own goal. Burnley's captain had to fling himself in the way of another Kucka strike minutes after putting into his own net, before the returning Pedro blazed over. The visitors thought they had won a penalty when Dwight McNeil's heels were clipped by Moussa Sissoko. However, the Frenchman's challenge was deemed to be outside the box and McNeil struck the subsequent free-kick straight into the Hornets wall. Emmanuel Dennis forced Nick Pope into a smart save at his near post following yet another Tarkowski deflection, as Watford continued to threaten. Burnley improved after the interval, though, and a lapse in concentration early in the second half from Ismaila Sarr almost gifted Lennon an equaliser, but Foster produced a fine save low to his left to snuff out the danger. The home side had opportunities to add to their lead on the counter-attack, but a combination of poor passing and wasteful finishing set up a nervous finish as Burnley slowly turned the screw. Foster managed to tip Barnes' powerful header on to the crossbar, but the warning went unheeded as Cork's header restored parity with seven minutes remaining. Brownhill completed the turnaround three minutes later, guiding a right-footed strike into the bottom corner after Watford had failed to properly clear McNeil's free-kick. This is the first time Burnley have won three Premier League games in a row since 2019, while Jackson also becomes the first manager to stay unbeaten in his first four top-flight matches in charge of the Clarets. The last manager not to lose any of their first four league games with the club was Owen Coyle in 2007. Player of the match LowtonMatthew Lowton 6.38 5.42 5.17 5.10 5.05 5.03 5.01 4.96 4.95 4.93 4.93 8.17 8.16 7.98 7.68 7.67 7.66 7.50 7.49 7.47 7.44 7.44 7.44 7.44 6.47 Formation  4-3-3 Formation  4-4-2 Match ends, Watford 1, Burnley 2. Second Half ends, Watford 1, Burnley 2. Attempt missed. Imrân Louza (Watford) left footed shot from outside the box is too high. Assisted by João Pedro with a cross. Substitution, Burnley. Dale Stephens replaces Matej Vydra. Nathan Collins (Burnley) is shown the yellow card for a bad foul. Foul by Nathan Collins (Burnley). Moussa Sissoko (Watford) wins a free kick on the left wing. Attempt missed. Ashley Barnes (Burnley) right footed shot from outside the box is too high. Substitution, Burnley. Matthew Lowton replaces Aaron Lennon. Attempt missed. Juraj Kucka (Watford) left footed shot from the left side of the box is high and wide to the left. Assisted by Ismaïla Sarr with a cross. Attempt saved. Matej Vydra (Burnley) left footed shot from the centre of the box is saved in the centre of the goal. Juraj Kucka (Watford) is shown the yellow card. Goal!  Watford 1, Burnley 2. Josh Brownhill (Burnley) right footed shot from the centre of the box to the centre of the goal. Assisted by Matej Vydra   following a set piece situation. Ashley Barnes (Burnley) wins a free kick on the left wing. Foul by Imrân Louza (Watford). Goal!  Watford 1, Burnley 1. Jack Cork (Burnley) header from very close range to the centre of the goal. Assisted by Charlie Taylor with a cross. Attempt missed. Juraj Kucka (Watford) right footed shot from outside the box is high and wide to the right. Aaron Lennon (Burnley) wins a free kick on the right wing. Foul by Juraj Kucka (Watford). Attempt blocked. Josh Brownhill (Burnley) right footed shot from the right side of the box is blocked. ",positive
36,https://www.bbc.co.uk/sport/football/61287385,Watford 1-2 Burnley: Mike Jackson leads Clarets five points clear of relegation zone,"Two weeks ago, the question on many people's lips was: ""What are Burnley doing?"" Sean Dyche, a manager with experience of escaping relegation, was sacked and replaced by caretaker Mike Jackson, whose last foray into management ended in the sack at Tranmere. Four games on, Jackson has pulled Burnley five points clear of the drop with a remarkable run - the best start of any Burnley manager for 31 years. The Clarets are not out of trouble yet - but Jackson's Burnley are the form team at the bottom. Remarkably, their dramatic late 2-1 win over Watford on Saturday was the first time they have won when trailing at half-time away from home in the Premier League. ""Burnley's fans stayed for 20 minutes to sing 'Super Mike Jackson',"" former Brighton striker Glenn Murray told BBC Radio 5 Live. ""He has united a football club. ""He has tweaked Burnley's identity and given the players more time on the ball. Maybe they aren't playing under such direct instruction and they feel happier for that."" Jackson's only previous first-team managerial experience was at Shrewsbury and Tranmere. At Tranmere he was sacked after just three months, having won just two of his first 10 games in League Two. But since being promoted from his role as Burnley's Under-23 coach, Jackson has guided the first team to a draw at West Ham, followed by victories over Southampton, Wolves and now Watford - making a run of five losses from six league games a distant memory. In the 48-year-old's four games, Burnley have a better rate of goals scored, expected goals, shots, touches in the opposition box, passes in the opposition half and possession than under Dyche this season - and are playing fewer long balls. ""The freedom starts to come after a win or two and you start to realise you are decent players,"" former Liverpool midfielder Danny Murphy said. ""Mike Jackson deserves great credit. ""It is leadership from all angles. They are all in together. It is amazing how winning does things to you."" Asked about the revival, Jackson said there had been ""no magic wand"", instead a matter of increased confidence among the Burnley players. ""I'd say you get those results, you get that more belief, a bit more feeling about yourself and the group starts to come together, they know what's at stake and obviously everything builds with that,"" he said. ""There's been no magic wand whatsoever. It's just reminding the players who they are and making sure they stick together as a group, stay honest and look after each other. That's the way we try to do it."" Midfielder Jack Cork explained the Liverpudlian's impact. ""He pulled us all together and reminded us how good we are,"" Cork said after the 2-1 victory at Watford. ""It is a massive part of this club that when things aren't going our way, we pull together - it has not just been these past few weeks. We never gave up and were probably the better team in the second half."" As it stands, Jackson has only been given the job on a ""game-by-game"" basis. But his haul of 10 points and no defeats with a relegation-threatened team must rank among the best caretaker stints in recent memory. Perhaps the most famous caretaker manager of all is Roberto di Matteo, who won the Champions League and FA Cup after taking over from Andre Villas-Boas at Chelsea in 2012. Guus Hiddink was another interim Chelsea boss to have strong success. In his first of popular two caretaker stints he won the FA Cup, having taken charge after Luis Felipe Scolari was sacked. And it may have ended badly, but who can forget Ole Gunnar Solskjaer's spell as Manchester United caretaker manager? After Jose Mourinho was sacked, the Norwegian began with a 12-game unbeaten run, winning 10, and memorably oversaw a Champions League knockout win over Paris St-Germain. Comment below with any other 'best caretaker manager' suggestions... ",positive
37,https://www.bbc.co.uk/sport/football/61198622,Newcastle 0-1 Liverpool: Naby Keita scores as Reds keep up the pressure on Man City,"Liverpool kept themselves firmly in the fight for the quadruple as they overcame a spirited Newcastle to keep up the pressure on Premier League leaders Manchester City. Jurgen Klopp made five changes at St James' Park, including leaving top scorer Mohamed Salah on the bench, after the Champions League semi-final on Wednesday. It looked like it would backfire as in-form Newcastle started strongly, pressing Liverpool high and forcing them into a couple of early mistakes. But Liverpool grew into the game and were dominating possession when Naby Keita struck in the 19th minute. The midfielder showed great composure as he dribbled across the box and past Martin Dubravka before slotting into the net. Sadio Mane should have made it 2-0 before the break when his shot on the counter was too close to Dubravka, who also made a fine save from a Diogo Jota header. The Newcastle fans, who were aggrieved that play continued in the lead-up to Liverpool's goal because Fabian Schar was down injured, thought Miguel Almiron had equalised after rounding Alisson, only for the effort was ruled out for offside. The hosts also made a lively start to the second half, although Liverpool went closest to adding a second with Mane shooting wide from close range before Jota's shot was pushed over. It was not a vintage Liverpool display, but they got the job done and they are second, one point behind Manchester City, who won at Leeds later on Saturday to reclaim top spot after a brief spell in first place for the Reds. The Liverpool line-up may have intrigued City boss Pep Guardiola, who, while focused on his own side's pursuit of a treble, will no doubt welcome any helping hand in denting his rivals' title bid. Thiago - excellent in the 2-0 Champions League semi-final win against Villarreal in midweek - was on the bench alongside Salah and Trent Alexander-Arnold. It could have been seen as a big risk, but instead it emphasised the incredible strength in depth in this Liverpool squad. James Milner came in and was his dependable self, providing experience in midfield, while Joe Gomez was solid at right-back and the front three of Luis Diaz, Jota and Mane caused as many problems as any of the attacking combinations Liverpool could field. When Newcastle pressed for an equaliser in the closing stages, Liverpool were able to send on Thiago, Salah and Fabinho to see the game out. Against a side who had won their previous six home games, Liverpool fans had a right to feel apprehensive, but the Reds overcame a big hurdle that serves only to strengthen the feeling that they will end this season with multiple trophies. Only Liverpool and City boast a better record in 2022 than Newcastle and there was understandably a buoyant mood among the home fans before kick-off. The match provided Newcastle with an opportunity to show what sort of threat they pose to teams at the top end of the table - and they certainly gave a good account of themselves. They started superbly, getting at Liverpool from the outset and making their opponents nervous. Although Newcastle could not maintain their high-tempo start, there was still a sense of pride at St James' Park at the fight shown against one of the best sides in Europe. Player of the match RobertsonAndrew Robertson 6.66 5.83 5.65 5.48 5.46 5.41 5.38 5.29 5.14 5.12 5.10 4.81 4.70 4.60 8.25 8.21 8.09 7.88 7.86 7.83 7.78 7.69 7.62 7.60 7.46 7.43 7.37 7.25 Formation  4-3-3 Formation  4-3-3 Match ends, Newcastle United 0, Liverpool 1. Second Half ends, Newcastle United 0, Liverpool 1. Attempt missed. Fabinho (Liverpool) right footed shot from outside the box is high and wide to the right from a direct free kick. Diogo Jota (Liverpool) wins a free kick in the attacking half. Foul by Joelinton (Newcastle United). Fabinho (Liverpool) wins a free kick on the left wing. Foul by Jonjo Shelvey (Newcastle United). Offside, Newcastle United. Jacob Murphy tries a through ball, but Miguel Almirón is caught offside. Offside, Newcastle United. Chris Wood tries a through ball, but Miguel Almirón is caught offside. Hand ball by Naby Keïta (Liverpool). Hand ball by Luis Díaz (Liverpool). Attempt saved. Bruno Guimarães (Newcastle United) right footed shot from outside the box is saved in the bottom left corner. Assisted by Allan Saint-Maximin. Thiago (Liverpool) wins a free kick in the defensive half. Foul by Chris Wood (Newcastle United). Substitution, Newcastle United. Jacob Murphy replaces Emil Krafth. Attempt missed. Luis Díaz (Liverpool) right footed shot from the left side of the six yard box is close, but misses to the left. Assisted by Naby Keïta following a fast break. Attempt missed. Joseph Gomez (Liverpool) right footed shot from outside the box is high and wide to the right following a corner. Corner,  Liverpool. Conceded by Martin Dúbravka. Attempt saved. Diogo Jota (Liverpool) left footed shot from the centre of the box is saved in the top centre of the goal. Substitution, Liverpool. Thiago replaces James Milner. ",positive
38,https://www.bbc.co.uk/sport/football/61198355,Shrewsbury Town 0-3 Wigan Athletic: Latics promoted as League One champions,"Will Keane scored twice as Wigan Athletic secured promotion to the Championship and the League One title with a clinical victory over Shrewsbury. The Latics only had to draw to be sure of returning to the second tier, but needed three points to be certain of going up as champions. An anxious final day was in prospect having wasted two previous chances to seal promotion. However, Max Power's tap-in just before the break settled the nerves and Keane's penalty and calm finish wrapped up victory for a side who were just a point away from relegation last season. Wigan's return to the second tier of English football comes two years after they dropped out of the Championship following a points penalty for going into administration. Rotherham's win over Gillingham took the Millers up as runners up, while MK Dons had to settle for third spot and a play-off place despite a 5-0 thrashing of Plymouth Argyle, who missed out on the top six. Ultimately, other results did not matter for Latics boss Leam Richardson, whose side showed urgency and attacking intent from the off, with Kell Watts heading over after a well-worked short corner and Power's 30-yard free-kick forcing Shrews keeper Marko Marosi into a fine save. The pressure told when the ball fell kindly for Power to score the opener from close range two minutes before the interval and the same player was involved in the second goal when his shot from outside box was handled by a diving Tom Flanagan. Keane knocked in the spot-kick and grabbed his second of the afternoon when he got on the end of James McClean's free-kick. To understand what it means to win promotion back to the Championship, it is important to know what Wigan have been through in less than two years. When the coronavirus pandemic hit, few considered them at risk of imminent financial instability. In July 2020, however, they entered administration when their Hong Kong owners conceded they could not support them financially, throwing an already chaotic season into further disarray. With a 12-point deduction looming, the Latics had six games left to build a cushion on the relegation places to avoid the drop to League One. Under former boss Paul Cook they put up quite the fight, including beating Hull City 8-0 to equal the biggest victory in Championship history, losing just once in their final 15 games, but their spirited efforts were not enough. A failed appeal against the points deduction followed, as did a fan-led crowdfunding campaign to save the club - leading to more than £600,000 being raised. Cook - and many of the club's squad - left the Latics just before they tentatively began the 2020-21 League One season. In March 2021, Bahraini businessman Abdulrahman Al-Jasmi bought the club after an ill-fated deal with a Spanish consortium collapsed, ending nearly a year of financial uncertainty, and the club later avoided relegation to League Two by just a point. This season, under Richardson's stewardship, the club has reached the FA Cup fourth round - as well as the semi-final of the Papa John's Trophy - as the turnaround began. Just one defeat in their final 13 games saw Richardson claw them over the line to restore their place in English football's second tier. Bill Rice - Sports Editor, BBC Radio Manchester It's only just over a year since Wigan Athletic's future was secured with a takeover bringing the club out of administration, so to earn promotion back to the Championship as champions is a phenomenal achievement. The consortium led by Abdulrahman Al-Jasmi has delivered on their promises, providing boss Leam Richardson with the tools to build a promotion-winning squad, and he has done just that, even overcoming the loss of striker Charlie Wyke, who suffered a cardiac arrest in November that ended his season. Becoming a stable Championship club was the aim from day one and they are halfway there. This Wigan might not be as swashbuckling or pretty on the eye as sides of years gone by, but they are efficient, dangerous and manage games as well as anyone - and have performers right across the pitch to call upon when required. The goalkeeper and defence have been solid and stable, the midfield pairing of Tom Naylor and Max Power have won battles all season long, and - in forwards like Will Keane and Callum Lang - the Latics have match-winners when required. Formation  3-5-2 Formation  3-1-4-2 Match ends, Shrewsbury Town 0, Wigan Athletic 3. Second Half ends, Shrewsbury Town 0, Wigan Athletic 3. Attempt missed. Tom Naylor (Wigan Athletic) header from the centre of the box is too high. Assisted by Joe Bennett with a cross following a corner. Corner,  Wigan Athletic. Conceded by Matthew Pennington. Luke Leahy (Shrewsbury Town) is shown the yellow card for a bad foul. Callum Lang (Wigan Athletic) wins a free kick on the right wing. Foul by Luke Leahy (Shrewsbury Town). Substitution, Shrewsbury Town. Saikou Janneh replaces Ryan Bowman. Attempt missed. Jordan Cousins (Wigan Athletic) right footed shot from outside the box misses to the left. Assisted by Callum Lang. Corner,  Wigan Athletic. Conceded by Josh Vela. Jordan Cousins (Wigan Athletic) wins a free kick on the left wing. Foul by Tom Bloxham (Shrewsbury Town). Substitution, Shrewsbury Town. Tom Bloxham replaces Daniel Udoh. Jason Kerr (Wigan Athletic) wins a free kick in the defensive half. Foul by Ryan Bowman (Shrewsbury Town). Attempt missed. Luke Leahy (Shrewsbury Town) left footed shot from outside the box is high and wide to the left from a direct free kick. Substitution, Shrewsbury Town. Shaun Whalley replaces George Nurse. Foul by Tendayi Darikwa (Wigan Athletic). Luke Leahy (Shrewsbury Town) wins a free kick in the attacking half. Jordan Cousins (Wigan Athletic) wins a free kick on the left wing. ",positive
39,https://www.bbc.co.uk/sport/football/61198302,Gillingham 0-2 Rotherham United: Millers seal promotion with win that relegates Gills,"Rotherham United sealed promotion to the Championship and consigned Gillingham to relegation to League Two with victory at the Priestfield Stadium. It is the fourth time in nine seasons that the Millers have been promoted to the Championship, having yo-yoed between League One and the second division. Rarmani Edmonds-Green's poked first-half finish and a late second from substitute Georgie Kelly, on his debut, in the tense and high-stakes final-day meeting was enough to once again send the Millers up. Ben Thompson hit the underside of the bar for Gillingham just before the break, but that is as close as they came from taking something from a game that ended their nine-season stay in League One. Edmonds-Green, who threatened early, put Paul Warne's Millers on track for promotion with his close-range finish on 34 minutes. Gillingham goalkeeper Aaron Chapman ensured Rotherham could not relax in pursuit of promotion in a game they had to win, brilliantly denying Ben Wiles from close range just before the hour. Wiles was again denied late on before Kelly, a January arrival from Bohemians, sealed victory with a clinical 89th-minute strike. Rotherham have once again been promoted back to the Championship at the first time of asking. The Millers have now been promoted to or relegated from the second tier in each of the past six seasons, becoming the second club to bounce between two divisions for six consecutive seasons since Wimbledon did so, between the third and fourth tiers, between 1978 and 1984. Warne's side suffered heartbreak as they went down on the final day of the 2020-21 campaign despite drawing with Cardiff. They made an indifferent start to the season, with just three wins from their first seven league matches, but then embarked on a run that saw them go unbeaten in all competitions between 11 September and 26 December. A run of one league win in seven matches from the start of March, that included a first home defeat since September, saw them drop down to third behind Wigan and MK Dons. However, three wins from their final five matches proved to be enough to get them over the line. Promotion ultimately caps a fine season for the South Yorkshire side, who claimed silverware in April, amid their poor league form, when they won the Papa Johns Trophy at Wembley against League Two side Sutton. This is Warne's third promotion in his five-and-a-half-years in charge of the club and, prior to Saturday's game at Gillingham, he acknowledged that going up this season would top the previous two. ""I want the players to have that moment in time that will keep them connected forever. If we can go up automatically it will be the greatest achievement I have ever had, given the quality in this league,"" he told BBC Radio Sheffield. Attention will now turn to seeing if they can put together a squad capable of staying in the Championship, having failed to do so in each of their past three attempts. It's been a difficult season for Gillingham, who have been among the strugglers throughout the campaign, winning only three league games by the end of January. Boss Steve Evans had already been linked with the job at Stevenage before he left the Gills early in the new year following a run of 13 matches without a win in all competitions. He was replaced by former Millwall and Cardiff manager Neil Harris on 31 January and his arrival coincided with an upturn in form, with Gillingham winning five and drawing three of his first 12 games in charge to climb four points clear of the relegation zone. However, they were unable to maintain that momentum as they failed to win any of their final six games to drop into the fourth tier for the first time since 2013. Formation  5-4-1 Formation  3-4-2-1 Match ends, Gillingham 0, Rotherham United 2. Second Half ends, Gillingham 0, Rotherham United 2. Attempt missed. Jack Tucker (Gillingham) header from the centre of the box misses to the right. Assisted by Mustapha Carayol with a cross following a corner. Corner,  Gillingham. Conceded by Wes Harding. Foul by Chiedozie Ogbene (Rotherham United). Daniel Phillips (Gillingham) wins a free kick in the defensive half. Corner,  Rotherham United. Conceded by Ben Reeves. Corner,  Rotherham United. Conceded by Ryan Jackson. Substitution, Rotherham United. Hakeem Odoffin replaces Oliver Rathbone. Foul by Rarmani Edmonds-Green (Rotherham United). Vadaine Oliver (Gillingham) wins a free kick in the attacking half. Georgie Kelly (Rotherham United) is shown the yellow card for excessive celebration. Goal!  Gillingham 0, Rotherham United 2. Georgie Kelly (Rotherham United) right footed shot from the centre of the box to the bottom right corner. Assisted by Chiedozie Ogbene. Substitution, Gillingham. Gerald Sithole replaces David Tutonda. Offside, Rotherham United. Georgie Kelly tries a through ball, but Richard Wood is caught offside. Attempt missed. Georgie Kelly (Rotherham United) header from the centre of the box misses to the left. Assisted by Daniel Barlaser following a set piece situation. Daniel Barlaser (Rotherham United) wins a free kick on the right wing. Foul by Mustapha Carayol (Gillingham). Attempt blocked. Oliver Rathbone (Rotherham United) left footed shot from the centre of the box is blocked. Attempt saved. Ben Wiles (Rotherham United) left footed shot from the left side of the six yard box is saved in the top centre of the goal. Assisted by Chiedozie Ogbene. ",positive
