,URL,Content_title,Contents,Sentiment
121,https://www.bbc.co.uk/sport/football/61115597,Huddersfield Town 2-1 Barnsley: Defeat consigns Tykes to relegation to League One,"Barnsley were relegated to League One following defeat by promotion-chasing Huddersfield Town, who themselves sealed a Championship play-off spot. Jordan Rhodes headed in from close range after a Huddersfield corner was deflected into his path to give the hosts an early lead. Harry Toffolo was then found completely unmarked to tap in with a cool finish to double their advantage just before the break. In a subdued second half, Barnsley found a late consolation through Callum Styles' impressive strike from the edge of the box but it was too late as their fate was confirmed. The Tykes, who stay bottom, are 11 points behind 21st-placed Reading with three games left this season. Barnsley's three-season stay in English football's second tier comes to an end, while Huddersfield move to within a point of second-placed Bournemouth. However, the Cherries have three games in hand on the Terriers and are still heavy favourites to claim the second automatic promotion place. Huddersfield had lost just two of their past 23 Championship games while Barnsley arrived at the John Smith's Stadium having not won since 15 March and having won just eight points on their travels this term. Barnsley needed a victory to keep up their slim hopes of Championship survival but Rhodes made that task even harder when he put the hosts ahead inside four minutes. The former Scotland striker had to wait for confirmation that the goal would stand after a late flag went up for offside from the assistant referee. But it was eventually given after it was judged the ball had deflected off a Barnsley defender as they tried to defend the corner, leading to Rhodes' simple header. But it was Toffolo's goal just before half-time that epitomised Barnsley's position, as the visitors failed to pick his run into the box, leaving him to latch onto Danel Sinani's cross to fire low past Tykes keeper Jack Walton. Styles' late strike was a bitter-sweet consolation for the visitors, who rarely threatened during an abject 90 minutes where Huddersfield controlled much of the match. Relegation after a season of struggle ends an eventful three-year stay in the second tier for the club who have played more games at this level than anyone else. They scored a last-minute winner at Brentford in the final game of the Covid-hit 2019-20 season to miraculously avoid relegation and send Charlton down instead. Gerhard Struber, who had taken over midway through that campaign after the sacking of Daniel Stendel, left soon into 2020-21 for MLS side New York Red Bulls and was replaced by Valerien Ismael. The former Bayern Munich man oversaw a remarkable turn around of the team's fortunes and improbably guided them to a fifth place finish. They fell to defeat by Swansea in the play-offs and Ismael, along with influential captain Alex Mowatt, both left for West Brom. His replacement Markus Schopp won only one of his 13 games in charge, a victory over Coventry in their first home game, and departed in November after a run of seven straight losses. Sweden Under-21 coach Poya Asbaghi took over but failed to win any of his first 11 league matches at the helm, leaving relegation looking inevitable before finally ending his wait with a home victory against QPR. Surprisingly, that kick-started an upturn in fortunes as they won three times in February to give fans hope of staying up, with January loan signings Domingos Quina and Amine Bassi scoring crucial goals. They could not keep the run going though and conceded late equalisers in home games against Stoke and Fulham in the space of four days in March, at a time when victory in both would have seen them climb out of the relegation zone for the first time since 2 October. Still, they retained some hope up until Easter Monday's limp 2-0 home defeat by fellow strugglers Peterborough in a game where they had more shots and more possession but failed to score against a team who had failed to keep a clean sheet away from home all season. Formation  4-4-2 Formation  4-2-3-1 Match ends, Huddersfield Town 2, Barnsley 1. Second Half ends, Huddersfield Town 2, Barnsley 1. Goal!  Huddersfield Town 2, Barnsley 1. Callum Styles (Barnsley) right footed shot from the centre of the box to the top right corner. Assisted by Remy Vita. Attempt blocked. Josh Ruffels (Huddersfield Town) left footed shot from the left side of the box is blocked. Attempt blocked. Josh Ruffels (Huddersfield Town) right footed shot from the centre of the box is blocked. Assisted by Lewis O'Brien. Jordan Rhodes (Huddersfield Town) wins a free kick in the attacking half. Foul by Mads Andersen (Barnsley). Naby Sarr (Huddersfield Town) wins a free kick in the defensive half. Foul by Aaron Leya Iseka (Barnsley). Substitution, Huddersfield Town. Fraizer Campbell replaces Duane Holmes. Jonathan Russell (Huddersfield Town) wins a free kick in the defensive half. Foul by Callum Styles (Barnsley). Attempt saved. Jordan Rhodes (Huddersfield Town) right footed shot from the centre of the box is saved in the top centre of the goal. Assisted by Duane Holmes. Substitution, Huddersfield Town. Josh Ruffels replaces Harry Toffolo. Corner,  Barnsley. Conceded by Oliver Turton. Attempt missed. Aaron Leya Iseka (Barnsley) header from the centre of the box misses to the right. Assisted by Amine Bassi with a cross following a corner. Corner,  Barnsley. Conceded by Lewis O'Brien. Attempt saved. Carlton Morris (Barnsley) left footed shot from a difficult angle on the left is saved in the centre of the goal. Assisted by Liam Kitching. Corner,  Barnsley. Conceded by Jonathan Russell. Jordan Rhodes (Huddersfield Town) wins a free kick in the defensive half. ",positive
122,https://www.bbc.co.uk/sport/football/61124791,Bournemouth 1-1 Fulham - Dominic Solanke equalises from spot in added time for Cherries,"Dominic Solanke's 98th-minute penalty snatched a point for Bournemouth in a 1-1 draw against Championship leaders Fulham. Aleksandar Mitrovic's 41st league goal of the season, awarded via goalline technology, looked to have all but sealed the title for the Cottagers. But the Cherries won a penalty deep into added time as Harry Wilson was penalised for a foul on Adam Smith, with Fulham boss Marco Silva sent off for his protests against the decision. Solanke stepped up to slot the ball home for his 27th league goal of the season and keep the title race alive for another week. A stop-start first half went by largely without incident and the spark came soon after the restart when Wilson, who had been Fulham's best player, crossed for Mitrovic to out climb Nat Philips and divert his header goalward. Mark Travers looked to have made a smart save on the line but referee Graham Scott's watch alerted him to blow the whistle as the ball had just crossed the line. Tosin Adarabioyo headed against the bar as the Cottagers looked to double their lead, Wilson again playing the ball in before Tim Ream nodded the ball down for his centre-back partner to hit the woodwork. Bournemouth upped the intensity as they went in search of an equaliser but Fulham thought they had done enough to close out the game and essentially win the title. But a late, late Wilson challenge on Smith was deemed a foul as the referee pointed to the spot. Silva was dismissed for his remonstrations and Solanke scored in the eighth minute of time added on to delay Fulham's title celebrations. The visitors can secure the trophy with a win against Nottingham Forest on Tuesday, while eight points from the Cherries' four remaining games will guarantee that Scott Parker's side will join Fulham in the Premier League next season. Bournemouth boss Scott Parker: ""They scored a goal which looks a little bit dubious. It doesn't look like the whole ball has crossed the line so I think that's a little bit harsh. ""Maybe technology was faulty or the camera was not lined up properly, I don't know. ""It was well-deserved point for sure. It was a match between two very good sides. ""In the second half I felt we took them to certain depths and really nullified their opportunities. ""In the end I thought physical prowess and endeavour got us the penalty. ""I didn't see why Marco got sent off. It was edgy at times, it was a bit nitty gritty and I don't think anyone would have wanted it any different."" Fulham boss Marco Silva told BBC Radio London: ""It's tough for us, for me it's a mistake from the referee [to award the penalty], that's made a big impact on the game. ""It wasn't a great game to watch, both teams didn't perform to their best in my opinion. ""I saw just one picture [of Mitrovic's goal] and I saw the ball over the line."" Formation  4-1-3-2 Formation  4-2-3-1 Match ends, Bournemouth 1, Fulham 1. Second Half ends, Bournemouth 1, Fulham 1. Goal!  Bournemouth 1, Fulham 1. Dominic Solanke (Bournemouth) converts the penalty with a right footed shot to the bottom left corner. Tosin Adarabioyo (Fulham) is shown the yellow card. Penalty Bournemouth. Adam Smith draws a foul in the penalty area. Penalty conceded by Harry Wilson (Fulham) after a foul in the penalty area. Nathaniel Phillips (Bournemouth) wins a free kick in the defensive half. Foul by Nathaniel Chalobah (Fulham). Corner,  Fulham. Conceded by Lloyd Kelly. Corner,  Fulham. Conceded by Siriki Dembélé. Kenny Tete (Fulham) is shown the yellow card. Marek Rodák (Fulham) is shown the yellow card. Attempt missed. Todd Cantwell (Bournemouth) left footed shot from the left side of the box is close, but misses to the left. Attempt blocked. Nathaniel Phillips (Bournemouth) header from the centre of the box is blocked. Assisted by Adam Smith with a cross. Ethan Laird (Bournemouth) wins a free kick in the defensive half. Foul by Neeskens Kebano (Fulham). Aleksandar Mitrovic (Fulham) is shown the yellow card for a bad foul. Lewis Cook (Bournemouth) wins a free kick in the attacking half. Foul by Aleksandar Mitrovic (Fulham). Foul by Tim Ream (Fulham). ",positive
123,https://www.bbc.co.uk/sport/football/61124786,Luton Town 1-1 Blackpool: Visitors fight back to deny play-off chasers victory,"Luton missed the chance to strengthen their grip on fourth place in the Championship with a 1-1 draw against Blackpool. Elijah Adebayo gave the hosts the lead inside two minutes before Gary Madine equalised from the penalty spot in the second half at Kenilworth Road. Luton were denied a penalty when Keshi Anderson cleaned out Robert Snodgrass in the area, before Blackpool had a second shout waved away for Kal Naismith's challenge on substitute Josh Bowler. Luton had the ball in the net in added time but Adebayo was adjudged to have fouled Richard Keogh before squaring for Admiral Muskwe to tap home. Adebayo got the Hatters off to a flying start inside two minutes when he received the ball down the right before cutting in and sending a left-foot shot into the net via a big deflection off Blackpool defender Keogh. The Seasiders did not shrink following that early blow and could have been level after 10 minutes when Luton's defence failed to deal with a long Callum Connolly throw into the box, but Madine sliced his effort wide. Keeper Chris Maxwell needed strong hands to keep out a powerful Harry Cornick strike, before Cornick missed a glorious chance to double the lead, heading over from Robert Snodgrass' tantalising whipped cross into the box. Blackpool were level 10 minutes into the second half after Dan Potts brought down CJ Hamilton for a penalty that Madine drilled into the bottom-left corner. Muskwe was sent on for the injured Sonny Bradley and the striker was involved straight away, forcing a smart save from Maxwell. Anderson brought down Snodgrass in the aftermath for what looked like a clear penalty but referee John Brooks waved play on. Blackpool were then calling for a second penalty when Naismith appeared to bring down Bowler in the box but Brooks was again unmoved. Luton thought they were in for the winner as Adebayo powered through Keogh, but the whistle blew for a foul with Keogh going down after the shoulder-to-shoulder tussle, before Muskwe finished. Adebayo left the field injured in added time as the game finished 1-1, with Luton needing four points from their last two games to guarantee a play-off spot. Luton boss Nathan Jones told PA Media: ""We're very, very hard done by not to have got three points. ""We didn't play well today, we weren't ourselves but we did enough to win the game. ""We had some glorious chances - Harry Cornick had two in the first half, Cameron Jerome's had one, Admiral Muskwe's had one, Allan Campbell's had a chance, we had a penalty shout and that's a clear goal, no issue whatsoever. ""Suddenly we don't get that and we end up drawing the game. ""Blackpool were front-footed today, caused us a few problems. Harry [Isted] hasn't had many saves to make, but they're playing with freedom, four up top - it's easy to do that when you're 16th and haven't really got anything to play for and were really at it."" Blackpool boss Neil Critchley said: ""We'd spoken about their start and highlighted it - they play with high intensity and they get the ball forward quickly. ""They play a very simple but effective game. We spoke about the first 20 minutes, about how to manage it and then we didn't do that. ""After they scored I thought we were good for the next 20 minutes, grew into the game, looked really threatening and dangerous. ""They had a good chance, but we had a good chance as well. Then in the second half, again I thought we were the team in the ascendancy. ""We got a penalty, could have had another penalty when Josh Bowler went down, but I thought we stayed strong. ""We finished strong and if one team looked most likely to create a chance near the end of the game and win it, I felt it was us."" Formation  3-1-4-2 Formation  4-4-2 Match ends, Luton Town 1, Blackpool 1. Second Half ends, Luton Town 1, Blackpool 1. Attempt saved. Peter Kioso (Luton Town) left footed shot from the centre of the box is saved in the centre of the goal. Assisted by Cameron Jerome. Shayne Lavery (Blackpool) is shown the yellow card. Foul by Shayne Lavery (Blackpool). Henri Lansbury (Luton Town) wins a free kick in the attacking half. Richard Keogh (Blackpool) wins a free kick in the defensive half. Foul by Elijah Adebayo (Luton Town). Foul by CJ Hamilton (Blackpool). Cameron Jerome (Luton Town) wins a free kick in the defensive half. James Husband (Blackpool) wins a free kick in the defensive half. Foul by Allan Campbell (Luton Town). Gary Madine (Blackpool) is shown the yellow card for a bad foul. Foul by Gary Madine (Blackpool). Peter Kioso (Luton Town) wins a free kick in the defensive half. Offside, Luton Town. Amari'i Bell tries a through ball, but Cameron Jerome is caught offside. Hand ball by Gary Madine (Blackpool). Attempt missed. Cameron Jerome (Luton Town) header from the centre of the box misses to the left. Assisted by Robert Snodgrass with a cross. Attempt saved. Peter Kioso (Luton Town) left footed shot from outside the box is saved in the bottom right corner. Assisted by Allan Campbell. Attempt missed. Allan Campbell (Luton Town) right footed shot from outside the box misses to the left. Assisted by Peter Kioso. ",positive
124,https://www.bbc.co.uk/sport/football/61124787,Birmingham City 2-2 Millwall: Benik Afobe's late penalty grabs a vital point for Millwall,"Benik Afobe scored a 96th-minute penalty to earn Millwall a crucial point at Birmingham City in their push for the play-offs. Juninho Bacuna put the Blues ahead two minutes into the second half with a low strike, but Oliver Burke found the Lions a crucial equaliser. Lyle Taylor reinstated Birmingham's lead with 11 minutes to go from the penalty spot after he was brought down, but there was late drama after Jake Cooper was also fouled inside the box with seconds left on the clock, and Afobe stepped up to draw Millwall level. Millwall remain in seventh, three points behind Sheffield United, who occupy the final play-off spot, with two games remaining. Birmingham came into the match stuck in 20th place on the run of three straight defeats and having conceded 12 goals - including a humiliating 6-1 thrashing to Blackpool. Manager Lee Bowyer had called for his players to 'step up' for the fixture with Millwall and he saw an almost instant reaction when Gary Gardner's free-kick hit the post after only three minutes. Millwall grew into the game, however, and Murray Wallace forced a good save out of Neil Etheridge before Ivan Sunjic superbly prevented Shaun Hutchinson from scoring with a block on the line. Bacuna then rattled a second shot against the woodwork for Birmingham just before the break, after being set up by Onel Hernandez. Hernandez picked up where he left off in the second half, teeing up Bacuna to slot into the net. Millwall needed to get something out of the match to keep up their hopes of getting into the top six and when Mason Bennett whipped a cross into the box and Danny McNamara headed it back across goal, Burke was on hand to draw them level. Taylor had appeared to give Birmingham all three points when he scored from the spot with only 11 minutes to go, but there was late drama when Gary Rowett's side were awarded their own penalty deep in stoppage time and Afobe tucked it away. Birmingham City head coach Lee Bowyer told BBC Radio WM: ""I have to praise the players for the effort that they just put in. The fighting spirit. That's what we are and when we come off it shows a lot. ""To have the result we did last time out and then to put in that performance shows a lot from the players so, I have to say, I'm pleased that we got that reaction. ""Most of all I'm pleased for the fans because the last thing I wanted to do was come and play against a Millwall side and they could have easily run over the top of us, but every player stood up man for man and was counted today. ""We should have won the game for sure. I think Bacuna's chance in the first half hits the bar, he's a very technically gifted player and I would expect him to finish that. But he took his goal well and got us going. ""In the end, another decision - a bad decision - goes against us and then we end up only getting a point but we deserved all three for sure."" Millwall manager Gary Rowett said: ""We threw everything we had at it. We made too many mistakes in the game and didn't do the basics well enough at this stage of the season to pass the ball and open the game up. ""What we have got is fabulous desire and character. We ended up with Oliver Burke at right wing-back, Tyler Burey at left wing-back and Jake Cooper up front on his own. Maybe, just because of that, we deserved something out of the game. 'We've got to win those games and if we win those games, what you've seen is teams faltering all around the top 10 - teams with far better squads than ours. But we're still in there because we've got character."" Formation  3-4-1-2 Formation  3-4-2-1 Match ends, Birmingham City 2, Millwall 2. Second Half ends, Birmingham City 2, Millwall 2. Corner,  Millwall. Conceded by Jordan Graham. Goal!  Birmingham City 2, Millwall 2. Benik Afobe (Millwall) converts the penalty with a right footed shot to the bottom left corner. Penalty Millwall. Jake Cooper draws a foul in the penalty area. Penalty conceded by Ivan Sunjic (Birmingham City) after a foul in the penalty area. Attempt missed. Onel Hernández (Birmingham City) left footed shot from a difficult angle on the left is close, but misses to the left. Assisted by Juninho Bacuna with a through ball following a fast break. Corner,  Millwall. Conceded by Neil Etheridge. Attempt saved. Benik Afobe (Millwall) left footed shot from the left side of the box is saved in the top left corner. Assisted by Bartosz Bialkowski. Juninho Bacuna (Birmingham City) is shown the yellow card. Foul by Danny Ballard (Millwall). Onel Hernández (Birmingham City) wins a free kick on the left wing. Substitution, Millwall. Ryan Leonard replaces Dan McNamara. Ivan Sunjic (Birmingham City) is shown the yellow card. Maikel Kieftenbeld (Millwall) wins a free kick in the defensive half. Foul by Ivan Sunjic (Birmingham City). Foul by Mason Bennett (Millwall). Gary Gardner (Birmingham City) wins a free kick in the defensive half. Danny Ballard (Millwall) wins a free kick in the defensive half. Foul by Juninho Bacuna (Birmingham City). ",positive
125,https://www.bbc.co.uk/sport/football/61124788,Derby County 1-3 Bristol City: City eased past already-relegated Rams,"Andreas Weimann scored his 20th goal of the season as Bristol City beat relegated Derby 2-1 at Pride Park. The Austrian found the net against his old club after only 10 minutes, coolly striking the ball past Ryan Allsopp in the Rams' goal in a one-on-one . Antoine Semenyo doubled the Robins' advantage before half-time, but Craig Forsyth headed a goal back for Derby on the hour mark. Defender Timm Klose then wrapped up the win for Bristol City with a header from a set piece, to confine Derby to only a fourth home defeat this season. Derby's fate was finally sealed on Easter Monday after they were beaten by Queens Park Rangers and relegated to League One next season. Wayne Rooney made six changes to his side for the visit of City - a team also confined to the bottom half of the table and similarly looking ahead to the summer and a restart. Weimann has been a significant bright spot, however, for the Robins and has been enjoying his most prolific campaign to date. He didn't take long to move his tally of goals for the season to 20, after being set up by Chris Martin, beating the offside trap before slotting past the on-rushing Allsopp. Semenyo then made it 2-0, after stealing the ball from Richard Stearman and running into the box to slot into the far corner. Bartosz Cybulski was among the changes Rooney made but the teenager missed a sitter for Derby on his debut right before time, heading the ball over the bar from close range. Forsyth pulled one back for the hosts with a unmarked header from a Malcolm Ebiowei cross. But it was Derby's only real chance in front of goal and they recorded only two shots on target all match. Klose eased Bristol City's nerves for the final 10 minutes with his first goal for the club as they go unbeaten in four games and moved up a place to 17th. Derby first-team development coach Justin Walker: ""It was a good exercise for us in terms of providing players with the opportunity today. ""Disappointing first half, I thought the goals we gave away were cheap, we were disappointed as a group and at half-time had a bit of a chat about the rhythm and intensity and self belief. ""I thought second half we started to push a little bit and got ourselves back in the game. That's what we were looking at today, the character and temperament of some of the players to handle the environment. ""There's an objective to what we want out of these last three games and we've got a tough job to do over the coming weeks to prepare ourselves properly for next season."" Bristol City manager Nigel Pearson told BBC Radio Bristol: ""I'm pleased with the result, We made hard work of it in the second half because we created so many chances but couldn't put them away. ""We just wanted to come away with a positive result today and the players in the first half were excellent. We should've made the game easier for ourselves but it was still a really good team performance. ""For somebody [Weimann] who's at the more senior end of his career to get a career-best return is testament to his professionalism and his desire and attitude - he's a top-class pro."" Formation  4-2-3-1 Formation  3-4-1-2 Match ends, Derby County 1, Bristol City 3. Second Half ends, Derby County 1, Bristol City 3. Attempt missed. Louie Sibley (Derby County) left footed shot from outside the box is close, but misses to the right. Assisted by Ravel Morrison. Attempt missed. Robbie Cundy (Bristol City) header from the centre of the box misses to the right. Assisted by Matty James following a set piece situation. Substitution, Bristol City. Andy King replaces Joe Williams. Foul by Darren Robinson (Derby County). Chris Martin (Bristol City) wins a free kick on the left wing. Attempt saved. Antoine Semenyo (Bristol City) right footed shot from outside the box is saved in the centre of the goal. Assisted by Andreas Weimann. Substitution, Derby County. Jason Knight replaces Max Bird. Substitution, Derby County. Darren Robinson replaces Louie Watson. Attempt missed. Matty James (Bristol City) right footed shot from outside the box misses to the left. Assisted by Han-Noah Massengo. Goal!  Derby County 1, Bristol City 3. Timm Klose (Bristol City) header from the centre of the box to the top right corner. Assisted by Matty James with a cross   following a set piece situation. Foul by Malcolm Ebiowei (Derby County). Han-Noah Massengo (Bristol City) wins a free kick on the left wing. Substitution, Bristol City. Han-Noah Massengo replaces Sam Bell. Offside, Derby County. Max Bird tries a through ball, but Craig Forsyth is caught offside. Attempt missed. Antoine Semenyo (Bristol City) right footed shot from the left side of the box is close, but misses to the left. Assisted by Andreas Weimann. Substitution, Bristol City. Duncan Idehen replaces Ayman Benarous. Offside, Bristol City. Joe Williams tries a through ball, but Antoine Semenyo is caught offside. Attempt missed. Malcolm Ebiowei (Derby County) left footed shot from outside the box is close, but misses to the left. Assisted by Curtis Davies. ",positive
