,URL,Content_title,Contents,Sentiment
0,https://www.bbc.com/sport/football/61300681,Villarreal 2-3 Liverpool (2-5 on aggregate): Jurgen Klopp's side advance to Champions League final,"Liverpool survived a scare against Villarreal to move into the Champions League final - and keep their hopes of winning an unprecedented quadruple alive. The Reds had comfortably won 2-0 in the first leg but that advantage was wiped out after only 41 minutes at a noisy and passionate El Madrigal as the Spanish side pushed for a huge upset. Boulaye Dia scored Villarreal's first after only three minutes, converting Etienne Capoue's pass, before ex-Arsenal midfielder Francis Coquelin headed in a second from another Capoue cross as the Reds looked rattled. Liverpool had to improve in the second half and Fabinho put them back in front on aggregate with a shot that went through the legs of Villarreal goalkeeper Geronimo Rulli in the 62nd minute. Luis Diaz, whose introduction at half time changed the game after he replaced Diogo Jota, restored Liverpool's two-goal aggregate advantage with a header at the back post. Sadio Mane secured Liverpool's place in their third Champions League final in five seasons with a third goal after taking the ball around Rulli. Villarreal ended the game with 10 men with Capoue sent off late on for two bookable offences. The Reds will play either Manchester City or Real Madrid at the Stade de France in Paris on Saturday, 28 May. No English side has ever won the Champions League, Premier League, FA Cup and League Cup all in the same season, with Liverpool aiming to create history. Villarreal's performance in their 2-0 loss at Anfield led one English radio pundit to call the Spanish side a ""disgrace"" and ""pathetic"", despite an incredible run that had seen them eliminate former winners Juventus and Bayern Munich in the previous two rounds. However, Reds boss Jurgen Klopp knew the tie was not over and warned his side they ""would have to be prepared to suffer"" in the second leg. And suffer they did in arguably Liverpool's worst half of football this season, with passes misplaced, errors made and the side looking uncharacteristically vulnerable. They made the worst possible start, conceding after only three minutes. Pervis Estupinan, who scored an own goal at Anfield, provided a cross which was pulled back by Capoue and Dia, inside the six-yard box, reacted quickest to convert from close range. Dani Parejo shot just wide and Gerard Moreno had an effort blocked before Villarreal, seventh in La Liga and managed by ex-Arsenal boss Unai Emery, made it 2-2 on aggregate thanks to Coquelin's fine header. Liverpool had to improve in the second half, and Trent Alexander-Arnold's shot hit the crossbar after taking a huge deflection off Coquelin. But the breakthrough came with Fabinho's strike and that led to a capitulation from Villarreal, who conceded three times in a 12-minute spell. Diaz headed in Alexander-Arnold's cross to give the visitors some breathing space before a rash decision from Rulli saw him sprint off the line with Mane getting there first and finishing into an unguarded goal. This is the 10th time Liverpool have reached the final of the European Cup or Champions League as they aim to become European champions for a seventh time after successes in 1977, 1978, 1981, 1984, 2005 and 2019. Liverpool's progress keeps them on course to become the first English side to complete the quadruple. They already have the Carabao Cup in the trophy cabinet after beating Chelsea on penalties in February and Thomas Tuchel's side are again the opposition at Wembley for the FA Cup final on 14 May. This victory means Liverpool have become the first English club to reach the final of the European Cup/Champions League, FA Cup and League Cup in the same season. Liverpool are also only one point behind Manchester City in the Premier League title race and could meet in the Champions League final later this month. Pep Guardiola's side hold the advantage in the second semi-final after an incredible first leg at Etihad Stadium saw them beat Real 4-3 in one of the best games in the tournament's history. The second leg takes place at Real's Santiago Bernabeu stadium on Wednesday and if the Spanish champions, managed by ex-Everton boss Carlo Ancelotti, can turn the one-goal deficit around it would set up a repeat of the 2018 final. Real won 3-1 on that occasion as Gareth Bale scored twice, including an incredible overhead kick, but the game will largely be remembered for two goalkeeping errors from Liverpool's Loris Karius. Player of the match DíazLuis Díaz 5.77 5.46 5.26 5.26 5.25 5.24 5.14 5.11 5.07 5.06 4.46 4.25 4.25 4.22 4.16 4.10 8.90 7.87 7.64 7.43 7.37 7.28 7.05 7.05 7.05 6.93 6.91 6.91 6.90 6.87 6.57 6.39 Formation  4-4-2 Formation  4-3-3 Match ends, Villarreal 2, Liverpool 3. Second Half ends, Villarreal 2, Liverpool 3. James Milner (Liverpool) wins a free kick in the defensive half. Foul by Alfonso Pedraza (Villarreal). Corner,  Villarreal. Conceded by Konstantinos Tsimikas. Attempt missed. Mohamed Salah (Liverpool) left footed shot from the centre of the box misses to the left following a fast break. Foul by Curtis Jones (Liverpool). Daniel Parejo (Villarreal) wins a free kick in the defensive half. Attempt missed. Jordan Henderson (Liverpool) right footed shot from outside the box is too high. Attempt blocked. Mohamed Salah (Liverpool) left footed shot from the centre of the box is blocked. Assisted by Curtis Jones. Second yellow card to Etienne Capoue (Villarreal) for a bad foul. Curtis Jones (Liverpool) wins a free kick on the left wing. Foul by Etienne Capoue (Villarreal). Pau Torres (Villarreal) is shown the yellow card for a bad foul. Sadio Mané (Liverpool) wins a free kick in the defensive half. Foul by Pau Torres (Villarreal). Substitution, Liverpool. James Milner replaces Fabinho. Offside, Liverpool. Alisson tries a through ball, but Mohamed Salah is caught offside. Giovani Lo Celso (Villarreal) is shown the yellow card for a bad foul. Fabinho (Liverpool) wins a free kick in the defensive half. ",positive
1,https://www.bbc.com/sport/football/60342935,Bournemouth 1-0 Nottingham Forest: Cherries promoted to Premier League,"Kieffer Moore sent Bournemouth back to the Premier League with a late winner against Nottingham Forest that sealed automatic promotion from the Championship. Substitute Moore's cool finish, after a low free-kick found him unmarked in the box, leaves third-placed Forest needing to go through the play-offs if they are to join the Cherries in the top flight next season. Moore, a January arrival from Cardiff who has managed to make just three substitute appearances because of injury, was smothered by jubilant team-mates as they knew a win against their closest challengers would end a two-year top-flight absence. They return to the Premier League under manager Scott Parker, who celebrates his second promotion in three campaigns, having taken Fulham up in 2019-20 before leaving the west London club for Bournemouth following relegation last season. The showdown between second and third in the Championship, while lacking the hype and pageantry of a play-off final, felt every bit the high-stakes encounter that makes the Wembley showpiece the richest game in club football. In an absorbing and tense first half, Forest striker Sam Surridge hit the crossbar and had a strong penalty appeal ignored after an incorrect offside flag against him. The forward was brought down by goalkeeper Mark Travers as he tried to round him, but the foul was waved away as the flag was already up. After the match, Forest boss Steve Cooper told BBC Radio Nottingham that referee Stuart Attwell and his assistant apologised for the mistake. ""They have put their hands up and owned up to a huge error,"" he said. ""It doesn't really help but at least they had the courtesy to own up to the decision that they made."" The visitors created little in a second half dominated by the Cherries, with Dominic Solanke hitting the side netting while Philip Billing and Jaidon Anthony tested Reds goalkeeper Brice Samba. When Jordan Zemura was brought down on the edge of the area, Billing appeared to be ready to go directly for goal. Instead, he spotted Moore free in box to sweep home a goal that propelled the hosts back to the Premier League and sparked a party atmosphere at the Vitality Stadium, which saw ecstatic home fans spill onto the pitch at full-time. Bournemouth, who are now six points clear of Forest, have spent just one of the past 32 weeks outside the automatic promotion spots. In stark contrast, Forest spent 46 of the first 52 days of the season in the relegation places after making their worst start to a campaign for more than a century. Since Cooper's appointment as Chris Hughton's replacement in September, no side has collected more points than the Reds as they have mounted what would once have seemed to be a preposterous bid to challenge for promotion back to the Premier League after 23 years away. When Forest beat Huddersfield on 18 September for their first win - a victory secured under caretaker Steven Reid - the East Midlands club were bottom of the table and 14 points adrift of then leaders Bournemouth. Forest started the night knowing victory would take them above the hosts on goal difference and into pole position to claim the last remaining automatic promotion place with one game to go. After Billing tested Samba with an awkward curled shot, it was former Cherries striker Surridge who took centre stage, crashing a powerful shot off the crossbar before the controversial offside decision. Bournemouth emerged re-energised after the interval, afforded Forest little space or time to play the free-flowing attacking football that saw them win nine of their previous 10 games, and created the better chances before Moore buried his with a fine first-time finish beyond Samba with seven minutes remaining. Forest finish the season with a trip to Hull on Saturday, knowing victory would guarantee them third place, while Bournemouth host Millwall who are hoping to sneak into the play-offs themselves. Bournemouth boss Parker told BBC Radio Solent: ""I never wanted the game to be an emotional one, I felt if we turned it into an emotional game it would suit Forest. ""It was easier said than done, and we got dragged into that, it became helter-skelter, a basketball game. If we'd shown the same performance second half there would have only been one winner. ""We've executed second half tonight, we were electric and certainly worthy of the result. My emotions are ecstatic."" Nottingham Forest boss Cooper told BBC Radio Nottingham: ""Obviously it hurts, but like it or not we have to get over it and get ready for the play-offs. ""Congratulations to Bournemouth, promotion wasn't just about tonight. It was about getting to the position they had been in. We go into the play-offs now to try and join them."" Formation  4-2-3-1 Formation  3-4-1-2 Match ends, Bournemouth 1, Nottingham Forest 0. Second Half ends, Bournemouth 1, Nottingham Forest 0. Attempt missed. Brice Samba (Nottingham Forest) left footed shot from a difficult angle on the right is close, but misses to the right following a corner. Corner,  Nottingham Forest. Conceded by Lloyd Kelly. Dominic Solanke (Bournemouth) is shown the yellow card for a bad foul. Foul by Dominic Solanke (Bournemouth). Djed Spence (Nottingham Forest) wins a free kick in the attacking half. Mark Travers (Bournemouth) is shown the yellow card. Offside, Nottingham Forest. Brennan Johnson tries a through ball, but Ryan Yates is caught offside. Offside, Nottingham Forest. Brennan Johnson tries a through ball, but Ryan Yates is caught offside. Djed Spence (Nottingham Forest) is shown the yellow card for a bad foul. Dominic Solanke (Bournemouth) wins a free kick in the attacking half. Foul by Djed Spence (Nottingham Forest). Kieffer Moore (Bournemouth) wins a free kick in the attacking half. Foul by Richie Laryea (Nottingham Forest). Substitution, Bournemouth. Chris Mepham replaces Jaidon Anthony. Substitution, Bournemouth. Ben Pearson replaces Ryan Christie. Substitution, Nottingham Forest. Alex Mighten replaces Philip Zinckernagel. Substitution, Nottingham Forest. Richie Laryea replaces Jack Colback. Substitution, Nottingham Forest. Joe Lolley replaces Steve Cook. ",positive
2,https://www.bbc.com/sport/football/61310012,Kevin de Bruyne says Manchester City winning Champions League would change perspective of club,"Winning the Champions League would change how people view Manchester City, says midfielder Kevin de Bruyne. City have not won the competition despite spending more than £1bn and lifting 16 trophies since the 2008 takeover by the Abu Dhabi United Group. Pep Guardiola's side have a 4-3 lead against Real Madrid heading into the semi-final second leg on Wednesday. ""I think it would change the perspective from outside,"" De Bruyne said. ""We have not won it but winning it would change that little narrative."" Following their defeat by Chelsea last year, City could make their second successive final if they get past the Spanish champions. ""The fact we've been fighting for numerous years and getting to the latter stages means we've been doing really well,"" Belgium midfielder De Bruyne added. ""It's a cup competition and the quality is very high so it's very difficult to win it."" Manager Guardiola has previously said he needs to win the competition with City otherwise his time at the club will be judged as a ""failure"".. ",positive
3,https://www.bbc.com/sport/football/61212449,"Man Utd 3-0 Brentford: Fernandes, Ronaldo & Varane score in morale-boosting win","Manchester United recorded the biggest win of Ralf Rangnick's reign in his final home match as interim boss as Brentford were beaten at Old Trafford. A brilliant opener from Bruno Fernandes was followed by a second-half penalty from Cristiano Ronaldo and Raphael Varane's first United goal as the hosts cruised to victory. Ronaldo also had a goal disallowed as he moved onto 18 Premier League goals, four behind Golden Boot leader Mohamed Salah. The result keeps alive United's slender hopes of Champions League qualification at least until next weekend, while Brentford could still go down, even though their 40 points is almost certainly enough to retain their status as a top-flight club. For the third game running, home fans protested against the club's owners, but while there were plenty of anti-Glazer family chants and green and gold flares in opposition to the Americans, the mooted 73rd-minute walkout did not materialise in any significant number. United's victory moved them on to 58 points with two games remaining, meaning they still have the chance to match their tally from the 2013-14 campaign under David Moyes, which is their lowest since the 59 they struggled to in 1990-91. This was actually one of their better displays, helped in no small part by Juan Mata, who was making his first league start of the season in what was probably his last match at Old Trafford. Mata could have had an assist to go with his precise passing and invention, only for Ronaldo to be judged marginally offside after he had scored from the veteran Spain international's pass. Ronaldo got his goal anyway, sending Brentford keeper David Raya the wrong way from the spot after the Portuguese had been fouled by Rico Henry. That doubled a lead given to the hosts by Fernandes. With a contract to 2026, Fernandes is one of the pillars of incoming manager Erik ten Hag's United. His first goal since February was a beauty, slamming home Anthony Elanga's cutback with a first-time volley. Raphael Varane's deflected shot brought United their third - and with the protest not gaining the anticipated momentum, there were still plenty of fans in the stadium as the home players went on their post-match lap of appreciation for a season that most connected with the club cannot wait to end. This was only Christian Eriksen's ninth match for club and country since his return from the cardiac arrest he suffered while playing for Denmark against Finland at the European Championship in June 2021. Yet the Dane has already done enough to show he can operate at a level above Brentford. Within 10 seconds of kick-off, he had lifted a pass over the United defence that threatened to create an opportunity for Bryan Mbeumo before Victor Lindelof came across to cover. It was a pin-point curling Eriksen cross that Ivan Toney headed over from a central position, a deep free-kick at the start of the second half that the striker was unable to keep on target and a long-range free-kick from the Dane that David de Gea had to palm away. Eriksen's contract runs out in the summer, although it does contain an option to extend it for a further year. The big question is whether the 30-year-old repays Brentford - and Thomas Frank's faith in offering him a way back into the game - and commits to another season or he accepts an offer from a bigger club, which will surely come his way. Player of the match Cristiano RonaldoCristiano Ronaldo 8.28 7.83 7.30 7.23 7.19 7.12 6.87 6.57 6.51 6.33 6.31 6.30 6.09 5.96 7.55 5.52 5.09 5.06 5.02 4.93 4.91 4.88 4.88 4.86 4.83 4.65 4.63 4.49 Formation  4-2-3-1 Formation  5-3-2 Match ends, Manchester United 3, Brentford 0. Second Half ends, Manchester United 3, Brentford 0. Fred (Manchester United) wins a free kick in the defensive half. Foul by Ivan Toney (Brentford). Attempt missed. Bruno Fernandes (Manchester United) right footed shot from outside the box is too high. Assisted by Edinson Cavani. Attempt blocked. Mathias Jensen (Brentford) right footed shot from outside the box is blocked. Offside, Manchester United. Cristiano Ronaldo tries a through ball, but Edinson Cavani is caught offside. Corner,  Brentford. Conceded by Diogo Dalot. Corner,  Manchester United. Conceded by Mads Bech Sørensen. Attempt blocked. Bruno Fernandes (Manchester United) right footed shot from outside the box is blocked. Assisted by Fred. Attempt saved. Scott McTominay (Manchester United) right footed shot from the centre of the box is saved in the bottom left corner. Assisted by Cristiano Ronaldo. Attempt blocked. Christian Eriksen (Brentford) right footed shot from outside the box is blocked. Assisted by Ivan Toney. Corner,  Brentford. Conceded by Phil Jones. Substitution, Brentford. Yoane Wissa replaces Bryan Mbeumo. Substitution, Manchester United. Phil Jones replaces Juan Mata. Substitution, Manchester United. Edinson Cavani replaces Anthony Elanga. Goal!  Manchester United 3, Brentford 0. Raphaël Varane (Manchester United) right footed shot from the centre of the box to the centre of the goal. Assisted by Alex Telles with a cross   following a corner. Corner,  Manchester United. Conceded by David Raya. Substitution, Manchester United. Fred replaces Nemanja Matic. Substitution, Brentford. Josh Dasilva replaces Vitaly Janelt. ",positive
