,URL,Content_title,Contents,Sentiment
51,https://www.standard.co.uk/sport/football/everton-chelsea-premier-league-result-richarlison-pickford-b997405.html,Everton 1-0 Chelsea: Richarlison and Jordan Pickford the heroes as Toffees seal huge win in survival scrap,"verton secured a vital three points in their fight against relegation by beating Chelsea 1-0 at Goodison Park on Sunday. The first half consisted primarily of Chelsea possession and fouls. Five of a total eight yellow cards were handed out in the first 45 minutes, two of which came Cesar Azpilicueta and Seamus Coleman’s way after the captains tussled over a foul committed by Mason Mount, which also earned a booking. It was Azpilicueta who, moments after the restart, surrendered possession by his own penalty area for the opening goal. Demarai Gray slipped in Richarlison to bury the opener and send Goodison Park into raptures, matching the big-game atmosphere present all weekend on Merseyside as fireworks set off outside the Chelsea hotel overnight were followed by flares welcoming the home team bus into the stadium. Vitalii Mykolenko squandered a great chance for 2-0 immediately afterwards, firing over from close range, before Jordan Pickford came to Everton’s rescue. Mason Mount hit the post with a half-volley from outside the box, which rolled agonisingly along the goalline. Azpilicueta arrived on the scene to have a rebound stunningly denied by the keeper, who got up to save Antonio Rudiger’s point-blank effort from the subsequent corner with his face. With seven minutes of added time, Pickford again produced heroics to deny Mateo Kovacic after the midfielder wriggled free deep in the Everton box. The win leaves the Toffees just two points off safety with a game in hand on Burnley and Leeds. ",positive
52,https://www.standard.co.uk/sport/football/everton-vs-chelsea-fc-live-stream-premier-league-2022-latest-score-result-watch-tv-team-news-b997365.html,"Everton 1-0 Chelsea FC LIVE! Richarlison goal - Premier League result, match stream and latest updates today","verton vs Chelsea FC LIVE! Richarlison profited from a Chelsea error to secure struggling Everton a 1-0 Premier League win and what could be a precious three points in their bid to avoid relegation at a rocking Goodison Park on Sunday. The home side grabbed the lead a minute into the second half after Cesar Azpilicueta gave up possession under pressure from the Brazilian forward, who harried the Chelsea captain into a mistake before slotting a low shot past goalkeeper Edouard Mendy. Chelsea dominated possession and Frank Lampard’s Everton had to hold on grimly for the final half-hour. They stay in the relegation zone, but move to within two points of Burnley and Leeds with a game in hand. SPONSORED Chelsea remain third with 66 points from 34 games as they bid to qualify for the Champions League. They are six points ahead of fifth-placed Arsenal, but have now played a game more. That draws to an end of our coverage of Everton versus Chelsea, with the Toffees picking up a huge win. Thanks for joining us and recap the action with our match report. Read the full story. After Tottenham beat Leicester 3-1, the pressure is on Arsenal to push back in the fight for Champions League football with a victory at West Ham... You can follow that game live via our blog. James delivers his verdict on the Chelsea players from today’s defeat. Read the full story. “I really enjoyed it, that’s what I’m there to do. It’s about enjoying it but not getting carried away, we’ve got a big game next and the fans were brilliant today.” Ecstasy at Goodison Park! 90+7 mins: Iwobi and Dele with the key interventions in defence before Rondon holds the ball up just outside the box. He beats Rudiger but slips before Dele nearly scraps his way into a shooting chance - but Chelsea survive. 90+5 mins: Chelsea are offside at a free-kick into the Everton box and a palpable sigh of relief comes up from the home end. Holgate booked for time wasting. ",positive
53,https://www.standard.co.uk/sport/football/chelsea-player-ratings-vs-everton-werner-jorginho-b997408.html,Chelsea player ratings vs Everton: Timo Werner ineffective as Jorginho sets the (lack of) pace,"helsea fell to a 1-0 defeat against Everton on Sunday after Richarlison netted the winner early in the second-half. Cesar Azpilicueta surrendered possession on the edge of his own box to allow the Toffees to take the lead, as they took three points in the fight for survival. It was a scrappy performance from the Blues, who fell to defeat away from home for the first time since January. James Robson was at Goodison Park to give his verdict on the visiting players... Edouard Mendy - 6 Had very little to do – but could not keep out Richarlison’s strike. Let down by Azpilicueta on that occasion. Cesar Azpilicueta - 5 Took his eye off the ball and Chelsea paid as Richarlison struck. Typical of a performance when he seemed more interested in getting into arguments than concentrating on his job. Thiago Silva - 6 Felt like the only Chelsea defender not to lose his head on as when they allowed themselves to be frustrated by Everton. Antonio Rudiger - 6 Booked early on and had to walk a tightrope afterwards. Still as physical as you would expect, but there were some heart in mouth moments. Reece James - 6 After his brilliant performance at Old Trafford, there was a sense of him wanting to do too much on occasion here. At times he could have kept it simple as was caught as a result. Still one of Chelsea’s most threatening players. Jorginho - 4 Chelsea needed him to be more dynamic. His one-paced display typified the lack of urgency in his side’s first-half offering. Ruben Loftus-Cheek - 6 Chelsea’s best moments of a dour first half came from his bursts through midfield. One of the few players in yellow to try to open Everton up. Marcos Alonso - 6 He had more reason than most to pile the misery on Lampard after the break down of their relationship at Chelsea. Pushed high to give Chelsea an outlet on the left. Mason Mount - 6 So close to scoring. Not short of endeavour, but in that No10 role he needs to produce a bit more craft to got along with the graft. Timo Werner - 5 Largely ineffective. Got himself into some decent areas, but never did anything with those opportunities. Kai Havertz - 6 Worked hard and it was clear how he was trying to get between the lines of Everton’s defence. Did not look like scoring. Substitutes Mateo Kovacic (Jorginho, 46) - 6 Brought a bit more drive to Chelsea’s midfield to try to break Everton out of their comfortable shape. Christian Pulisic (Azpilicueta, 68) - 4 Struggled much like the rest of Chelsea’s forwards. Hakim Ziyech (Werner, 68) - 5 Produced the odd threatening cross. Not a lot else. Subs unused: Kepa, Chalobah, Sarr, Saul, Kenedy, Lukaku. ",positive
54,https://www.standard.co.uk/sport/football/tottenham-vs-leicester-live-stream-premier-league-2022-latest-score-result-watch-tv-team-news-b997367.html,"Tottenham 3-1 Leicester LIVE! Premier League result, match stream and latest updates today","ottenham vs Leicester LIVE! Heung-min Son’s stunning goal helped Tottenham get their Champions League hopes back on track with a 3-1 win over Leicester. The South Korean curled a 20-yard effort into the top corner to seal a brace that sees him register his highest tally in a Premier League season, moving to 19 goals - just three behind Mohamed Salah in the race for the Golden Boot. Harry Kane got the ball rolling with his customary goal against the Foxes, heading in a first-half corner for his 19th goal in 18 games against his former loan club. The victory ends a two-game blip and piles the pressure on Arsenal ahead of their game at West Ham as the race for the top four looks increasingly likely to go down to the rearranged north London derby in the penultimate week of the season. It was clear where Leicester’s attention lies, as they made eight changes to the side which drew 1-1 with Roma in the Europa Conference League on Thursday, and they only had a stoppage-time goal from Kelechi Iheanacho to show for their efforts. The pressure is now on Arsenal as Tottenham get their top-four push back on track with a comfortable win. It wasn’t always pretty or polished but individual quality told, specifically Son’s & Romero’s. Having Kulusevski as an impact sub also (perhaps inadvertently) worked very well. Spurs are back into the top four! How long for? That depends on Arsenal later this afternoon... There is the consolation! Tielemans with the assist, Iheanacho with the finish. Just two more needed in as many minutes... 89 mins: Nearly a consolation! Thomas, Castagne, Tielemans all whip in crosses. The third one is the best of the bunch, Vardy gets across his man and flicks the header just wide. 85 mins: Game being played at a snail’s pace down. That is until Spurs give the ball away under no pressure at all. Vardy pounces... Romero swiftly in to win it back. Again. 82 mins: Son will get another ovation, as he’s brought off. Bergwijn on to replace him for the final ten minutes. Conte knows the job is very much done. STUNNING FROM SON! 20 yards out, onto his left foot and it’s curled perfectly into the top corner. Sensational finish and that will be that. 77 mins: Dier briefly down in some discomfort, but he’s back up and fine to continue. Tielemans on for the visitors - hasn’t got much time left to inspire a big comeback. 74 mins: Spurs increasingly sitting back now, letting Leicester have possession. The front three waiting for any chances to counter though - Kulusevski in particularly looks like he has a point to prove. 71 mins: Royal looks to drill it low across the face of goal... Son was completely free at the back post. Cleared behind for a corner. Son takes the corner, Dier wins the header but it’s straight at Schmeichel. ",positive
55,https://www.standard.co.uk/sport/football/tottenham-vs-leicester-result-harry-kane-heung-min-son-b997399.html,Tottenham 3-1 Leicester: Harry Kane and Heung-min Son get top-four bid back on track,"ottenham’s dynamic duo led them to a 3-1 win over Leicester to get the club’s top-four bid back on track. After poor results against Brighton and Brentford, Spurs needed a response in their quest for Champions League football. It came in familiar fashion - Harry Kane headed them in front in the first-half, before Heung-min Son fired home his side’s second after the break. Son’s second, and Spurs’ third, came in stunning fashion, as the South Korean curled home a finish into the top corner from 20 yards to cap off a perfect afternoon for the hosts. Kelechi Iheanacho got the visitors on the scoresheet in the dying moments, but any hopes of a comeback had long since gone. It lifts Tottenham back into fourth place in the Premier League, though that will change if Arsenal come away from the London Stadium with three points later on Sunday. Spurs started the better of the two sides but it was a much-changed Leicester side who very nearly took the lead early on as Patson Daka was denied by the woodwork. Cristian Romero then had to make a brilliant interception to stop the Foxes striker having a tap-in at the back post. Despite that strong spell, it was Tottenham who found the opening goal of the match. The Foxes once again were found wanting defending a set-piece, as Son swung in the corner and Kane was there to head home. Spurs’ main man went close to getting his second of the afternoon as he pounced on a loose pass and poked an effort at goal, Kasper Schmeichel doing just about enough to keep it out. After a scrappy start to the second-half, Tottenham took real control of proceedings on the hour mark. Two huge challenges from Cristian Romero set them away, and Dejan Kulusevski then slid the ball through to Son. He turned smartly in the box and fired home with his left foot to double the advantage. Leicester never looked like mounting a comeback but any hopes of one were ended when Son got his second. He picked up the ball, cut inside onto his left and bent a stunning effort into the top corner to put the result beyond any doubt. Iheanacho added a late consolation in stoppage-time, but it did little to dampen the mood on a positive afternoon for Spurs in north London. ",positive
56,https://www.standard.co.uk/sport/football/celtic-vs-rangers-live-stream-old-firm-2022-latest-score-result-watch-tv-team-news-b997362.html,"Celtic 1-1 Rangers LIVE! Old Firm result, match stream and latest updates today","eltic vs Rangers LIVE! Celtic took a giant step towards clinching the Scottish Premiership title with an absorbing 1-1 draw against Old Firm rivals Rangers at Parkhead. The visitors, beaten 1-0 by RB Leipzig in the first leg of their Europa League semi-final in Germany on Thursday night, started positively and could have taken the lead through Ryan Kent when he missed a good chance. But in the 20th minute Portuguese attacker Jota volleyed past Gers goalkeeper Allan McGregor from close range. Striker Fashion Sakala levelled in the 68th minute with a powerful drive, and struck the post late on when clean through as he failed to take a massive opportunity. The draw keeps Rangers six points behind the Hoops with only three fixtures remaining - and with Celtic having a superior goal difference of 19 it would take a notable and unlikely turnaround to keep the title at Ibrox. Not had enough football yet? Good. We’ve got plenty more for you to enjoy. In about five minutes, Everton and Chelsea get underway at Goodison Park. It’s an absolutely massive game for the Toffees in their relegation fight. Click here to follow that one live. And if you want to follow Tottenham’s latest challenge in their battle for top-four football, you can follow their clash against Leicester right here. And that is all we get at Celtic Park. A really entertaining conclusion to the match, which finishes level. Celtic will take that - they have a six-point lead with three matches remaining. Fashion Sakala got the equaliser and very nearly had the winner late on, but the woodwork denied him and Rangers. 90 mins: Abada has the ball in the back of the net, but the flag has long been up for offside. It is absolute chaos at Celtic Park. Just two minutes added on. 88 mins: Corner for Rangers, it’s cleared and Celtic are on the break. Abada looks to have the Rangers half to himself, but Diallo gets back and pulls him to the ground. Yellow card. Breathless finish to this match. 86 mins: RANGERS HIT THE POST! What. A. Chance. Sakala had to win it for his side, won’t get a better chance than that. He was clean through, slid it past Hart at the near post but it cannons back off the post. 85 mins: AND THAT’S BRILLIANT FROM HART! All is forgiven. Rangers break away on the right with Wright who is far too quick for Starfelt. Cuts it back, Arfield flicks it at goal... Hart sticks a big hand out. Makes the save from the rebound too. Big moment in the match. 83 mins: What a mess from Joe Hart. Takes an age to move with the ball at his feet... and then just falls over. Kicks it straight to Kent, but fortunately for the goalkeeper Rangers can’t take advantage. 81 mins: Celtic have taken a bit more control now, would have to say they probably look the more likely to find a winner. Not a huge amount of space on offer for either side though. As it stands, it’s a point that Celtic will be more than happy with. 78 mins: Yellow card starting to put a serious shift in. Kent the latest addition to the book as he’s penalised for a high boot. Maeda off, Abada on for Celtic for the final 15 minutes or so. 77 mins: Giakoumakis with an unnecessary challenge, not his first since coming on. He’s earned a yellow card for it too. He’s certainly been keen to make an impact, you have to give him that! ",positive
57,https://www.standard.co.uk/sport/football/celtic-vs-rangers-scottish-premiership-old-firm-fashion-sakala-b997394.html,Celtic 1-1 Rangers: Bhoys on course for Scottish Premiership title despite Fashion Sakala’s Old Firm equaliser,"eltic remain well on course for the Scottish Premiership title after a 1-1 draw against Rangers at Celtic Park. It was a typically competitive Old Firm derby, with the visitors knowing defeat would have effectively seen Celtic wrap up the league title. That hosts were on track for that when Jota put them in front in the first-half, but Fashion Sakala got his side level after the break. Scott Arfield and Sakala both missed huge chances late on to win it for Rangers. It leaves Celtic six points clear at the top of the table with three games remaining, though Rangers will still be hoping for an historic end to the season with a Europa League semi-final second-leg clash against RB Leipzig to come in midweek. The first big chance of the match fell to Ryan Kent, when he got on the end of James Tavernier’s brilliant cross only to divert it wide from close range. Kent then fired a shot from distance straight at Joe Hart soon after. With just over 20 minutes played, it was Celtic who took the lead. Daizen Maeda found space to drill a low cross towards the far post, where Jota beat Borna Barisic to it and provided the finish. The hosts increasingly took control of the match and Jota could well have had a second, though he sent a difficult headed chance flying over the bar. An even better opportunity came for Maeda just before half-time. The ball was looped to him superbly by Jota and he was completely free, but Allan McGregor charging off his line clearly put him off and the Celtic man flicked the header wide. Maeda started the second-half as he ended the first, wasting a big chance to double the lead. This time it dropped perfectly for him in the box and once again he fluffed his lines, blasting the shot over the bar. Rangers enjoyed a better spell as they tried to find a way back into the match, with Fashion Sakala heading over the bar and Steven Davis then unable to keep his effort from range down. The visitors got their equaliser though midway through the second-half. Ryan Kent slid the ball through to Sakala and he drilled a low effort past Hart, who would have been furious to get beaten at his near post. Hart had to be alert minutes later when Sakala was through and the goalkeeper tipped the effort away, before the Rangers forward continued his eventful period by heading over from the resulting corner. Once again Hart made up for his early disappointment when he made a brilliant save late on to deny Scott Arfield, with the Rangers midfielder thinking he had found a crucial later winner for his side. There was still time for the biggest moment of the match and potentially the decisive one in the title race. Sakala was played clean through on goal, he beat Hart with the finish but saw the ball cannon back off the inside of the post. Celtic have now perhaps overcome the last big obstacle between them and another league title. ",positive
58,https://www.standard.co.uk/sport/football/cristiano-ronaldo-man-utd-champions-league-b997382.html,"Cristiano Ronaldo justified in quitting Manchester United if Champions League bid fails, says Dimitar Berbatov","imitar Berbatov has stated that Cristiano Ronaldo could not be blamed for quitting Manchester United if the Red Devils fail to qualify for the Champions League. The 37-year-old has hit 23 goals this season as United’s leading scorer but the team is off the pace in the race for fourth place - leaving questions over his future at Old Trafford. Former teammate Berbatov wants to see Ronaldo continue into next season thanks to his consitent output in front of goal. “Ronaldo is doing incredibly well for his age with the way he plays and the goals he scores,” the Bulgarian told Betfair. “To have so many Premier League goals in a season at his age is an incredible achievement. He is doing what he needs to do, and that is score goals. “His game is different now than it was before, but one thing is a constant, the goals. He still produces and scores which is so important. SPONSORED “He has one more year at United, which is a good thing in my opinion, and now it is down to him whether he stays or leaves. I'd be glad to see him stay and of course things depend on the new manager and on what Ronaldo wants. He is an icon in football and when you are like that your opinion matters.” However, Berbatov accepts that Ronaldo may want to move on to have one last shot at lifting the Champions League trophy. “If he decides to go, obviously you can not blame him,” he added. “When you are used to playing Champions League football every year of your career and then you don't have it, it's tough to accept. “His performances this season show how well he is taking care of himself. He will want to play as long as he can and show that the impossible is possible. “He has proven that he can still do it at 37 in the Premier League, he likes to prove people wrong and I'm pretty sure that he will want to continue doing that and play a few more years.” ",positive
59,https://www.standard.co.uk/sport/football/benzema-ballon-dor-real-madrid-b997374.html,Karim Benzema tipped to win Ballon d’Or after Real Madrid romp to LaLiga title,"eal Madrid president Florentino Perez has “no doubt” that Karim Benzema should win the Ballon d’Or after leading the Spanish giants to the LaLiga crown. The French striker scored his 42nd goal in 42 games this season as Madrid romped to the league title on Sautrday, with a 4-0 win over Espanyol. He has also led Real to the latter stages of the Champions League, where they face Manchester City on Wednesday. Such feats have led to calls for him to win the Ballon d’Or, a sentiment echoed by his boss. “Benzema has been good now and ever since he arrived,” said Perez. “There is no doubt that they have to give him the Ballon d'Or this year, they can't take it away.” SPONSORED Perez also gave a cryptic take on Real’s pursuit of Kylian Mbappe, with the Paris Saint-Germain star out of contract in the summer. “I hadn't fallen for that but now that you tell me it could be true...” he teased when asked if he was excited to sign the striker. “When we plan next year's squad, we'll see.” ",positive
60,https://www.standard.co.uk/sport/football/carlo-ancelotti-grand-slam-real-madrid-la-liga-b997343.html,Carlo Ancelotti makes history with ‘Grand Slam’ as Real Madrid seal La Liga title,"arlo Ancelotti has made history by becoming the first manager to win the league title in Europe’s top five divisions after Real Madrid confirmed themselves as La Liga champions. A 4-0 win over Espanyol over Saturday sealed La Liga glory for Real to ensure that Ancelotti has won the league in his first season back at the Bernabeu. A draw would have been good enough, but Rodrygo netted twice and Marco Asensio and Karim Benzema also got on the scoresheet to get the job done in style. The Italian left Real back in 2015 after three years in charge in which he was unable to lead them to the title. It’s the latest in a long line of trophies that he has lifted. Ancelotti won Serie A in 2004 when he was managing AC Milan and then sealed Premier League glory in 2010 as Chelsea boss. His time at PSG saw him win Ligue 1 in 2013, before leading Bayern Munich to the league title in 2017. Ancelotti will be hoping there is even more success to come for him this season, with Champions League glory still a possibility. “I’m very proud of this,” Ancelotti said. “I’ve had a very long season, but I’m still enjoying it.” “Now I’m with Real Madrid, and to win with Real Madrid is very special. “This is the first time for me to win a title at the (Santiago) Bernabeu, and the atmosphere here is special.” It’s a 35th La Liga triumph for Real Madrid, with the players marking it after the match by throwing Ancelotti up in the air. He did not want the fun to stop. “I told Marcelo that I wanted to keep going,” Ancelotti joked. “I was enjoying being up there in the air.” Along with Bob Paisley and Zinedine Zidane, Ancelotti has won the European Cup or Champions League on three occasions as a manager, with two of those coming when it charge at AC Milan and the third in 2014 when Real lifted the trophy for a tenth time. Champions League success this season would see him break that managerial record, though there is a tough task ahead. Real have a one-goal deficit to overcome on Wednesday night, after losing 4-3 to Manchester City in the first leg, though the Spanish side have already knocked out PSG and Chelsea this season despite not being at their best. ",positive
