,URL,Content_title,Contents,Sentiment
6,https://www.thairath.co.th/sport/eurofootball/uefa/2383136,"เผื่อใจไว้ ""คลอปป์"" วิเคราะห์เป็นฉากๆ ก่อนเกมบียาร์เรอัล-ลิเวอร์พูล UCL ยก 2","กุนซือลิเวอร์พูล วิเคราะห์สิ่งที่จะเกิดขึ้นก่อนเกมยูฟ่า แชมเปียนส์ลีก รอบรองฯ เลก 2 ย้ำไม่ประมาท แม้ชนะ บียาร์เรอัล มาก่อน วันที่ 3 พฤษภาคม 2565 เยอร์เกน คลอปป์ ผู้จัดการทีมลิเวอร์พูล รองจ่าฝูงพรีเมียร์ลีก อังกฤษ ให้สัมภาษณ์ก่อนเกม ยูฟ่า แชมเปียนส์ลีก รอบรองชนะเลิศ นัดที่ 2 ซึ่งจะไปเยือน บียาร์เรอัล ทีมอันดับ 7 ลา ลีกา สเปน ในคืนนี้ 02.00 น. ตามเวลาประเทศไทย หลังจากนัดแรกเปิดบ้านชนะไปก่อน 2-0 เมื่อสัปดาห์ที่แล้ว แม้จะกุมความได้เปรียบเหนือ บียาร์เรอัล แต่ เยอร์เกน คลอปป์ รีบออกตัวทันทีว่า ลิเวอร์พูล ห้ามประมาทโดยเด็ดขาด พร้อมวิเคราะห์ถึงสิ่งที่น่าจะเกิดขึ้นในเกมคืนนี้เป็นฉากๆ ว่า ""เราต้องพร้อมที่จะเล่นเกมนี้ให้ดีที่สุด เพราะพวกเขาจะพยายามทุกวิถีทางเพื่อให้ได้เข้ารอบชิงชนะเลิศแทนเราแน่ พวกเขาจะตั้งใจเล่นมากกว่าที่เราเปิดโอกาสในเกมแรก"" ""สิ่งที่ผมกังวลคือ สิ่งที่เราจะทำในเกมนี้ และเราต้องพร้อมรับมือกับความกดดัน แต่เราจะต้องไม่ตกเป็นฝ่ายตามหลัง 0-1 หรืออะไรทำนองนั้น สิ่งนั้นสามารถเกิดขึ้นได้ในการแข่งขันฟุตบอล แต่เราต้องมีทิศทางของเกมที่ถูกต้อง"" ""ถ้าพวกเขามีโอกาสได้ยิงตรงกรอบครั้งแรกของเกมนี้ก่อน แฟนบอลก็จะช่วยปลุกเร้าพวกเขาให้มีความฮึกเหิม และการได้โอกาสลุ้นในแต่ละครั้ง แฟนบอลก็จะยิ่งเพิ่มแรงกระตุ้นมากขึ้นไปอีก นั่นคือสิ่งที่จะเป็น"" สำหรับ เอสตาดิโอ เดอ ลา เซรามิกา หรือ ""เอล มาดรีกัล"" สนามเหย้าของ บียาร์เรอัล ซึ่งมีความจุ 23,500 ที่นั่ง ถือเป็นสนามปราบเซียนที่ทีมเยือนยากแก่การบุกมาเอาชนะ โดยฤดูกาลนี้ ""เรือดำน้ำสีเหลือง"" เพิ่งแพ้ครั้งเดียวใน ยูฟ่า แชมเปียนส์ลีก (แพ้ แมนเชสเตอร์ ยูไนเต็ด 0-2 / ชนะ 2 เสมอ 2) และเคยโค่น บาเยิร์น มิวนิก 1-0 ในรอบ 8 ทีม นัดแรกมาแล้ว. ทั้งนี้ ลิเวอร์พูล หวังเข้ารอบชิงชนะเลิศ เพื่อโอกาสคว้าแชมป์ยูฟ่า แชมเปียนส์ลีก สมัยที่ 7 หลังจากประสบความสำเร็จครั้งล่าสุดในฤดูกาล 2018-19 และยังอยู่ในเส้นทางลุ้นแชมป์ครบทั้ง 4 รายการของซีซั่นนี้ด้วย ",neutral
7,https://www.thairath.co.th/sport/eurofootball/premierleague/2383121,"แก่แต่ยังแกร่ง ""โรนัลโด"" ทุบ 1 สถิติผู้เฒ่าหลังยิงให้ แมนยูฯ ดับ ""เบรนท์ฟอร์ด""","แม้จะอายุเข้าสู่ 37 แต่ CR7 ทำ 1 สถิติใหม่หลังยิงให้ แมนยูฯ ปิดฉากซีซั่นในรังเหย้าด้วยชัยชนะเหนือ เบรนท์ฟอร์ด วันอังคารที่ 3 พฤษภาคม 2565 ควันหลงหลังจากที่ ""ปิศาจแดง"" แมนเชสเตอร์ ยูไนเต็ด สามารถเปิดรัง โอลด์ แทรฟเฟิร์ด เอาชนะ เบรนท์ฟอร์ด ไปด้วยสกอร์ 3-0 ใน เกมที่ 36 ของ พรีเมียร์ลีก อังกฤษ ประจำฤดูกาล 2021-22 เมื่อค่ำคืนที่ผ่านมา โดยในเกมนี้ คริสเตียโน โรนัลโด สตาร์หมายเลขที่ 7 ของ ""ปิศาจแดง"" ยิงได้ 1 ประตูในช่วงครึ่งหลัง พาทีมขึ้นนำ 2-0 นอกจากจะเป็นประตูขึ้นนำห่าง 2 ประตูในเกมนี้แล้วนั้น ยังเป็นประตูที่ 18 ในลีกซีซั่นนี้ด้วย ยิ่งไปกว่านั้นเจ้าตัวยังทุบ 1 สถิติ โดยเป็นนักเตะที่อายุ 37 ปี หรือมากกว่านั้น ที่ยิงได้มากสุดต่อหนึ่งฤดูกาล ที่ 18 ประตู เทียบเท่า จอห์นนี แฮนคอกส์ ของ วูล์ฟแฮมป์ตัน ที่ทำเอาไว้ ฤดูกาล 1955-1956 ซีซั่นนี้ คริสเตียโน โรนัลโด ยิงให้ ""ปิศาจแดง"" ไปแล้วทั้งหมด 24 ประตู 3 แอสซิสต์ จากการลงเล่น 38 นัดในทุกรายการ ""ปิศาจแดง"" ในเวลานี้เป็นเรื่องยากมากๆ ที่พวกเขาจะติดท็อป 4 เนื่องจากแข่งมากกว่า ทอตแนม ฮอตสเปอร์ อันดับ 4 และ อาร์เซนอล อันดับ 5 มากถึง 2 เกม และ คะแนนตามหลังอยู่ 5 คะแนน จึงอาจจะต้องไปเล่น ยูโรปา ลีก ในซีซั่นหน้าแทน. ",neutral
8,https://www.thairath.co.th/sport/eurofootball/premierleague/2383111,"ดีใจไม่สุด ""รังนิก"" เผย 2 เรื่องคาใจ แม้แมนยูฯ ชนะส่งท้ายพรีเมียร์ลีกในบ้าน","กุนซือชั่วคราว ยอมรับดีใจไม่สุด แม้ แมนยูฯ ชนะ เบรนท์ฟอร์ด ส่งท้ายเกมพรีเมียร์ลีกในบ้านฤดูกาลนี้ เผย 2 เรื่องใหญ่ที่คาใจ วันที่ 3 พฤษภาคม 2565ควันหลงฟุตบอลพรีเมียร์ลีก อังกฤษ นัดมันเดย์ไนต์ ซึ่ง แมนเชสเตอร์ ยูไนเต็ด เปิดบ้านชนะ เบรนท์ฟอร์ด 3-0 ทำให้ ""ปิศาจแดง"" เก็บเพิ่มเป็น 58 คะแนน รั้งอันดับ 6 ลดช่องว่างที่ตามหลัง อาร์เซนอล อันดับ 4 เหลือ5 แต้ม ยังพอมีลุ้นโควตาไปเล่น ยูฟ่า แชมเปียนส์ลีก ฤดูกาลหน้า ในอีก 2 นัดสุดท้าย แม้ว่าจะแข่งมากกว่า ""ปืนใหญ่"" 2 เกมก็ตาม ส่วน ""เดอะ บีส์"" มี 40 คะแนน อยู่อันดับ 14 ตามเดิม อย่างไรก็ตาม ราล์ฟ รังนิก กุนซือชั่วคราวยอมรับว่า แมนยูฯ อาจไม่ได้ไปเล่น ยูฟ่า แชมเปียนส์ลีก ตามเป้าหมายที่ตั้งใจไว้ หลังจากพลาดแชมป์ทุกรายการในซีซั่นนี้ โดยกล่าวถึง 2 เรื่องที่เขาผิดหวังว่า ""สุดท้ายแล้ว ผมก็ยังไม่มีความสุขกับผลงาน โดยเฉพาะช่วง 4-5 สัปดาห์ที่ผ่านมา ผมไม่ค่อยมีความสุขนักกับช่วงเวลา 6 เดือนนั้น (ที่ทำหน้าที่ผู้จัดการทีมชั่วคราว) เพราะผมคาดหวังว่าจะได้โควตาไปเล่น ยูฟ่า แชมเปียนส์ลีก นั่นคือเป้าหมายที่เรามี"" ""เราเสียผู้เล่นคนสำคัญไปหลายคน จากทีมที่ชนะ เวสต์แฮม (เมื่อวันที่ 22 มกราคม)แต่เกมถัดไปก็มีผู้เล่น 3 คนได้รับบาดเจ็บ และทีมอื่นก็ได้ผู้เล่นใหม่เข้ามาในตลาดนักเตะฤดูหนาว เรามีช่วงเวลาที่ดี เราเสียประตูน้อยลง แต่ในช่วง2-3 สัปดาห์ที่ผ่านมานั้น เราทำยังผลงานได้ไม่ดีเท่าที่ควร โดยทั่วไปแล้ว เราขาดความสม่ำเสมอ"" ",neutral
9,https://www.thairath.co.th/sport/eurofootball/premierleague/2383085,"ตำรวจวุ่น แฟน ""แมนยูฯ-เบรนท์ฟอร์ด"" ซัดนอกสนาม ส่งท้ายเกมพรีเมียร์ลีกในบ้าน (คลิป)","ตำรวจปราบจลาจลต้องเหนื่อยส่งท้ายเกมพรีเมียร์ลีกในบ้านฤดูกาลนี้ของ แมนยูฯ หลังแฟนบอลเจ้าถิ่นซัดกับทีมเยือนนอกสนามจนวุ่นวาย วันที่ 3 พฤษภาคม 2565 ควันหลงฟุตบอลพรีเมียร์ลีก อังกฤษ นัดมันเดย์ไนต์ ซึ่ง แมนเชสเตอร์ ยูไนเต็ด เปิดบ้านชนะ เบรนท์ฟอร์ด 3-0 ทำให้ ""ปิศาจแดง"" เก็บเพิ่มเป็น 58 คะแนน รั้งอันดับ 6ลดช่องว่างที่ตามหลัง อาร์เซนอล อันดับ 4 เหลือ5 แต้ม ยังพอมีลุ้นโควตาไปเล่น ยูฟ่า แชมเปียนส์ลีก ฤดูกาลหน้า ในอีก 2 นัดสุดท้าย แม้ว่าจะแข่งมากกว่า ""ปืนใหญ่"" 2 เกมก็ตาม ส่วน ""เดอะ บีส์"" มี 40 คะแนน อยู่อันดับ 14 ตามเดิม เกมนี้ถือเป็นนัดสุดท้ายของฤดูกาลนี้ที่ แมนยูฯ จะได้ลงเล่นในบ้านของตัวเอง อย่างไรก็ตาม ช่วงก่อนเริ่มการแข่งขันกลับมีเหตุวุ่นวายนอกสนามโอลด์ แทรฟฟอร์ด เมื่อแฟนบอลทั้ง 2 ทีมเกิดการปะทะกันอย่างดุเดือด หลังจากสาวก ""ปิศาจแดง"" มีการรวมตัวประท้วง ""ตระกูลเกลเซอร์"" เจ้าของสโมสรชาวอเมริกันที่อยู่กับทีมมานาน 17 ปี พร้อมตะโกนสาปแช่ง โจเอล เกลเซอร์ หนึ่งในหัวเรือใหญ่ให้ไปตาย แต่เกิดการปะทะคารมกับกองเชียร์เบรนท์ฟอร์ด ผู้มาเยือน จนกลายเป็นเหตุชุลมุน เดลี เมล รายงานว่า แฟนบอลแมนยูฯ และ เบรนท์ฟอร์ด มีการขว้างปาสิ่งของใส่กัน รวมถึงมีการชกต่อยและจุดพลุควันด้วย ร้อนถึงตำรวจปราบจลาจลที่ต้องรีบเข้าไปห้ามปราม เพื่อไม่ให้เกิดเหตุการณ์รุนแรงบานปลาย ก่อนที่จะควบคุมสถานการณ์ได้ในที่สุด ทั้งนี้ แฟนบอลแมนยูฯ ส่วนหนึ่งได้วางแผนประท้วง ""ตระกูลเกลเซอร์"" ในแมตช์นี้ ด้วยการไม่เข้าไปชมเกมในสนามช่วง 17 นาทีแรก และนัดกันเดินออกจากสนามในช่วง 17 นาทีสุดท้าย ตามจำนวนปีที่เจ้าของสโมสรชาวอเมริกันเข้ามาบริหารทีมรัก แต่เวลานี้ไม่ได้แชมป์รายการใดๆ เลยเป็นเวลานานถึง 5 ปีแล้ว Manchester United fans clash with Brentford fans before the game earlier this evening. #manchesterunited #brentford #RedArmy #GlazersOut #football #PremierLeague pic.twitter.com/IjHvkzAfRm ",neutral
10,https://www.thairath.co.th/sport/eurofootball/uefa/2382987,ส่อง 3 สถานการณ์ “ลิเวอร์พูล” ก่อนบุกไปเยือน “บียาร์เรอัล” ใน “แชมเปียนส์ลีก”,ติดตาม 3 ความเคลื่อนไหวของ “ลิเวอร์พูล” ก่อนบุกไปเยือน “บียาร์เรอัล” ในศึก “ยูฟ่า แชมเปียนส์ลีก” รอบรองชนะเลิศ นัดสอง วันที่ 2 พ.ค. 65 ความเคลื่อนไหวก่อนการแข่งขันฟุตบอล ยูฟ่า แชมเปียนส์ลีก ฤดูกาล 2021-22 รอบรองชนะเลิศ นัดสอง ซึ่ง “หงส์แดง” ลิเวอร์พูล ที่เอาชนะมาก่อน 2-0 จะบุกไปเยือน “เรือดำน้ำสีเหลือง” บียาร์เรอัล ในวันพุธที่ 4 พ.ค. เวลา 02.00 น. ตามเวลาประเทศไทย  ล่าสุด ลิเวอร์พูล เอคโค สื่อชื่อดังของอังกฤษรายงานว่า “การฝึกซ้อมเมื่อช่วงเช้าของลิเวอร์พูลในวันนี้ ไร้เงาของคีย์แมนอย่าง โรแบร์โต เฟอร์มิโน ที่ยังไม่หายขาดจากอาการบาดเจ็บเท้า ที่ได้รับตั้งแต่เกมเอฟเอ คัพ รอบรองชนะเลิศกับแมนเชสเตอร์ ซิตี้ เมื่อเดือนที่แล้ว  อย่างไรก็ตาม ลิเวอร์พูลก็ยังพอมีข่าวดีอยู่บ้าง เพราะ ดิว็อค โอริกี กองหน้าทีมชาติเบลเยียม ที่พลาดเกมลีกกับ นิวคาสเซิล เนื่องจากมีอาการป่วย สามารถกลับมาลงซ้อมกับทีมได้ตามปกติ ส่วนแข้งอีก 2 รายอย่าง เคอร์ติส โจนส์ กองกลางชาวอังกฤษ กับ คอสตาส ซิมิกาส แบ็กซ้ายชาวกรีซ ที่ป่วยทั้งคู่ ก็กลับมาลงซ้อมได้ตามปกติ คาดว่าคลอปป์น่าให้ทั้งคู่ เรียกความฟิตเพื่อเตรียมพร้อมสำหรับโปรแกรมการแข่งขันที่เข้มข้น. ,neutral
11,https://www.thairath.co.th/sport/eurofootball/laliga/2383070,สรุปผลบอล ลา ลีกา-กัลโช่ เบติสเสมอเกตาเฟ อตาลันตาไล่เจ๊าซาแลร์ฯ ยังลุ้นตั๋วยุโรป,สรุปผลบอล 2 ลีกดัง เรอัล เบติส เสมอ เกตาเฟ ยังมีลุ้นตั๋วยูฟ่า แชมเปียนส์ลีก ด้าน อตาลันตา ไล่เจ๊า ยังพอมีหวังไปถ้วยยุโรป วันที่2 พฤษภาคม 2565 สรุปผลฟุตบอลเกมมันเดย์ไนต์ 2 ลีกดังของยุโรป เริ่มที่ ลา ลีกา สเปน นัดที่ 34 เกตาเฟ เปิดบ้านเสมอ เรอัล เบติส 0-0 ทำให้ เกตาเฟ เจ้าถิ่นมี 36 คะแนน รั้งอันดับ 15 ห่างจากโซนตกชั้น 5 แต้ม ส่วนทีมเยือน เรอัล เบติส มี 58 คะแนน อยู่อันดับ 5 ในโควตาไปเล่นยูโรปาลีก ฤดูกาลหน้า ตามหลัง แอตเลติโก มาดริด อันดับ 4 ในพื้นที่ตีตั๋วไปลุย ยูฟ่า แชมเปียนส์ลีก อยู่ 3 แต้ม ในขณะที่เหลืออีก 4 เกมสุดท้าย ส่วน กัลโช่ เซเรีย อา อิตาลี นัดที่ 35 อตาลันตา เปิดบ้านเสมอ ซาแลร์นิตานา ทีมท้ายตาราง 1-1 โดยทีมเยือนนำก่อนจาก เอแดร์ซอน ในนาทีที่ 27 แต่ มาริโอ ปาซาลิช มาตีเสมอให้เจ้าถิ่นได้ในช่วงท้ายเกม นาทีที่ 88 จบเกมนี้ อตาลันตา มี 56 คะแนนรั้งอันดับ 8ตามหลัง ลาซิโอ อันดับ 6 ซึ่งเป็นโควตาสุดท้ายที่จะได้ไปเล่นฟุตบอลถ้วยสโมสรยุโรป ฤดูกาลหน้า (ยูโรปา คอนเฟอเรนซ์ ลีก รอบเพลย์ออฟ) อยู่ 3 แต้ม ขณะที่ ซาแลร์นิตานา มี 26 คะแนน ยังหนีไม่พ้นโซนตกชั้น รั้งอันดับ 18 ตามหลัง กายารี อันดับ 17 ในโซนปลอดภัย 2 แต้ม แต่ ซาแลร์นิตานา แข่งน้อยกว่า 1 เกม ,neutral
