,URL,Content_title,Contents,Sentiment
15,https://www.thairath.co.th/sport/eurofootball/premierleague/2381436,เชื่อเมียแล้วเจริญ,ถือว่าเป็นข่าวสุดเซอร์ไพรส์เลยทีเดียวสำหรับการต่อสัญญาฉบับใหม่ของเจอร์เกน คลอปป์ กุนซือชาวเยอรมันกับลิเวอร์พูล รองจ่าฝูง พรีเมียร์ลีก หลังจากที่กุนซือเลือดเบียร์ได้ตัดสินใจ อยู่ในถิ่นแอนฟิลด์ต่อไปอีก 2 ปี จนถึงปี 2026 หลายคนอาจจะงงว่าแค่กุนซือต่อสัญญาฉบับใหม่ทำไมถึงต้องเซอร์ไพรส์ด้วย เนื่องจากมันเป็นเรื่องปกติของโลกลูกหนัง!! ก็เพราะก่อนหน้านี้คลอปป์ได้ออกมาประกาศยืนยันแล้วว่าจะคุมทัพ “หงส์แดง” เป็นครั้งสุดท้ายและจะไม่มีการต่อสัญญาฉบับใหม่ออกไปอีกหลังจากของเดิมจะหมดลงในปี 2024 ซึ่งก่อนหน้านี้ก็มีนักข่าวได้สัมภาษณ์ถึงเรื่องนี้ และคลอปป์ก็ยืนยันมาตลอดว่าเตรียมวางมือจากถิ่นแอนฟิลด์ จะว่าไปเมื่อช่วงกลางซีซัน กุนซือวัย 54 ปี ก็ยังยันคำพูดเดิมอยู่เลย นั่นแหละถึงได้บอกว่ามันเซอร์ไพรส์ เพราะปกติแล้วคลอปป์นั้น พูดแล้วคือคำไหนคำนั้นแสดงว่าเรื่องนี้มันต้องมีเงื่อนงำแน่นอน แม้หลายคนอาจจะสงสัย แต่สาวก “เดอะ ค็อป” ไม่คิดที่จะสงสัยเรื่องนี้เลยก็เพราะไม่อยาก ให้คลอปป์อำลาทีมอยู่แล้ว เนื่องจาก “หงส์แดง” ในมืออดีตกุนซือดอร์ทมุนด์นั้น มีแต่พุ่งขึ้นเรื่อยๆ และยังไม่มีแววว่าจะกลายเป็นดาวตกเลย แถมฤดูกาลนี้ก็ยังมีลุ้นถึง 4 แชมป์ การมีกุนซือที่ได้ขึ้นชื่อว่าเก่งที่สุดในโลกอยู่ในทีมมันย่อมดีกับทีมอยู่เสมอ ไม่ว่านักเตะเก่า ไปใหม่มาหมุนเวียนกันแค่ไหน แต่มีเทรนเนอร์ที่เจ๋ง และมีแบบแผนก็สามารถปรับนักเตะเข้าสู่ทีมได้เสมอ ดูได้จากหลุยส์ ดิอาซ ปีกความเร็วสูงทีมชาติ โคลอมเบียเพิ่งย้ายมาจากปอร์โต เมื่อช่วงเปิดตลาด รอบสองเดือนมกราคมแท้ๆ แต่คลอปป์ก็สามารถจูนให้เข้ากับทีมได้ทันทีตั้งแต่เกมแรก เหมือนกับเล่นกับทีมชุดนี้มาแล้ว 4-5 ปี เลยทีเดียว จะบอกว่านักเตะปรับตัวได้เร็ว นั่นก็คือส่วนหนึ่ง แต่ถ้าคนเป็นกุนซือไม่มีกึ๋นและไม่เจ๋งมากพอก็คงไม่สามารถปรับนักเตะให้เข้ากับทีมได้ไว ยิ่งนักเตะละตินอเมริกาด้วยแล้วโอกาสที่ จะเข้ากับลีกผู้ดีได้ทันทีแทบจะหาได้ยาก เคสนี้สำหรับ “มะระหวาน” ยกเครดิตให้คลอปป์จริงๆ ซึ่งการอยู่ต่อของคลอปป์สร้างขวัญและกำลังใจให้กับแข้ง “หงส์แดง” อย่างมากเลยทำให้แอบคิดไม่ได้ว่าการต่อสัญญาครั้งนี้เป็นกลยุทธ์ในการเสริมกำลังใจครั้งใหญ่ในการล่า 4 แชมป์ เพราะถ้าคลอปป์ยืนยันคำเดิมว่าไม่ต่อสัญญา อำลาทีมแน่ มันกระทบต่อจิตใจนักเตะไม่มากก็น้อย แต่พอบอกว่าอยู่ต่ออีก 2 ปี เชื่อว่าแข้ง “หงส์แดง” นั้นฮึกเหิมแบบขีดสุดเลยทีเดียว ย้อนกลับไปเรื่องการเซ็นสัญญาของคลอปป์ เล็กน้อย ตอนแรกที่บอกว่ามันมีเงื่อนงำ เพราะตอนข่าวประกาศออกมามันรู้สึกแบบนั้นจริงๆ แต่พอมาฟังคลอปป์ให้สัมภาษณ์แล้วถึงบางอ้อเลยทีเดียวที่ต่อสัญญาฉบับใหม่ เพราะอุลล่า เมียสุดที่รักอยากให้อยู่ต่อ เมื่อศรีภรรยาสุดที่รักพูดขนาดนี้แล้วพ่อบ้านดีเด่นอย่างคลอปป์มีรึจะยอมขัดใจ ถ้าพูดถึงเรื่องนี้ก็นึกถึงเซอร์อเล็กซ์ เฟอร์กูสัน ตำนานกุนซือชาวสกอตมีช่วงหนึ่งก็ตัดสินใจอำลา “ปิศาจแดง” เช่นกัน แต่พอเมียบอกให้อยู่ต่อ “เฟอร์กี้” ก็กลับลำคุมทีมต่อเช่นกัน สงสัยคำที่ชอบพูดกันว่า “ชายใดเชื่อฟังภรรยา เจริญทุกคน” คงจะเป็นเรื่องจริง ดูจาก “เฟอร์กี้” คว้าแชมป์เป็นว่าเล่น ขณะที่ “คลอปป์” นั้นก็เตรียมจะดำเนินรอยตาม ในไม่ช้า!! มะระหวาน ,neutral
16,https://www.thairath.co.th/sport/eurofootball/uefa/2383320,"สามล้อถูกหวย ""สกอตแลนด์"" รับส้มหล่นจาก ""รัสเซีย"" หลังยูฟ่าแบนต่อฤดูกาลหน้า","สกอตแลนด์ กลายเป็น ""สามล้อถูกหวย"" ในพริบตา หลัง สหพันธ์ฟุตบอลยุโรป สั่งแบน รัสเซีย ต่อเนื่อง เหตุสงครามกับยูเครนยังไม่จบ วันที่ 3 พฤษภาคม 2565 ควันหลงจากการที่ สหพันธ์ฟุตบอลยุโรป (ยูฟ่า) ประกาศห้าม รัสเซีย มีส่วนร่วมกับวงการฟุตบอลเพิ่มเติมตลอดฤดูกาล 2022-23 หลังจากสงครามรุกรานยูเครนยังไม่มีทีท่าว่าจะสิ้นสุด ซึ่งก่อนหน้านี้ ทุกสโมสรและทีมชาติรัสเซีย ได้ถูกลงโทษห้ามเข้าร่วมการแข่งขันทุกรายการของ ยูฟ่า และ สหพันธ์ฟุตบอลนานาชาติ (ฟีฟ่า) แบบไม่มีกำหนด เมื่อเดือนกุมภาพันธ์ ล่าสุด ยูฟ่า ยังประกาศเรื่องการอัปเดตโควตาของลีกต่างๆ ที่ได้สิทธิ์ไปเล่น ยูฟ่า แชมเปียนส์ลีก ฤดูกาลหน้า หลังริบสิทธิ์คืนจากสโมสรรัสเซีย 2 ที่ (รอบแบ่งกลุ่ม 1 ทีม / รอบคัดเลือก รอบ 3 อีก 1 ทีม) ส่งผลให้โควตาดังกล่าวตกมาถึงศึกสกอตติช พรีเมียร์ชิพ ลีกสูงสุดของสกอตแลนด์ ซึ่งมีค่าสัมประสิทธิ์ของ ยูฟ่า รองลงมาจาก รัสเซีย แทน ก่อนหน้านี้ โควตายูฟ่า แชมเปียนส์ลีก ของ สกอตแลนด์จะให้ทีมแชมป์ลีกไปเล่นในรอบคัดเลือก รอบ 3 ส่วนอันดับ 2 จะเริ่มต้นในรอบคัดเลือก รอบ 2 แต่จากการประกาศล่าสุดของ ยูฟ่า ทำให้แชมป์สกอตติช พรีเมียร์ชิพ จะได้ผ่านเข้าสู่รอบแบ่งกลุ่ม ยูฟ่า แชมเปียนส์ลีก โดยอัตโนมัติ ขณะที่อันดับ 2 ก็จะถูกปรับขึ้นมาเริ่มต้นในรอบคัดเลือก รอบ 3 แทน ซึ่งเวลานี้ 2 ทีมที่กำลังแย่งโควตากัน คือ กลาสโกว์ เซลติก จ่าฝูง และ กลาสโกว์ เรนเจอร์ส อันดับ 2 โดยทั้งคู่การันตีตั๋วรายการนี้แน่นอนแล้ว เหลือเพียงแย่งแชมป์กันเท่านั้น ",neutral
17,https://www.thairath.co.th/sport/eurofootball/otherleague/2383256,"สงครามไม่จบ สรุป 5 ผลกระทบ ""รัสเซีย"" ถูก ""ยูฟ่า"" แบนจากฟุตบอลต่อในฤดูกาลหน้า","สรุป 5 ผลกระทบที่รัสเซียได้รับจากการถูก สหพันธ์ฟุตบอลยุโรป ห้ามมีส่วนร่วมต่อเนื่องในฤดูกาลหน้า หลังสงครามกับยูเครนยังไม่จบ วันที่ 3 พฤษภาคม 2565 สหพันธ์ฟุตบอลยุโรป (ยูฟ่า) ประกาศห้าม รัสเซีย มีส่วนร่วมกับวงการฟุตบอลเพิ่มเติมตลอดฤดูกาล 2022-23 หลังจากสงครามรุกรานยูเครนยังไม่มีทีท่าว่าจะสิ้นสุด ซึ่งก่อนหน้านี้ทุกสโมสรและทีมชาติรัสเซียได้ถูกลงโทษห้ามเข้าร่วมการแข่งขันทุกรายการของ ยูฟ่า และ สหพันธ์ฟุตบอลนานาชาติ (ฟีฟ่า) แบบไม่มีกำหนด เมื่อเดือนกุมภาพันธ์ ซึ่งรวมถึง ฟุตบอลโลก 2022 และฟุตบอลโลกหญิง 2023 ด้วย เนื่องจากถูกตัดออกจากรอบคัดเลือกโซนยุโรป การประกาศล่าสุดของ ยูฟ่า ทำให้ รัสเซีย ได้รับผลกระทบ 5 ข้อ ดังนี้ 1. รัสเซีย จะไม่ได้รับการพิจารณาข้อเสนอในการขอเป็นเจ้าภาพจัดการแข่งขันฟุตบอลชิงแชมป์แห่งชาติยุโรปทั้ง 2 ครั้ง (ยูโร 2028 และ ยูโร 2032) ที่ยื่นเข้ามาเมื่อเดือนมีนาคม 2. รัสเซีย ถูกตัดสิทธิ์จากฟุตบอลหญิงชิงแชมป์แห่งชาติยุโรป ยูโร 2022 ในเดือนกรกฎาคมนี้ โดยให้ โปรตุเกส ผู้แพ้ในรอบเพลย์ออฟได้เข้ามาแข่งขันแทน 3. ทีมชาติรัสเซีย ทีมชาย จะไม่ได้แข่งขันใน ยูฟ่า เนชันส์ ลีก 2022-23 และจะโดนปรับให้เป็นทีมอันดับสุดท้ายของกลุ่ม 2 ลีกบี และเมื่อสิ้นสุดรอบแบ่งกลุ่ม ก็จะตกชั้นสู่ลีกซี โดยอัตโนมัติ 4. ทุกสโมสรจากรัสเซีย ทั้งทีมชายและทีมหญิง จะหมดสิทธิ์แข่งขันฟุตบอลถ้วยยุโรปทุกรายการในฤดูกาล 2022-23 ทั้ง ยูฟ่า แชมเปียนส์ลีก, ยูโรปาลีก และ ยูโรปา คอนเฟอเรนซ์ ลีก 5. ทีมชาติรัสเซีย หมดสิทธิ์แข่งขันฟุตบอลชิงแชมป์ยุโรป รุ่นอายุไม่เกิน 21 ปี ในปี 2023 รวมถึงฟุตบอลทุกรายการในระดับเยาวชน และทุกทัวร์นาเมนต์ของฟุตซอล. ",neutral
18,https://www.thairath.co.th/sport/eurofootball/premierleague/2383085,"ตำรวจวุ่น แฟน ""แมนยูฯ-เบรนท์ฟอร์ด"" ซัดนอกสนาม ส่งท้ายเกมพรีเมียร์ลีกในบ้าน (คลิป)","ตำรวจปราบจลาจลต้องเหนื่อยส่งท้ายเกมพรีเมียร์ลีกในบ้านฤดูกาลนี้ของ แมนยูฯ หลังแฟนบอลเจ้าถิ่นซัดกับทีมเยือนนอกสนามจนวุ่นวาย วันที่ 3 พฤษภาคม 2565 ควันหลงฟุตบอลพรีเมียร์ลีก อังกฤษ นัดมันเดย์ไนต์ ซึ่ง แมนเชสเตอร์ ยูไนเต็ด เปิดบ้านชนะ เบรนท์ฟอร์ด 3-0 ทำให้ ""ปิศาจแดง"" เก็บเพิ่มเป็น 58 คะแนน รั้งอันดับ 6ลดช่องว่างที่ตามหลัง อาร์เซนอล อันดับ 4 เหลือ5 แต้ม ยังพอมีลุ้นโควตาไปเล่น ยูฟ่า แชมเปียนส์ลีก ฤดูกาลหน้า ในอีก 2 นัดสุดท้าย แม้ว่าจะแข่งมากกว่า ""ปืนใหญ่"" 2 เกมก็ตาม ส่วน ""เดอะ บีส์"" มี 40 คะแนน อยู่อันดับ 14 ตามเดิม เกมนี้ถือเป็นนัดสุดท้ายของฤดูกาลนี้ที่ แมนยูฯ จะได้ลงเล่นในบ้านของตัวเอง อย่างไรก็ตาม ช่วงก่อนเริ่มการแข่งขันกลับมีเหตุวุ่นวายนอกสนามโอลด์ แทรฟฟอร์ด เมื่อแฟนบอลทั้ง 2 ทีมเกิดการปะทะกันอย่างดุเดือด หลังจากสาวก ""ปิศาจแดง"" มีการรวมตัวประท้วง ""ตระกูลเกลเซอร์"" เจ้าของสโมสรชาวอเมริกันที่อยู่กับทีมมานาน 17 ปี พร้อมตะโกนสาปแช่ง โจเอล เกลเซอร์ หนึ่งในหัวเรือใหญ่ให้ไปตาย แต่เกิดการปะทะคารมกับกองเชียร์เบรนท์ฟอร์ด ผู้มาเยือน จนกลายเป็นเหตุชุลมุน เดลี เมล รายงานว่า แฟนบอลแมนยูฯ และ เบรนท์ฟอร์ด มีการขว้างปาสิ่งของใส่กัน รวมถึงมีการชกต่อยและจุดพลุควันด้วย ร้อนถึงตำรวจปราบจลาจลที่ต้องรีบเข้าไปห้ามปราม เพื่อไม่ให้เกิดเหตุการณ์รุนแรงบานปลาย ก่อนที่จะควบคุมสถานการณ์ได้ในที่สุด ทั้งนี้ แฟนบอลแมนยูฯ ส่วนหนึ่งได้วางแผนประท้วง ""ตระกูลเกลเซอร์"" ในแมตช์นี้ ด้วยการไม่เข้าไปชมเกมในสนามช่วง 17 นาทีแรก และนัดกันเดินออกจากสนามในช่วง 17 นาทีสุดท้าย ตามจำนวนปีที่เจ้าของสโมสรชาวอเมริกันเข้ามาบริหารทีมรัก แต่เวลานี้ไม่ได้แชมป์รายการใดๆ เลยเป็นเวลานานถึง 5 ปีแล้ว Manchester United fans clash with Brentford fans before the game earlier this evening. #manchesterunited #brentford #RedArmy #GlazersOut #football #PremierLeague pic.twitter.com/IjHvkzAfRm ",neutral
19,https://www.thairath.co.th/sport/eurofootball/otherleague/2381625,"เปิด 10 แข้งตัวท็อปของ ""ไรโอลา"" เอเย่นต์ดังผู้ล่วงลับ พ่วง 3 การย้ายทีมแพงสุด","เปิดรายชื่อ 10 นักเตะบิ๊กเนมที่ มิโน ไรโอลา เอเย่นต์ดังผู้ล่วงลับเคยดูแล พร้อม 3 ดีลย้ายทีมแพงสุด มี 1 รายทุบสถิติโลก วันที่ 1 พฤษภาคม 2565 ไทยรัฐสปอร์ต รวบรวมรายชื่อนักเตะชั้นนำ 10 คนที่ มิโน ไรโอลา เอเย่นต์นักฟุตบอลชื่อดังระดับโลก เคยทำหน้าที่ดูแล หลังจากเจ้าตัวเพิ่งเสียชีวิตเมื่อวานนี้ (30 เมษายน 2565) ในวัยเพียง 54 ปี ด้วยโรคประจำตัว 1. เออร์ลิง ฮาแลนด์ (นอร์เวย์ / สโมสรปัจจุบัน โบรุสเซีย ดอร์ทมุนด์) 2. มัทไธส์ เดอ ลิกต์ (เนเธอร์แลนด์ /สโมสรปัจจุบัน ยูเวนตุส) 3. จานลุยจิ ดอนนารุมมา (อิตาลี /สโมสรปัจจุบัน ปารีส แซงต์ แชร์กแมง) 4. พอล ป็อกบา (ฝรั่งเศส / สโมสรปัจจุบัน แมนเชสเตอร์ ยูไนเต็ด) 5. มาร์โก แวร์รัตติ(อิตาลี / สโมสรปัจจุบัน ปารีส แซงต์ แชร์กแมง) 6. เดนเซล ดัมฟรีส์ (เนเธอร์แลนด์ / สโมสรปัจจุบัน อินเตอร์ มิลาน) 7. เฮนริค มคิตาร์ยาน (อาร์เมเนีย / สโมสรปัจจุบัน โรมา) 8. มาริโอ บาโลเตลลี (อิตาลี / สโมสรปัจจุบัน อดานา เดมีร์สปอร์) 9. ซลาตัน อิบราฮิโมวิช (สวีเดน/ สโมสรปัจจุบัน เอซี มิลาน) 10. โรเมลู ลูกากู (เบลเยียม / สโมสรปัจจุบัน เชลซี) * เอเย่นต์ปัจจุบัน เฟเดริโก ปาสโตเรลโล (แยกทางกับ มิโน ไรโอลา เดือนเมษายน ปี 2018) นอกจากนี้ มิโน ไรโอลา ยังเคยอยู่เบื้องหลังการซื้อขายผู้เล่นที่สั่นสะเทือนตลาดนักเตะมาแล้วมากมาย ซึ่งดาวดังที่มีมูลค่าการย้ายทีมแพงที่สุด 3 ราย มีดังนี้ 1. พอล ป็อกบา (ยูเวนตุส ไป แมนยูฯ) - ค่าตัว 89 ล้านปอนด์ (3,916 ล้านบาท)ปี 2016 * สถิติโลกในเวลานั้น 2. โรเมลู ลูกากู (เอฟเวอร์ตัน ไป แมนยูฯ) - ค่าตัว 75ล้านปอนด์ (3,300 ล้านบาท) ปี 2017 3. มัทไธส์ เดอ ลิกต์ (อาแจกซ์ อัมสเตอร์ดัม ไป ยูเวนตุส) -ค่าตัว67.5 ล้านปอนด์ (2,970 ล้านบาท) ปี 2019 ",neutral
